FID,OBJECTID,FACILITYID,NAME,ADDRESS,CITY,STATE,ZIP,ZIP4,TELEPHONE,TYPE,STATUS,POPULATION,COUNTY,COUNTYFIPS,COUNTRY,NAICS_CODE,NAICS_DESC,SOURCE,SOURCEDATE,VAL_METHOD,VAL_DATE,WEBSITE,SECURELVL,CAPACITY,Shape_Leng,SHAPE_Length,SHAPE_Area
1,1201,10000919,JESSUP CORRECTIONAL INSTITUTION,"P O BOX 534, HOUSE OF CORRECTION RD",JESSUP,MD,20794,NOT AVAILABLE,(410) 799-6100,STATE,OPEN,1619,ANNE ARUNDEL,24003,USA,922140,CORRECTIONAL INSTITUTIONS,http://dpscs.maryland.gov/publicinfo/publications/annuals.shtml#doc,6/30/2016,IMAGERY/OTHER,2017/12/05 00:00:00,http://www.dpscs.maryland.gov/locations/prisons.shtml,MAXIMUM,1750,0.0178892438438,2223.85006758242,1.44769458225e-05
2,1,10006326,GADSDEN RE-ENTRY CENTER,630 OPPORTUNITY LANE,HAVANA,FL,32333,NOT AVAILABLE,(850) 539-2440,STATE,OPEN,383,GADSDEN,12039,USA,922140,CORRECTIONAL INSTITUTIONS,"http://www.dc.state.fl.us/pub/pop/, http://www.dc.state.fl.us/orginfo/facilitydir.html#4",9/30/2017,IMAGERY,2017/11/02 00:00:00,http://www.dc.state.fl.us/orginfo/facilitydir.html#4,MEDIUM,432,0.00635179011114,760.026051793899,2.48321285195e-06
3,1202,10001557,JESSUP PRE-RELEASE UNIT,2000 TOULSON RD,JESSUP,MD,20794,NOT AVAILABLE,NOT AVAILABLE,STATE,CLOSED,0,ANNE ARUNDEL,24003,USA,922140,CORRECTIONAL INSTITUTIONS,https://www.dpscs.state.md.us/locations/prisons.shtml,4/1/2014,IMAGERY/OTHER,2017/12/05 00:00:00,http://www.dpscs.state.md.us/locations/prisons.shtml,MINIMUM,596,0.0061658990468,772.764319671447,1.87915634026e-06
4,2,10006327,BAKER RE-ENTRY CENTER,17128 US HIGHWAY 90 WEST,SANDERSON,FL,32087,NOT AVAILABLE,(386) 719-6300,STATE,OPEN,397,BAKER,12003,USA,922140,CORRECTIONAL INSTITUTIONS,"http://www.dc.state.fl.us/pub/pop/, http://www.dc.state.fl.us/orginfo/facilitydir.html#4",9/30/2017,IMAGERY,2017/11/02 00:00:00,http://www.dc.state.fl.us/orginfo/facilitydir.html#4,MEDIUM,432,0.00703467598496,848.693639156055,3.07949456259e-06
5,1203,10003464,"UTAH STATE PRISON, DRAPER - NORTH COMPLEX",WEST 13800 SOUTH,DRAPER,UT,84020,NOT AVAILABLE,(801) 576-7000,STATE,OPEN,994,SALT LAKE,49035,USA,922140,CORRECTIONAL INSTITUTIONS,https://crbiprod.utah.gov/cognos10/cgi-bin/cognos.cgi?b_action=xts.run&m=portal/cc.xts&gohome=,1/17/2018,IMAGERY/OTHER,2018/01/17 00:00:00,https://corrections.utah.gov/,MAXIMUM,2000,0.0283235852297,3684.6272749866,2.03282838195e-05
6,3,10004255,SOUTH MISSISSIPPI CORRECTIONAL INSTITUTION,22689 STATE HWY 63 N,LEAKESVILLE,MS,39451,NOT AVAILABLE,(601) 394-5600,STATE,OPEN,2637,GREENE,28041,USA,922140,CORRECTIONAL INSTITUTIONS,http://www.mdoc.ms.gov/Admin-Finance/Pages/Monthly-Facts.aspx,12/4/2017,IMAGERY/OTHER,2017/12/08 00:00:00,http://www.mdoc.ms.gov/Pages/Facility-Locations.aspx,MAXIMUM,3082,0.0351515539098,4140.68856585259,3.70912879597e-05
7,1204,10001874,NORTHERN REGIONAL JAIL / CORRECTIONAL FACILITY,112 N REGIONAL CORRECTIONAL DR,MOUNDSVILLE,WV,26041,NOT AVAILABLE,(304) 843-4067,COUNTY,OPEN,-999,MARSHALL,54051,USA,922140,CORRECTIONAL INSTITUTIONS,"http://www.wvdoc.com/wvdoc/PrisonsandFacilities/tabid/36/Default.aspx, http://rja.wv.gov/facilityinfo/Pages/default.aspx",1/22/2018,IMAGERY,2018/01/22 00:00:00,http://www.wvdoc.com/wvdoc/PrisonsandFacilities/tabid/36/Default.aspx,MAXIMUM,-999,0.00901112031734,1149.89446027773,4.75652514895e-06
8,4,10001816,EAST MISSISSIPPI CORRECTIONAL FACILITY,10641 HWY 80 W,MERIDIAN,MS,39307,NOT AVAILABLE,(601) 485-5255,STATE,OPEN,1266,LAUDERDALE,28075,USA,922140,CORRECTIONAL INSTITUTIONS,"http://www.mdoc.ms.gov/Admin-Finance/Pages/Monthly-Facts.aspx, http://www.mtctrains.com/corrections/#locations",12/4/2017,IMAGERY,2017/12/08 00:00:00,http://www.mtctrains.com/corrections/#locations,MAXIMUM,1500,0.0106507982639,1291.10641902032,6.25296684442e-06
9,1205,10003465,"UTAH STATE PRISON, DRAPER - SOUTH COMPLEX",14425 BITTERBRUSH LANE,DRAPER,UT,84020,NOT AVAILABLE,(801) 576-7000,STATE,OPEN,1839,SALT LAKE,49035,USA,922140,CORRECTIONAL INSTITUTIONS,"https://crbiprod.utah.gov/cognos10/cgi-bin/cognos.cgi?b_action=xts.run&m=portal/cc.xts&gohome=, https://corrections.utah.gov/",1/17/2018,IMAGERY/OTHER,2018/01/17 00:00:00,https://corrections.utah.gov/,MAXIMUM,2450,0.0354241766791,4509.74519949864,2.43933657921e-05
10,5,10006328,EVERGLADES RE-ENTRY CENTER,1599 S.W. 187TH AVENUE,MIAMI,FL,33194,NOT AVAILABLE,(305) 228-4400,STATE,OPEN,386,MIAMI-DADE,12086,USA,922140,CORRECTIONAL INSTITUTIONS,http://www.dc.state.fl.us/pub/pop/,9/30/2017,IMAGERY,2017/11/02 00:00:00,http://www.dc.state.fl.us/orginfo/facilitydir.html#4,NOT AVAILABLE,-999,0.00593795491411,696.766598345612,2.20292169508e-06
11,6,10002151,BERRYDALE FORESTRY CAMP,6920 STATE HWY 4,JAY,FL,32565,2204,(850) 675-4564,STATE,CLOSED,0,SANTA ROSA,12113,USA,922140,CORRECTIONAL INSTITUTIONS,http://www.pnj.com/story/news/local/escambia-county/2017/03/04/jay-work-camp-eyed-escambia-county-inmates/98687000/,3/4/2017,IMAGERY,2017/11/02 00:00:00,http://www.dc.state.fl.us/orginfo/facilitydir.html,MEDIUM,-999,0.00661010617094,791.861960747475,2.72034714906e-06
12,7,10003606,MORTON COUNTY CORRECTIONAL CENTER,205 1ST AVE NW,MANDAN,ND,58554,3112,(701) 667-3330,COUNTY,OPEN,-999,MORTON,38059,USA,922140,CORRECTIONAL INSTITUTIONS,https://www.nd.gov/docr/county/jails.html,4/4/2018,IMAGERY,2018/04/04 00:00:00,http://www.co.morton.nd.us/sheriffsoffice,MAXIMUM,35,0.00237695934324,328.93068104229,2.60378262922e-07
13,8,10004073,MOREHOUSE PARISH DETENTION CENTER,6444 PATEY RD,COLLINSTON,LA,71229,NOT AVAILABLE,NOT AVAILABLE,COUNTY,OPEN,260,MOREHOUSE,22067,USA,922140,CORRECTIONAL INSTITUTIONS,http://doc.louisiana.gov/briefing-book,9/29/2017,IMAGERY,2018/03/15 00:00:00,http://www.mpso.net/mpsocorrectiondivision.html,NOT AVAILABLE,272,0.00447117388692,549.294854067331,8.34824044373e-07
14,9,10005350,CENTRAL JAIL COMPLEX,550 NORTH FLOWER STREET,SANTA ANA,CA,92702,NOT AVAILABLE,(409) 883-1026,COUNTY,OPEN,1471,ORANGE,06059,USA,922140,CORRECTIONAL INSTITUTIONS,"http://www.bscc.ca.gov/s_fsojailprofilesurvey.php, http://www.ocsd.org/divisions/custody",2/12/2018,IMAGERY,2018/02/12 00:00:00,http://www.ocsd.org/divisions/custody,MAXIMUM,1813,0.00675702199999,805.495600007474,2.29802779218e-06
15,10,10002576,GREEN LAKE COUNTY JUSTICE CENTER,571 COUNTY ROAD A,GREEN LAKE,WI,54941,NOT AVAILABLE,(920) 294-4059,COUNTY,OPEN,-999,GREEN LAKE,55047,USA,922140,CORRECTIONAL INSTITUTIONS,http://www.co.green-lake.wi.us/departments.html?Department=28,5/8/2018,IMAGERY,2018/05/08 00:00:00,NOT AVAILABLE,MAXIMUM,108,0.0058415325312,760.581071364943,8.84298319257e-07
16,11,10005212,FRANKLIN WORK CAMP,1760 HIGHWAY 67,CARRABELLE,FL,32322,NOT AVAILABLE,(850) 697-1464,STATE,OPEN,221,FRANKLIN,12037,USA,922140,CORRECTIONAL INSTITUTIONS,http://www.dc.state.fl.us/pub/pop/,9/30/2017,IMAGERY,2017/11/02 00:00:00,http://www.dc.state.fl.us/orginfo/facilitydir.html#4,NOT AVAILABLE,-999,0.00669582326258,802.075447914976,2.80193985046e-06
17,12,10004340,BINGHAM COUNTY JAIL,501 N MAPLE #408,BLACKFOOT,ID,83221,NOT AVAILABLE,(208) 236-7125,COUNTY,OPEN,-999,BINGHAM,16011,USA,922140,CORRECTIONAL INSTITUTIONS,http://www.co.bingham.id.us/Sheriff/index.html,2/28/2018,IMAGERY,2018/03/01 00:00:00,http://www.co.bingham.id.us/Sheriff/index.html,NOT AVAILABLE,102,0.00331240244598,428.086150194535,5.01323180312e-07
18,13,10004572,TAYLOR WORK CAMP,8501 HAMPTON SPRINGS ROAD,PERRY,FL,32348,NOT AVAILABLE,(850) 838-8550,STATE,OPEN,401,TAYLOR,12123,USA,922140,CORRECTIONAL INSTITUTIONS,http://www.dc.state.fl.us/pub/pop/,9/30/2017,IMAGERY,2017/11/02 00:00:00,http://www.dc.state.fl.us/orginfo/facilitydir.html#4,NOT AVAILABLE,-999,0.00717786372939,858.763811101599,3.15890338812e-06
19,14,10000332,GRACEVILLE WORK CAMP,5230 EZELL RD,GRACEVILLE,FL,32440,4289,(850) 263-9230,STATE,OPEN,264,JACKSON,12063,USA,922140,CORRECTIONAL INSTITUTIONS,http://www.dc.state.fl.us/pub/pop/,9/30/2017,IMAGERY,2017/11/02 00:00:00,http://www.dc.state.fl.us/orginfo/facilitydir.html#4,NOT AVAILABLE,-999,0.00627622546265,751.043837056224,2.43882915329e-06
20,15,10000361,WALTON WORK CAMP,301 INSTITUTION RD,DEFUNIAK SPRINGS,FL,32433,NOT AVAILABLE,(850) 951-1300,STATE,OPEN,283,WALTON,12131,USA,922140,CORRECTIONAL INSTITUTIONS,http://www.dc.state.fl.us/pub/pop/,9/30/2017,IMAGERY,2017/11/02 00:00:00,http://www.dc.state.fl.us/orginfo/facilitydir.html#4,NOT AVAILABLE,-999,0.00593429863628,709.416942049361,2.17946024038e-06
21,16,10000357,HOLMES WORK CAMP,3182 THOMAS DR,BONIFAY,FL,32425,4238,(850) 547-8911,STATE,OPEN,328,HOLMES,12059,USA,922140,CORRECTIONAL INSTITUTIONS,http://www.dc.state.fl.us/pub/pop/,9/30/2017,IMAGERY,2017/11/02 00:00:00,http://www.dc.state.fl.us/orginfo/facilitydir.html#4,NOT AVAILABLE,-999,0.00601888361048,723.571193281593,2.26268170883e-06
22,17,10000391,"LIBERTY WORK CAMP, SOUTH UNIT",11064 NW DEMPSEY BARRON RD,BRISTOL,FL,32321,0711,(850) 643-9542,STATE,OPEN,407,LIBERTY,12077,USA,922140,CORRECTIONAL INSTITUTIONS,http://www.dc.state.fl.us/pub/pop/,9/30/2017,IMAGERY,2017/11/02 00:00:00,http://www.dc.state.fl.us/orginfo/facilitydir.html#4,NOT AVAILABLE,-999,0.00669147951997,808.861586421118,2.78331311965e-06
23,18,10004558,OKALOOSA WORK CAMP,3189 COLONEL GREG MALLOY RD,CRESTVIEW,FL,32539,6708,(850) 682-0931,STATE,OPEN,245,OKALOOSA,12091,USA,922140,CORRECTIONAL INSTITUTIONS,http://www.dc.state.fl.us/pub/pop/,9/30/2017,IMAGERY,2017/11/02 00:00:00,http://www.dc.state.fl.us/orginfo/facilitydir.html#4,NOT AVAILABLE,-999,0.00505802685201,604.571813022273,1.62937840174e-06
24,19,10006653,CANYON HILLS,2519 WINDMILL DRIVE,SPEARFISH,SD,57583,NOT AVAILABLE,(605) 559-3501,STATE,OPEN,-999,LAWRENCE,46081,USA,922140,CORRECTIONAL INSTITUTIONS,http://doc.sd.gov/juvenile/JuvenilePrivatePlacement.aspx,1/9/2018,IMAGERY,2018/01/09 00:00:00,http://doc.sd.gov/juvenile/JuvenilePrivatePlacement.aspx,JUVENILE,-999,0.00304879107406,387.906183814852,3.18350974951e-07
25,20,10000403,BAKER WORK CAMP,20706 US HIGHWAY 90 WEST,SANDERSON,FL,32087,2359,(386) 719-6130,STATE,OPEN,284,BAKER,12003,USA,922140,CORRECTIONAL INSTITUTIONS,http://www.dc.state.fl.us/pub/pop/,9/30/2017,IMAGERY,2017/11/02 00:00:00,http://www.dc.state.fl.us/orginfo/facilitydir.html#4,NOT AVAILABLE,-999,0.00527921402422,630.176339627192,1.69200357078e-06
26,21,10004075,MOREHOUSE PARISH JAIL,250 E WALNUT ST,BASTROP,LA,71220,NOT AVAILABLE,NOT AVAILABLE,COUNTY,OPEN,-999,MOREHOUSE,22067,USA,922140,CORRECTIONAL INSTITUTIONS,http://www.mpso.net/mpsocorrectiondivision.html,3/15/2018,IMAGERY,2018/03/15 00:00:00,http://www.mpso.net/mpsocorrectiondivision.html,NOT AVAILABLE,-999,0.00251275771773,302.958340064402,3.88659927713e-07
27,22,10004333,BONNER COUNTY DETENTION CENTER,4001 N BOYER RD,SANDPOINT,ID,83864,NOT AVAILABLE,(208) 263-8417,COUNTY,OPEN,106,BONNER,16017,USA,922140,CORRECTIONAL INSTITUTIONS,http://www.bonnerso.org/index.php,2/28/2018,IMAGERY,2018/03/01 00:00:00,http://www.bonnerso.org/index.php,MAXIMUM,124,0.00359722154634,479.544105762627,6.94438748355e-07
28,23,10003525,SEVIER COUNTY JAIL,137 COMMERCE ST,SEVIERVILLE,TN,37862,NOT AVAILABLE,NOT AVAILABLE,COUNTY,OPEN,194,SEVIER,47155,USA,922140,CORRECTIONAL INSTITUTIONS,"https://www.tn.gov/correction/statistics-and-information/jail-summary-reports.html, http://www.seviercountysheriff.com/",3/31/2018,IMAGERY,2018/04/24 00:00:00,http://www.seviercountysheriff.com/,NOT AVAILABLE,214,0.00269738414951,334.324595975886,3.66068620549e-07
29,24,10002177,AVON PARK CORRECTIONAL INSTITUTION,8100 HIGHWAY 64 EAST,AVON PARK,FL,33825,NOT AVAILABLE,(863) 452-8801,STATE,OPEN,1027,POLK,12105,USA,922140,CORRECTIONAL INSTITUTIONS,"http://www.dc.state.fl.us/pub/pop/, http://www.dc.state.fl.us/orginfo/facilitydir.html#4",9/30/2017,IMAGERY,2017/11/01 00:00:00,http://www.dc.state.fl.us/orginfo/facilitydir.html#4,CLOSE,956,0.0195124239308,2302.74179231931,1.3095537607e-05
30,25,10000382,MADISON WORK CAMP,382 SW MCI WAY,MADISON,FL,32340,4430,(850) 973-5645,STATE,OPEN,292,MADISON,12079,USA,922140,CORRECTIONAL INSTITUTIONS,http://www.dc.state.fl.us/pub/pop/,9/30/2017,IMAGERY,2017/11/03 00:00:00,http://www.dc.state.fl.us/orginfo/facilitydir.html#4,NOT AVAILABLE,-999,0.00507320072484,607.242515866812,1.6029533253e-06
31,26,10000410,MAYO WORK CAMP,8976 US 27 W,MAYO,FL,32066,NOT AVAILABLE,(386) 294-4752,STATE,OPEN,304,LAFAYETTE,12067,USA,922140,CORRECTIONAL INSTITUTIONS,http://www.dc.state.fl.us/pub/pop/,9/30/2017,IMAGERY,2017/11/03 00:00:00,http://www.dc.state.fl.us/orginfo/facilitydir.html#4,NOT AVAILABLE,-999,0.00615235181752,735.593929640727,2.35923955194e-06
32,27,10000420,RMC WORK CAMP,P.O. BOX 628,LAKE BUTLER,FL,32054,NOT AVAILABLE,(386) 496-4050,STATE,OPEN,431,UNION,12125,USA,922140,CORRECTIONAL INSTITUTIONS,"http://www.dc.state.fl.us/pub/pop/, http://www.dc.state.fl.us/orginfo/facilitydir.html#4",9/30/2017,IMAGERY,2017/11/03 00:00:00,http://www.dc.state.fl.us/orginfo/facilitydir.html#4,NOT AVAILABLE,432,0.00677115842927,799.92995673726,2.74144147093e-06
33,28,10001804,MARSHALL COUNTY CORRECTIONAL FACILITY,833 WEST ST,HOLLY SPRINGS,MS,38635,NOT AVAILABLE,(662) 252-7111,STATE,OPEN,998,MARSHALL,28093,USA,922140,CORRECTIONAL INSTITUTIONS,"http://www.mdoc.ms.gov/Admin-Finance/Pages/Monthly-Facts.aspx, http://www.mtctrains.com/corrections/#locations",12/4/2017,IMAGERY,2017/12/08 00:00:00,http://www.mtctrains.com/corrections/#locations,MEDIUM,1076,0.0101194377532,1223.58401529339,6.54043435525e-06
34,29,10005643,PEMBINA COUNTY LAW ENFORCEMENT CENTER,308 COURTHOUSE DRIVE #2,CAVALIER,ND,58220,NOT AVAILABLE,(701) 265-4122,COUNTY,OPEN,5,PEMBINA,38067,USA,922140,CORRECTIONAL INSTITUTIONS,http://pembinacountynd.gov/county/departments/sheriff/,6/13/2017,IMAGERY,2018/04/04 00:00:00,http://pembinacountynd.gov/county/departments/sheriff/,MAXIMUM,18,0.00372965626188,516.26778857443,2.86609805271e-07
35,30,10002592,IOWA COUNTY JAIL,1205 N BEQUETTE ST,DODGEVILLE,WI,53533,NOT AVAILABLE,(608) 935-3314 EXT 2,COUNTY,OPEN,-999,IOWA,55049,USA,922140,CORRECTIONAL INSTITUTIONS,http://iowacounty.org/departments/sheriff/sheriff.shtml#about,5/8/2018,IMAGERY,2018/05/08 00:00:00,NOT AVAILABLE,NOT AVAILABLE,-999,0.00198653203974,247.905096440255,1.32089145096e-07
36,31,10000416,NEW RIVER CORRECTIONAL INSTITUTION,8000 NW 80TH PLACE,RAIFORD,FL,32083,NOT AVAILABLE,(904) 368-1500,STATE,OPEN,115,BRADFORD,12007,USA,922140,CORRECTIONAL INSTITUTIONS,"http://www.dc.state.fl.us/pub/pop/, http://www.dc.state.fl.us/facilities/region2/210.html",9/30/2017,IMAGERY,2017/11/03 00:00:00,http://www.dc.state.fl.us/facilities/region2/210.html,CLOSE,1050,0.0116719601344,1408.13271478333,8.91639109369e-06
37,32,10005349,JAMES A MUSICK FACILITY,13502 MUSICK RD,IRVINE,CA,92618,NOT AVAILABLE,(949) 855-2600,COUNTY,OPEN,614,ORANGE,06059,USA,922140,CORRECTIONAL INSTITUTIONS,"http://www.bscc.ca.gov/s_fsojailprofilesurvey.php, http://www.ocsd.org/divisions/custody",2/12/2018,IMAGERY,2018/02/12 00:00:00,http://www.ocsd.org/divisions/custody,MINIMUM,1322,0.0105119174579,1266.48872479661,3.05820695517e-06
38,33,10001821,WILKINSON COUNTY CORRECTIONAL FACILITY,2999 US HWY 61 N,WOODVILLE,MS,39669,NOT AVAILABLE,(601) 888-3199,STATE,OPEN,904,WILKINSON,28157,USA,922140,CORRECTIONAL INSTITUTIONS,"http://www.mdoc.ms.gov/Admin-Finance/Pages/Monthly-Facts.aspx, http://www.mtctrains.com/corrections/#locations",12/4/2017,IMAGERY,2017/12/08 00:00:00,http://www.mtctrains.com/corrections/#locations,CLOSE,900,0.00944026193743,1142.79268057495,5.98503985373e-06
39,34,10005689,BONNER COUNTY JUVENILE DETENTION CENTER,4002 SAMUELSON AVE,SANDPOINT,ID,83864,NOT AVAILABLE,(208) 263-1602,COUNTY,OPEN,-999,BONNER,16017,USA,922140,CORRECTIONAL INSTITUTIONS,https://www.bonnercountyid.gov/departments/JusticeServices/justice-services,2/28/2018,IMAGERY,2018/03/01 00:00:00,https://www.bonnercountyid.gov/departments/JusticeServices/justice-services,JUVENILE,-999,0.00261798969223,345.593263400211,3.63977338393e-07
40,35,10000503,DESOTO WORK CAMP,13617 SE HWY 70,ARCADIA,FL,34266,NOT AVAILABLE,(863) 494-3727,STATE,OPEN,-999,DESOTO,12027,USA,922140,CORRECTIONAL INSTITUTIONS,http://www.dc.state.fl.us/orginfo/facilitydir.html#4,11/3/2017,IMAGERY,2017/11/03 00:00:00,http://www.dc.state.fl.us/orginfo/facilitydir.html#4,NOT AVAILABLE,-999,0.0053986623767,635.080050300454,1.80760313245e-06
41,36,10000518,LOXAHATCHEE ROAD PRISON,230 SUNSHINE RD,WEST PALM BEACH,FL,33411,3616,(561) 791-4760,STATE,OPEN,92,PALM BEACH,12099,USA,922140,CORRECTIONAL INSTITUTIONS,http://www.dc.state.fl.us/pub/pop/,9/30/2017,IMAGERY,2017/11/03 00:00:00,http://www.dc.state.fl.us/orginfo/facilitydir.html#4,NOT AVAILABLE,-999,0.0061350647758,728.429281062577,2.27956947757e-06
42,37,10000457,SUMTER WORK CAMP,9858 COUNTY RD 476B,BUSHNELL,FL,33513,0667,(352) 569-6114,STATE,OPEN,287,SUMTER,12119,USA,922140,CORRECTIONAL INSTITUTIONS,http://www.dc.state.fl.us/pub/pop/,9/30/2017,IMAGERY,2017/11/03 00:00:00,http://www.dc.state.fl.us/orginfo/facilitydir.html#4,NOT AVAILABLE,100,0.00470358399618,557.964184435953,1.4204818779e-06
43,38,10004244,WALNUT GROVE YOUTH CORRECTIONAL FACILITY,1650 HWY 492,WALNUT GROVE,MS,39189,NOT AVAILABLE,(601) 253-2348,STATE,CLOSED,0,LEAKE,28079,USA,922140,CORRECTIONAL INSTITUTIONS,http://www.jacksonfreepress.com/news/2016/sep/15/walnut-grove-prison-officially-closed/,9/15/2016,IMAGERY,2017/12/08 00:00:00,http://www.mdoc.ms.gov/Pages/Facility-Locations.aspx,JUVENILE,1500,0.0108654749052,1299.05842807698,6.44567951368e-06
44,39,10000455,SUMTER CORRECTIONAL INSTITUTION AND BASIC TRAINING UNIT,9544 COUNTY RD 476B,BUSHNELL,FL,33513,0667,(352) 569-6100,STATE,OPEN,1284,SUMTER,12119,USA,922140,CORRECTIONAL INSTITUTIONS,"http://www.dc.state.fl.us/pub/pop/, http://www.dc.state.fl.us/orginfo/facilitydir.html#4",9/30/2017,IMAGERY,2017/11/03 00:00:00,http://www.dc.state.fl.us/orginfo/facilitydir.html#4,CLOSE,1639,0.0211730501638,2524.7881435354,2.81752307239e-05
45,40,10002557,JACKSON COUNTY JAIL,30 N 3RD ST,BLACK RIVER FALLS,WI,54615,NOT AVAILABLE,NOT AVAILABLE,COUNTY,OPEN,70,JACKSON,55053,USA,922140,CORRECTIONAL INSTITUTIONS,http://www.co.jackson.wi.us/index.asp?Type=B_BASIC&SEC={F36F4D0A-D731-4DD2-BEA0-A9D5F213D9DD},4/5/2018,IMAGERY,2018/05/09 00:00:00,NOT AVAILABLE,MAXIMUM,-999,0.00179424978282,253.617325883346,1.49249600485e-07
46,41,10005346,THEO LACY FACILITY,501 THE CITY DRIVE SOUTH,ORANGE,CA,92868,NOT AVAILABLE,(714) 935-6940,COUNTY,OPEN,3249,ORANGE,06059,USA,922140,CORRECTIONAL INSTITUTIONS,"http://www.bscc.ca.gov/s_fsojailprofilesurvey.php, http://www.ocsd.org/divisions/custody",2/12/2018,IMAGERY,2018/02/12 00:00:00,http://www.ocsd.org/divisions/custody,MAXIMUM,3442,0.00903647916754,1092.41237669684,4.63206782345e-06
47,42,10006654,OUR HOME - PARKSTON,103 W MAPLE ST,PARKSTON,SD,57336,NOT AVAILABLE,(605) 928-7907,STATE,OPEN,34,HUTCHINSON,46067,USA,922140,CORRECTIONAL INSTITUTIONS,http://www.ourhomeinc.org/PREA.html,6/15/2016,IMAGERY,2018/01/09 00:00:00,http://www.ourhomeinc.org/index.html,JUVENILE,385,0.0037360717591,483.718068325205,4.21791858955e-07
48,43,10005654,RICHLAND COUNTY SHERIFF'S DEPARMENT,413 3RD AVENUE NORTH,WAHPETON,ND,58075,NOT AVAILABLE,(701) 642-7711,COUNTY,OPEN,-999,RICHLAND,38077,USA,922140,CORRECTIONAL INSTITUTIONS,http://www.co.richland.nd.us/sheriff-jail,4/4/2018,IMAGERY,2018/04/04 00:00:00,http://www.co.richland.nd.us/sheriff-jail,MINIMUM,-999,0.00296123783554,391.204994533501,3.86444841371e-07
49,44,10003605,SOUTHWEST MULTI-COUNTY CORRECTION CENTER,66 MUSEUM DR,DICKINSON,ND,58601,NOT AVAILABLE,NOT AVAILABLE,COUNTY,OPEN,-999,STARK,38089,USA,922140,CORRECTIONAL INSTITUTIONS,http://swmccc.govoffice3.com/,4/4/2018,IMAGERY,2018/04/04 00:00:00,http://swmccc.govoffice3.com/,MINIMUM,118,0.00353957975658,471.491141184113,5.63781868097e-07
50,45,10001948,BONNEVILLE COUNTY JAIL / WORK RELEASE CENTER,900 ENVIRONMENTAL WAY,IDAHO FALLS,ID,83401,NOT AVAILABLE,(208) 529-1315,COUNTY,OPEN,399,BONNEVILLE,16019,USA,922140,CORRECTIONAL INSTITUTIONS,http://www.bonnevillesheriff.com/,2/28/2018,IMAGERY,2018/03/01 00:00:00,http://www.bonnevillesheriff.com/,NOT AVAILABLE,340,0.00667135607438,852.547100675309,1.19686448538e-06
51,46,10004084,NATCHITOCHES PARISH DETENTION CENTER,299 EDWINA DR,NATCHITOCHES,LA,71457,NOT AVAILABLE,(318) 357-9300,COUNTY,OPEN,502,NATCHITOCHES,22069,USA,922140,CORRECTIONAL INSTITUTIONS,http://doc.louisiana.gov/briefing-book,9/29/2017,IMAGERY,2018/03/15 00:00:00,https://npsheriff.org/,MEDIUM,515,0.00462308094928,558.24797633542,1.08857830083e-06
52,47,10005347,ORANGE COUNTY JUVENILE HALL,331 THE CITY DRIVE,ORANGE,CA,92868,NOT AVAILABLE,(714) 935-6660,COUNTY,OPEN,-999,ORANGE,06059,USA,922140,CORRECTIONAL INSTITUTIONS,http://www.ocgov.com/gov/probation/contact/institutions,2/12/2018,IMAGERY,2018/02/12 00:00:00,http://www.ocgov.com/gov/probation/contact/institutions,JUVENILE,434,0.0103705731634,1252.0770931556,5.03426593569e-06
53,48,10002190,BROWARD JUVENILE DETENTION CENTER,222 NW 22ND AVE,FT. LAUDERDALE,FL,33311,NOT AVAILABLE,(954) 467-4563,STATE,OPEN,-999,BROWARD,12011,USA,922140,CORRECTIONAL INSTITUTIONS,http://www.djj.state.fl.us/programs-facilities/detention-centers,11/3/2017,IMAGERY,2017/11/03 00:00:00,http://www.djj.state.fl.us/programs-facilities/detention-centers,JUVENILE,102,0.00518293995952,595.96618405771,9.73354591661e-07
54,49,10003526,SEVIER COUNTY JAIL ANNEX,896 OLD KNOXVILLE HWY,SEVIERVILLE,TN,37862,NOT AVAILABLE,NOT AVAILABLE,COUNTY,OPEN,324,SEVIER,47155,USA,922140,CORRECTIONAL INSTITUTIONS,"https://www.tn.gov/correction/statistics-and-information/jail-summary-reports.html, http://www.seviercountysheriff.com/",3/31/2018,IMAGERY,2018/04/24 00:00:00,http://www.seviercountysheriff.com/,MINIMUM,356,0.00387981160942,476.004422836241,7.43527652505e-07
55,50,10001450,ALACHUA REGIONAL JUVENILE DETENTION CENTER,3440 NE 39TH AVE,GAINESVILLE,FL,32609,NOT AVAILABLE,(352) 955-2105,STATE,OPEN,40,ALACHUA,12001,USA,922140,CORRECTIONAL INSTITUTIONS,"https://nces.ed.gov/ccd/schoolsearch/, http://www.djj.state.fl.us/programs-facilities/detention-centers",10/31/2015,IMAGERY,2017/11/06 00:00:00,http://www.djj.state.fl.us/programs-facilities/detention-centers,JUVENILE,48,0.00376662811705,449.714906328064,6.32573061216e-07
56,51,10005351,YOUTH LEADERSHIP ACADEMY,3155 WEST JUSTICE CENTER WAY,ORANGE,CA,92868,NOT AVAILABLE,(714) 935-7099,COUNTY,OPEN,-999,ORANGE,06059,USA,922140,CORRECTIONAL INSTITUTIONS,http://www.ocgov.com/gov/probation/contact/institutions,2/12/2018,IMAGERY,2018/02/12 00:00:00,http://www.ocgov.com/gov/probation/contact/institutions,JUVENILE,120,0.00278900226777,325.002138133179,3.44703968987e-07
57,52,10006655,OUR HOME - ADOLESCENT SEXUAL ADJUSTMENT PROGRAM,40354 210TH ST,HURON,SD,57350,NOT AVAILABLE,(605) 352-9098,STATE,OPEN,36,BEADLE,46005,USA,922140,CORRECTIONAL INSTITUTIONS,http://www.ourhomeinc.org/PREA.html,6/15/2016,IMAGERY,2018/01/09 00:00:00,http://www.ourhomeinc.org/index.html,JUVENILE,36,0.00709614550032,869.078346464021,2.36988579149e-06
58,53,10005059,BOUNDARY COUNTY JAIL,6438 KOOTENAI STREET,BONNERS FERRY,ID,83805,NOT AVAILABLE,(208) 267-3151 EXT 207,COUNTY,OPEN,-999,BOUNDARY,16021,USA,922140,CORRECTIONAL INSTITUTIONS,https://www.boundarysheriff.org/,2/28/2018,IMAGERY,2018/03/01 00:00:00,https://www.boundarysheriff.org/,NOT AVAILABLE,-999,0.00143719718634,196.592453214195,1.07221461023e-07
59,54,10005076,BUTTE COUNTY JAIL,P.O. BOX 130,ARCO,ID,83213,NOT AVAILABLE,(208) 527-8553,COUNTY,NOT AVAILABLE,-999,BUTTE,16023,USA,922140,CORRECTIONAL INSTITUTIONS,http://www.buttecountyid.us/about/butte-county-sheriffs-office/,2/28/2018,UNVERIFIED,2018/03/01 00:00:00,http://www.buttecountyid.us/about/butte-county-sheriffs-office/,NOT AVAILABLE,-999,0.0015373474522,195.839202222151,9.24691308641e-08
60,55,10004085,NATCHITOCHES PARISH WORK RELEASE FACILITY,299 EDWINA DR,NATCHITOCHES,LA,71457,NOT AVAILABLE,NOT AVAILABLE,COUNTY,OPEN,13,NATCHITOCHES,22069,USA,922140,CORRECTIONAL INSTITUTIONS,http://doc.louisiana.gov/briefing-book,9/29/2017,IMAGERY,2018/03/15 00:00:00,https://npsheriff.org/,MINIMUM,48,0.00152195385891,183.437581375913,1.44036036832e-07
61,56,10002593,JEFFERSON COUNTY JAIL,411 S CENTER AVE,JEFFERSON,WI,53549,1703,(920) 674-7310,COUNTY,OPEN,153,JEFFERSON,55055,USA,922140,CORRECTIONAL INSTITUTIONS,http://www.jeffersoncountywi.gov/departments/sheriff/divisions/index.php,5/9/2018,IMAGERY,2018/05/09 00:00:00,NOT AVAILABLE,MAXIMUM,229,0.00542903705446,727.701316397252,7.4119526764e-07
62,57,10001946,DALE G HAILE DETENTION CENTER,219 N 12TH AVE,CALDWELL,ID,83605,NOT AVAILABLE,(208) 454-6603,COUNTY,OPEN,424,CANYON,16027,USA,922140,CORRECTIONAL INSTITUTIONS,https://www.canyonco.org/elected-officials/sheriff/,2/28/2018,IMAGERY,2018/03/01 00:00:00,https://www.canyonco.org/elected-officials/sheriff/,NOT AVAILABLE,361,0.00671043470972,863.729132874796,1.10269976444e-06
63,58,10005348,JOPLIN YOUTH CENTER,19480 ROSE CANYON ROAD,TRABUCO CANYON,CA,92678,NOT AVAILABLE,(949) 635-2600,COUNTY,OPEN,-999,ORANGE,06059,USA,922140,CORRECTIONAL INSTITUTIONS,http://www.ocgov.com/gov/probation/contact/institutions,2/12/2018,IMAGERY,2018/02/12 00:00:00,http://www.ocgov.com/gov/probation/contact/institutions,JUVENILE,64,0.0034538481783,416.505658913541,7.25476421546e-07
64,59,10000347,ESCAMBIA REGIONAL JUVENILE DETENTION CENTER,1800 ST. MARY AVE,PENSACOLA,FL,32501,NOT AVAILABLE,(850) 595-8820,STATE,OPEN,-999,ESCAMBIA,12033,USA,922140,CORRECTIONAL INSTITUTIONS,http://www.djj.state.fl.us/programs-facilities/detention-centers,11/6/2017,IMAGERY,2017/11/06 00:00:00,http://www.djj.state.fl.us/programs-facilities/detention-centers,JUVENILE,50,0.00487679468635,577.092115852049,1.11512854677e-06
65,60,10004619,MANATEE REGIONAL JUVENILE DETENTION CENTER,1803 5TH STREET WEST,BRADENTON,FL,34205,NOT AVAILABLE,(941) 741-3023,STATE,OPEN,-999,MANATEE,12081,USA,922140,CORRECTIONAL INSTITUTIONS,http://www.djj.state.fl.us/programs-facilities/detention-centers,11/6/2017,IMAGERY,2017/11/06 00:00:00,http://www.djj.state.fl.us/programs-facilities/detention-centers,JUVENILE,42,0.00318954871908,376.697791333597,4.53498360531e-07
66,61,10005345,YOUTH GUIDANCE CENTER,3030 NORTH HESPERIAN WAY,SANTA ANA,CA,92706,NOT AVAILABLE,(714) 836-2700,COUNTY,OPEN,-999,ORANGE,06059,USA,922140,CORRECTIONAL INSTITUTIONS,http://www.ocgov.com/gov/probation/contact/institutions,2/12/2018,IMAGERY,2018/02/12 00:00:00,http://www.ocgov.com/gov/probation/contact/institutions,JUVENILE,80,0.003631665933,438.368523756134,5.12926821375e-07
67,62,10001809,CARROLL-MONTGOMERY COUNTY REGIONAL CORRECTIONAL FACILITY,33714 MS HWY 35,VAIDEN,MS,39176,NOT AVAILABLE,(662) 464-5440,COUNTY,OPEN,273,CARROLL,28015,USA,922140,CORRECTIONAL INSTITUTIONS,http://www.mdoc.ms.gov/Admin-Finance/Pages/Monthly-Facts.aspx,12/4/2017,IMAGERY,2017/12/08 00:00:00,http://www.mdoc.ms.gov/Pages/Facility-Locations.aspx,MEDIUM,280,0.0056961128416,695.469910676398,1.74032529164e-06
68,63,10006656,SUMMIT OAKS,621 EAST PRESENTATION ST,SIOUX FALLS,SD,57104,NOT AVAILABLE,(605) 221-2346,STATE,OPEN,-999,MINNEHAHA,46099,USA,922140,CORRECTIONAL INSTITUTIONS,http://doc.sd.gov/juvenile/JuvenilePrivatePlacement.aspx,1/9/2018,IMAGERY,2018/01/09 00:00:00,https://www.lsssd.org/what-we-do/child-adolescent-services/residential-services-for-children-youth/,JUVENILE,-999,0.00327777576229,432.680051761433,5.04393191392e-07
69,64,10004102,HOUSE OF DETENTION,2735 PERDIDO ST,NEW ORLEANS,LA,70119,NOT AVAILABLE,NOT AVAILABLE,COUNTY,CLOSED,0,ORLEANS,22071,USA,922140,CORRECTIONAL INSTITUTIONS,https://thelensnola.org/2012/04/10/gusman-closes-house-of-detention/,4/10/2012,UNVERIFIED,2018/03/15 00:00:00,NOT AVAILABLE,NOT AVAILABLE,-999,0.00246825604677,291.78128082362,3.67783349026e-07
70,65,10003545,SHELBY COUNTY JAIL,201 POPLAR AVE,MEMPHIS,TN,38103,NOT AVAILABLE,NOT AVAILABLE,COUNTY,OPEN,2359,SHELBY,47157,USA,922140,CORRECTIONAL INSTITUTIONS,http://www.shelby-sheriff.org/index.html,4/24/2018,IMAGERY,2018/04/24 00:00:00,http://www.shelby-sheriff.org/index.html,NOT AVAILABLE,-999,0.0101708198509,1216.97595152339,1.73086052972e-06
71,66,10006827,LAKE REGION RESIDENTIAL RE-ENTRY CENTER,225 W. WALNUT STREET,DEVILS LAKE,ND,58301,NOT AVAILABLE,(701) 662-0735,COUNTY,OPEN,23,RAMSEY,38071,USA,922140,CORRECTIONAL INSTITUTIONS,https://www.lrlec.org/,6/12/2015,IMAGERY/OTHER,2018/04/04 00:00:00,https://www.lrlec.org/,NOT AVAILABLE,28,0.00110487164205,162.050745311791,6.10910974073e-08
72,67,10006102,ADAMS COUNTY JAIL / SHERIFF,"500 WEST 4TH STREET, SUITE 126",HASTINGS,NE,68902,NOT AVAILABLE,NOT AVAILABLE,COUNTY,OPEN,29,ADAMS,31001,USA,922140,CORRECTIONAL INSTITUTIONS,https://ncc.nebraska.gov/jail-standards-inspection-reports,4/4/2018,IMAGERY,2018/04/04 00:00:00,NOT AVAILABLE,NOT AVAILABLE,37,0.0018604738266,231.646793348013,2.02582217269e-07
73,68,10000544,MIAMI DADE REGIONAL JUVENILE DETENTION CENTER,3300 NW 27TH AVE,MIAMI,FL,33142,NOT AVAILABLE,(305) 637-4500,STATE,OPEN,-999,MIAMI-DADE,12086,USA,922140,CORRECTIONAL INSTITUTIONS,http://www.djj.state.fl.us/programs-facilities/detention-centers,11/6/2017,IMAGERY,2017/11/06 00:00:00,http://www.djj.state.fl.us/programs-facilities/detention-centers,JUVENILE,126,0.00958123864229,1097.51075838623,4.0184822158e-06
74,69,10001179,SOUTHWEST IDAHO JUVENILE DETENTION CENTER,222 N 12TH AVE,CALDWELL,ID,83605,NOT AVAILABLE,(208) 454-7240,COUNTY,OPEN,45,CANYON,16027,USA,922140,CORRECTIONAL INSTITUTIONS,http://www.canyonco.org/elected-officials/commissioners/juvenile-detention/,3/1/2018,IMAGERY,2018/03/01 00:00:00,http://www.canyonco.org/elected-officials/commissioners/juvenile-detention/,JUVENILE,90,0.00531911676542,682.373128039018,7.76966321581e-07
75,70,10005073,FREMONT COUNTY JAIL,146 NORTH 2ND WEST,SAINT ANTHONY,ID,83445,NOT AVAILABLE,(208) 624-4482,COUNTY,OPEN,-999,FREMONT,16043,USA,922140,CORRECTIONAL INSTITUTIONS,http://www.co.fremont.id.us/departments/sheriff/,2/15/2016,IMAGERY,2018/03/01 00:00:00,http://www.co.fremont.id.us/departments/sheriff/,NOT AVAILABLE,-999,0.00145146369164,189.681615247788,1.12478182164e-07
76,71,10005063,CLEARWATER COUNTY JAIL,"150 MICHIGAN AVENUE, 2ND FLOOR",OROFINO,ID,83544,NOT AVAILABLE,(208) 476-4521,COUNTY,OPEN,-999,CLEARWATER,16035,USA,922140,CORRECTIONAL INSTITUTIONS,http://www.clearwatercounty.org/departments/sheriff/index.php,3/1/2018,IMAGERY,2018/03/01 00:00:00,http://www.clearwatercounty.org/departments/sheriff/index.php,NOT AVAILABLE,-999,0.00177650315215,242.000531521379,1.83793853626e-07
77,72,10005088,MINI-CASSIA CRIMINAL JUSTICE CENTER,1415 ALBION AVENUE,BURLEY,ID,83318,NOT AVAILABLE,(208) 878-1000,COUNTY,OPEN,176,CASSIA,16031,USA,922140,CORRECTIONAL INSTITUTIONS,https://www.cassiacounty.org/sheriff,3/1/2018,IMAGERY,2018/03/01 00:00:00,https://www.cassiacounty.org/sheriff,NOT AVAILABLE,-999,0.00300835807049,391.641443423171,5.23198606572e-07
78,73,10000464,ORANGE REGIONAL JUVENILE DETENTION CENTER,2800 S BUMBY AVE,ORLANDO,FL,32806,NOT AVAILABLE,(407) 897-2800,STATE,OPEN,20,ORANGE,12095,USA,922140,CORRECTIONAL INSTITUTIONS,http://www.djj.state.fl.us/programs-facilities/detention-centers,10/31/2015,IMAGERY,2017/11/06 00:00:00,http://www.djj.state.fl.us/programs-facilities/detention-centers,JUVENILE,124,0.00743219905992,864.085500635915,1.34307666474e-06
79,74,10005086,CARIBOU COUNTY JAIL,475 EAST 2ND SOUTH,SODA SPRINGS,ID,83276,NOT AVAILABLE,(208) 547-3094,COUNTY,OPEN,25,CARIBOU,16029,USA,922140,CORRECTIONAL INSTITUTIONS,https://www.cariboucountysheriff.com/,10/13/2016,IMAGERY,2018/03/01 00:00:00,https://www.cariboucountysheriff.com/,MAXIMUM,49,0.00261640015905,333.678150311964,3.54528295747e-07
80,75,10005074,CLARK COUNTY JAIL,224 WEST MAIN STREET,DUBOIS,ID,83423,NOT AVAILABLE,(208) 374-5403,COUNTY,OPEN,-999,CLARK,16033,USA,922140,CORRECTIONAL INSTITUTIONS,https://www.clark-co.id.gov/county-officials,3/1/2018,IMAGERY,2018/03/01 00:00:00,https://www.clark-co.id.gov/county-officials,NOT AVAILABLE,-999,0.00161879836313,219.283070996311,1.4352766376e-07
81,76,10002563,JUNEAU COUNTY JAIL,200 OAK ST,MAUSTON,WI,53948,NOT AVAILABLE,(608) 847-9513,COUNTY,OPEN,36,JUNEAU,55057,USA,922140,CORRECTIONAL INSTITUTIONS,http://www.co.juneau.wi.gov/sheriffs-office1.html,5/9/2018,IMAGERY,2018/05/09 00:00:00,NOT AVAILABLE,NOT AVAILABLE,157,0.00449639210609,582.493600794028,7.8831003605e-07
82,77,10005078,ELMORE COUNTY DETENTION CENTER,2255 EAST 8TH NORTH,MOUNTAIN HOME,ID,83647,NOT AVAILABLE,(208) 587-9103,COUNTY,OPEN,121,ELMORE,16039,USA,922140,CORRECTIONAL INSTITUTIONS,http://www.elmorecounty.org/Sheriff/default.html,10/19/2017,IMAGERY,2018/03/01 00:00:00,http://www.elmorecounty.org/Sheriff/default.html,MAXIMUM,127,0.0040961189613,550.457498417356,8.62370335942e-07
83,78,10006657,BENCHMARK BEHAVIORAL HEALTH SYSTEMS,592 WEST 1350 SOUTH,WOODS CROSS,UT,84087,NOT AVAILABLE,(801) 299-5319,STATE,OPEN,-999,DAVIS,49011,USA,922140,CORRECTIONAL INSTITUTIONS,"http://doc.sd.gov/juvenile/JuvenilePrivatePlacement.aspx, https://www.bbhsnet.com/",1/9/2018,IMAGERY,2018/01/09 00:00:00,https://www.bbhsnet.com/,JUVENILE,84,0.00319136428787,404.812184160258,6.24161148522e-07
84,79,10005071,CUSTER COUNTY JAIL,130 S. 9TH STREET,CHALLIS,ID,83226,NOT AVAILABLE,(208) 879-2232,COUNTY,OPEN,-999,CUSTER,16037,USA,922140,CORRECTIONAL INSTITUTIONS,http://www.co.custer.id.us/departments/legislative/sheriff/,3/1/2018,UNVERIFIED,2018/03/01 00:00:00,http://www.co.custer.id.us/departments/legislative/sheriff/,NOT AVAILABLE,-999,0.00107985096735,137.84824883668,6.16689783328e-08
85,80,10005064,IDAHO COUNTY JAIL,320 WEST MAIN STREET,GRANGEVILLE,ID,83530,NOT AVAILABLE,(208) 983-1123,COUNTY,OPEN,18,IDAHO,16049,USA,922140,CORRECTIONAL INSTITUTIONS,http://idahocounty.org/sheriffs-office/jail-division/,3/1/2018,IMAGERY,2018/03/01 00:00:00,http://idahocounty.org/sheriffs-office/jail-division/,NOT AVAILABLE,11,0.00172286809198,211.350800540885,1.21785927195e-07
86,81,10005087,JEROME COUNTY JAIL,2151 S TIGER DRIVE,JEROME,ID,83338,NOT AVAILABLE,(208) 595-3360,COUNTY,OPEN,-999,JEROME,16053,USA,922140,CORRECTIONAL INSTITUTIONS,https://www.jeromecountyid.us/190/Sheriff,3/1/2018,IMAGERY,2018/03/01 00:00:00,https://www.jeromecountyid.us/190/Sheriff,NOT AVAILABLE,-999,0.0029396041305,388.479822634292,4.01105930459e-07
87,82,10000471,PASCO JUVENILE DETENTION CENTER,28534 STATE ROAD 52,SAN ANTONIO,FL,33576,NOT AVAILABLE,(352) 588-5900,STATE,OPEN,49,PASCO,12101,USA,922140,CORRECTIONAL INSTITUTIONS,http://www.djj.state.fl.us/programs-facilities/detention-centers,11/6/2017,IMAGERY,2017/11/06 00:00:00,http://www.djj.state.fl.us/programs-facilities/detention-centers,JUVENILE,36,0.00348165861579,411.302657185645,7.4538002897e-07
88,83,10006706,SOUTH PLACER JAIL,11801 GO FOR BROKE ROAD,ROSEVILLE,CA,95678,NOT AVAILABLE,(916) 409-8100,COUNTY,OPEN,389,PLACER,06061,USA,922140,CORRECTIONAL INSTITUTIONS,http://www.bscc.ca.gov/s_fsojailprofilesurvey.php,2/12/2018,IMAGERY,2018/02/12 00:00:00,https://www.placer.ca.gov/departments/Sheriff/Corrections,NOT AVAILABLE,-999,0.0117612255439,1518.46766002035,5.24049205727e-06
89,84,10004334,KOOTENAI COUNTY JAIL,5500 N GOVERNMENT WAY,COEUR D'ALENE,ID,83815,NOT AVAILABLE,(208) 446-1400,COUNTY,OPEN,461,KOOTENAI,16055,USA,922140,CORRECTIONAL INSTITUTIONS,http://www.kcsheriff.com/index.html,3/1/2018,IMAGERY,2018/03/01 00:00:00,http://www.kcsheriff.com/index.html,NOT AVAILABLE,325,0.00531088518727,712.022123713859,1.04330335101e-06
90,85,10004101,ORLEANS PARISH PRISON,531 SOUTH BROAD ST,NEW ORLEANS,LA,70119,NOT AVAILABLE,(504) 827-8810,COUNTY,CLOSED,0,ORLEANS,22071,USA,922140,CORRECTIONAL INSTITUTIONS,http://www.theadvocate.com/new_orleans/news/article_f9e8c064-914d-53e9-9439-0da4627e0c1a.html,9/14/2015,IMAGERY,2018/03/15 00:00:00,http://www.opcso.org/index.php?option=com_simplelists&view=simplelist&layout=toggle&category_id=97&Itemid=201#orleans-parish-prison,NOT AVAILABLE,3377,0.00587931032617,690.738121043624,1.64248806153e-06
91,86,10001814,LEAKE COUNTY CORRECTIONAL FACILITY,399 C O BROOKS ST,CARTHAGE,MS,39051,NOT AVAILABLE,(601) 298-9003,COUNTY,OPEN,229,LEAKE,28079,USA,922140,CORRECTIONAL INSTITUTIONS,http://www.mdoc.ms.gov/Admin-Finance/Pages/Monthly-Facts.aspx,12/4/2017,IMAGERY/OTHER,2017/12/08 00:00:00,http://www.mdoc.ms.gov/Pages/Facility-Locations.aspx,MEDIUM,280,0.0048932416324,602.655554361639,1.28221931004e-06
92,87,10006073,ANTELOPE COUNTY JAIL / SHERIFF,1102 L STREET,NELIGH,NE,68756,NOT AVAILABLE,NOT AVAILABLE,COUNTY,OPEN,7,ANTELOPE,31003,USA,922140,CORRECTIONAL INSTITUTIONS,https://ncc.nebraska.gov/jail-standards-inspection-reports,4/4/2018,IMAGERY,2018/04/04 00:00:00,NOT AVAILABLE,NOT AVAILABLE,31,0.00188029620468,235.652941939329,1.60105871824e-07
93,88,10004107,CONCHETTA,2620 TULANE AVE,NEW ORLEANS,LA,70119,NOT AVAILABLE,(504) 827-6766,COUNTY,CLOSED,0,ORLEANS,22071,USA,922140,CORRECTIONAL INSTITUTIONS,http://www.theadvocate.com/new_orleans/news/article_f9e8c064-914d-53e9-9439-0da4627e0c1a.html,9/14/2015,IMAGERY,2018/03/15 00:00:00,http://www.opcso.org/index.php?option=com_simplelists&view=simplelist&layout=toggle&category_id=97&Itemid=201,NOT AVAILABLE,-999,0.00248453208608,293.356467433127,3.11696852021e-07
94,89,10006658,CLARINDA ACADEMY,1820 N. 16TH ST,CLARINDA,IA,51632,NOT AVAILABLE,(712) 542-6128,STATE,OPEN,190,PAGE,19145,USA,922140,CORRECTIONAL INSTITUTIONS,http://www.clarindaacademy.org/prea.html,11/14/2015,IMAGERY,2018/01/09 00:00:00,http://www.clarindaacademy.org/index.html,JUVENILE,265,0.00386408124568,470.3086205181,4.87325583424e-07
95,90,10006079,BOONE COUNTY JAIL / SHERIFF,217 SOUTH 5TH STREET,ALBION,NE,68620,NOT AVAILABLE,NOT AVAILABLE,COUNTY,OPEN,1,BOONE,31011,USA,922140,CORRECTIONAL INSTITUTIONS,https://ncc.nebraska.gov/jail-standards-inspection-reports,4/4/2018,IMAGERY,2018/04/04 00:00:00,NOT AVAILABLE,NOT AVAILABLE,8,0.000904587843774,116.008752041965,3.33411065314e-08
96,91,10003544,SHELBY COUNTY JAIL WOMEN'S FACILITY,6201 HALEY RD,MEMPHIS,TN,38134,NOT AVAILABLE,NOT AVAILABLE,COUNTY,OPEN,228,SHELBY,47157,USA,922140,CORRECTIONAL INSTITUTIONS,http://www.shelby-sheriff.org/index.html,4/24/2018,IMAGERY,2018/04/24 00:00:00,http://www.shelby-sheriff.org/index.html,NOT AVAILABLE,-999,0.0061199470611,748.138500177585,1.10494578157e-06
97,92,10005269,PLUMAS COUNTY CORRECTIONAL FACILITY,50 ABERNATHY LANE,QUINCY,CA,95971,NOT AVAILABLE,(530) 283-6267,COUNTY,OPEN,51,PLUMAS,06063,USA,922140,CORRECTIONAL INSTITUTIONS,http://www.bscc.ca.gov/s_fsojailprofilesurvey.php,2/12/2018,IMAGERY,2018/02/12 00:00:00,http://www.countyofplumas.com/index.aspx?NID=587,NOT AVAILABLE,-999,0.00315995827127,388.393445875045,5.80645093835e-07
98,93,10006729,PIERCE CLEGG WORK RELEASE CENTER,250 E DALTON AVE,DALTON GARDENS,ID,83815,NOT AVAILABLE,(208) 446-1370,COUNTY,OPEN,-999,KOOTENAI,16055,USA,922140,CORRECTIONAL INSTITUTIONS,http://www.kcsheriff.com/index.html,3/1/2018,IMAGERY,2018/03/01 00:00:00,http://www.kcsheriff.com/index.html,NOT AVAILABLE,-999,0.00159469219924,215.528343266509,1.37135571386e-07
99,94,10006071,BOX BUTTE COUNTY JAIL,512 NIOBRARA AVENUE,ALLIANCE,NE,69301,NOT AVAILABLE,NOT AVAILABLE,COUNTY,OPEN,14,BOX BUTTE,31013,USA,922140,CORRECTIONAL INSTITUTIONS,https://ncc.nebraska.gov/jail-standards-inspection-reports,4/4/2018,IMAGERY,2018/04/04 00:00:00,NOT AVAILABLE,NOT AVAILABLE,32,0.00190452874222,242.076046249403,1.74450841953e-07
100,95,10005344,SOUTHWEST JUVENILE HALL,30755-C AULD ROAD,MURRIETA,CA,92563,NOT AVAILABLE,(951) 600-6750,COUNTY,OPEN,-999,RIVERSIDE,06065,USA,922140,CORRECTIONAL INSTITUTIONS,http://rcprob.us/index.html,2/12/2018,IMAGERY,2018/02/12 00:00:00,http://rcprob.us/index.html,JUVENILE,99,0.00533046169576,658.359189997161,1.02960040843e-06
101,96,10000862,RIVERSIDE COUNTY INDIO JAIL,46057 OASIS STREET,INDIO,CA,92201,NOT AVAILABLE,(760) 863-8252,COUNTY,OPEN,364,RIVERSIDE,06065,USA,922140,CORRECTIONAL INSTITUTIONS,http://www.bscc.ca.gov/s_fsojailprofilesurvey.php,2/12/2018,IMAGERY,2018/02/12 00:00:00,http://www.riversidesheriff.org/corrections/,NOT AVAILABLE,-999,0.00489866359633,588.671965736634,9.9624438359e-07
102,97,10001536,ROBERT PRESLEY DETENTION CENTER,4000 ORANGE STREET,RIVERSIDE,CA,92501,NOT AVAILABLE,(951) 955-4500,COUNTY,OPEN,711,RIVERSIDE,06065,USA,922140,CORRECTIONAL INSTITUTIONS,http://www.bscc.ca.gov/s_fsojailprofilesurvey.php,2/12/2018,IMAGERY,2018/02/12 00:00:00,http://www.riversidesheriff.org/corrections/,NOT AVAILABLE,-999,0.00229933686192,274.862066629438,3.30278941018e-07
103,98,10006659,COASTAL HARBOR TREATMENT CENTER,1150 CORNELL AVE,SAVANNAH,GA,31406,NOT AVAILABLE,(912) 354-3911,STATE,OPEN,-999,CHATHAM,13051,USA,922140,CORRECTIONAL INSTITUTIONS,http://doc.sd.gov/juvenile/JuvenilePrivatePlacement.aspx,1/9/2018,IMAGERY,2018/01/09 00:00:00,https://coastalharbor.com/,JUVENILE,-999,0.00335391338321,408.964988879098,4.8352056303e-07
104,99,10000860,RIVERSIDE COUNTY JUVENILE HALL,3933 HARRISON STREET,RIVERSIDE,CA,92503,3523,(951) 358-4200,COUNTY,OPEN,-999,RIVERSIDE,06065,USA,922140,CORRECTIONAL INSTITUTIONS,http://rcprob.us/index.html,2/15/2016,IMAGERY,2018/02/12 00:00:00,http://rcprob.us/index.html,JUVENILE,187,0.00951505173629,1155.1643687666,4.23603541349e-06
105,100,10006084,BUTLER COUNTY JAIL,451 5TH STREET,DAVID CITY,NE,68632,NOT AVAILABLE,NOT AVAILABLE,COUNTY,OPEN,18,BUTLER,31023,USA,922140,CORRECTIONAL INSTITUTIONS,https://ncc.nebraska.gov/jail-standards-inspection-reports,4/4/2018,IMAGERY,2018/04/04 00:00:00,NOT AVAILABLE,NOT AVAILABLE,28,0.00354929942171,456.382197661934,4.07759974576e-07
106,101,10000778,SACRAMENTO COUNTY MAIN JAIL,651 I STREET,SACRAMENTO,CA,95814,NOT AVAILABLE,(916) 874-6752,COUNTY,OPEN,1917,SACRAMENTO,06067,USA,922140,CORRECTIONAL INSTITUTIONS,http://www.bscc.ca.gov/s_fsojailprofilesurvey.php,2/12/2018,IMAGERY,2018/02/12 00:00:00,https://www.sacsheriff.com/pages/organization/main_jail/mainjail.aspx,NOT AVAILABLE,-999,0.00314151935631,381.97315064488,5.38296173826e-07
107,102,10002574,LA CROSSE COUNTY JAIL,333 VINE ST,LA CROSSE,WI,54601,NOT AVAILABLE,(608) 785-9630,COUNTY,OPEN,189,LA CROSSE,55063,USA,922140,CORRECTIONAL INSTITUTIONS,http://www.co.la-crosse.wi.us/Sheriff/index.asp,5/9/2018,IMAGERY/OTHER,2018/05/09 00:00:00,http://www.co.la-crosse.wi.us/Sheriff/index.asp,NOT AVAILABLE,323,0.00428608628047,545.617191272784,1.02611310617e-06
108,103,10005067,LEMHI COUNTY JAIL / JUVENILE DETENTION CENTER,206 COURTHOUSE DRIVE,SALMON,ID,83467,NOT AVAILABLE,(208) 756-8980,COUNTY,OPEN,-999,LEMHI,16059,USA,922140,CORRECTIONAL INSTITUTIONS,http://lemhicountyidaho.org/Sheriffs%20Office.htm,3/1/2018,IMAGERY,2018/03/01 00:00:00,http://lemhicountyidaho.org/Sheriffs%20Office.htm,NOT AVAILABLE,26,0.00187858336507,243.831493136799,1.49972137725e-07
109,104,10002542,MARATHON COUNTY JAIL / SHERIFF,500 FOREST ST,WAUSAU,WI,54403,NOT AVAILABLE,NOT AVAILABLE,COUNTY,OPEN,330,MARATHON,55073,USA,922140,CORRECTIONAL INSTITUTIONS,http://www.co.marathon.wi.us/Departments/Sheriff.aspx,5/9/2018,IMAGERY,2018/05/09 00:00:00,NOT AVAILABLE,NOT AVAILABLE,279,0.00658829046428,849.789311654702,1.12561402726e-06
110,105,10006066,CEDAR COUNTY JAIL,101 SOUTH BROADWAY STREET,HARTINGTON,NE,68739,NOT AVAILABLE,NOT AVAILABLE,COUNTY,OPEN,4,CEDAR,31027,USA,922140,CORRECTIONAL INSTITUTIONS,https://ncc.nebraska.gov/jail-standards-inspection-reports,4/4/2018,IMAGERY,2018/04/04 00:00:00,NOT AVAILABLE,NOT AVAILABLE,20,0.00277692030487,350.192698664456,2.34656204829e-07
111,106,10000779,RIO COSUMNES CORRECTIONAL CENTER,12500 BRUCEVILLE ROAD,ELK GROVE,CA,95757,NOT AVAILABLE,(916) 874-1927,COUNTY,OPEN,1504,SACRAMENTO,06067,USA,922140,CORRECTIONAL INSTITUTIONS,http://www.bscc.ca.gov/s_fsojailprofilesurvey.php,2/12/2018,IMAGERY,2018/02/12 00:00:00,https://www.sacsheriff.com/pages/organization/rccc/rccc.aspx,MEDIUM,-999,0.0182967781521,2299.22107149003,2.15741822872e-05
112,107,10003543,SHELBY ADULT OFFENDER CENTER,961 SYCAMORE VIEW RD,MEMPHIS,TN,38134,NOT AVAILABLE,NOT AVAILABLE,COUNTY,OPEN,-999,SHELBY,47157,USA,922140,CORRECTIONAL INSTITUTIONS,http://www.shelbycountytn.gov/26/Corrections,3/1/2016,IMAGERY,2018/04/24 00:00:00,http://www.shelbycountytn.gov/26/Corrections,MEDIUM,768,0.00795827752503,984.017023389416,3.39741075998e-06
113,108,10006333,ALACHUA ACADEMY,3430 NE 39TH AVENUE,GAINESVILLE,FL,32609,NOT AVAILABLE,(352) 872-5152,STATE,OPEN,14,ALACHUA,12001,USA,922140,CORRECTIONAL INSTITUTIONS,"https://nces.ed.gov/ccd/schoolsearch/, http://www.djj.state.fl.us/programs-facilities/residential-facilities",11/6/2017,IMAGERY,2017/11/06 00:00:00,http://www.djj.state.fl.us/programs-facilities/residential-facilities,JUVENILE,28,0.0021864782023,258.335151310076,2.43028476509e-07
114,109,10003948,BAY REGIONAL JUVENILE DETENTION CENTER,450 EAST 11TH STREET,PANAMA CITY,FL,32401,NOT AVAILABLE,(850) 872-4706,STATE,OPEN,27,BAY,12005,USA,922140,CORRECTIONAL INSTITUTIONS,"https://nces.ed.gov/ccd/schoolsearch/, http://www.djj.state.fl.us/programs-facilities/detention-centers",11/6/2017,IMAGERY,2017/11/06 00:00:00,http://www.djj.state.fl.us/programs-facilities/detention-centers,JUVENILE,32,0.00342358580222,405.652870777389,5.44163356405e-07
115,110,10002164,BREVARD GROUP TREATMENT HOME,3905 GRISSOM PARKWAY,COCOA,FL,32926,NOT AVAILABLE,(321) 637-1866,STATE,OPEN,28,BREVARD,12009,USA,922140,CORRECTIONAL INSTITUTIONS,"https://nces.ed.gov/ccd/schoolsearch/, http://www.djj.state.fl.us/programs-facilities/residential-facilities",11/6/2017,IMAGERY,2017/11/06 00:00:00,http://www.djj.state.fl.us/programs-facilities/residential-facilities,JUVENILE,30,0.00689045349197,780.655381391264,1.22458595176e-06
116,111,10002165,BREVARD JUVENILE DETENTION CENTER,5225 DEWITT AVE,COCOA,FL,32927,NOT AVAILABLE,(321) 690-3400,STATE,OPEN,37,BREVARD,12009,USA,922140,CORRECTIONAL INSTITUTIONS,"https://nces.ed.gov/ccd/schoolsearch/, http://www.djj.state.fl.us/programs-facilities/detention-centers",11/6/2017,IMAGERY,2017/11/06 00:00:00,http://www.djj.state.fl.us/programs-facilities/detention-centers,JUVENILE,40,0.00341208199927,408.55060286021,5.8084164662e-07
117,112,10006336,BROWARD YOUTH TREATMENT CENTER,"8301 SOUTH PALM DRIVE, BUILDING 2",PEMBROKE PINES,FL,33025,NOT AVAILABLE,(954) 962-1088,STATE,OPEN,28,BROWARD,12011,USA,922140,CORRECTIONAL INSTITUTIONS,"https://nces.ed.gov/ccd/schoolsearch/, http://www.djj.state.fl.us/programs-facilities/residential-facilities",11/6/2017,IMAGERY,2017/11/06 00:00:00,http://www.djj.state.fl.us/programs-facilities/residential-facilities,JUVENILE,28,0.00337286922241,394.384523751548,2.28006759641e-07
118,113,10005080,MADISON COUNTY JAIL,145 EAST MAIN STREET,REXBURG,ID,83440,NOT AVAILABLE,(208) 372-5002,COUNTY,OPEN,-999,MADISON,16065,USA,922140,CORRECTIONAL INSTITUTIONS,http://www.madisonsheriff.com/index.php?option=com_content&view=featured&Itemid=47,3/1/2018,IMAGERY,2018/03/01 00:00:00,http://www.madisonsheriff.com/index.php?option=com_content&view=featured&Itemid=47,NOT AVAILABLE,-999,0.0020050508631,253.920856160615,2.21908886354e-07
119,114,10005081,MADISON COUNTY WOMEN'S CORRECTIONAL FACILITY,15 NORTH 2ND STREET EAST,REXBURG,ID,83440,NOT AVAILABLE,(208) 356-5426,COUNTY,OPEN,-999,MADISON,16065,USA,922140,CORRECTIONAL INSTITUTIONS,http://www.madisonsheriff.com/index.php?option=com_content&view=article&id=10&Itemid=13,2/15/2016,UNVERIFIED,2018/03/01 00:00:00,http://www.madisonsheriff.com/index.php?option=com_content&view=article&id=10&Itemid=13,NOT AVAILABLE,-999,0.00274730250009,340.868045915707,4.06882917925e-07
120,115,10006101,CHASE COUNTY JAIL,921 BROADWAY STREET,IMPERIAL,NE,69033,NOT AVAILABLE,NOT AVAILABLE,COUNTY,OPEN,2,CHASE,31029,USA,922140,CORRECTIONAL INSTITUTIONS,https://ncc.nebraska.gov/jail-standards-inspection-reports,4/4/2018,IMAGERY,2018/04/04 00:00:00,NOT AVAILABLE,NOT AVAILABLE,6,0.00125635400002,162.319400008768,6.70668326534e-08
121,116,10000531,COLLIER JUVENILE DETENTION CENTER,3351 E TAMIAMI TRAIL,NAPLES,FL,34112,NOT AVAILABLE,(239) 417-6277,STATE,OPEN,3,COLLIER,12021,USA,922140,CORRECTIONAL INSTITUTIONS,"https://nces.ed.gov/ccd/schoolsearch/, http://www.djj.state.fl.us/Detention/Facilities/Collier.html",11/6/2017,IMAGERY,2017/11/06 00:00:00,http://www.djj.state.fl.us/programs-facilities/detention-centers,JUVENILE,45,0.00337398003066,393.15364868389,4.06353062254e-07
122,117,10004571,DUVAL REGIONAL JUVENILE DETENTION CENTER,1241 EAST 8TH STREET,JACKSONVILLE,FL,32206,4099,(904) 798-4820,STATE,OPEN,102,DUVAL,12031,USA,922140,CORRECTIONAL INSTITUTIONS,"https://nces.ed.gov/ccd/schoolsearch/, http://www.djj.state.fl.us/programs-facilities/detention-centers",11/6/2017,IMAGERY,2017/11/06 00:00:00,http://www.djj.state.fl.us/programs-facilities/detention-centers,JUVENILE,100,0.00624436835446,752.915546702115,1.46415337426e-06
123,801,10000668,MACON COUNTY JAIL,333 SOUTH FRANKLIN STREET,DECATUR,IL,62523,NOT AVAILABLE,(217) 424-1341,COUNTY,OPEN,329,MACON,17115,USA,922140,CORRECTIONAL INSTITUTIONS,http://www.sheriff-macon-il.us/Corrections.html,10/13/2017,IMAGERY,2018/03/02 00:00:00,http://www.sheriff-macon-il.us/Corrections.html,MAXIMUM,425,0.00436640877908,546.756945277358,9.4773987135e-07
124,118,10000435,MARION REGIONAL JUVENILE DETENTION CENTER,3040 NW 10TH ST,OCALA,FL,34475,NOT AVAILABLE,(352) 732-1450,STATE,OPEN,29,MARION,12083,USA,922140,CORRECTIONAL INSTITUTIONS,"https://nces.ed.gov/ccd/schoolsearch/, http://www.djj.state.fl.us/programs-facilities/detention-centers",11/6/2017,IMAGERY,2017/11/06 00:00:00,http://www.djj.state.fl.us/programs-facilities/detention-centers,JUVENILE,42,0.00401194760928,469.219953963284,7.78885667602e-07
125,119,10004657,MONROE JUVENILE DETENTION CENTER,"5503 COLLEGE ROAD, 1ST FLOOR",KEY WEST,FL,33040,NOT AVAILABLE,(305) 293-1500,STATE,OPEN,2,MONROE,12087,USA,922140,CORRECTIONAL INSTITUTIONS,"https://nces.ed.gov/ccd/schoolsearch/, http://www.djj.state.fl.us/programs-facilities/detention-centers",11/6/2017,IMAGERY,2017/11/06 00:00:00,http://www.djj.state.fl.us/programs-facilities/detention-centers,JUVENILE,10,0.00206195957685,239.904533786343,2.58745836629e-07
126,120,10001460,PALM BEACH JUVENILE DETENTION CENTER,"1100 45TH ST, BLDG A",WEST PALM BEACH,FL,33407,NOT AVAILABLE,(561) 881-5020,STATE,OPEN,51,PALM BEACH,12099,USA,922140,CORRECTIONAL INSTITUTIONS,"https://nces.ed.gov/ccd/schoolsearch/, http://www.djj.state.fl.us/programs-facilities/detention-centers",11/6/2017,IMAGERY,2017/11/06 00:00:00,http://www.djj.state.fl.us/programs-facilities/detention-centers,JUVENILE,65,0.00442303436245,521.536824908507,9.96947035043e-07
127,121,10000478,PINELLAS JUVENILE DETENTION CENTER,5255 140TH AVE N,CLEARWATER,FL,33760,NOT AVAILABLE,(727) 538-7100,STATE,OPEN,69,PINELLAS,12103,USA,922140,CORRECTIONAL INSTITUTIONS,"https://nces.ed.gov/ccd/schoolsearch/, http://www.djj.state.fl.us/programs-facilities/detention-centers",11/6/2017,IMAGERY,2017/11/06 00:00:00,http://www.djj.state.fl.us/programs-facilities/detention-centers,JUVENILE,96,0.00501072905921,588.829566081982,1.53200604361e-06
128,122,10004628,ST. LUCIE REGIONAL JUVENILE DETENTION CENTER,1301 BELL AVENUE,FORT PIERCE,FL,34982,NOT AVAILABLE,(772) 468-3940,STATE,OPEN,44,ST. LUCIE,12111,USA,922140,CORRECTIONAL INSTITUTIONS,"https://nces.ed.gov/ccd/schoolsearch/, http://www.djj.state.fl.us/programs-facilities/detention-centers",11/6/2017,IMAGERY,2017/11/06 00:00:00,http://www.djj.state.fl.us/programs-facilities/detention-centers,JUVENILE,49,0.00349152415176,410.500929348363,4.74164598207e-07
129,123,10000528,SW FLORIDA REGIONAL JUVENILE DETENTION CENTER,2525 ORTIZ AVE,FORT MYERS,FL,33905,NOT AVAILABLE,(239) 332-6927,STATE,OPEN,54,LEE,12071,USA,922140,CORRECTIONAL INSTITUTIONS,"https://nces.ed.gov/ccd/schoolsearch/, http://www.djj.state.fl.us/programs-facilities/detention-centers",11/6/2017,IMAGERY,2017/11/06 00:00:00,http://www.djj.state.fl.us/programs-facilities/detention-centers,JUVENILE,60,0.00299445483673,354.248225356171,4.88835123387e-07
130,124,10000448,VOLUSIA REGIONAL JUVENILE DETENTION CENTER,3840 OLD DELAND RD,DAYTONA BEACH,FL,32124,NOT AVAILABLE,(386) 238-4780,STATE,OPEN,49,VOLUSIA,12127,USA,922140,CORRECTIONAL INSTITUTIONS,"https://nces.ed.gov/ccd/schoolsearch/, http://www.djj.state.fl.us/programs-facilities/detention-centers",11/6/2017,IMAGERY,2017/11/06 00:00:00,http://www.djj.state.fl.us/programs-facilities/detention-centers,JUVENILE,64,0.00323126401339,384.544064641659,5.52061789162e-07
131,125,10006660,COPPER HILLS YOUTH CENTER,5899 W. RIVENDELL RD,WEST JORDAN,UT,84081,NOT AVAILABLE,(800) 776-7116,STATE,OPEN,-999,SALT LAKE,49035,USA,922140,CORRECTIONAL INSTITUTIONS,http://doc.sd.gov/juvenile/JuvenilePrivatePlacement.aspx,1/9/2018,IMAGERY,2018/01/09 00:00:00,https://copperhillsyouthcenter.com/,JUVENILE,-999,0.00938759375873,1149.82305470961,1.75770592639e-06
132,126,10000472,CENTRAL PASCO GIRLS ACADEMY,2953 WILSON RD,LAND O'LAKES,FL,34639,NOT AVAILABLE,(813) 909-7800,STATE,OPEN,27,PASCO,12101,USA,922140,CORRECTIONAL INSTITUTIONS,"https://nces.ed.gov/ccd/schoolsearch/, http://www.djj.state.fl.us/programs-facilities/residential-facilities",11/6/2017,IMAGERY,2017/11/06 00:00:00,http://www.djj.state.fl.us/programs-facilities/residential-facilities,JUVENILE,32,0.00647692677459,754.206087268824,2.3595007793e-06
133,127,10004103,TEMPLEMAN PHASE V,3100 PERDIDO ST,NEW ORLEANS,LA,70119,NOT AVAILABLE,(504) 827-8582,COUNTY,CLOSED,0,ORLEANS,22071,USA,922140,CORRECTIONAL INSTITUTIONS,http://opcso.org/index.php?option=com_content&view=article&id=477%3Asheriff-expects-to-close-old-facilities-in-mid-september-&catid=131%3Apress-release&Itemid=45,8/6/2015,IMAGERY,2018/03/15 00:00:00,http://www.opcso.org/index.php?option=com_simplelists&view=simplelist&layout=toggle&category_id=97&Itemid=201,NOT AVAILABLE,-999,0.00229907621033,272.638874231902,3.24450590537e-07
134,128,10004600,CHALLENGE YOUTH ACADEMY,201 CULBREATH ROAD,BROOKSVILLE,FL,34602,NOT AVAILABLE,(352) 799-5621,STATE,OPEN,58,HERNANDO,12053,USA,922140,CORRECTIONAL INSTITUTIONS,"https://nces.ed.gov/ccd/schoolsearch/, http://www.djj.state.fl.us/programs-facilities/residential-facilities",11/6/2017,IMAGERY,2017/11/06 00:00:00,http://www.djj.state.fl.us/programs-facilities/residential-facilities,JUVENILE,60,0.00445437626846,529.67224933684,1.39406633154e-06
135,129,10001457,CHARLES BRITT ACADEMY,3001 26TH AVE S,ST PETERSBURG,FL,33712,NOT AVAILABLE,(727) 954-5402,STATE,OPEN,28,PINELLAS,12103,USA,922140,CORRECTIONAL INSTITUTIONS,"https://nces.ed.gov/ccd/schoolsearch/, http://www.djj.state.fl.us/programs-facilities/residential-facilities",11/6/2017,IMAGERY,2017/11/06 00:00:00,http://www.djj.state.fl.us/programs-facilities/residential-facilities,JUVENILE,28,0.00222444981068,261.092682278954,2.64042809351e-07
136,130,10006775,ORLEANS JUSTICE CENTER,2800 PERDIDO ST,NEW ORLEANS,LA,70119,NOT AVAILABLE,(504) 202-9339,COUNTY,OPEN,1461,ORLEANS,22071,USA,922140,CORRECTIONAL INSTITUTIONS,http://doc.louisiana.gov/briefing-book,9/29/2017,IMAGERY,2018/03/15 00:00:00,http://opcso.org/,NOT AVAILABLE,1938,0.00467965139809,556.078190065703,1.37129948652e-06
137,131,10004615,COLUMBUS JUVENILE RESIDENTIAL FACILITY,9502 EAST COLUMBUS DRIVE,TAMPA,FL,33619,NOT AVAILABLE,(813) 769-0445,STATE,OPEN,40,HILLSBOROUGH,12057,USA,922140,CORRECTIONAL INSTITUTIONS,"https://nces.ed.gov/ccd/schoolsearch/, http://www.djj.state.fl.us/programs-facilities/residential-facilities",11/6/2017,IMAGERY,2017/11/06 00:00:00,http://www.djj.state.fl.us/programs-facilities/residential-facilities,JUVENILE,50,0.00319706482919,373.893989257152,5.78217471073e-07
138,401,10001978,BETO PRISON,1391 FM 3328,TENNESSEE COLONY,TX,75880,NOT AVAILABLE,(903) 928-2217,STATE,OPEN,3357,ANDERSON,48001,USA,922140,CORRECTIONAL INSTITUTIONS,"https://www.texastribune.org/library/data/texas-prisons/units/, http://www.tdcj.state.tx.us/unit_directory/index.html",9/15/2016,IMAGERY,2018/01/10 00:00:00,http://www.tdcj.state.tx.us/unit_directory/index.html,MAXIMUM,3471,0.0180894043121,2177.14357469916,2.03274413504e-05
139,132,10005532,ALCORN COUNTY REGIONAL CORRECTIONAL FACILITY,2839 SOUTH HARPER RD,CORINTH,MS,38834,NOT AVAILABLE,(662) 286-7085,COUNTY,OPEN,285,ALCORN,28003,USA,922140,CORRECTIONAL INSTITUTIONS,http://www.mdoc.ms.gov/Admin-Finance/Pages/Monthly-Facts.aspx,12/4/2017,IMAGERY,2017/12/08 00:00:00,http://alcorncountycorrectionalfacility.com/default.aspx,MEDIUM,300,0.00847566328925,1011.1977099079,3.79246223524e-06
140,133,10004234,BOLIVAR COUNTY REGIONAL CORRECTIONAL FACILITY,2792 HWY 8 W,CLEVELAND,MS,38732,NOT AVAILABLE,(662) 843-3284,COUNTY,OPEN,297,BOLIVAR,28011,USA,922140,CORRECTIONAL INSTITUTIONS,http://www.mdoc.ms.gov/Admin-Finance/Pages/Monthly-Facts.aspx,12/4/2017,IMAGERY/OTHER,2017/12/08 00:00:00,https://www.co.bolivar.ms.us/regional-correctional-facility,MEDIUM,369,0.00831694283182,992.782487918862,1.9735686225e-06
141,134,10000353,OKALOOSA YOUTH ACADEMY AND CRESTVIEW SEX OFFENDER PROGRAM,4455 STRAIGHTLINE RD,CRESTVIEW,FL,32539,NOT AVAILABLE,(850) 689-1984,STATE,OPEN,63,OKALOOSA,12091,USA,922140,CORRECTIONAL INSTITUTIONS,"https://nces.ed.gov/ccd/schoolsearch/, http://www.djj.state.fl.us/programs-facilities/residential-facilities",11/6/2017,IMAGERY,2017/11/06 00:00:00,http://www.djj.state.fl.us/programs-facilities/residential-facilities,JUVENILE,75,0.00581566434279,700.901933930355,2.16520552451e-06
142,135,10001822,GEORGE-GREENE COUNTY REG CORRECTIONAL FACILITY,154 INDUSTRIAL PARK RD,LUCEDALE,MS,39452,NOT AVAILABLE,(601) 947-9399,COUNTY,OPEN,339,GEORGE,28039,USA,922140,CORRECTIONAL INSTITUTIONS,http://www.mdoc.ms.gov/Admin-Finance/Pages/Monthly-Facts.aspx,12/4/2017,IMAGERY,2017/12/08 00:00:00,http://www.georgecountymssheriff.com/page.php?id=6,MEDIUM,280,0.00514402594649,596.653453993109,1.14783101177e-06
143,136,10001810,HOLMES-HUMPHREYS COUNTY REG CORRECTIONAL FACILITY,23234 HWY 12 E,LEXINGTON,MS,39095,NOT AVAILABLE,(662) 834-5016,COUNTY,OPEN,256,HOLMES,28051,USA,922140,CORRECTIONAL INSTITUTIONS,http://www.mdoc.ms.gov/Admin-Finance/Pages/Monthly-Facts.aspx,12/4/2017,IMAGERY,2017/12/08 00:00:00,http://www.mdoc.ms.gov/Pages/Facility-Locations.aspx,MEDIUM,280,0.00569046956567,680.656423949566,1.2993738437e-06
144,137,10004242,ISSAQUENA COUNTY CORRECTIONAL FACILITY,22746 MS HWY 1,MAYERSVILLE,MS,39113,NOT AVAILABLE,(662) 873-2153,COUNTY,OPEN,274,ISSAQUENA,28055,USA,922140,CORRECTIONAL INSTITUTIONS,http://www.mdoc.ms.gov/Admin-Finance/Pages/Monthly-Facts.aspx,12/4/2017,IMAGERY/OTHER,2017/12/08 00:00:00,http://www.mdoc.ms.gov/Pages/Facility-Locations.aspx,MEDIUM,274,0.00546523379619,663.563482419097,1.11176519302e-06
145,138,10001819,JEFFERSON-FRANKLIN COUNTY REG CORRECTIONAL FACILITY,279 HWY 33,FAYETTE,MS,39069,NOT AVAILABLE,(601) 786-2284,COUNTY,OPEN,273,JEFFERSON,28063,USA,922140,CORRECTIONAL INSTITUTIONS,http://www.mdoc.ms.gov/Admin-Finance/Pages/Monthly-Facts.aspx,12/4/2017,IMAGERY,2017/12/08 00:00:00,http://www.jeffersoncountyms.com/sheriff,MEDIUM,280,0.00580594974249,711.370489652333,1.664826794e-06
146,139,10002646,KEMPER-NESHOBA COUNTY REGIONAL CORRECTIONAL FACILITY,374 STENNIS INDUSTRIAL PARK RD,DEKALB,MS,39328,NOT AVAILABLE,(601) 743-5767,COUNTY,OPEN,345,KEMPER,28069,USA,922140,CORRECTIONAL INSTITUTIONS,"http://www.mdoc.ms.gov/Admin-Finance/Pages/Monthly-Facts.aspx, https://www.kempercountysheriff.com/page.php?id=10",12/4/2017,IMAGERY,2017/12/08 00:00:00,https://www.kempercountysheriff.com/page.php?id=10,MEDIUM,467,0.00685264702453,793.809803327369,1.85674701022e-06
147,140,10004591,CYPRESS CREEK JUVENILE OFFENDER CC,2855 WEST WOODLAND RIDGE DRIVE,LECANTO,FL,34461,NOT AVAILABLE,(352) 527-3091,STATE,OPEN,71,CITRUS,12017,USA,922140,CORRECTIONAL INSTITUTIONS,"https://nces.ed.gov/ccd/schoolsearch/, http://www.djj.state.fl.us/programs-facilities/residential-facilities",11/6/2017,IMAGERY,2017/11/06 00:00:00,http://www.djj.state.fl.us/programs-facilities/residential-facilities,JUVENILE,96,0.0078154182252,952.449217779181,3.35445377491e-06
148,141,10004258,MARION-WALTHALL COUNTY REG CORRECTIONAL FACILITY,503 S MAIN ST,COLUMBIA,MS,39429,NOT AVAILABLE,(601) 736-3621,COUNTY,OPEN,277,MARION,28091,USA,922140,CORRECTIONAL INSTITUTIONS,http://www.mdoc.ms.gov/Admin-Finance/Pages/Monthly-Facts.aspx,12/4/2017,IMAGERY,2017/12/08 00:00:00,http://www.co.walthall.ms.us/marion-walthall-regional-correctional-facility.html,MEDIUM,280,0.00677158590166,812.119574304699,2.14383249163e-06
149,142,10004261,STONE COUNTY CORRECTIONAL FACILITY,1420 INDUSTRIAL PARK RD,WIGGINS,MS,39577,NOT AVAILABLE,(601) 928-7042,COUNTY,OPEN,325,STONE,28131,USA,922140,CORRECTIONAL INSTITUTIONS,http://www.mdoc.ms.gov/Admin-Finance/Pages/Monthly-Facts.aspx,12/4/2017,IMAGERY,2017/12/08 00:00:00,http://www.mdoc.ms.gov/Pages/Facility-Locations.aspx,MEDIUM,326,0.00515862012766,627.601468030384,1.07676098433e-06
150,143,10004655,DADE JUVENILE RESIDENTIAL FACILITY AND DADE YOUTH ACADEMY,18500 SOUTHWEST 424TH STREET,FLORIDA CITY,FL,33034,NOT AVAILABLE,(305) 247-6492,STATE,OPEN,50,MIAMI-DADE,12086,USA,922140,CORRECTIONAL INSTITUTIONS,"https://nces.ed.gov/ccd/schoolsearch/, http://www.djj.state.fl.us/programs-facilities/residential-facilities",11/6/2017,IMAGERY,2017/11/06 00:00:00,http://www.djj.state.fl.us/programs-facilities/residential-facilities,JUVENILE,56,0.00666150877623,777.160305489712,2.7336744689e-06
151,144,10000449,DAYTONA JUVENILE RESIDENTIAL FACILITY,1386 INDIAN LAKE ROAD,DAYTONA BEACH,FL,32124,1001,(386) 265-1932,STATE,OPEN,48,VOLUSIA,12127,USA,922140,CORRECTIONAL INSTITUTIONS,http://www.djj.state.fl.us/programs-facilities/residential-facilities,11/6/2017,IMAGERY,2017/11/06 00:00:00,http://www.djj.state.fl.us/programs-facilities/residential-facilities,JUVENILE,30,0.00432160490061,527.374974362945,1.03768613511e-06
152,145,10004240,WINSTON-CHOCTAW COUNTY REG CORRECTIONAL FACILITY,"2460 STATE HWY 25 N, P.O. DRAWER 1437",LOUISVILLE,MS,39339,NOT AVAILABLE,(662) 773-2528,COUNTY,OPEN,270,WINSTON,28159,USA,922140,CORRECTIONAL INSTITUTIONS,http://www.mdoc.ms.gov/Admin-Finance/Pages/Monthly-Facts.aspx,12/4/2017,IMAGERY,2017/12/08 00:00:00,http://www.mdoc.ms.gov/Pages/Facility-Locations.aspx,MEDIUM,280,0.00521554800269,613.042952547414,1.27683542469e-06
153,146,10004554,DOVE ACADEMY,5270 EZELL ROAD,GRACEVILLE,FL,32440,NOT AVAILABLE,(850) 263-7550,STATE,OPEN,-999,JACKSON,12063,USA,922140,CORRECTIONAL INSTITUTIONS,http://www.djj.state.fl.us/programs-facilities/residential-facilities,11/6/2017,IMAGERY,2017/11/06 00:00:00,http://www.djj.state.fl.us/programs-facilities/residential-facilities,JUVENILE,38,0.00415542859851,502.987677286801,1.07589634578e-06
154,147,10006215,YAZOO COUNTY REGIONAL CORRECTIONAL FACILITY,154 ROOSEVELT HUDSON DRIVE,YAZOO CITY,MS,39194,NOT AVAILABLE,(662) 751-8484,COUNTY,OPEN,295,YAZOO,28163,USA,922140,CORRECTIONAL INSTITUTIONS,http://www.mdoc.ms.gov/Admin-Finance/Pages/Monthly-Facts.aspx,12/4/2017,IMAGERY,2017/12/08 00:00:00,http://www.mdoc.ms.gov/Pages/Facility-Locations.aspx,MEDIUM,300,0.00565512528314,671.061967739623,1.6695328805e-06
155,148,10005533,ALCORN COUNTY COMMUNITY WORK CENTER,2407 NORMAN ROAD,CORINTH,MS,38834,NOT AVAILABLE,(662) 287-8105,STATE,CLOSED,0,ALCORN,28003,USA,922140,CORRECTIONAL INSTITUTIONS,http://www.mdoc.ms.gov/Community-Corrections/Pages/Community-Work-Centers-List.aspx,11/13/2015,IMAGERY/OTHER,2017/12/08 00:00:00,http://www.mdoc.ms.gov/Pages/Facility-Locations.aspx,NOT AVAILABLE,92,0.00363916852642,436.4675361338,7.58610047147e-07
156,149,10005083,MINI-CASSIA JUVENILE DETENTION CENTER,718 H STREET,RUPERT,ID,83350,NOT AVAILABLE,(208) 436-7199,COUNTY,OPEN,-999,MINIDOKA,16067,USA,922140,CORRECTIONAL INSTITUTIONS,http://www.minidoka.id.us/219/Juvenile-Detention,3/1/2018,IMAGERY,2018/03/01 00:00:00,http://www.minidoka.id.us/219/Juvenile-Detention,JUVENILE,16,0.00209711404722,298.928319212513,1.87680898297e-07
157,150,10006214,WASHINGTON COUNTY REGIONAL CORRECTIONAL FACILITY,60 STOKES KING ROAD,GREENVILLE,MS,38701,NOT AVAILABLE,(662) 537-2000,COUNTY,OPEN,235,WASHINGTON,28151,USA,922140,CORRECTIONAL INSTITUTIONS,http://www.mdoc.ms.gov/Admin-Finance/Pages/Monthly-Facts.aspx,12/4/2017,IMAGERY,2017/12/08 00:00:00,http://www.mdoc.ms.gov/Pages/Facility-Locations.aspx,NOT AVAILABLE,300,0.0062941974839,772.581285974464,2.73096332137e-06
158,151,10006337,DUVAL ACADEMY,7500 RICKER ROAD,JACKSONVILLE,FL,32244,5052,(904) 777-0100,STATE,OPEN,28,DUVAL,12031,USA,922140,CORRECTIONAL INSTITUTIONS,"https://nces.ed.gov/ccd/schoolsearch/, http://www.djj.state.fl.us/programs-facilities/residential-facilities",11/6/2017,IMAGERY,2017/11/06 00:00:00,http://www.djj.state.fl.us/programs-facilities/residential-facilities,JUVENILE,28,0.00226516269217,269.819092017606,1.7531592865e-07
159,152,10006213,JEFFERSON COUNTY COMMUNITY WORK CENTER,101 CORRECTIONS ROAD,FAYETTE,MS,39069,NOT AVAILABLE,(601) 786-3556,STATE,CLOSED,0,JEFFERSON,28063,USA,922140,CORRECTIONAL INSTITUTIONS,http://www.mdoc.ms.gov/Community-Corrections/Pages/Community-Work-Centers-List.aspx,5/22/2015,IMAGERY,2017/12/08 00:00:00,http://www.mdoc.ms.gov/Pages/Facility-Locations.aspx,NOT AVAILABLE,102,0.00385322776775,459.401001597271,9.22982142374e-07
160,153,10000350,ESCAMBIA BOYS BASE,"640 ROBERTS AVE, BUILDING 3780 CORRY STATION",PENSACOLA,FL,32511,NOT AVAILABLE,(850) 453-7490,STATE,OPEN,18,ESCAMBIA,12033,USA,922140,CORRECTIONAL INSTITUTIONS,"https://nces.ed.gov/ccd/schoolsearch/, http://www.djj.state.fl.us/programs-facilities/residential-facilities",11/6/2017,IMAGERY/OTHER,2017/11/06 00:00:00,http://www.djj.state.fl.us/programs-facilities/residential-facilities,JUVENILE,28,0.00317054094523,378.175387752892,5.05929996835e-07
161,154,10005065,NEZ PERCE COUNTY ADULT DETENTION CENTER,1150 WALL STREET,LEWISTON,ID,83501,NOT AVAILABLE,(208) 799-3139,COUNTY,OPEN,120,NEZ PERCE,16069,USA,922140,CORRECTIONAL INSTITUTIONS,https://www.co.nezperce.id.us/ElectedOfficials/Sheriff.aspx,3/1/2018,IMAGERY,2018/03/01 00:00:00,https://www.co.nezperce.id.us/ElectedOfficials/Sheriff.aspx,NOT AVAILABLE,-999,0.00789320317936,1024.33415735893,2.68108210414e-06
162,155,10001813,YAZOO COUNTY COMMUNITY WORK CENTER,625 W JEFFERSON ST,YAZOO CITY,MS,39194,NOT AVAILABLE,(662) 746-3711,STATE,CLOSED,0,YAZOO,28163,USA,922140,CORRECTIONAL INSTITUTIONS,http://www.mdoc.ms.gov/Community-Corrections/Pages/Community-Work-Centers-List.aspx,3/4/2016,IMAGERY,2017/12/08 00:00:00,http://www.mdoc.ms.gov/Pages/Facility-Locations.aspx,MINIMUM,102,0.0031101333753,375.270406205368,5.82503508752e-07
163,156,10006063,CHERRY COUNTY JUSTICE CENTER,"365 NORTH MAIN STREET, SUITE 9",VALENTINE,NE,69201,NOT AVAILABLE,NOT AVAILABLE,COUNTY,OPEN,10,CHERRY,31031,USA,922140,CORRECTIONAL INSTITUTIONS,https://ncc.nebraska.gov/jail-standards-inspection-reports,4/4/2018,IMAGERY,2018/04/04 00:00:00,NOT AVAILABLE,NOT AVAILABLE,30,0.00320255611528,396.939114807944,3.63148063839e-07
164,157,10006661,FOREST RIDGE ACADEMY,PO BOX 515,ESTHERVILLE,IA,51334,NOT AVAILABLE,(712) 362-5231,STATE,OPEN,-999,EMMET,19063,USA,922140,CORRECTIONAL INSTITUTIONS,http://doc.sd.gov/juvenile/JuvenilePrivatePlacement.aspx,1/10/2018,IMAGERY,2018/01/10 00:00:00,http://www.forestridgeyouthservices.com/,JUVENILE,-999,0.00314432020065,406.375761219156,3.99001065665e-07
165,158,10003015,KIDSPEACE MESABI ACADEMY,200 WANLESS STREET,BUHL,MN,55713,NOT AVAILABLE,NOT AVAILABLE,LOCAL,CLOSED,0,ST. LOUIS,27137,USA,922140,CORRECTIONAL INSTITUTIONS,https://www.apmreports.org/story/2017/02/21/mesabi-academy-fight-club,2/21/2017,IMAGERY,2018/01/10 00:00:00,NOT AVAILABLE,JUVENILE,-999,0.0107036643394,1425.77255673353,6.46950043769e-06
166,159,10002541,MARATHON COUNTY JUVENILE FACILITY,7015 PACKER DR,WAUSAU,WI,54401,NOT AVAILABLE,NOT AVAILABLE,COUNTY,OPEN,-999,MARATHON,55073,USA,922140,CORRECTIONAL INSTITUTIONS,http://www.co.marathon.wi.us/Departments/Sheriff.aspx,5/9/2018,IMAGERY,2018/05/09 00:00:00,NOT AVAILABLE,JUVENILE,20,0.00401690257946,505.248952822874,5.32180298399e-07
167,160,10006104,CLAY COUNTY JAIL,104 EAST EDGAR STREET,CLAY CENTER,NE,68933,NOT AVAILABLE,NOT AVAILABLE,COUNTY,OPEN,5,CLAY,31035,USA,922140,CORRECTIONAL INSTITUTIONS,https://ncc.nebraska.gov/jail-standards-inspection-reports,4/4/2018,IMAGERY,2018/04/04 00:00:00,NOT AVAILABLE,NOT AVAILABLE,10,0.00114367385971,139.204278999461,5.96140921582e-08
168,161,10000527,FORT MYERS YOUTH ACADEMY,2515 ORTIZ AVE,FORT MYERS,FL,33905,NOT AVAILABLE,(239) 210-0940,STATE,OPEN,-999,LEE,12071,USA,922140,CORRECTIONAL INSTITUTIONS,http://www.djj.state.fl.us/programs-facilities/residential-facilities,11/6/2017,IMAGERY,2017/11/06 00:00:00,http://www.djj.state.fl.us/programs-facilities/residential-facilities,JUVENILE,28,0.0032605171525,383.405460245587,5.19960433058e-07
169,162,10004603,GULF ACADEMY,765 EAST SAINT JOHNS AVENUE,HASTINGS,FL,32145,NOT AVAILABLE,(904) 347-2162,STATE,OPEN,-999,ST. JOHNS,12109,USA,922140,CORRECTIONAL INSTITUTIONS,http://www.djj.state.fl.us/programs-facilities/residential-facilities,11/6/2017,IMAGERY,2017/11/06 00:00:00,http://www.djj.state.fl.us/programs-facilities/residential-facilities,JUVENILE,56,0.00545208628231,667.935118283753,1.74931776243e-06
170,163,10006707,SACRAMENTO COUNTY YOUTH DETENTION FACILITY,9601 KIEFER BOULEVARD,SACRAMENTO,CA,95827,NOT AVAILABLE,(916) 875-6996,COUNTY,OPEN,-999,SACRAMENTO,06067,USA,922140,CORRECTIONAL INSTITUTIONS,http://www.probation.saccounty.net/Pages/default.aspx,2/12/2018,IMAGERY,2018/02/12 00:00:00,http://www.probation.saccounty.net/Pages/default.aspx,JUVENILE,-999,0.0153021302399,1850.52234973907,5.01348334025e-06
171,164,10004577,HASTINGS COMPREHENSIVE MENTAL HEALTH TREATMENT PROGRAM / HASTINGS SUBSTANCE ABUSE PROGRAM,765 EAST SAINT JOHNS AVENUE,HASTINGS,FL,32145,NOT AVAILABLE,(904) 347-2162,STATE,OPEN,-999,ST. JOHNS,12109,USA,922140,CORRECTIONAL INSTITUTIONS,http://www.djj.state.fl.us/programs-facilities/residential-facilities,11/6/2017,IMAGERY,2017/11/06 00:00:00,http://www.djj.state.fl.us/programs-facilities/residential-facilities,JUVENILE,64,0.0055078427155,673.47817761442,1.8117831791e-06
172,165,10004263,JACKSON COUNTY COMMUNITY WORK CENTER,1717 KENNETH AVE,PASCAGOULA,MS,39567,NOT AVAILABLE,(228) 762-0255,STATE,CLOSED,0,JACKSON,28059,USA,922140,CORRECTIONAL INSTITUTIONS,http://www.mdoc.ms.gov/Community-Corrections/Pages/Community-Work-Centers-List.aspx,4/15/2016,IMAGERY,2017/12/08 00:00:00,http://www.mdoc.ms.gov/Pages/Facility-Locations.aspx,MINIMUM,102,0.00359504151074,433.207575933187,7.99366765715e-07
173,166,10004605,HIGHLANDS YOUTH ACADEMY,242 SOUTH BOULEVARD,AVON PARK,FL,33825,NOT AVAILABLE,(863) 452-3815,STATE,OPEN,80,POLK,12105,USA,922140,CORRECTIONAL INSTITUTIONS,"https://nces.ed.gov/ccd/schoolsearch/, http://www.djj.state.fl.us/programs-facilities/residential-facilities",11/7/2017,IMAGERY,2017/11/07 00:00:00,http://www.djj.state.fl.us/programs-facilities/residential-facilities,JUVENILE,80,0.0165354460285,1916.37388833982,1.0482817074e-05
174,167,10005322,SAN BENITO COUNTY JAIL,710 FLYNN ROAD,HOLLISTER,CA,95024,NOT AVAILABLE,(831) 636-4060,COUNTY,OPEN,120,SAN BENITO,06069,USA,922140,CORRECTIONAL INSTITUTIONS,http://sbso.us/,2/12/2018,IMAGERY,2018/02/12 00:00:00,http://sbso.us/,MAXIMUM,142,0.00261031860654,325.721718966806,4.09425371009e-07
175,168,10006231,SAN BENITO COUNTY JUVENILE HALL,708 FLYNN ROAD,HOLLISTER,CA,95023,NOT AVAILABLE,(831) 636-4050,COUNTY,OPEN,-999,SAN BENITO,06069,USA,922140,CORRECTIONAL INSTITUTIONS,http://www.cosb.us/county-departments/probation/,2/12/2018,IMAGERY,2018/02/12 00:00:00,http://www.cosb.us/county-departments/probation/,JUVENILE,124,0.00219574046205,272.201909654449,2.26264292501e-07
176,169,10006776,ORLEANS TEMPORARY DETENTION CENTER,3200 PERDIDO ST,NEW ORLEANS,LA,70119,NOT AVAILABLE,NOT AVAILABLE,COUNTY,OPEN,-999,ORLEANS,22071,USA,922140,CORRECTIONAL INSTITUTIONS,http://opcso.org/,3/15/2018,UNVERIFIED,2018/03/15 00:00:00,http://opcso.org/,NOT AVAILABLE,-999,0.00455285241918,532.352589315406,7.33348824806e-07
177,170,10002528,MARINETTE COUNTY JAIL / SHERIFF,2161 UNIVERSITY DR,MARINETTE,WI,54143,NOT AVAILABLE,(715) 732-7630,COUNTY,OPEN,-999,MARINETTE,55075,USA,922140,CORRECTIONAL INSTITUTIONS,https://www.marinettecounty.com/departments/office-of-sheriff/general-information/,5/9/2018,IMAGERY,2018/05/09 00:00:00,NOT AVAILABLE,NOT AVAILABLE,-999,0.00512062451086,661.765177173328,6.90165671082e-07
178,171,10006862,SHELBY COUNTY JUVENILE DETENTION BUREAU,616 ADAMS AVENUE,MEMPHIS,TN,38103,NOT AVAILABLE,(901) 222-5267,COUNTY,OPEN,-999,SHELBY,47157,USA,922140,CORRECTIONAL INSTITUTIONS,http://www.shelbycountytn.gov/368/Detention-Services-Bureau,4/24/2018,IMAGERY,2018/04/24 00:00:00,http://www.shelbycountytn.gov/368/Detention-Services-Bureau,JUVENILE,135,0.00328982235444,394.381484849065,6.00245260446e-07
179,172,10004616,HILLSBOROUGH GIRLS ACADEMY,9506 EAST COLUMBUS DRIVE,TAMPA,FL,33619,NOT AVAILABLE,(813) 630-2900,STATE,OPEN,13,HILLSBOROUGH,12057,USA,922140,CORRECTIONAL INSTITUTIONS,"https://nces.ed.gov/ccd/schoolsearch/, http://www.djj.state.fl.us/programs-facilities/residential-facilities",11/7/2017,IMAGERY,2017/11/07 00:00:00,http://www.djj.state.fl.us/programs-facilities/residential-facilities,JUVENILE,20,0.00209967247229,247.749560635573,2.97513813653e-07
180,173,10006662,NATCHEZ TRACE YOUTH ACADEMY,415 SEVEN HAWKS LANE,WAVERLY,TN,37185,NOT AVAILABLE,(931) 296-1183,STATE,OPEN,-999,HUMPHREYS,47085,USA,922140,CORRECTIONAL INSTITUTIONS,https://www.natcheztraceyouthacademy.com/,1/10/2018,IMAGERY,2018/01/10 00:00:00,https://www.natcheztraceyouthacademy.com/,JUVENILE,90,0.00954215362087,1148.53043603692,3.3252642137e-06
181,174,10000399,JACKSONVILLE YOUTH ACADEMY,4501 LANNIE RD,JACKSONVILLE,FL,32218,NOT AVAILABLE,(904) 374-1733,STATE,OPEN,-999,DUVAL,12031,USA,922140,CORRECTIONAL INSTITUTIONS,http://www.djj.state.fl.us/programs-facilities/residential-facilities,11/7/2017,IMAGERY,2017/11/07 00:00:00,http://www.djj.state.fl.us/programs-facilities/residential-facilities,JUVENILE,24,0.00448051830158,535.092351558076,1.2212697911e-06
182,175,10004564,JOANN BRIDGES ACADEMY,950 SOUTHWEST GREENVILLE HILLS ROAD,GREENVILLE,FL,32331,NOT AVAILABLE,(850) 948-2230,STATE,OPEN,23,MADISON,12079,USA,922140,CORRECTIONAL INSTITUTIONS,"https://nces.ed.gov/ccd/schoolsearch/, http://www.djj.state.fl.us/programs-facilities/residential-facilities",11/7/2017,IMAGERY,2017/11/07 00:00:00,http://www.djj.state.fl.us/programs-facilities/residential-facilities,JUVENILE,28,0.00329690008367,394.945980918254,6.36231131371e-07
183,176,10005333,HIGH DESERT JUVENILE DETENTION AND ASSESMENT CENTER,21101 DALE EVANS PARKWAY,APPLE VALLEY,CA,92307,NOT AVAILABLE,(760) 961-6701,COUNTY,OPEN,-999,SAN BERNARDINO,06071,USA,922140,CORRECTIONAL INSTITUTIONS,http://www.sbcounty.gov/uploads/probation/main/bureaus/JDAC.pdf,2/13/2018,IMAGERY,2018/02/13 00:00:00,http://joinprobation.org/Home.aspx,JUVENILE,200,0.00871599948998,1090.60982848232,3.8455508982e-06
184,177,10001823,GEORGE COUNTY COMMUNITY WORK CENTER,156 INDUSTRIAL PARK RD,LUCEDALE,MS,39452,NOT AVAILABLE,(601) 947-7581,STATE,OPEN,66,GEORGE,28039,USA,922140,CORRECTIONAL INSTITUTIONS,http://www.mdoc.ms.gov/Admin-Finance/Pages/Daily-Inmate-Population.aspx,11/30/2017,IMAGERY,2017/12/11 00:00:00,http://www.mdoc.ms.gov/Pages/Facility-Locations.aspx,MINIMUM,102,0.00316061120487,379.132825845692,6.49735552199e-07
185,178,10004753,STEWART COUNTY JAIL,314 CEDAR ST,DOVER,TN,37058,NOT AVAILABLE,(931) 232-3114,COUNTY,OPEN,80,STEWART,47161,USA,922140,CORRECTIONAL INSTITUTIONS,"https://stewartcountysheriff.com/, https://www.tn.gov/correction/statistics-and-information/jail-summary-reports.html",3/31/2018,IMAGERY,2018/04/24 00:00:00,https://stewartcountysheriff.com/,NOT AVAILABLE,132,0.00287821891844,342.582813052933,3.46774395624e-07
186,179,10006212,HARRISON COUNTY COMMUNITY WORK CENTER,3820 8TH AVENUE,GULFPORT,MS,39501,NOT AVAILABLE,(228) 865-0020,STATE,OPEN,57,HARRISON,28047,USA,922140,CORRECTIONAL INSTITUTIONS,http://www.mdoc.ms.gov/Admin-Finance/Pages/Daily-Inmate-Population.aspx,11/30/2017,IMAGERY,2017/12/11 00:00:00,http://www.mdoc.ms.gov/Pages/Facility-Locations.aspx,MINIMUM,102,0.00417621447613,500.123369549339,1.0872369559e-06
187,180,10000828,HIGH DESERT DETENTION CENTER,9438 COMMERCE WAY,ADELANTO,CA,92301,NOT AVAILABLE,(760) 530-9300,COUNTY,OPEN,1203,SAN BERNARDINO,06071,USA,922140,CORRECTIONAL INSTITUTIONS,"http://www.bscc.ca.gov/s_fsojailprofilesurvey.php, http://cms.sbcounty.gov/sheriff/CourtsCorrections/CorrectionsandDetentionsBureau.aspx",2/13/2018,IMAGERY,2018/02/13 00:00:00,http://cms.sbcounty.gov/sheriff/CourtsCorrections/CorrectionsandDetentionsBureau.aspx,MEDIUM,700,0.0102440514546,1250.88364141846,2.35511834542e-06
188,181,10003041,SOUTHWESTERN YOUTH SERVICES,401 WEST LUVERNE STREET,MAGNOLIA,MN,56158,NOT AVAILABLE,(507) 283-4425,STATE,OPEN,-999,ROCK,27133,USA,922140,CORRECTIONAL INSTITUTIONS,http://doc.sd.gov/juvenile/JuvenilePrivatePlacement.aspx,1/10/2018,IMAGERY,2018/01/10 00:00:00,http://www.southwestyouth.org/,JUVENILE,-999,0.00448263981457,604.072717489638,1.2377487004e-06
189,182,10005331,WEST VALLEY DETENTION CENTER,9500 ETIWANDA AVENUE,RANCHO CUCAMONGA,CA,91739,NOT AVAILABLE,(909) 887-0364,COUNTY,OPEN,2572,SAN BERNARDINO,06071,USA,922140,CORRECTIONAL INSTITUTIONS,"http://www.bscc.ca.gov/s_fsojailprofilesurvey.php, http://cms.sbcounty.gov/sheriff/CourtsCorrections/CorrectionsandDetentionsBureau.aspx",2/13/2018,IMAGERY,2018/02/13 00:00:00,http://cms.sbcounty.gov/sheriff/CourtsCorrections/CorrectionsandDetentionsBureau.aspx,MAXIMUM,3347,0.0161976099834,1934.33055742914,9.25702371328e-06
190,183,10005330,REGIONAL YOUTH EDUCATIONAL FACILITY,740 EAST GILBERT STREET,SAN BERNARDINO,CA,92415,NOT AVAILABLE,(909) 387-6933,COUNTY,OPEN,-999,SAN BERNARDINO,06071,USA,922140,CORRECTIONAL INSTITUTIONS,http://wp.sbcounty.gov/dbh/mental-health-services/children-youth/jjp/gateway/,2/13/2018,IMAGERY,2018/02/13 00:00:00,NOT AVAILABLE,JUVENILE,20,0.0026370512379,312.540999055831,3.35067732282e-07
191,184,10004608,KISSIMMEE YOUTH ACADEMY,2330 NEW BEGINNINGS RD,KISSIMMEE,FL,34744,NOT AVAILABLE,(407) 350-4900,STATE,OPEN,-999,OSCEOLA,12097,USA,922140,CORRECTIONAL INSTITUTIONS,http://www.djj.state.fl.us/programs-facilities/residential-facilities,11/7/2017,IMAGERY,2017/11/07 00:00:00,http://www.djj.state.fl.us/programs-facilities/residential-facilities,JUVENILE,62,0.00666524608748,781.596956320955,2.06043356326e-06
192,185,10004614,TAMPA RESIDENTIAL FACILITY,9508 EAST COLUMBUS DRIVE,TAMPA,FL,33619,7715,(813) 740-3630,STATE,OPEN,56,HILLSBOROUGH,12057,USA,922140,CORRECTIONAL INSTITUTIONS,"https://nces.ed.gov/ccd/schoolsearch/, http://www.djj.state.fl.us/programs-facilities/residential-facilities",11/7/2017,IMAGERY/OTHER,2017/11/07 00:00:00,http://www.djj.state.fl.us/programs-facilities/residential-facilities,JUVENILE,60,0.00471267479037,567.761850048079,1.16694366381e-06
193,186,10006566,MADISON COUNTY COMMUNITY WORK CENTER,140 CORRECTIONS DRIVE,CANTON,MS,39046,NOT AVAILABLE,(601) 859-7711,STATE,OPEN,62,MADISON,28089,USA,922140,CORRECTIONAL INSTITUTIONS,http://www.mdoc.ms.gov/Admin-Finance/Pages/Daily-Inmate-Population.aspx,11/30/2017,IMAGERY,2017/12/11 00:00:00,http://www.mdoc.ms.gov/Pages/Facility-Locations.aspx,MINIMUM,62,0.00430059753932,537.098949347948,1.12072647321e-06
194,187,10005360,FACILITY 8 DETENTION FACILITY,"446 ALTA ROAD, STE. 5300",SAN DIEGO,CA,92158,NOT AVAILABLE,(619) 210-0327,COUNTY,OPEN,248,SAN DIEGO,06073,USA,922140,CORRECTIONAL INSTITUTIONS,http://www.sdsheriff.net/detentionfacilities.html,2/12/2018,IMAGERY,2018/02/13 00:00:00,http://www.sdsheriff.net/detentionfacilities.html,MEDIUM,200,0.00505981362962,607.037095101763,1.54110578546e-06
195,188,10004239,NOXUBEE COUNTY COMMUNITY WORK CENTER,110 INDUSTRIAL PARK ROAD,MACON,MS,39341,NOT AVAILABLE,(662) 726-2375,STATE,OPEN,46,NOXUBEE,28103,USA,922140,CORRECTIONAL INSTITUTIONS,http://www.mdoc.ms.gov/Admin-Finance/Pages/Daily-Inmate-Population.aspx,11/30/2017,IMAGERY,2017/12/11 00:00:00,http://www.mdoc.ms.gov/Pages/Facility-Locations.aspx,MINIMUM,58,0.00327275664806,394.822301874876,6.90429952235e-07
196,189,10001538,GEORGE F BAILEY DETENTION FACILITY,"446 ALTA ROAD, STE. 5300",SAN DIEGO,CA,92158,0002,(619) 210-0385,COUNTY,OPEN,1668,SAN DIEGO,06073,USA,922140,CORRECTIONAL INSTITUTIONS,http://www.sdsheriff.net/detentionfacilities.html,2/13/2018,IMAGERY,2018/02/13 00:00:00,http://www.sdsheriff.net/detentionfacilities.html,MAXIMUM,1380,0.00703715535002,848.132754946443,3.28239042253e-06
197,190,10004260,PIKE COUNTY COMMUNITY WORK CENTER,2015 JESSE HALL RD,MAGNOLIA,MS,39652,NOT AVAILABLE,(601) 783-5514,STATE,OPEN,87,PIKE,28113,USA,922140,CORRECTIONAL INSTITUTIONS,http://www.mdoc.ms.gov/Admin-Finance/Pages/Daily-Inmate-Population.aspx,11/30/2017,IMAGERY,2017/12/11 00:00:00,http://www.mdoc.ms.gov/Pages/Facility-Locations.aspx,MINIMUM,93,0.00377387430671,440.950825042247,7.60401202735e-07
198,191,10006730,REGION II JUVENILE DETENTION CENTER,140 10TH STREET,LEWISTON,ID,83501,NOT AVAILABLE,NOT AVAILABLE,COUNTY,OPEN,-999,NEZ PERCE,16069,USA,922140,CORRECTIONAL INSTITUTIONS,https://www.co.nezperce.id.us/Departments/JusticeServices.aspx,3/1/2018,IMAGERY,2018/03/01 00:00:00,https://www.co.nezperce.id.us/Departments/JusticeServices.aspx,JUVENILE,16,0.0015919892598,206.373804652234,1.13970714867e-07
199,192,10006663,WOODWARD ACADEMY,1251 334TH STREET,WOODWARD,IA,50276,NOT AVAILABLE,(515) 438-3481,STATE,OPEN,262,DALLAS,19049,USA,922140,CORRECTIONAL INSTITUTIONS,http://www.wwacademy.com/prea-information/,3/11/2015,IMAGERY,2018/01/10 00:00:00,http://www.wwacademy.com/,JUVENILE,-999,0.014575137798,1838.26228782291,7.15388839981e-06
200,193,10004994,CHAMBERLAIN ACADEMY,211 W 16TH ST,CHAMBERLAIN,SD,57325,NOT AVAILABLE,NOT AVAILABLE,STATE,CLOSED,0,BRULE,46015,USA,922140,CORRECTIONAL INSTITUTIONS,"http://www.youthservices.com/index.php?option=com_content&task=view&id=17&Itemid=54, http://madvilletimes.com/2014/01/troubled-for-profit-youth-prison-company-closes-chamberlain-academy/",1/9/2014,IMAGERY,2018/01/10 00:00:00,NOT AVAILABLE,JUVENILE,40,0.0033344174705,448.160348171938,4.97782782827e-07
201,194,10002597,MILWAUKEE COUNTY HOUSE OF CORRECTION,8885 S 68TH ST,FRANKLIN,WI,53132,NOT AVAILABLE,(414) 427-4700,COUNTY,OPEN,1800,MILWAUKEE,55079,USA,922140,CORRECTIONAL INSTITUTIONS,http://county.milwaukee.gov/HOC,5/9/2018,IMAGERY,2018/05/09 00:00:00,NOT AVAILABLE,NOT AVAILABLE,-999,0.0140050386974,1896.03669081804,9.06314652231e-06
202,1601,10006935,MCF - MOOSE LAKE,1000 LAKE SHORE DRIVE,MOOSE LAKE,MN,55767,NOT AVAILABLE,(218) 485-5000,STATE,OPEN,1037,CARLTON,27017,USA,922140,CORRECTIONAL INSTITUTIONS,"https://mn.gov/doc/facilities/, https://mn.gov/doc/data-publications/legislative-reports/",7/1/2016,IMAGERY,2017/12/07 00:00:00,https://mn.gov/doc/facilities/,MEDIUM,1053,0.0200332805666,2517.54184352175,1.69733836528e-05
203,195,10002666,SPRINGFIELD ACADEMY,709 6TH ST,SPRINGFIELD,SD,57062,NOT AVAILABLE,NOT AVAILABLE,STATE,CLOSED,0,BON HOMME,46009,USA,922140,CORRECTIONAL INSTITUTIONS,"http://www.youthservices.com/index.php?option=com_content&task=view&id=29&Itemid=54, http://www.yankton.net/articles/2011/01/05/community/doc4d23e5b73d3f0996405509.txt",1/5/2011,IMAGERY,2018/01/10 00:00:00,NOT AVAILABLE,JUVENILE,72,0.00436385192746,568.804994295653,7.32597812943e-07
204,196,10004251,SIMPSON COUNTY TECHNICAL VIOLATION CENTER,714 WOOD RD,MAGEE,MS,39111,NOT AVAILABLE,(601) 849-3281,STATE,OPEN,58,SIMPSON,28127,USA,922140,CORRECTIONAL INSTITUTIONS,http://www.mdoc.ms.gov/Admin-Finance/Pages/Daily-Inmate-Population.aspx,11/30/2017,IMAGERY,2017/12/11 00:00:00,http://www.mdoc.ms.gov/Pages/Facility-Locations.aspx,MINIMUM,102,0.00365278021358,445.022328339133,7.90210669169e-07
205,197,10006534,LAKE ACADEMY,9504 E COLUMBUS DRIVE,TAMPA,FL,33619,NOT AVAILABLE,(813) 623-6286,STATE,OPEN,41,HILLSBOROUGH,12057,USA,922140,CORRECTIONAL INSTITUTIONS,"https://nces.ed.gov/ccd/schoolsearch/, http://www.djj.state.fl.us/programs-facilities/residential-facilities",11/7/2017,IMAGERY/OTHER,2017/11/07 00:00:00,http://www.djj.state.fl.us/programs-facilities/residential-facilities,JUVENILE,48,0.00332828614008,397.773197300983,5.39731482034e-07
206,198,10002657,SOUTH DAKOTA WOMEN'S PRISON,3200 E HWY 34,PIERRE,SD,57501,NOT AVAILABLE,(605) 773-6636,STATE,OPEN,213,HUGHES,46065,USA,922140,CORRECTIONAL INSTITUTIONS,"https://doc.sd.gov/about/stats/, https://doc.sd.gov/about/PrisonRapeEliminationAct.aspx",8/24/2017,IMAGERY,2018/01/09 00:00:00,https://doc.sd.gov/adult/facilities/,MAXIMUM,460,0.00734407347214,933.57502403746,2.30295704359e-06
207,199,10000485,LES PETERS ACADEMY,3930 W DR. MARTIN LUTHER KING JR BLVD,TAMPA,FL,33614,NOT AVAILABLE,(813) 871-7655,STATE,OPEN,22,HILLSBOROUGH,12057,USA,922140,CORRECTIONAL INSTITUTIONS,"https://nces.ed.gov/ccd/schoolsearch/, http://www.djj.state.fl.us/programs-facilities/residential-facilities",11/7/2017,IMAGERY,2017/11/07 00:00:00,http://www.djj.state.fl.us/programs-facilities/residential-facilities,JUVENILE,24,0.00359801394938,428.058504916054,7.11749525116e-07
208,200,10006567,QUITMAN COUNTY COMMUNITY WORK CENTER,201 CAMP B ROAD,LAMBERT,MS,38643,NOT AVAILABLE,(662) 326-2133,STATE,OPEN,47,QUITMAN,28119,USA,922140,CORRECTIONAL INSTITUTIONS,http://www.mdoc.ms.gov/Admin-Finance/Pages/Daily-Inmate-Population.aspx,11/30/2017,IMAGERY,2017/12/11 00:00:00,http://www.mdoc.ms.gov/Pages/Facility-Locations.aspx,MINIMUM,93,0.00388607367426,473.447671292609,7.80882497931e-07
209,201,10000876,LAS COLINAS DETENTION AND REENTRY FACILITY,451 RIVERVIEW PARKWAY,SANTEE,CA,92071,NOT AVAILABLE,(619) 402-1312,COUNTY,OPEN,846,SAN DIEGO,06073,USA,922140,CORRECTIONAL INSTITUTIONS,http://www.sdsheriff.net/detentionfacilities.html,2/12/2018,IMAGERY,2018/02/13 00:00:00,http://www.sdsheriff.net/detentionfacilities.html,MAXIMUM,1270,0.0142418479506,1729.29374268519,1.33835679007e-05
210,202,10000870,SOUTH BAY DETENTION FACILITY,500 3RD AVENUE,CHULA VISTA,CA,91910,NOT AVAILABLE,(619) 213-1433,COUNTY,OPEN,389,SAN DIEGO,06073,USA,922140,CORRECTIONAL INSTITUTIONS,http://www.sdsheriff.net/detentionfacilities.html,2/12/2018,IMAGERY,2018/02/13 00:00:00,http://www.sdsheriff.net/detentionfacilities.html,MAXIMUM,386,0.00286832466162,345.618646202846,5.03061057028e-07
211,203,10005082,OWYHEE COUNTY JAIL,20381 STATE HIGHWAY 78,MURPHY,ID,83650,NOT AVAILABLE,(208) 495-1154,COUNTY,OPEN,-999,OWYHEE,16073,USA,922140,CORRECTIONAL INSTITUTIONS,http://owyheecounty.net/departments/sheriff/,3/1/2018,IMAGERY,2018/03/01 00:00:00,http://owyheecounty.net/departments/sheriff/,NOT AVAILABLE,-999,0.0025983974974,332.621955556121,2.76838572917e-07
212,204,10003491,SULLIVAN COUNTY JAIL,140 BLOUNTVILLE BYPASS,BLOUNTVILLE,TN,37617,NOT AVAILABLE,NOT AVAILABLE,COUNTY,OPEN,757,SULLIVAN,47163,USA,922140,CORRECTIONAL INSTITUTIONS,"https://www.tn.gov/correction/statistics-and-information/jail-summary-reports.html, http://www.scsotn.com/?BISKIT=1959605501",3/31/2018,IMAGERY,2018/04/24 00:00:00,http://www.scsotn.com/?BISKIT=1959605501,NOT AVAILABLE,623,0.007140239265,882.889362635703,1.41078307638e-06
213,205,10006828,COLFAX COUNTY JAIL,411 EAST 11TH STREET,SCHUYLER,NE,68661,NOT AVAILABLE,NOT AVAILABLE,COUNTY,OPEN,-999,COLFAX,31037,USA,922140,CORRECTIONAL INSTITUTIONS,https://ncc.nebraska.gov/jail-standards-inspection-reports,4/5/2018,IMAGERY,2018/04/05 00:00:00,NOT AVAILABLE,NOT AVAILABLE,4,0.00122824383507,153.733515498871,8.8052826437e-08
214,206,10006005,TIPTON COUNTY JAIL,1801 SOUTH COLLEGE STREET,COVINGTON,TN,38019,NOT AVAILABLE,NOT AVAILABLE,COUNTY,OPEN,251,TIPTON,47167,USA,922140,CORRECTIONAL INSTITUTIONS,"https://www.tn.gov/correction/statistics-and-information/jail-summary-reports.html, http://tiptonco.com/government/sheriff/index.php",3/31/2018,IMAGERY/OTHER,2018/04/24 00:00:00,NOT AVAILABLE,NOT AVAILABLE,201,0.00462968012921,582.783548865015,7.98244926007e-07
215,207,10005077,PAYETTE COUNTY JAIL,1130 3RD AVENUE NORTH,PAYETTE,ID,83661,NOT AVAILABLE,(208) 642-6006,COUNTY,OPEN,-999,PAYETTE,16075,USA,922140,CORRECTIONAL INSTITUTIONS,https://www.payettecounty.org/elected-officials/sheriff,3/1/2018,IMAGERY,2018/03/01 00:00:00,https://www.payettecounty.org/elected-officials/sheriff,NOT AVAILABLE,72,0.00366448913837,476.146087217992,4.55035816595e-07
216,208,10000442,MARION YOUTH ACADEMY,10420 NW GAINESVILLE RD,OCALA,FL,34482,1446,(352) 840-8240,STATE,OPEN,42,MARION,12083,USA,922140,CORRECTIONAL INSTITUTIONS,"https://nces.ed.gov/ccd/schoolsearch/, http://www.djj.state.fl.us/programs-facilities/residential-facilities",11/7/2017,IMAGERY,2017/11/07 00:00:00,http://www.djj.state.fl.us/programs-facilities/residential-facilities,JUVENILE,48,0.00526077449761,626.952956219418,1.61958842163e-06
217,209,10006568,OAKLEY YOUTH DEVELOPMENT CENTER,2375 OAKLEY ROAD,RAYMOND,MS,39154,NOT AVAILABLE,(601) 857-8031,STATE,OPEN,-999,HINDS,28049,USA,922140,CORRECTIONAL INSTITUTIONS,http://www.youthlibraries.org/oakley-youth-development-center,12/11/2017,IMAGERY,2017/12/11 00:00:00,http://www.mdhs.state.ms.us/youth-services/programs-dys/institutional-programs-and-services/,JUVENILE,150,0.00722128818371,863.186043390791,1.86001457766e-06
218,210,10000459,MELBOURNE CENTER FOR PERSONAL GROWTH,1000 INSPIRATION LN,MELBOURNE,FL,32934,NOT AVAILABLE,(321) 752-3200,STATE,OPEN,28,BREVARD,12009,USA,922140,CORRECTIONAL INSTITUTIONS,"https://nces.ed.gov/ccd/schoolsearch/, http://www.djj.state.fl.us/programs-facilities/residential-facilities",11/7/2017,IMAGERY,2017/11/07 00:00:00,http://www.djj.state.fl.us/programs-facilities/residential-facilities,JUVENILE,32,0.00287091868797,334.164842308145,4.10316028254e-07
219,211,10001808,DELTA CORRECTIONAL FACILITY,3800 COUNTY RD,GREENWOOD,MS,38930,NOT AVAILABLE,NOT AVAILABLE,STATE,CLOSED,0,LEFLORE,28083,USA,922140,CORRECTIONAL INSTITUTIONS,http://www.marketwired.com/press-release/cca-and-the-state-of-mississippi-announce-closure-of-the-delta-correctional-facility-nyse-cxw-1585370.htm,11/10/2011,IMAGERY,2017/12/11 00:00:00,http://www.mdoc.state.ms.us/Five%20Private%20Prisons.htm,MEDIUM,1000,0.0133604214715,1620.79637509721,9.59006047434e-06
220,212,10004651,MIAMI YOUTH ACADEMY,10855 SOUTHWEST 84TH STREET,MIAMI,FL,33173,NOT AVAILABLE,(786) 518-3263,STATE,OPEN,24,MIAMI-DADE,12086,USA,922140,CORRECTIONAL INSTITUTIONS,"https://nces.ed.gov/ccd/schoolsearch/, http://www.djj.state.fl.us/programs-facilities/residential-facilities",11/7/2017,IMAGERY,2017/11/07 00:00:00,http://www.djj.state.fl.us/programs-facilities/residential-facilities,JUVENILE,28,0.00224561505243,262.457150617927,3.12520192709e-07
221,213,10006081,CUSTER COUNTY JAIL / SHERIFF,116 SOUTH 11TH STREET,BROKEN BOW,NE,68822,NOT AVAILABLE,NOT AVAILABLE,COUNTY,OPEN,8,CUSTER,31041,USA,922140,CORRECTIONAL INSTITUTIONS,https://ncc.nebraska.gov/jail-standards-inspection-reports,4/5/2018,IMAGERY,2018/04/05 00:00:00,http://www.custercounty.org/index.html,NOT AVAILABLE,26,0.00199589200008,257.559399995953,2.0963517598e-07
222,214,10002573,MONROE COUNTY JAIL,112 S COURT STREET,SPARTA,WI,54656,NOT AVAILABLE,(608) 269-8759,COUNTY,OPEN,519,MONROE,55081,USA,922140,CORRECTIONAL INSTITUTIONS,http://www.co.monroe.wi.us/departments/sheriffs-department/,5/9/2018,IMAGERY,2018/05/09 00:00:00,NOT AVAILABLE,NOT AVAILABLE,-999,0.00400587842102,540.790264392755,5.96762602006e-07
223,215,10003624,MONTANA STATE PRISON,400 CONLEY LAKE RD,DEER LODGE,MT,59722,NOT AVAILABLE,(406) 846-1320,STATE,OPEN,1550,POWELL,30077,USA,922140,CORRECTIONAL INSTITUTIONS,https://cor.mt.gov/publications,12/8/2017,IMAGERY,2017/12/11 00:00:00,http://cor.mt.gov/Adult,MAXIMUM,1495,0.0329282950891,4253.61482321192,4.02796899286e-05
224,216,10002658,WOMEN'S STATE PRISON - UNIT E,3200 E STATE HWY 34,PIERRE,SD,57501,NOT AVAILABLE,(605) 773-6636,STATE,OPEN,94,HUGHES,46065,USA,922140,CORRECTIONAL INSTITUTIONS,https://doc.sd.gov/about/stats/,11/30/2017,UNVERIFIED,2018/01/10 00:00:00,http://doc.sd.gov/adult/facilities/,MINIMUM,-999,0.00317203023555,404.12214086807,3.90627042938e-07
225,217,10003507,MORGAN COUNTY CORRECTIONAL COMPLEX,541 WAYNE COTTON MORGAN DR,WARTBURG,TN,37887,NOT AVAILABLE,(423) 346-1300,STATE,OPEN,2149,MORGAN,47129,USA,922140,CORRECTIONAL INSTITUTIONS,https://www.tn.gov/correction/statistics-and-information/bed-space---capacity-reports.html,11/30/2017,IMAGERY,2018/01/10 00:00:00,https://www.tn.gov/correction/sp/state-prison-list.html,MAXIMUM,2230,0.0271155824388,3378.46560730487,2.79967248846e-05
226,218,10004625,OKEECHOBEE GIRLS ACADEMY,1117 NE 39TH BOULEVARD,OKEECHOBEE,FL,34972,NOT AVAILABLE,(863) 824-6114,STATE,OPEN,41,OKEECHOBEE,12093,USA,922140,CORRECTIONAL INSTITUTIONS,"http://criminology.fsu.edu/wp-content/uploads/2007-2008-Red-Road-Academy.pdf, http://www.djj.state.fl.us/programs-facilities/residential-facilities",10/31/2015,IMAGERY,2017/11/07 00:00:00,http://www.djj.state.fl.us/programs-facilities/residential-facilities,JUVENILE,32,0.00288839387733,334.967397808314,5.36159790918e-07
227,219,10000498,OKEECHOBEE INTENSIVE HALFWAY HOUSE,800 NORTH EAST 72ND CIRCLE,OKEECHOBEE,FL,34972,NOT AVAILABLE,(863) 357-0047,STATE,OPEN,30,OKEECHOBEE,12093,USA,922140,CORRECTIONAL INSTITUTIONS,"https://nces.ed.gov/ccd/schoolsearch/, http://www.djj.state.fl.us/programs-facilities/residential-facilities",11/7/2017,IMAGERY,2017/11/07 00:00:00,http://www.djj.state.fl.us/programs-facilities/residential-facilities,JUVENILE,30,0.00566927928314,681.600973716811,1.33476952005e-06
228,220,10000872,SAN DIEGO CENTRAL JAIL,1173 FRONT STREET,SAN DIEGO,CA,92101,NOT AVAILABLE,(619) 610-1647,COUNTY,OPEN,1008,SAN DIEGO,06073,USA,922140,CORRECTIONAL INSTITUTIONS,http://www.sdsheriff.net/detentionfacilities.html,2/12/2018,IMAGERY,2018/02/13 00:00:00,http://www.sdsheriff.net/detentionfacilities.html,NOT AVAILABLE,944,0.00306941523858,377.093537730679,5.83048531023e-07
229,221,10000496,OKEECHOBEE JUVENILE OFFENDER CORRECTIONS CENTER,5050 NE 168TH ST,OKEECHOBEE,FL,34972,NOT AVAILABLE,(863) 357-9922,STATE,OPEN,54,OKEECHOBEE,12093,USA,922140,CORRECTIONAL INSTITUTIONS,http://www.djj.state.fl.us/programs-facilities/residential-facilities,10/31/2015,IMAGERY,2017/11/07 00:00:00,http://www.djj.state.fl.us/programs-facilities/residential-facilities,JUVENILE,48,0.00851399142419,982.46960992197,3.74910608245e-06
230,222,10001933,CASCADE COUNTY REGIONAL PRISON,3800 ULM NORTH FRONTAGE RD,GREAT FALLS,MT,59404,NOT AVAILABLE,(406) 454-6823,STATE,OPEN,152,CASCADE,30013,USA,922140,CORRECTIONAL INSTITUTIONS,https://cor.mt.gov/publications,12/8/2017,IMAGERY,2017/12/11 00:00:00,http://cor.mt.gov/Adult/MSP#contracted,NOT AVAILABLE,152,0.00951109284268,1247.12690154498,2.50568345526e-06
231,223,10001155,DAWSON COUNTY CORRECTIONAL FACILITY,440 COLORADO BLVD,GLENDIVE,MT,59330,NOT AVAILABLE,(406) 377-7600,STATE,OPEN,141,DAWSON,30021,USA,922140,CORRECTIONAL INSTITUTIONS,https://cor.mt.gov/publications,12/8/2017,IMAGERY/OTHER,2017/12/11 00:00:00,http://cor.mt.gov/Adult/MSP#contracted,NOT AVAILABLE,141,0.00491150643704,660.041032215304,9.22695804505e-07
232,224,10006777,YOUTH STUDY CENTER,1100 MILTON ST,NEW ORLEANS,LA,70122,NOT AVAILABLE,(504) 658-3400,COUNTY,OPEN,-999,ORLEANS,22071,USA,922140,CORRECTIONAL INSTITUTIONS,https://www.nola.gov/youth-study-center/,3/15/2018,IMAGERY,2018/03/15 00:00:00,https://www.nola.gov/youth-study-center/,JUVENILE,-999,0.0075135695956,885.048166978987,1.5978050822e-06
233,225,10003492,NORTHEAST CORRECTIONAL COMPLEX-MAIN,5249 HWY 67 W,MOUNTAIN CITY,TN,37683,5000,(423) 727-7387,STATE,OPEN,-999,JOHNSON,47091,USA,922140,CORRECTIONAL INSTITUTIONS,https://www.tn.gov/correction/statistics-and-information/bed-space---capacity-reports.html,11/30/2017,IMAGERY,2018/01/10 00:00:00,https://www.tn.gov/correction/sp/state-prison-list.html,MAXIMUM,1700,0.0217016108491,2678.68560824683,1.68041154284e-05
234,226,10005085,POWER COUNTY JAIL,550 GIFFORD STREET,AMERICAN FALLS,ID,83211,NOT AVAILABLE,(208) 226-2311,COUNTY,OPEN,14,POWER,16077,USA,922140,CORRECTIONAL INSTITUTIONS,http://www.co.power.id.us/sheriffs-office/,3/1/2018,IMAGERY,2018/03/01 00:00:00,http://www.co.power.id.us/sheriffs-office/,NOT AVAILABLE,-999,0.00174935870753,230.734785761559,1.66758804407e-07
235,227,10006291,OUACHITA PARISH WORK RELEASE FACILITY,4801 SOUTH GRAND STREET,MONROE,LA,71202,NOT AVAILABLE,(318) 410-2400,COUNTY,OPEN,211,OUACHITA,22073,USA,922140,CORRECTIONAL INSTITUTIONS,http://doc.louisiana.gov/briefing-book,9/29/2017,IMAGERY,2018/03/15 00:00:00,http://www.opso.net/,MINIMUM,290,0.00360405480134,428.645899739193,5.53310797788e-07
236,228,10006070,DAKOTA COUNTY JAIL,1602 BROADWAY STREET,DAKOTA CITY,NE,68731,NOT AVAILABLE,(402) 987-2170,COUNTY,OPEN,88,DAKOTA,31043,USA,922140,CORRECTIONAL INSTITUTIONS,https://ncc.nebraska.gov/jail-standards-inspection-reports,4/5/2018,IMAGERY,2018/04/05 00:00:00,http://www.dakotacountyne.org/webpages/corrections/corrections.html,NOT AVAILABLE,129,0.00476902788399,608.036434729976,5.15559987235e-07
237,229,10006061,DAWES COUNTY JAIL,451 MAIN STREET,CHADRON,NE,69337,NOT AVAILABLE,NOT AVAILABLE,COUNTY,OPEN,8,DAWES,31045,USA,922140,CORRECTIONAL INSTITUTIONS,https://ncc.nebraska.gov/jail-standards-inspection-reports,4/5/2018,IMAGERY,2018/04/05 00:00:00,NOT AVAILABLE,NOT AVAILABLE,19,0.00107642971363,138.394649233678,5.87141657965e-08
238,230,10006095,DAWSON COUNTY JAIL,709 NORTH GRANT STREET,LEXINGTON,NE,68850,NOT AVAILABLE,NOT AVAILABLE,COUNTY,OPEN,80,DAWSON,31047,USA,922140,CORRECTIONAL INSTITUTIONS,https://ncc.nebraska.gov/jail-standards-inspection-reports,4/5/2018,IMAGERY/OTHER,2018/04/05 00:00:00,https://www.dawsoncone.com/index.html,NOT AVAILABLE,126,0.00287137356536,380.842436090062,4.15683549313e-07
239,231,10005358,VISTA DETENTION FACILITY,325 SOUTH MELROSE DRIVE #200,VISTA,CA,92081,NOT AVAILABLE,(760) 936-0014,COUNTY,OPEN,799,SAN DIEGO,06073,USA,922140,CORRECTIONAL INSTITUTIONS,http://www.sdsheriff.net/detentionfacilities.html,2/12/2018,IMAGERY,2018/02/13 00:00:00,http://www.sdsheriff.net/detentionfacilities.html,NOT AVAILABLE,825,0.00483736905786,587.887590176886,1.25313988073e-06
240,232,10003626,MONTANA WOMEN'S PRISON,701 S 27TH ST,BILLINGS,MT,59101,NOT AVAILABLE,(406) 247-5100,STATE,OPEN,208,YELLOWSTONE,30111,USA,922140,CORRECTIONAL INSTITUTIONS,https://cor.mt.gov/publications,12/8/2017,IMAGERY,2017/12/11 00:00:00,http://cor.mt.gov/Adult,MAXIMUM,194,0.00557329824489,714.342915386335,1.43537782603e-06
241,233,10000875,KEARNY MESA JUVENILE DETENTION FACILITY,2801 MEADOW LARK DRIVE,SAN DIEGO,CA,92123,NOT AVAILABLE,(858) 694-4500,COUNTY,OPEN,-999,SAN DIEGO,06073,USA,922140,CORRECTIONAL INSTITUTIONS,https://www.sandiegocounty.gov/probation/juvenile_information_detained.html,2/13/2018,IMAGERY,2018/02/13 00:00:00,https://www.sandiegocounty.gov/probation/juvenile_information_detained.html,JUVENILE,359,0.0066335219539,829.075852209464,1.71578948942e-06
242,234,10006535,OKEECHOBEE YOUTH DEVELOPMENT CENTER / CORRECTIONAL CENTER AND YOUTH TREATMENT CENTER,7200 HIGHWAY 441 NORTH,OKEECHOBEE,FL,34972,NOT AVAILABLE,(863) 763-2174,STATE,OPEN,128,OKEECHOBEE,12093,USA,922140,CORRECTIONAL INSTITUTIONS,"https://nces.ed.gov/ccd/schoolsearch/, http://www.djj.state.fl.us/programs-facilities/residential-facilities",11/7/2017,IMAGERY,2017/11/07 00:00:00,http://www.djj.state.fl.us/programs-facilities/residential-facilities,JUVENILE,130,0.0177325442336,2094.03146651058,1.9763659238e-05
243,235,10001703,NORTHEAST CORRECTIONAL COMPLEX - ANNEX,188 OLD RAILROAD GRADE RD,ROAN MOUNTAIN,TN,37687,NOT AVAILABLE,(423) 772-3231,STATE,OPEN,-999,CARTER,47019,USA,922140,CORRECTIONAL INSTITUTIONS,https://www.tn.gov/correction/sp/state-prison-list.html,1/10/2018,IMAGERY,2018/01/10 00:00:00,https://www.tn.gov/correction/sp/state-prison-list.html,MINIMUM,180,0.00677110219632,841.738561824885,1.05294256091e-06
244,236,10006569,LEWISTOWN INFIRMARY,800 CASINO CREEK DRIVE,LEWISTOWN,MT,59457,NOT AVAILABLE,(406) 535-6923,STATE,OPEN,24,FERGUS,30027,USA,922140,CORRECTIONAL INSTITUTIONS,https://cor.mt.gov/publications,12/8/2017,IMAGERY,2017/12/11 00:00:00,http://cor.mt.gov/Adult/MSP#contracted,NOT AVAILABLE,25,0.00603986845279,776.054690608181,2.32092860214e-06
245,237,10001709,RIVERBEND MAXIMUM SECURITY INSTITUTION,7475 COCKRILL BEND BLVD,NASHVILLE,TN,37243,0471,(615) 350-3100,STATE,OPEN,787,DAVIDSON,47037,USA,922140,CORRECTIONAL INSTITUTIONS,https://www.tn.gov/correction/statistics-and-information/bed-space---capacity-reports.html,11/30/2017,IMAGERY,2018/01/10 00:00:00,https://www.tn.gov/correction/sp/state-prison-list.html,MAXIMUM,808,0.0169922758226,2118.71860780434,1.62354299044e-05
246,238,10006103,FILLMORE COUNTY JAIL,900 G STREET,GENEVA,NE,68361,NOT AVAILABLE,NOT AVAILABLE,COUNTY,OPEN,7,FILLMORE,31059,USA,922140,CORRECTIONAL INSTITUTIONS,https://ncc.nebraska.gov/jail-standards-inspection-reports,4/5/2018,IMAGERY,2018/04/05 00:00:00,NOT AVAILABLE,NOT AVAILABLE,8,0.00131060800004,166.359200004488,9.35563700892e-08
247,239,10005060,SHOSHONE COUNTY JAIL,717 BANK STREET,WALLACE,ID,83873,NOT AVAILABLE,(208) 556-1114,COUNTY,OPEN,-999,SHOSHONE,16079,USA,922140,CORRECTIONAL INSTITUTIONS,http://shoshonecounty.id.gov/sheriff/,3/1/2018,IMAGERY,2018/03/01 00:00:00,http://shoshonecounty.id.gov/sheriff/,NOT AVAILABLE,64,0.00188408553894,237.70059538997,1.78998063506e-07
248,240,10001190,TWIN FALLS ADULT DETENTION FACILITY,504 GOODING ST N,TWIN FALLS,ID,83301,NOT AVAILABLE,(208) 734-9090,COUNTY,OPEN,242,TWIN FALLS,16083,USA,922140,CORRECTIONAL INSTITUTIONS,http://twinfallscoso.com/,3/1/2018,IMAGERY,2018/03/01 00:00:00,http://twinfallscoso.com/,NOT AVAILABLE,224,0.00330586221372,415.921469468758,4.05065922531e-07
249,241,10004765,TROUSDALE COUNTY JAIL,315 EAST MAIN STREET,HARTSVILLE,TN,37074,NOT AVAILABLE,NOT AVAILABLE,COUNTY,OPEN,43,TROUSDALE,47169,USA,922140,CORRECTIONAL INSTITUTIONS,https://www.tn.gov/correction/statistics-and-information/jail-summary-reports.html,3/31/2018,IMAGERY,2018/04/24 00:00:00,NOT AVAILABLE,NOT AVAILABLE,44,0.00160181315402,187.457550305863,8.80768013899e-08
250,242,10006292,GREEN OAKS JUVENILE DETENTION,4820 SOUTH GRAND STREET,MONROE,LA,71202,NOT AVAILABLE,NOT AVAILABLE,COUNTY,OPEN,-999,OUACHITA,22073,USA,922140,CORRECTIONAL INSTITUTIONS,http://oppj.org/departments/green_oaks/index.php,2/15/2016,IMAGERY,2018/03/15 00:00:00,http://oppj.org/departments/green_oaks/index.php,JUVENILE,60,0.00353106065848,420.932769851312,7.93648218551e-07
251,243,10000463,ORLANDO INTENSIVE YOUTH ACADEMY AND ORANGE YOUTH ACADEMY,3150 39TH ST,ORLANDO,FL,32839,NOT AVAILABLE,(407) 835-0111,STATE,OPEN,50,ORANGE,12095,USA,922140,CORRECTIONAL INSTITUTIONS,"https://nces.ed.gov/ccd/schoolsearch/, http://www.djj.state.fl.us/programs-facilities/residential-facilities",11/7/2017,IMAGERY,2017/11/07 00:00:00,http://www.djj.state.fl.us/programs-facilities/residential-facilities,JUVENILE,56,0.0056143687914,663.589943903759,1.31985745819e-06
252,244,10000515,PALM BEACH YOUTH ACADEMY,9680 FAIRGROUNDS RD,PALM BEACH,FL,33411,NOT AVAILABLE,(561) 333-0664,STATE,OPEN,115,PALM BEACH,12099,USA,922140,CORRECTIONAL INSTITUTIONS,"https://nces.ed.gov/ccd/schoolsearch/, http://www.djj.state.fl.us/programs-facilities/residential-facilities",11/7/2017,IMAGERY,2017/11/07 00:00:00,http://www.djj.state.fl.us/programs-facilities/residential-facilities,JUVENILE,78,0.00567799936994,673.337487206242,1.9011676463e-06
253,245,10002184,PALMETTO YOUTH ACADEMY,14494 HARLEE RD,PALMETTO,FL,34221,NOT AVAILABLE,(941) 722-3700,STATE,OPEN,46,MANATEE,12081,USA,922140,CORRECTIONAL INSTITUTIONS,"https://nces.ed.gov/ccd/schoolsearch/, http://www.djj.state.fl.us/programs-facilities/residential-facilities",11/7/2017,IMAGERY,2017/11/07 00:00:00,http://www.djj.state.fl.us/programs-facilities/residential-facilities,JUVENILE,48,0.00432424865422,512.374198367865,6.61667324275e-07
254,246,10002182,POLK HALFWAY HOUSE,2145 BOB PHILLIPS RD,BARTOW,FL,33830,NOT AVAILABLE,(863) 519-5581,STATE,OPEN,23,POLK,12105,USA,922140,CORRECTIONAL INSTITUTIONS,"https://nces.ed.gov/ccd/schoolsearch/, http://www.djj.state.fl.us/programs-facilities/residential-facilities",11/7/2017,IMAGERY,2017/11/07 00:00:00,http://www.djj.state.fl.us/programs-facilities/residential-facilities,JUVENILE,24,0.00281622784903,336.934401074442,4.3422419226e-07
255,247,10005691,SNAKE RIVER JUVENILE DETENTION CENTER,2515 WRIGHT AVENUE,TWIN FALLS,ID,83301,NOT AVAILABLE,(208) 736-2588,COUNTY,OPEN,16,TWIN FALLS,16083,USA,922140,CORRECTIONAL INSTITUTIONS,http://www.twinfallscounty.org/juvenile/detention/,8/7/2016,IMAGERY,2018/03/01 00:00:00,http://www.twinfallscounty.org/juvenile/detention/,JUVENILE,27,0.00221027607059,281.65597244922,2.80017562231e-07
256,248,10005354,EAST MESA JUVENILE DETENTION FACILITY,"446 ALTA ROAD, SUITE 6100",SAN DIEGO,CA,92158,NOT AVAILABLE,(619) 671-4400,COUNTY,OPEN,-999,SAN DIEGO,06073,USA,922140,CORRECTIONAL INSTITUTIONS,https://www.sandiegocounty.gov/probation/juvenile_information_detained.html,2/13/2018,IMAGERY,2018/02/13 00:00:00,https://www.sandiegocounty.gov/probation/juvenile_information_detained.html,JUVENILE,290,0.00836423746044,1002.14470919296,3.60413017452e-06
257,249,10001705,TENNESSEE PRISON FOR WOMEN,3881 STEWARTS LANE,NASHVILLE,TN,37243,0468,(615) 741-1255,STATE,OPEN,685,DAVIDSON,47037,USA,922140,CORRECTIONAL INSTITUTIONS,https://www.tn.gov/correction/statistics-and-information/bed-space---capacity-reports.html,11/30/2017,IMAGERY,2018/01/10 00:00:00,https://www.tn.gov/correction/sp/state-prison-list.html,MAXIMUM,817,0.0214290135202,2596.61566596687,1.28204544162e-05
258,250,10006108,GAGE COUNTY CORRECTIONS,612 LINCOLN STREET,BEATRICE,NE,68310,2988,NOT AVAILABLE,COUNTY,OPEN,34,GAGE,31067,USA,922140,CORRECTIONAL INSTITUTIONS,http://www.gagecountysheriff.us/index.jsp,4/5/2018,IMAGERY,2018/04/05 00:00:00,http://www.gagecountysheriff.us/index.jsp,NOT AVAILABLE,26,0.0019792000626,237.914694326938,1.68995006223e-07
259,251,10004092,POINTE COUPEE PARISH DETENTION CENTER,10933 CAJUN II RD,NEW ROADS,LA,70760,NOT AVAILABLE,(225) 638-5407,COUNTY,OPEN,128,POINTE COUPEE,22077,USA,922140,CORRECTIONAL INSTITUTIONS,"http://doc.louisiana.gov/briefing-book, http://doc.louisiana.gov/contact-us/local-facilities",9/29/2017,IMAGERY,2018/03/15 00:00:00,http://www.pcpso.org/,NOT AVAILABLE,209,0.00442958626216,524.553773334363,1.09680359675e-06
260,252,10006110,FURNAS COUNTY JAIL,912 R STREET,BEAVER CITY,NE,68926,NOT AVAILABLE,NOT AVAILABLE,COUNTY,OPEN,1,FURNAS,31065,USA,922140,CORRECTIONAL INSTITUTIONS,https://ncc.nebraska.gov/jail-standards-inspection-reports,4/5/2018,IMAGERY,2018/04/05 00:00:00,http://www.furnascosheriff.org/,NOT AVAILABLE,8,0.000955205598821,117.303912227303,5.0802684103e-08
261,253,10005069,VALLEY COUNTY JAIL,107 WEST SPRING STREET,CASCADE,ID,83611,NOT AVAILABLE,(208) 382-7168,COUNTY,OPEN,-999,VALLEY,16085,USA,922140,CORRECTIONAL INSTITUTIONS,http://www.co.valley.id.us/departments/sheriffs-office/,3/1/2018,IMAGERY,2018/03/01 00:00:00,http://www.co.valley.id.us/departments/sheriffs-office/,NOT AVAILABLE,-999,0.00212478789495,285.351605719038,2.42441560999e-07
262,254,10006094,HAMILTON COUNTY JAIL,715 12TH STREET,AURORA,NE,68818,NOT AVAILABLE,NOT AVAILABLE,COUNTY,OPEN,8,HAMILTON,31081,USA,922140,CORRECTIONAL INSTITUTIONS,https://ncc.nebraska.gov/jail-standards-inspection-reports,4/5/2018,IMAGERY,2018/04/05 00:00:00,NOT AVAILABLE,NOT AVAILABLE,34,0.00141959183955,176.141329724214,9.25234924303e-08
263,255,10000380,RAM-C PROGRAM,742 SW GREENVILLE HILLS RD,GREENVILLE,FL,32331,NOT AVAILABLE,(850) 948-1226,STATE,OPEN,-999,MADISON,12079,USA,922140,CORRECTIONAL INSTITUTIONS,http://www.djj.state.fl.us/programs-facilities/residential-facilities,11/7/2017,IMAGERY,2017/11/07 00:00:00,http://www.djj.state.fl.us/programs-facilities/residential-facilities,JUVENILE,40,0.00606433486714,724.005578822233,2.60285336077e-06
264,256,10006184,CONNECTIONS CORRECTIONS - BUTTE,111 WEST BROADWAY,BUTTE,MT,59701,NOT AVAILABLE,(406) 782-6626,STATE,OPEN,52,SILVER BOW,30093,USA,922140,CORRECTIONAL INSTITUTIONS,https://cor.mt.gov/publications,12/8/2017,IMAGERY,2017/12/11 00:00:00,http://www.cccscorp.com/programs/,MINIMUM,52,0.00205877534303,258.262134593624,2.15310990285e-07
265,257,10002157,SAINT JOHN'S YOUTH ACADEMY,4500 AVENUE D,ST. AUGUSTINE,FL,32085,NOT AVAILABLE,(904) 829-8850,STATE,OPEN,63,ST. JOHNS,12109,USA,922140,CORRECTIONAL INSTITUTIONS,"https://nces.ed.gov/ccd/schoolsearch/, http://www.djj.state.fl.us/programs-facilities/residential-facilities",11/7/2017,IMAGERY,2017/11/07 00:00:00,http://www.djj.state.fl.us/programs-facilities/residential-facilities,JUVENILE,70,0.00503191125331,601.854512895452,1.31428687811e-06
266,258,10000390,JUVENILE UNIT FOR SPECIALIZED TREATMENT,29841 LIBERTY WILDERNESS RD,SUMATRA,FL,32335,NOT AVAILABLE,(850) 379-8344,STATE,OPEN,65,LIBERTY,12077,USA,922140,CORRECTIONAL INSTITUTIONS,"http://www.twinoaksfl.org/, http://www.djj.state.fl.us/programs-facilities/residential-facilities",10/31/2015,IMAGERY,2017/11/07 00:00:00,http://www.djj.state.fl.us/programs-facilities/residential-facilities,JUVENILE,44,0.0182596988662,2215.19622617283,1.61086475319e-05
267,259,10005356,GIRLS REHABILITATION FACILITY,2861 MEADOW LARK DRIVE,SAN DIEGO,CA,92123,NOT AVAILABLE,(858) 694-4510,COUNTY,OPEN,-999,SAN DIEGO,06073,USA,922140,CORRECTIONAL INSTITUTIONS,https://www.sandiegocounty.gov/probation/juvenile_information_detained.html,2/13/2018,IMAGERY,2018/02/13 00:00:00,https://www.sandiegocounty.gov/probation/juvenile_information_detained.html,JUVENILE,50,0.00664973053,797.506225216937,1.73771034454e-06
268,260,10004582,UNION JUVENILE RESIDENTIAL FACILITY,14692 NORTHEAST COUNTY ROAD 199,RAIFORD,FL,32083,2519,(386) 431-1997,STATE,OPEN,23,UNION,12125,USA,922140,CORRECTIONAL INSTITUTIONS,"https://nces.ed.gov/ccd/schoolsearch/, http://www.djj.state.fl.us/programs-facilities/residential-facilities",11/7/2017,IMAGERY,2017/11/07 00:00:00,http://www.djj.state.fl.us/programs-facilities/residential-facilities,JUVENILE,24,0.0058424593954,688.677457149963,1.45050954906e-06
269,261,10005917,RAPIDES PARISH DETENTION CENTER I,700 MURRAY STREET,ALEXANDRIA,LA,71301,NOT AVAILABLE,(318) 473-6750,COUNTY,OPEN,356,RAPIDES,22079,USA,922140,CORRECTIONAL INSTITUTIONS,http://doc.louisiana.gov/briefing-book,9/29/2017,IMAGERY/OTHER,2018/03/16 00:00:00,http://www.rpso.org/,NOT AVAILABLE,348,0.00268207659954,321.941763970168,4.33062169791e-07
270,262,10001014,TURNEY CENTER INDUSTRIAL COMPLEX,1499 R.W. MOORE MEMORIAL HWY,ONLY,TN,37140,4050,(931) 729-5161,STATE,OPEN,1565,HICKMAN,47081,USA,922140,CORRECTIONAL INSTITUTIONS,https://www.tn.gov/correction/sp/prison-rape-elimination-act.html,9/25/2015,IMAGERY,2018/01/10 00:00:00,https://www.tn.gov/correction/sp/state-prison-list.html,CLOSE,1184,0.0263765184358,3203.6013281558,2.68254160266e-05
271,263,10004766,UNION COUNTY JAIL,901 MAIN STREET,MAYNARDVILLE,TN,37807,NOT AVAILABLE,NOT AVAILABLE,COUNTY,OPEN,110,UNION,47173,USA,922140,CORRECTIONAL INSTITUTIONS,"https://www.tn.gov/correction/statistics-and-information/jail-summary-reports.html, http://tn211.mycommunitypt.com/?option=com_cpx&task=resource&id=639134",3/31/2018,IMAGERY,2018/04/24 00:00:00,NOT AVAILABLE,NOT AVAILABLE,76,0.00149983696974,186.5361603458,1.25430249377e-07
272,264,10000363,WALTON ACADEMY FOR GROWTH AND CHANGE,286 GENE HURLEY RD,DEFUNIAK SPRINGS,FL,32433,NOT AVAILABLE,(850) 520-4642,STATE,OPEN,40,WALTON,12131,USA,922140,CORRECTIONAL INSTITUTIONS,"https://nces.ed.gov/ccd/schoolsearch/, http://www.djj.state.fl.us/programs-facilities/residential-facilities",11/7/2017,IMAGERY,2017/11/07 00:00:00,http://www.djj.state.fl.us/programs-facilities/residential-facilities,JUVENILE,39,0.00477829490572,553.031348436206,7.65710843267e-07
273,265,10006112,HITCHCOCK COUNTY JAIL / SHERIFF,229 EAST D STREET,TRENTON,NE,69044,NOT AVAILABLE,(308) 334-5148,COUNTY,OPEN,3,HITCHCOCK,31087,USA,922140,CORRECTIONAL INSTITUTIONS,https://ncc.nebraska.gov/jail-standards-inspection-reports,4/5/2018,IMAGERY,2018/04/05 00:00:00,http://www.hitchcockcountysheriff.org/index.html,NOT AVAILABLE,8,0.00237538044656,291.181499969314,2.02431524493e-07
274,266,10004618,YOUTH ENVIRONMENTAL SERVICES,4337 SAFFOLD ROAD,WIMAUMA,FL,33598,NOT AVAILABLE,(813) 671-5213,STATE,OPEN,-999,HILLSBOROUGH,12057,USA,922140,CORRECTIONAL INSTITUTIONS,http://www.djj.state.fl.us/programs-facilities/residential-facilities,11/7/2017,IMAGERY,2017/11/07 00:00:00,http://www.djj.state.fl.us/programs-facilities/residential-facilities,JUVENILE,32,0.00338652929865,396.117849801209,7.89479044111e-07
275,267,10001720,MARK H LUTTRELL TRANSITION CENTER,6000 STATE RD,MEMPHIS,TN,38134,NOT AVAILABLE,(901) 372-2080,STATE,OPEN,244,SHELBY,47157,USA,922140,CORRECTIONAL INSTITUTIONS,https://www.tn.gov/correction/statistics-and-information/bed-space---capacity-reports.html,11/30/2017,IMAGERY,2018/01/10 00:00:00,https://www.tn.gov/correction/sp/state-prison-list.html,MEDIUM,454,0.0083326182449,1031.22989754327,2.98092378245e-06
276,268,10000345,PENSACOLA COMMUNITY RELEASE CENTER,3050 NORTH L. ST,PENSACOLA,FL,32501,1010,(850) 595-8920,STATE,OPEN,83,ESCAMBIA,12033,USA,922140,CORRECTIONAL INSTITUTIONS,http://www.dc.state.fl.us/pub/pop/,10/31/2017,IMAGERY,2017/11/07 00:00:00,http://www.dc.state.fl.us/orginfo/facilitydir.html#4,MINIMUM,-999,0.00166645999459,197.859100854968,1.6868101957e-07
277,269,10006708,CAMP BARRETT,21077 LYONS VALLEY RD,ALPINE,CA,91901,NOT AVAILABLE,(619) 401-4900,COUNTY,OPEN,-999,SAN DIEGO,06073,USA,922140,CORRECTIONAL INSTITUTIONS,https://www.sandiegocounty.gov/probation/juvenile_information_detained.html,2/13/2018,IMAGERY,2018/02/13 00:00:00,https://www.sandiegocounty.gov/probation/juvenile_information_detained.html,JUVENILE,-999,0.00576517470589,716.147749865264,2.01102621623e-06
278,270,10004780,VAN BUREN COUNTY JAIL,17 VETERN SQUARE,SPENCER,TN,38585,NOT AVAILABLE,NOT AVAILABLE,COUNTY,OPEN,50,VAN BUREN,47175,USA,922140,CORRECTIONAL INSTITUTIONS,https://www.tn.gov/correction/statistics-and-information/jail-summary-reports.html,3/31/2018,IMAGERY,2018/04/24 00:00:00,NOT AVAILABLE,NOT AVAILABLE,13,0.00149452557081,189.310749814939,9.3249982628e-08
279,271,10001525,SAN FRANCISCO COUNTY JAIL #2,425 7TH STREET,SAN FRANCISCO,CA,94103,NOT AVAILABLE,(415) 575-4401,COUNTY,OPEN,232,SAN FRANCISCO,06075,USA,922140,CORRECTIONAL INSTITUTIONS,"http://www.bscc.ca.gov/s_fsojailprofilesurvey.php, http://www.sfsheriff.com/jailinfolanding.html",2/13/2018,IMAGERY,2018/02/13 00:00:00,http://www.sfsheriff.com/jailinfolanding.html,NOT AVAILABLE,392,0.00272019209001,338.415207178757,3.75470309096e-07
280,272,10005070,VALLEY COUNTY JUVENILE DETENTION CENTER,550 DEINHARD LANE,MCCALL,ID,83638,NOT AVAILABLE,(208) 634-5652 EXT 222,COUNTY,OPEN,-999,VALLEY,16085,USA,922140,CORRECTIONAL INSTITUTIONS,http://www.co.valley.id.us/departments/courts/court-services-judicial/,2/18/2016,IMAGERY,2018/03/01 00:00:00,http://www.co.valley.id.us/departments/courts/court-services-judicial/,JUVENILE,8,0.00142549692522,185.937360309931,1.09282162175e-07
281,273,10002536,OCONTO COUNTY JAIL,301 WASHINGTON ST,OCONTO,WI,54153,NOT AVAILABLE,(920) 834-6918,COUNTY,OPEN,64,OCONTO,55083,USA,922140,CORRECTIONAL INSTITUTIONS,https://www.co.oconto.wi.us/departments/page_87ff41f5fb47/?department=e587ce08a9a0&subdepartment=11fb938b6800,3/1/2016,IMAGERY,2018/05/09 00:00:00,NOT AVAILABLE,MAXIMUM,56,0.00487527649709,607.244368752529,5.59467341116e-07
282,274,10006064,HOLT COUNTY JAIL,204 NORTH 4TH STREET,O'NEILL,NE,68763,NOT AVAILABLE,NOT AVAILABLE,COUNTY,OPEN,8,HOLT,31089,USA,922140,CORRECTIONAL INSTITUTIONS,https://ncc.nebraska.gov/jail-standards-inspection-reports,4/5/2018,IMAGERY,2018/04/05 00:00:00,NOT AVAILABLE,NOT AVAILABLE,20,0.00130236782335,165.316449645831,9.0462518451e-08
283,275,10005483,JACKSON COUNTY JAIL,600 S MAIN,ALTUS,OK,73521,NOT AVAILABLE,NOT AVAILABLE,COUNTY,OPEN,130,JACKSON,40065,USA,922140,CORRECTIONAL INSTITUTIONS,https://www.oklahomasheriffs.org/app/web/sheriff/county,4/13/2018,IMAGERY,2018/04/13 00:00:00,NOT AVAILABLE,NOT AVAILABLE,-999,0.00290770000004,356.195399992168,4.2368420662e-07
284,276,10000374,TALLAHASSEE COMMUNITY RELEASE CENTER,2616A SPRINGHILL RD,TALLAHASSEE,FL,32305,6739,(850) 488-2478,STATE,OPEN,120,LEON,12073,USA,922140,CORRECTIONAL INSTITUTIONS,http://www.dc.state.fl.us/pub/pop/,10/31/2017,IMAGERY,2017/11/07 00:00:00,http://www.dc.state.fl.us/orginfo/facilitydir.html#4,MINIMUM,-999,0.0025871655872,305.462590392846,3.90145241765e-07
285,277,10004569,BRIDGES OF JACKSONVILLE,601 AGMAC AVENUE,JACKSONVILLE,FL,32254,NOT AVAILABLE,(904) 674-0850,STATE,OPEN,136,DUVAL,12031,USA,922140,CORRECTIONAL INSTITUTIONS,"http://www.dc.state.fl.us/pub/pop/, http://www.bridgesofamerica.com/facilities/",10/31/2017,IMAGERY,2017/11/07 00:00:00,http://www.bridgesofamerica.com/facilities/,MINIMUM,140,0.00326169988623,388.372915073051,6.9543258767e-07
286,278,10004567,BRIDGES OF LAKE CITY,1099 N.W. DOT GLN,LAKE CITY,FL,32055,2564,(386) 628-5130,STATE,OPEN,149,COLUMBIA,12023,USA,922140,CORRECTIONAL INSTITUTIONS,"http://www.dc.state.fl.us/pub/pop/, http://www.bridgesofamerica.com/facilities/",10/31/2017,IMAGERY,2017/11/07 00:00:00,http://www.bridgesofamerica.com/facilities/,MINIMUM,151,0.00515595751432,604.08139487636,1.47807879774e-06
287,279,10000450,DAYTONA BEACH COMMUNITY RELEASE CENTER,3601 US HWY 92 WEST,DAYTONA BEACH,FL,32124,1002,(386) 238-3171,STATE,OPEN,84,VOLUSIA,12127,USA,922140,CORRECTIONAL INSTITUTIONS,http://www.dc.state.fl.us/pub/pop/facility/fy1415.pdf,10/31/2015,IMAGERY,2017/11/07 00:00:00,http://www.dc.state.fl.us/orginfo/facilitydir.html#4,MINIMUM,-999,0.00380092226625,450.524517100814,9.41439868792e-07
288,280,10006778,RAPIDES PARISH DETENTION CENTER II,400 B JOHN ALLISON DR,ALEXANDRIA,LA,71303,NOT AVAILABLE,(318) 449-4370,COUNTY,OPEN,140,RAPIDES,22079,USA,922140,CORRECTIONAL INSTITUTIONS,http://doc.louisiana.gov/briefing-book,9/29/2017,IMAGERY,2018/03/16 00:00:00,http://www.rpso.org/,NOT AVAILABLE,140,0.007623852391,936.161954488232,2.39651252444e-06
289,281,10005072,WASHINGTON COUNTY JAIL,262 EAST COURT STREET,WEISER,ID,83672,NOT AVAILABLE,(208) 414-2124,COUNTY,OPEN,41,WASHINGTON,16087,USA,922140,CORRECTIONAL INSTITUTIONS,http://law.co.washington.id.us/sheriff/,3/1/2018,IMAGERY,2018/03/01 00:00:00,http://law.co.washington.id.us/sheriff/,NOT AVAILABLE,-999,0.00223278236026,292.623367565899,3.08143176806e-07
290,282,10003496,NORTHWEST CORRECTIONAL COMPLEX,960 STATE ROUTE 212,TIPTONVILLE,TN,38079,NOT AVAILABLE,(731) 253-5000,STATE,OPEN,2343,LAKE,47095,USA,922140,CORRECTIONAL INSTITUTIONS,https://www.tn.gov/correction/statistics-and-information/bed-space---capacity-reports.html,11/30/2017,IMAGERY,2018/01/10 00:00:00,https://www.tn.gov/correction/sp/state-prison-list.html,MEDIUM,2436,0.0361780199174,4393.75861249885,2.49433674078e-05
291,283,10001526,SAN FRANCISCO COUNTY JAIL #4,"850 BRYANT STREET, 7TH FLOOR",SAN FRANCISCO,CA,94103,NOT AVAILABLE,(415) 553-9506,COUNTY,OPEN,319,SAN FRANCISCO,06075,USA,922140,CORRECTIONAL INSTITUTIONS,"http://www.bscc.ca.gov/s_fsojailprofilesurvey.php, http://www.sfsheriff.com/jailinfolanding.html",2/13/2018,IMAGERY,2018/02/13 00:00:00,http://www.sfsheriff.com/jailinfolanding.html,MAXIMUM,402,0.00527460192402,649.713815973137,9.21764489594e-07
292,284,10001649,RAPIDS PARISH DETENTION CENTER III,7400 ACADEMY DR,ALEXANDRIA,LA,71303,NOT AVAILABLE,(318) 449-4389,COUNTY,OPEN,329,RAPIDES,22079,USA,922140,CORRECTIONAL INSTITUTIONS,http://doc.louisiana.gov/briefing-book,9/29/2017,IMAGERY/OTHER,2018/03/16 00:00:00,http://www.rpso.org/,NOT AVAILABLE,391,0.00529826661724,642.0459482182,1.83140247383e-06
293,285,10004699,ADAMS COUNTY JAIL,521 VERMONT STREET,QUINCY,IL,62301,NOT AVAILABLE,(217) 277-2202,COUNTY,OPEN,133,ADAMS,17001,USA,922140,CORRECTIONAL INSTITUTIONS,http://www.co.adams.il.us/Jail/index.htm,3/1/2018,IMAGERY,2018/03/01 00:00:00,http://www.co.adams.il.us/Jail/index.htm,NOT AVAILABLE,120,0.00370935122042,475.179408779677,3.66984318138e-07
294,286,10005915,SABINE PARISH WOMEN'S JAIL,400 CAPITOL STREET,MANY,LA,71449,NOT AVAILABLE,(318) 256-9241,COUNTY,OPEN,25,SABINE,22085,USA,922140,CORRECTIONAL INSTITUTIONS,http://doc.louisiana.gov/briefing-book,9/29/2017,IMAGERY/OTHER,2018/03/16 00:00:00,http://build.sabinesheriff.org/,NOT AVAILABLE,29,0.00214491773723,264.827992349986,2.68428104672e-07
295,287,10006330,TOMOKA CRC 285,1200 RED JOHN ROAD,DAYTONA BEACH,FL,32124,NOT AVAILABLE,(386) 236-3308,STATE,OPEN,111,VOLUSIA,12127,USA,922140,CORRECTIONAL INSTITUTIONS,http://www.dc.state.fl.us/pub/pop/,10/31/2017,IMAGERY,2017/11/08 00:00:00,http://www.dc.state.fl.us/orginfo/facilitydir.html#4,NOT AVAILABLE,-999,0.00425512942164,512.808820278892,1.07370423617e-06
296,288,10000400,TTH OF DINSMORE,13200 OLD KINGS RD,JACKSONVILLE,FL,32219,NOT AVAILABLE,(904) 999-4220,STATE,OPEN,145,DUVAL,12031,USA,922140,CORRECTIONAL INSTITUTIONS,"http://www.dc.state.fl.us/pub/pop/, http://thetransitionhouse.org/transform-your-life/doc/",10/31/2017,IMAGERY,2017/11/07 00:00:00,http://thetransitionhouse.org/transform-your-life/doc/,MINIMUM,150,0.00208517718112,249.942301148901,2.72283238041e-07
297,289,10001454,BRIDGES OF COCOA,585 CAMP RD,COCOA,FL,32927,4738,(321) 338-4550,STATE,OPEN,82,BREVARD,12009,USA,922140,CORRECTIONAL INSTITUTIONS,"http://www.dc.state.fl.us/pub/pop/, http://www.bridgesofamerica.com/facilities/",10/31/2017,IMAGERY,2017/11/08 00:00:00,http://www.bridgesofamerica.com/facilities/,MINIMUM,84,0.00176152355901,209.376400862239,1.93811641763e-07
298,290,10001711,WEST TENNESSEE STATE PENITENTIARY,480 GREEN CHAPEL RD,HENNING,TN,38041,1150,(731) 738-5044,STATE,OPEN,1908,LAUDERDALE,47097,USA,922140,CORRECTIONAL INSTITUTIONS,https://www.tn.gov/correction/statistics-and-information/bed-space---capacity-reports.html,11/30/2017,IMAGERY,2018/01/10 00:00:00,https://www.tn.gov/correction/sp/state-prison-list.html,MAXIMUM,2254,0.0297148124851,3634.11911820386,3.93642257053e-05
299,291,10004639,BRIDGES OF POMPANO - TURNING POINT WORK RELEASE,400 SOUTHWEST 2ND STREET,POMPANO BEACH,FL,33060,6822,(954) 580-0949,STATE,OPEN,100,BROWARD,12011,USA,922140,CORRECTIONAL INSTITUTIONS,"http://www.dc.state.fl.us/pub/pop/, http://www.bridgesofamerica.com/facilities/",10/31/2017,IMAGERY,2017/11/08 00:00:00,http://www.bridgesofamerica.com/facilities/,MINIMUM,100,0.00344412309663,403.831277932412,7.64767615334e-07
300,292,10004641,BROWARD COUNTY BRIDGE TC / CRC POMPANO,5600 NORTHWEST 9TH AVENUE,FORT LAUDERDALE,FL,33309,2800,(954) 358-2650,STATE,CLOSED,0,BROWARD,12011,USA,922140,CORRECTIONAL INSTITUTIONS,http://saintpetersblog.com/department-corrections-settles-case-bridges-america-program-shutdown/,11/8/2017,IMAGERY,2017/11/08 00:00:00,http://www.dc.state.fl.us/orginfo/facilitydir.html,MINIMUM,-999,0.0082696700813,953.894238890687,3.46104587802e-06
301,293,10004606,KISSIMMEE COMMUNITY RELEASE CENTER,2925 MICHIGAN AVE,KISSIMMEE,FL,34744,1200,(407) 846-5210,STATE,OPEN,155,OSCEOLA,12097,USA,922140,CORRECTIONAL INSTITUTIONS,http://www.dc.state.fl.us/pub/pop/,10/31/2017,IMAGERY,2017/11/08 00:00:00,http://www.dc.state.fl.us/orginfo/facilitydir.html#4,MINIMUM,-999,0.00635002860576,740.555911071393,1.92581265096e-06
302,294,10004650,OPA LOCKA COMMUNITY RELEASE CENTER,5400 NORTHWEST 135TH STREET,OPA LOCKA,FL,33054,4310,(305) 827-4057,STATE,OPEN,148,MIAMI-DADE,12086,USA,922140,CORRECTIONAL INSTITUTIONS,http://www.dc.state.fl.us/pub/pop/,10/31/2017,IMAGERY,2017/11/08 00:00:00,http://www.dc.state.fl.us/orginfo/facilitydir.html#4,MINIMUM,-999,0.00680068521832,781.163405960077,1.84785799205e-06
303,295,10000461,ORLANDO COMMUNITY RELEASE CENTER,7300 LAUREL HILL DRIVE,ORLANDO,FL,32818,5278,(407) 578-3510,STATE,OPEN,82,ORANGE,12095,USA,922140,CORRECTIONAL INSTITUTIONS,http://www.dc.state.fl.us/pub/pop/,10/31/2017,IMAGERY,2017/11/08 00:00:00,http://www.dc.state.fl.us/orginfo/facilitydir.html#4,MINIMUM,-999,0.00406451185985,494.677436045584,9.05765100846e-07
304,296,10000805,SAN FRANCISCO COUNTY JAIL #5,1 MORELAND DRIVE,SAN BRUNO,CA,94066,NOT AVAILABLE,(650) 266-7500,COUNTY,OPEN,676,SAN MATEO,06081,USA,922140,CORRECTIONAL INSTITUTIONS,"http://www.bscc.ca.gov/s_fsojailprofilesurvey.php, http://www.sfsheriff.com/jailinfolanding.html",2/13/2018,IMAGERY,2018/02/13 00:00:00,http://www.sfsheriff.com/jailinfolanding.html,NOT AVAILABLE,768,0.00824852772701,1025.41230240896,2.93395244381e-06
305,297,10006117,JEFFERSON COUNTY JAIL / SHERIFF,606 3RD STREET,FAIRBURY,NE,68352,NOT AVAILABLE,NOT AVAILABLE,COUNTY,OPEN,9,JEFFERSON,31095,USA,922140,CORRECTIONAL INSTITUTIONS,https://ncc.nebraska.gov/jail-standards-inspection-reports,4/5/2018,IMAGERY,2018/04/05 00:00:00,http://www.jeffcolaw.us/index.htm,NOT AVAILABLE,18,0.00191594199998,235.698800005019,1.80253583238e-07
306,298,10004698,ADAMS COUNTY JUVENILE DETENTION FACILITY,200 NORTH 52ND STREET,QUINCY,IL,62305,NOT AVAILABLE,(217) 277-2233,COUNTY,OPEN,-999,ADAMS,17001,USA,922140,CORRECTIONAL INSTITUTIONS,http://www.co.adams.il.us/Juvenile_center/index.htm,2/15/2016,IMAGERY,2018/03/01 00:00:00,http://www.co.adams.il.us/Juvenile_center/index.htm,JUVENILE,30,0.00290470157548,380.68611294131,3.40656884652e-07
307,299,10002527,ONEIDA COUNTY JAIL,2000 E WINNEBAGO ST,RHINELANDER,WI,54501,NOT AVAILABLE,(715) 361-5180,COUNTY,OPEN,252,ONEIDA,55085,USA,922140,CORRECTIONAL INSTITUTIONS,http://oneidasheriff.org/,5/9/2018,IMAGERY,2018/05/09 00:00:00,http://oneidasheriff.org/,NOT AVAILABLE,200,0.00545658905986,685.374748951976,1.41474022904e-06
308,300,10001456,PINELLAS COMMUNITY RELEASE CENTER,5205 ULMERTON RD,CLEARWATER,FL,33760,4002,(727) 570-5138,STATE,OPEN,43,PINELLAS,12103,USA,922140,CORRECTIONAL INSTITUTIONS,http://www.dc.state.fl.us/pub/pop/,10/31/2017,IMAGERY,2017/11/08 00:00:00,http://www.dc.state.fl.us/orginfo/facilitydir.html#4,MINIMUM,-999,0.00313845415654,375.335123484376,4.22680741346e-07
309,301,10003538,SOUTH CENTRAL CORRECTIONAL CENTER,555 FOREST AVE,CLIFTON,TN,38425,NOT AVAILABLE,(931) 676-5372,STATE,OPEN,1637,WAYNE,47181,USA,922140,CORRECTIONAL INSTITUTIONS,https://www.tn.gov/correction/statistics-and-information/bed-space---capacity-reports.html,11/30/2017,IMAGERY,2018/01/10 00:00:00,http://www.corecivic.com/facilities,MEDIUM,1700,0.0206504359848,2535.07789336637,1.67250684148e-05
310,302,10005307,SAN FRANCISCO GENERAL HOSPITAL WARD 7D / 7L,1001 POTRERO AVENUE,SAN FRANCISCO,CA,94110,NOT AVAILABLE,(415) 553-1098,COUNTY,OPEN,-999,SAN FRANCISCO,06075,USA,922140,CORRECTIONAL INSTITUTIONS,http://www.sfsheriff.com/jailinfolanding.html,2/15/2016,IMAGERY,2018/02/13 00:00:00,http://www.sfsheriff.com/jailinfolanding.html,NOT AVAILABLE,11,0.00535155630791,677.005372059793,1.58747459811e-06
311,303,10000480,ST. PETERSBURG COMMUNITY RELEASE CENTER,4237 8TH AVE S,ST PETERSBURG,FL,33711,2000,(727) 893-2289,STATE,OPEN,141,PINELLAS,12103,USA,922140,CORRECTIONAL INSTITUTIONS,http://www.dc.state.fl.us/pub/pop/,10/31/2017,IMAGERY,2017/11/08 00:00:00,http://www.dc.state.fl.us/orginfo/facilitydir.html#4,NOT AVAILABLE,-999,0.00208864799993,246.732600003481,2.71692960056e-07
312,304,10004611,SUNCOAST COMMUNITY RELEASE CENTER,10596 GANDY BOULEVARD,SAINT PETERSBURG,FL,33702,1422,(727) 523-1423,STATE,OPEN,159,PINELLAS,12103,USA,922140,CORRECTIONAL INSTITUTIONS,http://www.dc.state.fl.us/pub/pop/,10/31/2017,IMAGERY/OTHER,2017/11/08 00:00:00,http://www.dc.state.fl.us/orginfo/facilitydir.html#4,MINIMUM,-999,0.00279665882866,329.970581168936,2.05259400644e-07
313,305,10002178,TTH OF BARTOW,550 N RESTWOOD AVE,BARTOW,FL,33830,4200,(863) 733-4181,STATE,OPEN,70,POLK,12105,USA,922140,CORRECTIONAL INSTITUTIONS,"http://www.dc.state.fl.us/pub/pop/, http://thetransitionhouse.org/transform-your-life/doc/",10/31/2017,IMAGERY,2017/11/08 00:00:00,http://thetransitionhouse.org/transform-your-life/doc/,MINIMUM,79,0.00393379706344,468.126140563408,9.64121838737e-07
314,306,10004665,BOONE COUNTY JAIL,615 NORTH MAIN STREET,BELVIDERE,IL,61008,NOT AVAILABLE,(815) 547-6203,COUNTY,OPEN,-999,BOONE,17007,USA,922140,CORRECTIONAL INSTITUTIONS,http://www.boonecountyil.org/department/corrections,2/15/2016,IMAGERY,2018/03/01 00:00:00,http://www.boonecountyil.org/department/corrections,NOT AVAILABLE,150,0.0026440534744,339.656724385127,3.84773421699e-07
315,307,10004777,WARREN COUNTY JAIL,108 SECURITY CIRCLE,MCMINNVILLE,TN,37110,NOT AVAILABLE,NOT AVAILABLE,COUNTY,OPEN,332,WARREN,47177,USA,922140,CORRECTIONAL INSTITUTIONS,https://www.tn.gov/correction/statistics-and-information/jail-summary-reports.html,3/31/2018,IMAGERY,2018/04/24 00:00:00,http://www.warrencountytn.gov/sheriff.asp,NOT AVAILABLE,251,0.00642989893945,783.988129418487,1.9835750564e-06
316,308,10000798,SAN JOAQUIN COUNTY JAIL,7000 MICHAEL N CANLIS BOULEVARD,FRENCH CAMP,CA,95231,NOT AVAILABLE,(209) 468-4562,COUNTY,OPEN,1031,SAN JOAQUIN,06077,USA,922140,CORRECTIONAL INSTITUTIONS,http://www.bscc.ca.gov/s_fsojailprofilesurvey.php,2/13/2018,IMAGERY,2018/02/13 00:00:00,https://www.sjgov.org/sheriff/default.htm,NOT AVAILABLE,-999,0.0127086013373,1557.95405616979,7.28078984537e-06
317,309,10004112,ST. BERNARD PARISH PRISON,1900 PARIS RD,CHALMETTE,LA,70043,NOT AVAILABLE,(504) 278-7650,COUNTY,OPEN,227,ST. BERNARD,22087,USA,922140,CORRECTIONAL INSTITUTIONS,http://doc.louisiana.gov/briefing-book,9/29/2017,IMAGERY,2018/03/16 00:00:00,NOT AVAILABLE,NOT AVAILABLE,250,0.00478123526963,581.918956074149,9.86904161982e-07
318,310,10006573,NEXUS TREATMENT CENTER,111 SKYLINE DRIVE,LEWISTOWN,MT,59457,NOT AVAILABLE,(406) 535-6660,STATE,OPEN,82,FERGUS,30027,USA,922140,CORRECTIONAL INSTITUTIONS,https://cor.mt.gov/publications,12/8/2017,IMAGERY,2017/12/11 00:00:00,http://www.cccscorp.com/programs/,NOT AVAILABLE,82,0.00495008988327,645.860080167347,1.40304749997e-06
319,311,10001659,NELSON COLEMAN CORRECTIONAL CENTER,5061 STATE HWY 3127,KILLONA,LA,70057,NOT AVAILABLE,(985) 783-1164,COUNTY,OPEN,550,ST. CHARLES,22089,USA,922140,CORRECTIONAL INSTITUTIONS,http://www.stcharlessheriff.org/8/Divisions,3/16/2018,IMAGERY,2018/03/16 00:00:00,http://www.stcharlessheriff.org/8/Divisions,NOT AVAILABLE,600,0.00868743983413,1029.46482229885,2.8365731055e-06
320,312,10006324,TTH OF KISSIMMEE,900 EAST VINE STREET,KISSIMMEE,FL,34744,NOT AVAILABLE,(407) 846-0068,STATE,OPEN,150,OSCEOLA,12097,USA,922140,CORRECTIONAL INSTITUTIONS,"http://www.dc.state.fl.us/pub/pop/, http://thetransitionhouse.org/transform-your-life/doc/",10/31/2017,IMAGERY,2017/11/08 00:00:00,http://thetransitionhouse.org/transform-your-life/doc/,MINIMUM,150,0.003105735528,380.971873746761,4.50837298274e-07
321,313,10004612,TTH OF TARPON SPRINGS,566 BRADY ROAD,TARPON SPRINGS,FL,34689,6707,(727) 940-6936,STATE,OPEN,83,PINELLAS,12103,USA,922140,CORRECTIONAL INSTITUTIONS,"http://www.dc.state.fl.us/pub/pop/, http://thetransitionhouse.org/transform-your-life/doc/",10/31/2017,IMAGERY,2017/11/08 00:00:00,http://thetransitionhouse.org/transform-your-life/doc/,MINIMUM,84,0.00287628307211,345.214121414073,5.03107368936e-07
322,314,10001459,WEST PALM BEACH COMMUNITY RELEASE CENTER,261 WEST FAIRGROUNDS RD,WEST PALM BEACH,FL,33411,3639,(561) 791-4750,STATE,OPEN,147,PALM BEACH,12099,USA,922140,CORRECTIONAL INSTITUTIONS,http://www.dc.state.fl.us/pub/pop/,10/31/2017,IMAGERY,2017/11/08 00:00:00,http://www.dc.state.fl.us/orginfo/facilitydir.html#4,MINIMUM,-999,0.00238031355267,281.875147140536,3.52147890754e-07
323,315,10004652,BAY POINT SCHOOLS - MAIN CAMPUS,22025 SOUTHWEST 87TH AVENUE,MIAMI,FL,33190,NOT AVAILABLE,NOT AVAILABLE,STATE,CLOSED,0,MIAMI-DADE,12086,USA,922140,CORRECTIONAL INSTITUTIONS,https://therealdeal.com/miami/2016/05/05/mater-academy-pays-8-5m-for-failed-youth-offender-building-in-cutler-bay/,5/5/2016,IMAGERY,2017/11/08 00:00:00,NOT AVAILABLE,JUVENILE,-999,0.00777981509534,902.65058279401,3.22635797277e-06
324,316,10004653,BAY POINT SCHOOLS - NORTH CAMPUS,20660 NORTHWEST 47TH AVENUE,MIAMI GARDENS,FL,33055,NOT AVAILABLE,NOT AVAILABLE,STATE,CLOSED,0,MIAMI-DADE,12086,USA,922140,CORRECTIONAL INSTITUTIONS,http://www.miamiherald.com/news/local/community/miami-dade/article1975544.html,7/14/2014,IMAGERY,2017/11/08 00:00:00,NOT AVAILABLE,JUVENILE,-999,0.00324857482838,382.694360928925,6.5375433738e-07
325,317,10004676,BUREAU COUNTY JAIL,22 PARK AVENUE WEST,PRINCETON,IL,61356,NOT AVAILABLE,(815) 875-3344,COUNTY,OPEN,-999,BUREAU,17011,USA,922140,CORRECTIONAL INSTITUTIONS,http://www.bureaucountysheriff.org/,3/1/2018,IMAGERY,2018/03/01 00:00:00,http://www.bureaucountysheriff.org/,NOT AVAILABLE,36,0.00130624621556,173.254423404205,8.62806730318e-08
326,318,10003625,RIVERSIDE RECOVERY & REENTRY PROGRAM,2 RIVERSIDE ROAD,BOULDER,MT,59632,0088,(406) 225-4500,STATE,OPEN,31,JEFFERSON,30043,USA,922140,CORRECTIONAL INSTITUTIONS,https://cor.mt.gov/publications,12/8/2017,IMAGERY,2017/12/11 00:00:00,http://cor.mt.gov/FamilyFriends/Visiting,NOT AVAILABLE,22,0.00591343546895,811.528526639597,2.15867001135e-06
327,319,10006572,ELKHORN TREATMENT CENTER,P.O. BOX 448,BOULDER,MT,59632,NOT AVAILABLE,(406) 447-5300,STATE,OPEN,40,JEFFERSON,30043,USA,922140,CORRECTIONAL INSTITUTIONS,https://cor.mt.gov/publications,12/8/2017,IMAGERY,2017/12/11 00:00:00,https://www.boydandrew.com/services/,NOT AVAILABLE,42,0.00371939855839,500.899764563261,5.36334598222e-07
328,320,10006664,TROUSDALE TURNER CORRECTIONAL CENTER,140 MACON WAY,HARTSVILLE,TN,37074,NOT AVAILABLE,(615) 808-0400,STATE,OPEN,2481,TROUSDALE,47169,USA,922140,CORRECTIONAL INSTITUTIONS,https://www.tn.gov/correction/statistics-and-information/bed-space---capacity-reports.html,11/30/2017,IMAGERY,2018/01/10 00:00:00,http://www.corecivic.com/facilities,MEDIUM,2672,0.0180343784864,2120.15785240386,1.65509939453e-05
329,321,10006088,KEITH COUNTY JAIL / SHERIFF,103 EAST 5TH STREET,OGALLALA,NE,69153,NOT AVAILABLE,(308) 284-4772,COUNTY,OPEN,12,KEITH,31101,USA,922140,CORRECTIONAL INSTITUTIONS,http://www.keithcountyne.gov/residents/jail.php,4/5/2018,IMAGERY,2018/04/05 00:00:00,http://www.keithcountyne.gov/residents/jail.php,MAXIMUM,16,0.00271816885298,349.494112497741,2.12961604621e-07
330,322,10000795,SAN JOAQUIN COUNTY JAIL (HONOR FARM),999 W MATHEWS RD,FRENCH CAMP,CA,95231,NOT AVAILABLE,NOT AVAILABLE,COUNTY,OPEN,292,SAN JOAQUIN,06077,USA,922140,CORRECTIONAL INSTITUTIONS,http://www.bscc.ca.gov/s_fsojailprofilesurvey.php,2/13/2018,IMAGERY,2018/02/13 00:00:00,NOT AVAILABLE,NOT AVAILABLE,-999,0.0171718866843,2138.50900541462,1.50614932805e-05
331,323,10003509,WILSON COUNTY JAIL,105 E HIGH ST,LEBANON,TN,37087,NOT AVAILABLE,(615) 444-1412 EXT 1,COUNTY,OPEN,456,WILSON,47189,USA,922140,CORRECTIONAL INSTITUTIONS,"https://www.tn.gov/correction/statistics-and-information/jail-summary-reports.html, http://wcso95.org/",3/31/2018,IMAGERY,2018/04/25 00:00:00,http://wcso95.org/,MAXIMUM,462,0.00681152531397,831.305315793854,1.28713758151e-06
332,324,10004623,BOWLING GREEN YOUTH ACADEMY,4705 UNITED STATES HIGHWAY 17,BOWLING GREEN,FL,33834,NOT AVAILABLE,NOT AVAILABLE,STATE,CLOSED,0,HARDEE,12049,USA,922140,CORRECTIONAL INSTITUTIONS,https://www.publicschoolreview.com/bowling-green-youth-academy-profile,11/8/2017,IMAGERY,2017/11/08 00:00:00,NOT AVAILABLE,JUVENILE,-999,0.00173229171291,208.636750682394,8.8090862994e-08
333,325,10002163,BREVARD CORRECTIONAL INSTITUTION,855 CAMP RD,COCOA,FL,32927,NOT AVAILABLE,NOT AVAILABLE,STATE,CLOSED,0,BREVARD,12009,USA,922140,CORRECTIONAL INSTITUTIONS,http://articles.orlandosentinel.com/2011-03-15/news/os-brevard-prison-closing-florida-20110315_1_brevard-prison-three-other-prisons-correctional-institution-boot-camp,10/31/2015,IMAGERY,2017/11/08 00:00:00,NOT AVAILABLE,CLOSE,-999,0.0118026692364,1395.7084472521,9.98411018478e-06
334,326,10002162,BREVARD WORK CAMP,855 CAMP RD,COCOA,FL,32927,NOT AVAILABLE,NOT AVAILABLE,STATE,CLOSED,0,BREVARD,12009,USA,922140,CORRECTIONAL INSTITUTIONS,http://www.brevardsheriff.com/home/how-do-i/request/paws-stripes/,11/8/2017,IMAGERY,2017/11/08 00:00:00,NOT AVAILABLE,MINIMUM,-999,0.00540669540664,642.021763870971,1.82541983376e-06
335,327,10000854,SAN LUIS OBISPO COUNTY JAIL,1585 KANSAS AVENUE,SAN LUIS OBISPO,CA,93405,NOT AVAILABLE,(805) 781-4600,COUNTY,OPEN,522,SAN LUIS OBISPO,06079,USA,922140,CORRECTIONAL INSTITUTIONS,http://www.bscc.ca.gov/s_fsojailprofilesurvey.php,2/13/2018,IMAGERY,2018/02/13 00:00:00,http://www.slosheriff.org/,NOT AVAILABLE,518,0.0072843918707,858.684190364596,1.53539714848e-06
336,328,10000344,CAMP E-MA-CHAMEE,3112 FRIENDSHIP RD,MILTON,FL,32570,NOT AVAILABLE,NOT AVAILABLE,STATE,CLOSED,0,SANTA ROSA,12113,USA,922140,CORRECTIONAL INSTITUTIONS,https://www.publicschoolreview.com/ewes-e-ma-chamee-camp-profile,11/8/2017,IMAGERY,2017/11/08 00:00:00,NOT AVAILABLE,JUVENILE,-999,0.0160495302229,1900.79411228104,1.05381157158e-05
337,329,10004654,DADE GROUP TREATMENT HOME,25345 SOUTHWEST 197TH AVENUE,HOMESTEAD,FL,33031,NOT AVAILABLE,NOT AVAILABLE,STATE,NOT AVAILABLE,-999,MIAMI-DADE,12086,USA,922140,CORRECTIONAL INSTITUTIONS,http://www.djj.state.fl.us/docs/car-reports/8low.pdf?sfvrsn=0,10/31/2015,IMAGERY,2017/11/08 00:00:00,NOT AVAILABLE,JUVENILE,10,0.00526141818628,627.575345718996,1.42390212282e-06
338,330,10000501,DESOTO DUAL DIAGNOSIS CORRECTIONAL FACILITY,5871 SE HWY 31,ARCADIA,FL,34266,NOT AVAILABLE,NOT AVAILABLE,STATE,CLOSED,0,DESOTO,12027,USA,922140,CORRECTIONAL INSTITUTIONS,http://www.palmbeachpost.com/news/state--regional/dosed-juvie-jail-investigators-focus-antipsychotic-doses-for-kids-and-possible-fraud/zD1VBuCn549DDRAHz6ysGL/,8/14/2011,IMAGERY,2017/11/08 00:00:00,http://www.fgcu.edu/connect/agencydetail.asp?ID=333,JUVENILE,-999,0.00950268330119,1105.09694947996,5.68792966607e-06
339,331,10005210,DOZIER SCHOOL FOR BOYS,4111 SOUTH STREET,MARIANNA,FL,32446,NOT AVAILABLE,NOT AVAILABLE,STATE,CLOSED,0,JACKSON,12063,USA,922140,CORRECTIONAL INSTITUTIONS,http://fcir.org/2011/12/05/feds-issue-condemning-report-on-shuttered-state-youth-facility/,10/31/2015,IMAGERY,2017/11/08 00:00:00,NOT AVAILABLE,JUVENILE,-999,0.0276842694172,3318.31391759235,4.3118837863e-05
340,332,10004710,CALHOUN COUNTY JAIL,P.O. BOX 635,HARDIN,IL,62047,NOT AVAILABLE,NOT AVAILABLE,COUNTY,OPEN,-999,CALHOUN,17013,USA,922140,CORRECTIONAL INSTITUTIONS,http://www.ilsheriff.org/index.php/directory?option=com_countysheriffs&view=countysheriffs,3/1/2018,UNVERIFIED,2018/03/01 00:00:00,NOT AVAILABLE,NOT AVAILABLE,2,0.00108512990517,136.258742923577,5.24171358052e-08
341,333,10006091,LINCOLN COUNTY JAIL,302 NORTH JEFFERS STREET,NORTH PLATTE,NE,69101,NOT AVAILABLE,NOT AVAILABLE,COUNTY,OPEN,121,LINCOLN,31111,USA,922140,CORRECTIONAL INSTITUTIONS,"http://lincolncountysheriff.us/, https://ncc.nebraska.gov/jail-standards-inspection-reports",4/5/2018,IMAGERY,2018/04/05 00:00:00,http://lincolncountysheriff.us/,NOT AVAILABLE,173,0.00290105645673,382.141261878607,4.04381551064e-07
342,334,10004123,MADISON COUNTY JAIL,1313 N MAIN ST,MADISON,NE,68748,NOT AVAILABLE,(402) 454-2110,COUNTY,OPEN,85,MADISON,31119,USA,922140,CORRECTIONAL INSTITUTIONS,http://www.madisoncountysheriff.com/,4/5/2018,IMAGERY,2018/04/05 00:00:00,http://www.madisoncountysheriff.com/,NOT AVAILABLE,120,0.00438542300363,567.548500764818,6.88683593596e-07
343,335,10004570,DUVAL JUVENILE RESIDENTIAL FACILITY,3036 PHILIPS HIGHWAY,JACKSONVILLE,FL,32207,NOT AVAILABLE,(904) 777-0100,STATE,CLOSED,0,DUVAL,12031,USA,922140,CORRECTIONAL INSTITUTIONS,http://www.djj.state.fl.us/programs-facilities/residential-facilities,11/9/2017,IMAGERY,2017/11/09 00:00:00,http://www.djj.state.fl.us/programs-facilities/residential-facilities,JUVENILE,-999,0.00359310215646,426.834431423576,8.36080559042e-07
344,336,10004599,ECKERD YOUTH ACADEMY,451 SAINT NICHOLAS AVENUE,CHRISTMAS,FL,32709,NOT AVAILABLE,NOT AVAILABLE,STATE,CLOSED,0,ORANGE,12095,USA,922140,CORRECTIONAL INSTITUTIONS,http://www.djj.state.fl.us/Residential/Facilities/central_facilities/EYA.html,10/31/2015,IMAGERY,2017/11/09 00:00:00,NOT AVAILABLE,JUVENILE,-999,0.00894610130628,1041.28008309851,3.55639742388e-06
345,337,10004635,FLORIDA ENVIRONMENTAL INSTITUTE,19570 COUNTY ROAD 731,VENUS,FL,33960,NOT AVAILABLE,(863) 699-3785,STATE,CLOSED,0,GLADES,12043,USA,922140,CORRECTIONAL INSTITUTIONS,http://www.djj.state.fl.us/docs/par-data/residential_par_data_fy2012-13_first2quartersFB87ED5233FC.pdf?sfvrsn=2,10/31/2015,IMAGERY,2017/11/09 00:00:00,NOT AVAILABLE,JUVENILE,-999,0.0110057584187,1296.32250612364,6.19729107572e-06
346,338,10000458,FRANCES WALKER HALFWAY HOUSE,5332 RIVEREDGE DR,TITUSVILLE,FL,32780,NOT AVAILABLE,(321) 264-4033,STATE,CLOSED,0,BREVARD,12009,USA,922140,CORRECTIONAL INSTITUTIONS,http://www.wftv.com/news/local/brevard-county-halfway-home-in-danger-of-closing/425841208,8/18/2016,IMAGERY,2017/11/09 00:00:00,http://www.djj.state.fl.us/programs-facilities/residential-facilities,JUVENILE,-999,0.00217338465814,256.350824374042,2.90064875124e-07
347,339,10000425,GAINESVILLE CORRECTIONAL INSTITUTION,2845 NE 39TH AVE,GAINESVILLE,FL,32602,NOT AVAILABLE,NOT AVAILABLE,STATE,CLOSED,0,ALACHUA,12001,USA,922140,CORRECTIONAL INSTITUTIONS,http://www.gainesville.com/article/20120417/articles/120419626,10/31/2015,IMAGERY,2017/11/09 00:00:00,NOT AVAILABLE,MEDIUM,507,0.00923299361889,1096.49502756275,5.25717501141e-06
348,340,10000513,GLADES CORRECTIONAL INSTITUTE,500 ORANGE AVENUE CIRCLE,BELLE GLADE,FL,33430,NOT AVAILABLE,NOT AVAILABLE,STATE,CLOSED,0,PALM BEACH,12099,USA,922140,CORRECTIONAL INSTITUTIONS,http://www.dc.state.fl.us/pub/annual/1112/facil.html,10/31/2015,IMAGERY,2017/11/09 00:00:00,NOT AVAILABLE,CLOSE,1045,0.0162355573369,1953.72216074352,1.43950004875e-05
349,341,10004553,GRACEVILLE VOCATIONAL YOUTH CENTER,5229 EZELL ROAD,GRACEVILLE,FL,32440,NOT AVAILABLE,NOT AVAILABLE,STATE,CLOSED,0,JACKSON,12063,USA,922140,CORRECTIONAL INSTITUTIONS,https://www.publicschoolreview.com/graceville-vocational-youth-center-profile,11/9/2017,IMAGERY,2017/11/09 00:00:00,NOT AVAILABLE,JUVENILE,36,0.00328592034262,390.589379523774,6.51128986441e-07
350,342,10000521,HENDRY CORRECTIONAL INSTITUTION,12551 WAINWRIGHT DR,IMMOKALEE,FL,34142,NOT AVAILABLE,NOT AVAILABLE,STATE,CLOSED,0,HENDRY,12051,USA,922140,CORRECTIONAL INSTITUTIONS,http://archive.naplesnews.com/news/state/hendry-correctional-institution-closing-as-state-plans-to-save-30-million-annually-ep-391989219-342994532.html/,3/15/2011,IMAGERY,2017/11/09 00:00:00,NOT AVAILABLE,CLOSE,-999,0.0179949335396,2095.4060936783,2.0074733233e-05
351,343,10000522,HENDRY WORK CAMP,11569 WAINWRIGHT DR,IMMOKALEE,FL,34142,NOT AVAILABLE,NOT AVAILABLE,STATE,CLOSED,0,HENDRY,12051,USA,922140,CORRECTIONAL INSTITUTIONS,http://archive.naplesnews.com/news/local/hendry-facility-one-of-7-prisons-4-work-camps-to-close-ep-390300669-342683142.html/,1/12/2012,IMAGERY,2017/11/09 00:00:00,NOT AVAILABLE,MINIMUM,-999,0.00467405688948,544.939328548606,1.31911453126e-06
352,344,10001717,WHITEVILLE CORRECTIONAL FACILITY,1440 UNION SPRINGS ROAD,WHITEVILLE,TN,38075,NOT AVAILABLE,(731) 254-9400,STATE,OPEN,1499,HARDEMAN,47069,USA,922140,CORRECTIONAL INSTITUTIONS,https://www.tn.gov/correction/statistics-and-information/bed-space---capacity-reports.html,11/30/2017,IMAGERY,2018/01/10 00:00:00,http://www.corecivic.com/facilities,MEDIUM,1619,0.0127665319774,1544.08844867928,1.03377378946e-05
353,345,10005339,SAN LUIS OBISPO COUNTY HONOR FARM JAIL,880 OKLAHOMA AVENUE,SAN LUIS OBISPO,CA,93405,NOT AVAILABLE,NOT AVAILABLE,COUNTY,OPEN,51,SAN LUIS OBISPO,06079,USA,922140,CORRECTIONAL INSTITUTIONS,http://www.bscc.ca.gov/s_fsojailprofilesurvey.php,2/13/2018,IMAGERY,2018/02/13 00:00:00,http://www.slosheriff.org/,NOT AVAILABLE,-999,0.00582673656032,700.729477436112,1.30429225441e-06
354,346,10004109,ST. JAMES PARISH DETENTION CENTER,5800 STATE HWY 44,CONVENT,LA,70723,NOT AVAILABLE,(225) 562-2204,COUNTY,OPEN,73,ST. JAMES,22093,USA,922140,CORRECTIONAL INSTITUTIONS,http://doc.louisiana.gov/briefing-book,9/29/2017,IMAGERY,2018/03/16 00:00:00,http://www.stjamessheriff.com/index.php,NOT AVAILABLE,124,0.00573177352879,694.730692159389,8.1264119576e-07
355,347,10002624,HAMILTON - SILVERDALE DETENTION FACILITIES,7609 STANDIFER GAP RD,CHATTANOOGA,TN,37422,NOT AVAILABLE,(423) 892-0921,COUNTY,OPEN,971,HAMILTON,47065,USA,922140,CORRECTIONAL INSTITUTIONS,https://www.tn.gov/correction/statistics-and-information/jail-summary-reports.html,3/31/2018,IMAGERY,2018/04/25 00:00:00,http://www.corecivic.com/facilities,MAXIMUM,1084,0.0135698887434,1619.98339100754,4.11605854373e-06
356,348,10003515,MOUNTAIN VIEW YOUTH DEVELOPMENT CENTER,809 PEARL LANE,DANDRIDGE,TN,37725,NOT AVAILABLE,(865) 397-0174,STATE,OPEN,31,JEFFERSON,47089,USA,922140,CORRECTIONAL INSTITUTIONS,https://www.tn.gov/dcs/program-areas/juvenile-justice/prea.html,5/26/2017,IMAGERY,2018/01/10 00:00:00,NOT AVAILABLE,JUVENILE,144,0.0116615987471,1404.18211143241,6.63859188779e-06
357,349,10006574,START CENTER,801 HIGHWAY 48,ANACONDA,MT,59711,NOT AVAILABLE,(406) 563-7002,STATE,OPEN,136,DEER LODGE,30111,USA,922140,CORRECTIONAL INSTITUTIONS,https://cor.mt.gov/publications,12/8/2017,IMAGERY,2017/12/11 00:00:00,http://www.cccscorp.com/programs/,NOT AVAILABLE,138,0.00443877404909,575.193077091694,1.00853116839e-06
358,350,10001534,SAN LUIS OBISPO JUVENILE HALL / SERVICE CENTER,1065 KANSAS AVE,SAN LUIS OBISPO,CA,93408,NOT AVAILABLE,(805) 781-5389,COUNTY,OPEN,25,SAN LUIS OBISPO,06079,USA,922140,CORRECTIONAL INSTITUTIONS,"http://www.slocounty.ca.gov/Departments/Probation/Forms-Documents/Annual-Statistical-Fiscal-Year-Reports.aspx, http://www.slocounty.ca.gov/Departments/Probation.aspx",2/13/2018,IMAGERY,2018/02/13 00:00:00,http://www.slocounty.ca.gov/Departments/Probation.aspx,JUVENILE,50,0.00449816216557,539.13891975332,6.96401742678e-07
359,351,10003546,JOHN S. WILDER YOUTH DEVELOPMENT CENTER,13870 HIGHWAY 59,SOMERVILLE,TN,38068,NOT AVAILABLE,(901) 465-7359,STATE,OPEN,122,FAYETTE,47047,USA,922140,CORRECTIONAL INSTITUTIONS,https://www.tn.gov/dcs/program-areas/juvenile-justice/prea.html,6/10/2015,IMAGERY,2018/01/10 00:00:00,https://www.tn.gov/dcs/program-areas/juvenile-justice/ydc.html,JUVENILE,144,0.0133806596197,1618.99218177123,9.06477403628e-06
360,352,10001270,ANDERSON COUNTY JUVENILE DETENTION CENTER,1120 E CRAWFORD ST,PALESTINE,TX,75801,NOT AVAILABLE,NOT AVAILABLE,COUNTY,NOT AVAILABLE,-999,ANDERSON,48001,USA,922140,CORRECTIONAL INSTITUTIONS,NOT AVAILABLE,NOT AVAILABLE,IMAGERY/OTHER,2018/04/25 00:00:00,NOT AVAILABLE,JUVENILE,25,0.00140302549337,166.934922424901,8.95794847618e-08
361,353,10002561,OUTAGAMIE COUNTY JAIL,320 S WALNUT ST,APPLETON,WI,54911,NOT AVAILABLE,(920) 832-5266,COUNTY,OPEN,435,OUTAGAMIE,55087,USA,922140,CORRECTIONAL INSTITUTIONS,http://www.outagamie.org/government/n-through-z/sheriff-1598,5/9/2018,IMAGERY,2018/05/09 00:00:00,NOT AVAILABLE,MAXIMUM,556,0.00359900805813,456.456647651701,6.33992317344e-07
362,354,10005309,MAGUIRE CORRECTIONAL FACILITY,300 BRADFORD STREET,REDWOOD CITY,CA,94063,NOT AVAILABLE,(650) 363-4000,COUNTY,OPEN,640,SAN MATEO,06081,USA,922140,CORRECTIONAL INSTITUTIONS,http://www.bscc.ca.gov/s_fsojailprofilesurvey.php,2/13/2018,IMAGERY,2018/02/13 00:00:00,http://www.smcsheriff.com/corrections-division,MAXIMUM,688,0.00266374582178,330.273291110928,3.82047439585e-07
363,355,10001271,ANDERSON COUNTY JAIL,1200 E LACY ST,PALESTINE,TX,75801,NOT AVAILABLE,(903) 731-8209,COUNTY,OPEN,169,ANDERSON,48001,USA,922140,CORRECTIONAL INSTITUTIONS,"https://www.tcjs.state.tx.us/index.php?linkID=325, http://www.co.anderson.tx.us/default.aspx?Anderson_County/Sheriff",3/1/2018,IMAGERY,2018/04/25 00:00:00,NOT AVAILABLE,NOT AVAILABLE,300,0.00393522635832,473.015787261347,7.42126653341e-07
364,356,10006731,CARROLL COUNTY CORRECTIONAL FACILITY,301 N MAIN STREET,MT CARROLL,IL,61053,NOT AVAILABLE,(815) 244-0265,COUNTY,OPEN,-999,CARROLL,17015,USA,922140,CORRECTIONAL INSTITUTIONS,http://www.carroll-county.net/sheriff,3/1/2018,IMAGERY,2018/03/01 00:00:00,http://www.carroll-county.net/sheriff,NOT AVAILABLE,-999,0.00169207388446,218.112668796623,1.6370061981e-07
365,357,10004750,ST. LANDRY PARISH JAIL,108 SOUTH MARKET STREET,OPELOUSAS,LA,70571,NOT AVAILABLE,(337) 943-2523,COUNTY,OPEN,254,ST. LANDRY,22097,USA,922140,CORRECTIONAL INSTITUTIONS,"http://doc.louisiana.gov/briefing-book, http://doc.louisiana.gov/contact-us/local-facilities",9/29/2017,IMAGERY,2018/03/16 00:00:00,http://www.slpsheriff.com/,NOT AVAILABLE,244,0.00224809835376,266.059538555762,3.00515259655e-07
366,358,10002546,PIERCE COUNTY JAIL,414 W MAIN ST,ELLSWORTH,WI,54011,NOT AVAILABLE,NOT AVAILABLE,COUNTY,OPEN,58,PIERCE,55093,USA,922140,CORRECTIONAL INSTITUTIONS,http://www.co.pierce.wi.us/Law%20Enforcement/Law_Enforcement_Main.php,5/5/2018,IMAGERY,2018/05/09 00:00:00,NOT AVAILABLE,NOT AVAILABLE,-999,0.00161777124642,216.524730913043,1.30303816114e-07
367,359,10006575,WATCH EAST,700 LITTLE STREET,GLENDIVE,MT,59330,NOT AVAILABLE,(406) 377-6001,STATE,OPEN,54,DAWSON,30021,USA,922140,CORRECTIONAL INSTITUTIONS,https://cor.mt.gov/publications,12/8/2017,IMAGERY,2017/12/11 00:00:00,http://www.cccscorp.com/programs/,NOT AVAILABLE,50,0.00626780830018,803.421735026297,1.37632341636e-06
368,360,10006571,CONNECTIONS CORRECTIONS WEST - WARM SPRINGS,725 OROFINO WAY,WARM SPRINGS,MT,59756,NOT AVAILABLE,(406) 693-2272,STATE,OPEN,54,DEER LODGE,30023,USA,922140,CORRECTIONAL INSTITUTIONS,https://cor.mt.gov/publications,12/8/2017,UNVERIFIED,2017/12/11 00:00:00,http://www.cccscorp.com/programs/,NOT AVAILABLE,52,0.00496655073101,642.556564070675,1.51363505752e-06
369,361,10005310,WOMEN'S CORRECTIONAL CENTER,1590 MAPLE STREET,REDWOOD CITY,CA,94063,NOT AVAILABLE,(650) 363-4310,COUNTY,CLOSED,0,SAN MATEO,06081,USA,922140,CORRECTIONAL INSTITUTIONS,https://www.almanacnews.com/news/2016/03/08/new-jail-designed-to-focus-on-rehabilitation,3/9/2016,IMAGERY,2018/02/13 00:00:00,http://www.smcsheriff.com/divisions/corrections-division/maple-street-complex-facilities,MAXIMUM,130,0.00166904202169,205.771732609528,1.6778730917e-07
370,362,10001706,WOODLAND HILLS YOUTH DEVELOPMENT CENTER,3965 STEWARTS LANE,NASHVILLE,TN,37243,NOT AVAILABLE,(615) 532-2000,STATE,CLOSED,0,DAVIDSON,47037,USA,922140,CORRECTIONAL INSTITUTIONS,https://www.tn.gov/content/dam/tn/dcs/documents/juvenile-justice/prea/GTI_PREA_Final_Report_2016.pdf,5/18/2016,IMAGERY,2018/01/10 00:00:00,http://state.tn.us/youth/juvenilejustice/ydcenters.htm,JUVENILE,144,0.0128981163373,1565.2267368155,9.90180060158e-06
371,363,10006829,NUCKOLLS COUNTY JAIL,150 SOUTH MAIN,NELSON,NE,68961,NOT AVAILABLE,NOT AVAILABLE,COUNTY,OPEN,-999,NUCKOLLS,31129,USA,922140,CORRECTIONAL INSTITUTIONS,https://ncc.nebraska.gov/jail-standards-inspection-reports,4/5/2018,IMAGERY,2018/04/05 00:00:00,NOT AVAILABLE,NOT AVAILABLE,3,0.00121367268443,158.698841813687,9.04986050445e-08
372,364,10003505,GATEWAY TO INDEPENDENCE,3981 STEWART LANE,NASHVILLE,TN,37218,NOT AVAILABLE,(615) 532-2000,STATE,OPEN,-999,DAVIDSON,47037,USA,922140,CORRECTIONAL INSTITUTIONS,https://www.tn.gov/content/dam/tn/dcs/documents/juvenile-justice/prea/GTI_PREA_Final_Report_2016.pdf,5/18/2016,IMAGERY,2018/01/10 00:00:00,https://www.tn.gov/dcs/program-areas/juvenile-justice/ydc.html,JUVENILE,-999,0.0029277282916,364.55786844356,4.35794201723e-07
373,365,10006099,OTOE COUNTY JAIL,1021 CENTRAL AVENUE,NEBRASKA CITY,NE,68410,NOT AVAILABLE,NOT AVAILABLE,COUNTY,OPEN,17,OTOE,31131,USA,922140,CORRECTIONAL INSTITUTIONS,https://ncc.nebraska.gov/jail-standards-inspection-reports,4/5/2018,IMAGERY,2018/04/05 00:00:00,NOT AVAILABLE,NOT AVAILABLE,21,0.00186454600009,221.634400002658,1.19148813178e-07
374,366,10000489,INDIAN RIVER CORRECTIONAL INSTITUTION,7625 17TH ST SW,VERO BEACH,FL,32968,NOT AVAILABLE,NOT AVAILABLE,STATE,CLOSED,0,INDIAN RIVER,12061,USA,922140,CORRECTIONAL INSTITUTIONS,http://www.wpbf.com/Indian-River-Correctional-Institution-Closes-Its-Doors/9244390,10/31/2015,IMAGERY,2017/11/09 00:00:00,NOT AVAILABLE,CLOSE,-999,0.0102594930476,1204.82279358455,6.97790210894e-06
375,367,10002779,ANDREWS COUNTY JAIL,201 N MAIN,ANDREWS,TX,79714,NOT AVAILABLE,NOT AVAILABLE,COUNTY,OPEN,24,ANDREWS,48003,USA,922140,CORRECTIONAL INSTITUTIONS,"https://www.tcjs.state.tx.us/index.php?linkID=325, http://www.co.andrews.tx.us/departments/sheriff.php",3/1/2018,IMAGERY,2018/04/25 00:00:00,NOT AVAILABLE,NOT AVAILABLE,50,0.00193322308556,232.408203587501,1.52163038007e-07
376,368,10006732,CHAMPAIGN COUNTY DOWNTOWN JAIL,204 E MAIN STREET,URBANA,IL,61801,NOT AVAILABLE,(217) 384-1240,COUNTY,OPEN,55,CHAMPAIGN,17019,USA,922140,CORRECTIONAL INSTITUTIONS,http://www1.co.champaign.il.us/SHERIFF/JailInspectionReport.php,9/28/2017,IMAGERY,2018/03/01 00:00:00,http://www1.co.champaign.il.us/SHERIFF/Home.php,NOT AVAILABLE,113,0.00321013685654,404.266737940571,3.95912843634e-07
377,369,10002529,POLK COUNTY JAIL,1005 W MAIN ST,BALSAM LAKE,WI,54810,NOT AVAILABLE,(715) 485-8370,COUNTY,OPEN,117,POLK,55095,USA,922140,CORRECTIONAL INSTITUTIONS,http://www.co.polk.wi.us/law,5/9/2018,IMAGERY,2018/05/09 00:00:00,NOT AVAILABLE,NOT AVAILABLE,-999,0.00667770040506,885.551628019521,1.50422557295e-06
378,370,10005209,JACKSON COUNTY JUVENILE CORRECTIONAL CENTER,4111 SOUTH STREET,MARIANNA,FL,32446,NOT AVAILABLE,NOT AVAILABLE,STATE,CLOSED,0,JACKSON,12063,USA,922140,CORRECTIONAL INSTITUTIONS,http://fcir.org/2011/12/05/feds-issue-condemning-report-on-shuttered-state-youth-facility/,10/31/2015,IMAGERY,2017/11/09 00:00:00,NOT AVAILABLE,JUVENILE,32,0.00882905341106,1053.45963807339,4.24680412042e-06
379,371,10004610,LARGO RESIDENTIAL RE-ENTRY CENTER,16432 UNITED STATES HIGHWAY 19 NORTH,CLEARWATER,FL,33764,NOT AVAILABLE,NOT AVAILABLE,STATE,CLOSED,0,PINELLAS,12103,USA,922140,CORRECTIONAL INSTITUTIONS,http://www.tampabay.com/news/publicsafety/crime/troubled-largo-work-release-center-closed-inmates-removed/2128999,10/31/2015,IMAGERY,2017/11/09 00:00:00,NOT AVAILABLE,MINIMUM,-999,0.00311297251551,363.260608470585,5.62337746769e-07
380,372,10001455,MANDALA JUVENILE CENTER,8005 KING HELIE BLVD,NEW PORT RICHEY,FL,34653,NOT AVAILABLE,NOT AVAILABLE,STATE,CLOSED,0,PASCO,12101,USA,922140,CORRECTIONAL INSTITUTIONS,"http://www.djj.state.fl.us/docs/quality-improvement---residential/mandalaatc1011.pdf?sfvrsn=2, http://patch.com/florida/newportrichey/residential-facility-for-troubled-teens-closing-its-doors#.VDf9JvldVlw",10/31/2015,IMAGERY,2017/11/09 00:00:00,NOT AVAILABLE,JUVENILE,24,0.00131713406867,155.724223482506,7.67711487698e-08
381,373,10001013,BRUSHY MOUNTAIN CORRECTIONAL COMPLEX,9182 PETROS HWY,PETROS,TN,37845,NOT AVAILABLE,NOT AVAILABLE,STATE,CLOSED,0,MORGAN,47129,USA,922140,CORRECTIONAL INSTITUTIONS,http://archive.knoxnews.com/news/local/brushy-mountain-inmates-transferred-as-prison-shuts-down-after-113-years-ep-409958898-359369871.html/,6/30/2009,IMAGERY,2018/01/10 00:00:00,NOT AVAILABLE,MAXIMUM,584,0.00776762044117,965.035859324821,3.55940928588e-06
382,374,10006576,WATCH WEST,"P.O. BOX G, XANTHOPOULOS BUILDING",WARM SPRINGS,MT,59756,NOT AVAILABLE,(406) 693-2272,STATE,OPEN,113,DEER LODGE,30023,USA,922140,CORRECTIONAL INSTITUTIONS,https://cor.mt.gov/publications,12/8/2017,IMAGERY/OTHER,2017/12/11 00:00:00,http://www.cccscorp.com/programs/,NOT AVAILABLE,115,0.00518031387235,697.048979627213,1.75634621345e-06
383,375,10006106,PHELPS COUNTY JAIL / SHERIFF,715 5TH AVENUE,HOLDREGE,NE,68949,NOT AVAILABLE,(308) 995-3129,COUNTY,OPEN,39,PHELPS,31137,USA,922140,CORRECTIONAL INSTITUTIONS,https://ncc.nebraska.gov/jail-standards-inspection-reports,4/5/2018,IMAGERY,2018/04/05 00:00:00,http://www.phelpscountycorrections.com/home.html,NOT AVAILABLE,51,0.00212170860705,263.744636319514,2.10557789153e-07
384,376,10003506,CHARLES B BASS CORRECTIONAL COMPLEX,7177 COCKRILL BEND BLVD,NASHVILLE,TN,37243,NOT AVAILABLE,(615) 350-3361,STATE,CLOSED,0,DAVIDSON,47037,USA,922140,CORRECTIONAL INSTITUTIONS,https://www.tennessean.com/story/money/real-estate/2016/10/25/119-acre-former-state-prison-complex-nashville-put-up-sale/92734882/,10/25/2016,IMAGERY,2018/01/10 00:00:00,http://www.tn.gov/correction/institutions/cbcx.html,MEDIUM,745,0.0114547431708,1405.8694604956,7.48317388148e-06
385,377,10001714,TAFT YOUTH DEVELOPMENT CENTER,900 STATE ROUTE 301,PIKEVILLE,TN,37367,NOT AVAILABLE,NOT AVAILABLE,STATE,CLOSED,0,BLEDSOE,47007,USA,922140,CORRECTIONAL INSTITUTIONS,"http://www.state.tn.us/youth/juvenilejustice/ydcenters2.htm#tydc, http://www.timesfreepress.com/news/2012/apr/27/house-oks-taft-closure/",4/27/2012,IMAGERY,2018/01/10 00:00:00,NOT AVAILABLE,JUVENILE,156,0.0129427489126,1617.81101313158,8.22024990218e-06
386,378,10006072,PIERCE COUNTY JAIL,111 WEST COURT STREET,PIERCE,NE,68767,NOT AVAILABLE,NOT AVAILABLE,COUNTY,OPEN,8,PIERCE,31139,USA,922140,CORRECTIONAL INSTITUTIONS,https://ncc.nebraska.gov/jail-standards-inspection-reports,4/5/2018,IMAGERY,2018/04/05 00:00:00,NOT AVAILABLE,NOT AVAILABLE,14,0.00281727999993,361.904199998826,2.76689028954e-07
387,379,10000342,MILTON GIRLS JUVENILE RESIDENTIAL FACILITY,5770 E MILTON RD,MILTON,FL,32583,NOT AVAILABLE,(850) 983-3250,STATE,CLOSED,0,SANTA ROSA,12113,USA,922140,CORRECTIONAL INSTITUTIONS,http://health.wusf.usf.edu/tags/milton-girls-juvenile-residential-facility#stream/0,2/12/2013,IMAGERY,2017/11/09 00:00:00,http://www.gulfcoastyouthservices.com/stage/milton_index.html,JUVENILE,60,0.00557996001583,659.20338533814,1.98676946107e-06
388,380,10004561,NASSAU JUVENILE FACILITY,1781 LISA AVENUE,FERNANDINA BEACH,FL,32034,NOT AVAILABLE,NOT AVAILABLE,STATE,CLOSED,0,NASSAU,12089,USA,922140,CORRECTIONAL INSTITUTIONS,https://www.publicschoolreview.com/nassau-juvenile-residential-facility-profile,11/9/2017,IMAGERY,2017/11/09 00:00:00,NOT AVAILABLE,JUVENILE,24,0.00433413920891,520.606224816855,1.21502312331e-06
389,381,10000424,NORTH FLORIDA EVALUATION & TREATMENT CENTER,1200 NE 55TH BLVD,GAINESVILLE,FL,32641,2759,(352) 375-8484,STATE,OPEN,-999,ALACHUA,12001,USA,922140,CORRECTIONAL INSTITUTIONS,http://www.myflfamilies.com/service-programs/mental-health/state-mental-health-treatment-facilities,11/9/2017,IMAGERY,2017/11/09 00:00:00,http://www.myflfamilies.com/service-programs/mental-health/state-mental-health-treatment-facilities,MAXIMUM,193,0.00988922217846,1169.27040340856,6.49005704387e-06
390,382,10006332,OKEECHOBEE CORRECTIONAL INSTITUTION WORK CAMP,3420 N.E. 168TH ST.,OKEECHOBEE,FL,34972,4824,(863) 462-5400,STATE,OPEN,440,OKEECHOBEE,12093,USA,922140,CORRECTIONAL INSTITUTIONS,http://www.dc.state.fl.us/pub/pop/,10/31/2017,IMAGERY,2017/11/09 00:00:00,http://www.dc.state.fl.us/orginfo/facilitydir.html#4,NOT AVAILABLE,-999,0.00700164467049,819.08569143113,2.94787021279e-06
391,383,10004562,OUTWARD BOUND,87692 BELL RIVER ESTATES ROAD,YULEE,FL,32097,NOT AVAILABLE,NOT AVAILABLE,STATE,CLOSED,0,NASSAU,12089,USA,922140,CORRECTIONAL INSTITUTIONS,https://www.facebook.com/notes/outward-bound-step-yulee/the-end-of-an-era/119333018151210/,6/3/2011,IMAGERY,2017/11/09 00:00:00,http://www.djj.state.fl.us/Residential/facilities/north_facilities/STEP.html,JUVENILE,30,0.00561422228804,669.267203726148,1.83890219612e-06
392,384,10004565,PANTHER SUCCESS CENTER,11180 NORTHEAST 38TH STREET,JASPER,FL,32052,NOT AVAILABLE,(386) 792-6540,STATE,CLOSED,0,HAMILTON,12047,USA,922140,CORRECTIONAL INSTITUTIONS,http://www.suwanneedemocrat.com/news/local_news/jasper-youth-treatment-center-a-no-go/article_906b0619-5e01-504e-bd4c-2365731741f8.html,3/7/2014,IMAGERY,2017/11/09 00:00:00,NOT AVAILABLE,JUVENILE,48,0.0115647985681,1402.55052704118,4.10204370181e-06
393,385,10001015,TURNEY CENTER INDUSTRIAL COMPLEX - ANNEX,245 CARROLL RD,CLIFTON,TN,38425,NOT AVAILABLE,(931) 676-3345,STATE,OPEN,365,WAYNE,47181,USA,922140,CORRECTIONAL INSTITUTIONS,https://www.tn.gov/correction/sp/prison-rape-elimination-act.html,9/25/2015,IMAGERY,2018/01/10 00:00:00,https://www.tn.gov/correction/sp/state-prison-list.html,MINIMUM,400,0.0112985967503,1402.48090535736,4.05713830867e-06
394,386,10002181,POLK REG JUVENILE DETENTION CENTER,2155 BOB PHILLIPS RD,BARTOW,FL,33830,NOT AVAILABLE,NOT AVAILABLE,STATE,CLOSED,0,POLK,12105,USA,922140,CORRECTIONAL INSTITUTIONS,http://humaneexposures.com/blog/polk-regional-juvenile-detention-center.html,11/24/2011,IMAGERY,2017/11/09 00:00:00,NOT AVAILABLE,JUVENILE,70,0.00379084853487,452.210458328314,6.47596440404e-07
395,387,10000372,RIVER JUNCTION WORK CAMP,300 PECAN LANE,CHATTAHOOCHEE,FL,32324,NOT AVAILABLE,(850) 663-3300,STATE,CLOSED,0,GADSDEN,12039,USA,922140,CORRECTIONAL INSTITUTIONS,http://www.wtvy.com/home/headlines/River_Junction_Work_Camp_in_Chattahoochee_Slated_to_Close_137329278.html,1/13/2012,IMAGERY,2017/11/09 00:00:00,http://www.dc.state.fl.us/facilities/region1/114.html,MEDIUM,736,0.00412005260671,473.442526529367,6.60066519313e-07
396,388,10004617,RIVERSIDE ACADEMY,4004 NORTH RIVERSIDE DRIVE,TAMPA,FL,33603,NOT AVAILABLE,(813) 739-1640,STATE,CLOSED,0,HILLSBOROUGH,12057,USA,922140,CORRECTIONAL INSTITUTIONS,"http://www.g4s.us/en-US/What%20we%20do/Services/Youth%20Services/Facilities/, http://www.bizjournals.com/tampabay/news/2013/12/04/g4s-youth-services-ceasing-operations.html",10/31/2015,IMAGERY,2017/11/09 00:00:00,http://www.g4s.us/en-US/What%20we%20do/Services/Youth%20Services/Facilities/,JUVENILE,165,0.00265351147267,313.11445447489,4.36638925823e-07
397,389,10000341,SANTA ROSA YOUTH ACADEMY,12364 ENVIRONMENTAL CENTER RD,HOLT,FL,32564,NOT AVAILABLE,NOT AVAILABLE,STATE,CLOSED,0,SANTA ROSA,12113,USA,922140,CORRECTIONAL INSTITUTIONS,https://www.publicschoolreview.com/santa-rosa-youth-academy-profile,11/9/2017,IMAGERY,2017/11/09 00:00:00,NOT AVAILABLE,JUVENILE,-999,0.0115085578571,1359.78860771727,3.90257692366e-06
398,390,10002161,SEMINOLE REGIONAL JUVENILE DETENTION CENTER,200 BUSH BLVD,SANFORD,FL,32773,NOT AVAILABLE,NOT AVAILABLE,STATE,CLOSED,0,SEMINOLE,12117,USA,922140,CORRECTIONAL INSTITUTIONS,http://articles.orlandosentinel.com/2011-05-31/news/os-juvenile-detention-centers-shut-do20110531_1_budget-cuts-detention-osceola-authorities,5/31/2011,IMAGERY,2017/11/09 00:00:00,NOT AVAILABLE,JUVENILE,-999,0.00312423544465,366.607696044065,2.67253276784e-07
399,391,10001438,SEMIOLE WORK & LEARN,3420 CAPITAL CIRCLE SW,TALLAHASSEE,FL,32310,NOT AVAILABLE,NOT AVAILABLE,STATE,CLOSED,0,LEON,12073,USA,922140,CORRECTIONAL INSTITUTIONS,http://www.publicschoolreview.com/school_ov/school_id/18578,10/31/2015,IMAGERY,2017/11/09 00:00:00,NOT AVAILABLE,JUVENILE,24,0.00129850885044,152.844087539826,6.45842214865e-08
400,392,10000451,VOLUSIA HALFWAY HOUSE,1047 MADISON AVE,DAYTONA BEACH,FL,32114,NOT AVAILABLE,NOT AVAILABLE,STATE,CLOSED,0,VOLUSIA,12127,USA,922140,CORRECTIONAL INSTITUTIONS,https://www.publicschoolreview.com/volusia-halfway-house-high-school-profile,11/9/2017,IMAGERY,2017/11/09 00:00:00,NOT AVAILABLE,JUVENILE,24,0.00512711624323,617.794277781829,1.47783197013e-06
401,393,10004656,W.I.N.G.S. FOR LIFE,11000 SOUTHWEST 220TH STREET,MIAMI,FL,33170,NOT AVAILABLE,NOT AVAILABLE,STATE,NOT AVAILABLE,-999,MIAMI-DADE,12086,USA,922140,CORRECTIONAL INSTITUTIONS,NOT AVAILABLE,NOT AVAILABLE,IMAGERY,2017/11/09 00:00:00,NOT AVAILABLE,JUVENILE,20,0.00904656878276,1038.24164017322,3.17165140705e-06
402,394,10004559,WEST FLORIDA WILDERNESS INSTITUTE,1912 OLD MOUNT ZION ROAD,PONCE DE LEON,FL,32455,NOT AVAILABLE,NOT AVAILABLE,STATE,CLOSED,0,HOLMES,12059,USA,922140,CORRECTIONAL INSTITUTIONS,http://www.newsherald.com/article/20150725/news/150729622,7/26/2015,IMAGERY,2017/11/09 00:00:00,NOT AVAILABLE,JUVENILE,40,0.00579824828758,681.290229291379,1.98978829924e-06
403,395,10002549,PORTAGE COUNTY JAIL / JUVENILE DETENTION CENTER,1500 STRONGS AVE,STEVENS POINT,WI,54481,3542,(715) 346-1259,COUNTY,OPEN,96,PORTAGE,55097,USA,922140,CORRECTIONAL INSTITUTIONS,http://www.co.portage.wi.us/department/sheriff-s-office/office-of-the-sheriff/annual-reports,5/9/2018,IMAGERY,2018/05/09 00:00:00,NOT AVAILABLE,NOT AVAILABLE,113,0.00272215902743,348.976210940707,3.97561181406e-07
404,396,10004629,YMCA CHARACTER HOUSE,41 NORTH SCHOOL AVENUE,SARASOTA,FL,34237,NOT AVAILABLE,NOT AVAILABLE,STATE,CLOSED,0,SARASOTA,12115,USA,922140,CORRECTIONAL INSTITUTIONS,https://www.sarasotaymca.org/history/,11/9/2017,UNVERIFIED,2017/11/09 00:00:00,NOT AVAILABLE,JUVENILE,16,0.0018254907932,215.472095402017,1.2233338232e-07
405,397,10006709,MAPLE STREET CORRECTIONAL CENTER,1300 MAPLE STREET,REDWOOD CITY,CA,94063,NOT AVAILABLE,(650) 599-3000,COUNTY,OPEN,405,SAN MATEO,06081,USA,922140,CORRECTIONAL INSTITUTIONS,"http://www.bscc.ca.gov/s_fsojailprofilesurvey.php, https://www.mercurynews.com/2016/03/01/san-mateo-county-unveils-compassionate-new-jail/",8/12/2016,IMAGERY,2018/02/13 00:00:00,http://www.smcsheriff.com/corrections-division,NOT AVAILABLE,832,0.00422243993908,526.657641600615,9.10185512484e-07
406,398,10004721,CLAY COUNTY JAIL,P.O. BOX 267,LOUISVILLE,IL,62858,NOT AVAILABLE,(618) 665-3316,COUNTY,OPEN,-999,CLAY,17025,USA,922140,CORRECTIONAL INSTITUTIONS,http://claycountyillinois.org/sheriff/,3/1/2018,IMAGERY,2018/03/01 00:00:00,http://claycountyillinois.org/sheriff/,NOT AVAILABLE,18,0.0014035389881,175.156545138264,1.03322883413e-07
407,399,10002716,ALLRED PRISON,2101 FM 369 N,IOWA PARK,TX,76367,NOT AVAILABLE,(940) 855-7477,STATE,OPEN,3701,WICHITA,48485,USA,922140,CORRECTIONAL INSTITUTIONS,"https://www.texastribune.org/library/data/texas-prisons/units/, http://www.tdcj.state.tx.us/unit_directory/index.html",9/15/2016,IMAGERY,2018/01/10 00:00:00,http://www.tdcj.state.tx.us/unit_directory/index.html,MAXIMUM,3722,0.0190659034106,2314.05787277366,2.48870922145e-05
408,400,10001662,ST. MARTIN PARISH CORRECTIONAL CENTER I,400 ST MARTIN ST,ST MARTINVILLE,LA,70582,NOT AVAILABLE,(337) 394-3071,COUNTY,OPEN,177,ST. MARTIN,22099,USA,922140,CORRECTIONAL INSTITUTIONS,http://doc.louisiana.gov/briefing-book,9/29/2017,IMAGERY,2018/03/16 00:00:00,http://www.stmartinsheriff.org/Default.asp,MAXIMUM,186,0.00175389642874,207.461369187403,1.50235700661e-07
409,402,10004723,CLINTON COUNTY JAIL,810 FRANKLIN STREET,CARLYLE,IL,62231,NOT AVAILABLE,(618) 594-4556,COUNTY,OPEN,-999,CLINTON,17027,USA,922140,CORRECTIONAL INSTITUTIONS,https://www.clintonco.illinois.gov/county-offices/sheriff/,3/1/2018,IMAGERY,2018/03/01 00:00:00,https://www.clintonco.illinois.gov/county-offices/sheriff/,NOT AVAILABLE,52,0.00141623170835,173.026472881994,1.05885305463e-07
410,1602,10002020,ITASKIN JUVENILE CENTER - SECURE UNIT,1880 RIVER ROAD,GRAND RAPIDS,MN,55744,NOT AVAILABLE,(218) 327-3000,STATE,OPEN,-999,ITASCA,27061,USA,922140,CORRECTIONAL INSTITUTIONS,http://www.northhomesinc.org/gr_secure.html,12/7/2017,IMAGERY,2017/12/07 00:00:00,http://www.northhomesinc.org/index,JUVENILE,12,0.0027784624618,368.526683260929,3.07275857584e-07
411,403,10001158,PINE HILLS YOUTH CORRECTIONAL FACILITY,4 N HAYNES AVE,MILES CITY,MT,59301,NOT AVAILABLE,(406) 232-1377,STATE,OPEN,80,CUSTER,30017,USA,922140,CORRECTIONAL INSTITUTIONS,https://cor.mt.gov/publications,12/8/2017,IMAGERY,2017/12/11 00:00:00,http://cor.mt.gov/Youth,JUVENILE,110,0.0120958952176,1624.94412373824,5.30460847162e-06
412,802,10006059,SULLIVAN COUNTY DEPARTMENT OF CORRECTIONS,103 COUNTY FARM ROAD,CLAREMONT,NH,03743,NOT AVAILABLE,(603) 542-8717,COUNTY,OPEN,72,SULLIVAN,33019,USA,922140,CORRECTIONAL INSTITUTIONS,http://www.sullivancountynh.gov/index.php?n=dept_of_corrections,10/20/2016,IMAGERY/OTHER,2018/04/05 00:00:00,http://www.sullivancountynh.gov/index.php?n=dept_of_corrections,MAXIMUM,168,0.00498798810594,638.277694479147,9.61015461057e-07
413,1206,10001877,SOUTH CENTRAL REGIONAL JAIL,1001 CENTRE WAY,CHARLESTON,WV,25309,NOT AVAILABLE,(304) 558-1336,COUNTY,OPEN,478,KANAWHA,54039,USA,922140,CORRECTIONAL INSTITUTIONS,http://rja.wv.gov/Pages/About-Us.aspx,1/22/2018,IMAGERY,2018/01/22 00:00:00,http://rja.wv.gov/facilityinfo/Pages/default.aspx,NOT AVAILABLE,372,0.00661757351631,837.675260452418,2.34803837603e-06
414,803,10006501,BACA COUNTY JAIL,265 E. 2ND AVE,SPRINGFIELD,CO,81073,NOT AVAILABLE,(719) 523-4511,COUNTY,OPEN,-999,BACA,08009,USA,922140,CORRECTIONAL INSTITUTIONS,https://www.bacacountyco.gov/departments/sheriffs-office/,2/19/2018,IMAGERY,2018/02/19 00:00:00,https://www.bacacountyco.gov/departments/sheriffs-office/,NOT AVAILABLE,-999,0.00197007222504,238.202271013228,2.00700724083e-07
415,404,10006577,GREAT FALLS YOUTH TRANSITION CENTER,4212 3RD AVENUE SOUTH,GREAT FALLS,MT,59405,NOT AVAILABLE,(406) 452-1792,STATE,OPEN,7,CASCADE,30013,USA,922140,CORRECTIONAL INSTITUTIONS,"https://cor.mt.gov/publications, https://cor.mt.gov/Youth/YTC",12/8/2017,IMAGERY/OTHER,2017/12/11 00:00:00,http://cor.mt.gov/Youth,JUVENILE,7,0.00108524768514,159.367952655368,6.56320114744e-08
416,804,10002199,BOULDER COUNTY JAIL,3200 AIRPORT ROAD,BOULDER,CO,80301,NOT AVAILABLE,(303) 441-4650,COUNTY,OPEN,767,BOULDER,08013,USA,922140,CORRECTIONAL INSTITUTIONS,"https://www.bouldercounty.org/safety/jail/listing-and-booking-reports/, https://www.bouldercounty.org/safety/jail/",2/19/2018,IMAGERY,2018/02/19 00:00:00,https://www.bouldercounty.org/safety/jail/,MAXIMUM,536,0.00503166399801,642.321846730347,1.10591328381e-06
417,405,10001661,ST. MARTIN PARISH CORRECTIONAL (SUB-STATION),437 W MILLS AVE,BREAUX BRIDGE,LA,70517,NOT AVAILABLE,(337) 394-2513,COUNTY,CLOSED,0,ST. MARTIN,22099,USA,922140,CORRECTIONAL INSTITUTIONS,https://archive.techetoday.com/news-local/cid-field-office-occupying-former-smso-breaux-bridge-substation,6/20/2014,IMAGERY,2018/03/16 00:00:00,http://www.stmartinsheriff.org/index.php?option=com_content&task=view&id=74&Itemid=68,MAXIMUM,365,0.00541869828964,641.979543245124,1.53716924827e-06
418,805,10002581,VERNON COUNTY JAIL / SHERIFF,1320 BAD AXE COURT,VIROQUA,WI,54665,NOT AVAILABLE,(608) 638-5780,COUNTY,OPEN,-999,VERNON,55123,USA,922140,CORRECTIONAL INSTITUTIONS,http://vernonsheriff.com/divisions.htm,5/9/2018,IMAGERY,2018/05/09 00:00:00,http://vernonsheriff.com/divisions.htm,NOT AVAILABLE,-999,0.00401549838803,517.961657270275,5.35478487002e-07
419,406,10001663,ST. MARY PARISH WORK RELEASE FACILITY,9311 UNITED STATES HIGHWAY 90 WEST SOUTH FRONTAGE,CENTERVILLE,LA,70522,NOT AVAILABLE,(337) 836-5520,COUNTY,OPEN,29,ST. MARY,22101,USA,922140,CORRECTIONAL INSTITUTIONS,http://doc.louisiana.gov/contact-us/local-facilities,3/16/2018,IMAGERY,2018/03/16 00:00:00,http://www.stmaryso.com/,NOT AVAILABLE,46,0.00152415052567,183.882142183678,1.14952888126e-07
420,806,10001788,PAMLICO CORRECTIONAL INSTITUTION,601 N THIRD ST,BAYBORO,NC,28515,NOT AVAILABLE,(252) 745-3074,STATE,OPEN,561,PAMLICO,37137,USA,922140,CORRECTIONAL INSTITUTIONS,"http://webapps6.doc.state.nc.us/apps/asqExt/ASQ, https://www.ncdps.gov/Adult-Corrections/Prisons/Prison-Facilities",10/31/2017,IMAGERY,2017/12/12 00:00:00,https://www.ncdps.gov/Adult-Corrections/Prisons/Prison-Facilities,MEDIUM,552,0.00886318160598,1096.68747224574,5.12880315333e-06
421,407,10002826,ANGELINA COUNTY JAIL,2311 E LUFKIN AVE,LUFKIN,TX,75902,NOT AVAILABLE,(936) 634-2724,COUNTY,OPEN,245,ANGELINA,48005,USA,922140,CORRECTIONAL INSTITUTIONS,"http://www.angelinacounty.net/sheriff/, https://www.tcjs.state.tx.us/index.php?linkID=325",3/1/2018,IMAGERY,2018/04/25 00:00:00,http://www.angelinacounty.net/sheriff/,NOT AVAILABLE,279,0.00408061980644,492.990968679442,6.38772280476e-07
422,408,10000190,BOYD CORRECTIONAL UNIT,200 SPUR 113,TEAGUE,TX,75860,2007,(254) 739-5555,STATE,OPEN,1330,FREESTONE,48161,USA,922140,CORRECTIONAL INSTITUTIONS,"https://www.texastribune.org/library/data/texas-prisons/units/, http://www.tdcj.state.tx.us/unit_directory/index.html",9/15/2016,IMAGERY,2018/01/10 00:00:00,http://www.tdcj.state.tx.us/unit_directory/index.html,MAXIMUM,1372,0.0128278764916,1557.26824310798,1.06259842709e-05
423,409,10001969,BRIDGEPORT CORRECTIONAL CENTER,4000 N 10TH ST,BRIDGEPORT,TX,76426,NOT AVAILABLE,(940) 683-3010,STATE,OPEN,518,WISE,48497,USA,922140,CORRECTIONAL INSTITUTIONS,"https://www.texastribune.org/library/data/texas-prisons/units/, http://www.tdcj.state.tx.us/unit_directory/index.html",9/15/2016,IMAGERY,2018/01/10 00:00:00,http://www.mtctrains.com/corrections/#locations,MINIMUM,520,0.00684099090778,848.533128357967,2.65296092577e-06
424,410,10000865,SANTA BARBARA COUNTY MAIN JAIL,4436 CALLE REAL,SANTA BARBARA,CA,93110,NOT AVAILABLE,(805) 681-4260,COUNTY,OPEN,779,SANTA BARBARA,06083,USA,922140,CORRECTIONAL INSTITUTIONS,"http://www.bscc.ca.gov/s_fsojailprofilesurvey.php, http://www.sbcgj.org/2017/DetentionFacilities.pdf",2/16/2018,IMAGERY,2018/02/16 00:00:00,https://www.sbsheriff.org/command-and-divisions/custody-operations/jail-operations-division/jail-facilities/,NOT AVAILABLE,659,0.00626293814176,770.504448805643,1.12126328209e-06
425,411,10004668,COOK COUNTY JUVENILE TEMPORARY DETENTION CENTER,1100 SOUTH HAMILTON AVENUE,CHICAGO,IL,60612,4284,(312) 443-5500,COUNTY,OPEN,-999,COOK,17031,USA,922140,CORRECTIONAL INSTITUTIONS,http://ipcsa.org/il-probation-directory/,3/1/2018,IMAGERY,2018/03/01 00:00:00,https://www.cookcountyil.gov/agency-directory,JUVENILE,-999,0.00770918787117,956.246663601083,2.26798951592e-06
426,412,10001276,ANGELINA COUNTY JUVENILE DETENTION CENTER,705 ELLEN TROUT,LUFKIN,TX,75904,NOT AVAILABLE,(936) 634-8689,COUNTY,OPEN,-999,ANGELINA,48005,USA,922140,CORRECTIONAL INSTITUTIONS,http://www.tjjd.texas.gov/publications/other/searchfacilityregistryresults.aspx?SelectedFacilityType=YKSBbGCMUWM=&SelectedSortBy=laExhobORj5ZHimppFKN0Q==&IncludeInactive=bZL7qeN3IjY=,4/25/2018,IMAGERY,2018/04/25 00:00:00,NOT AVAILABLE,JUVENILE,11,0.00166705263582,195.036228322931,1.19477814478e-07
427,413,10002902,ATASCOSA COUNTY JUVENILE JUSTICE CENTER,1501 ZANDERSON AVE,JOURDANTON,TX,78026,NOT AVAILABLE,(830) 769-3222,COUNTY,OPEN,-999,ATASCOSA,48013,USA,922140,CORRECTIONAL INSTITUTIONS,http://www.tjjd.texas.gov/publications/other/searchfacilityregistryresults.aspx?SelectedFacilityType=YKSBbGCMUWM=&SelectedSortBy=laExhobORj5ZHimppFKN0Q==&IncludeInactive=bZL7qeN3IjY=,4/25/2018,IMAGERY,2018/04/25 00:00:00,NOT AVAILABLE,JUVENILE,40,0.00375200673375,444.120402431717,3.24308521556e-07
428,1603,10001622,BOONVILLE CORRECTIONAL CENTER,1216 E MORGAN ST,BOONVILLE,MO,65233,1300,(660) 882-6521,STATE,OPEN,1322,COOPER,29053,USA,922140,CORRECTIONAL INSTITUTIONS,https://doc.mo.gov/OD/PREA-2017.php,1/27/2017,IMAGERY,2017/12/07 00:00:00,https://doc.mo.gov/DAI/Institutional_Facilities.php,MINIMUM,1346,0.0207783236877,2576.29452308651,2.2644668122e-05
429,414,10005935,ST. MARY LAW ENFORCEMENT CENTER,9311 HWY 90 WEST SOUTH FRONTAGE,CENTERVILLE,LA,70522,NOT AVAILABLE,(337) 836-5520,COUNTY,OPEN,195,ST. MARY,22101,USA,922140,CORRECTIONAL INSTITUTIONS,"http://www.stmaryso.com/, http://doc.louisiana.gov/contact-us/local-facilities",3/16/2018,IMAGERY,2018/03/16 00:00:00,http://www.stmaryso.com/,NOT AVAILABLE,481,0.00485646739084,589.718199980305,1.39231180032e-06
430,415,10002921,ARANSAS COUNTY DETENTION CENTER,301 N LIVE OAK ST,ROCKPORT,TX,78382,NOT AVAILABLE,(361) 790-0168,COUNTY,OPEN,188,ARANSAS,48007,USA,922140,CORRECTIONAL INSTITUTIONS,https://www.tcjs.state.tx.us/index.php?linkID=325,3/1/2018,IMAGERY,2018/04/25 00:00:00,http://www.aransascounty.org/detentioncenter/,NOT AVAILABLE,212,0.00182126848808,212.695756725517,1.93215071277e-07
431,1207,10005033,WALDO COUNTY HOLDING FACILITY,45B CONGRESS STREET,BELFAST,ME,04915,NOT AVAILABLE,(207) 338-1080,COUNTY,OPEN,3,WALDO,23027,USA,922140,CORRECTIONAL INSTITUTIONS,http://www.waldocountyme.gov/corr/index.html,3/20/2018,IMAGERY/OTHER,2018/03/20 00:00:00,http://www.waldocountyme.gov/corr/index.html,MINIMUM,32,0.00345995124378,444.580411737623,2.37108587597e-07
432,416,10004376,ARCHER COUNTY JAIL,NOT AVAILABLE,ARCHER CITY,TX,76351,NOT AVAILABLE,NOT AVAILABLE,COUNTY,OPEN,16,ARCHER,48009,USA,922140,CORRECTIONAL INSTITUTIONS,https://www.tcjs.state.tx.us/index.php?linkID=325,3/1/2018,IMAGERY,2018/04/25 00:00:00,NOT AVAILABLE,NOT AVAILABLE,48,0.00384255479493,453.684772098915,6.96256552329e-07
433,417,10006570,PASSAGES WOMEN'S COMMUNITY CORRECTIONAL FACILITY,1001 SOUTH 27TH STREET,BILLINGS,MT,59101,NOT AVAILABLE,NOT AVAILABLE,MULTI,OPEN,124,YELLOWSTONE,30111,USA,922140,CORRECTIONAL INSTITUTIONS,"https://cor.mt.gov/publications, http://altinc.net/passages/",12/8/2017,IMAGERY,2017/12/11 00:00:00,http://altinc.net/,NOT AVAILABLE,184,0.00368262980523,456.546805964664,3.83872247487e-07
434,418,10002604,RACINE COUNTY JAIL,717 WISCONSIN AVE,RACINE,WI,53403,NOT AVAILABLE,(262) 636-3929,COUNTY,OPEN,788,RACINE,55101,USA,922140,CORRECTIONAL INSTITUTIONS,http://racinecounty.com/government/sheriff-s-office,5/9/2018,IMAGERY,2018/05/09 00:00:00,NOT AVAILABLE,MAXIMUM,876,0.00582962860113,759.801096490217,9.294156662e-07
435,419,10006537,FLORIDA CIVIL COMMITMENT CENTER,13619 SE HIGHWAY 70,ARCADIA,FL,34266,NOT AVAILABLE,(863) 491-4800,STATE,OPEN,-999,DESOTO,12027,USA,922140,CORRECTIONAL INSTITUTIONS,http://www.correctcarers.com/fccc/,11/10/2017,IMAGERY,2017/11/10 00:00:00,http://www.correctcarers.com/fccc/,NOT AVAILABLE,720,0.00912692386721,1069.27566520623,5.36042870436e-06
436,420,10006536,SOUTH FLORIDA EVALUATION & TREATMENT CENTER,18680 SW 376TH ST,FLORIDA CITY,FL,33034,NOT AVAILABLE,(786) 349-6000,STATE,OPEN,-999,MIAMI-DADE,12086,USA,922140,CORRECTIONAL INSTITUTIONS,http://www.correctcarers.com/sfetc/,11/10/2017,IMAGERY,2017/11/10 00:00:00,http://www.correctcarers.com/sfetc/,NOT AVAILABLE,249,0.00877005806312,1022.77244238449,3.56044486641e-06
437,421,10006830,PLATTE COUNTY COURTHOUSE JAIL,2610 14TH STREET,COLUMBUS,NE,68601,NOT AVAILABLE,NOT AVAILABLE,COUNTY,OPEN,-999,PLATTE,31141,USA,922140,CORRECTIONAL INSTITUTIONS,https://ncc.nebraska.gov/jail-standards-inspection-reports,4/5/2018,IMAGERY,2018/04/05 00:00:00,NOT AVAILABLE,NOT AVAILABLE,27,0.00260605949508,316.918571701332,2.80464883519e-07
438,422,10005353,SANTA BARBARA COUNTY SANTA MARIA STATION JAIL,812-A W. FOSTER ROAD,SANTA MARIA,CA,93455,NOT AVAILABLE,(805) 934-6150,COUNTY,OPEN,2,SANTA BARBARA,06083,USA,922140,CORRECTIONAL INSTITUTIONS,"http://www.bscc.ca.gov/s_fsojailprofilesurvey.php, http://www.sbcgj.org/2017/DetentionFacilities.pdf",2/16/2018,IMAGERY,2018/02/16 00:00:00,https://www.sbsheriff.org/command-and-divisions/law-enforcement-operations/north-county-operations-division/,NOT AVAILABLE,35,0.00259242689407,313.498230181896,3.23093308856e-07
439,423,10000247,BRISCOE PRISON,1459 W STATE HWY 85,DILLEY,TX,78017,NOT AVAILABLE,(830) 965-4444,STATE,OPEN,1348,FRIO,48163,USA,922140,CORRECTIONAL INSTITUTIONS,"https://www.texastribune.org/library/data/texas-prisons/units/, http://www.tdcj.state.tx.us/unit_directory/index.html",9/15/2016,IMAGERY,2018/01/10 00:00:00,http://www.tdcj.state.tx.us/unit_directory/index.html,MAXIMUM,1384,0.0127092208839,1518.90212624745,1.04334000172e-05
440,424,10004716,CRAWFORD COUNTY JAIL,203 SOUTH JEFFERSON STREET,ROBINSON,IL,62454,NOT AVAILABLE,(618) 546-1515,COUNTY,OPEN,30,CRAWFORD,17033,USA,922140,CORRECTIONAL INSTITUTIONS,http://main.crawfordcountycentral.com/,1/19/2017,IMAGERY,2018/03/01 00:00:00,http://main.crawfordcountycentral.com/,NOT AVAILABLE,46,0.001185569826,151.145994006357,7.52683820882e-08
441,425,10006538,FLORIDA STATE HOSPITAL-FORENSIC SERVICE,"HIGHWAY 90, P.O. BOX 1000",CHATTAHOOCHEE,FL,32324,NOT AVAILABLE,(850) 663-7536,STATE,OPEN,-999,GADSDEN,12039,USA,922140,CORRECTIONAL INSTITUTIONS,http://www.myflfamilies.com/service-programs/mental-health/forensic-facilities,11/10/2017,IMAGERY,2017/11/10 00:00:00,http://www.myflfamilies.com/service-programs/mental-health/forensic-facilities,NOT AVAILABLE,469,0.0105549864611,1272.4618761464,7.41993048538e-06
442,426,10001984,BYRD DIAGNOSTIC INTAKE FACILITY,21 FM 247,HUNTSVILLE,TX,77320,NOT AVAILABLE,(936) 295-5768,STATE,OPEN,1142,WALKER,48471,USA,922140,CORRECTIONAL INSTITUTIONS,"https://www.texastribune.org/library/data/texas-prisons/units/, http://www.tdcj.state.tx.us/unit_directory/index.html",9/15/2016,IMAGERY,2018/01/10 00:00:00,http://www.tdcj.state.tx.us/unit_directory/index.html,NOT AVAILABLE,1365,0.00758778007978,925.820058592053,2.80219514876e-06
443,427,10000868,SANTA MARIA JUVENILE HALL,4263 CALIFORNIA BOULEVARD,SANTA MARIA,CA,93455,NOT AVAILABLE,(805) 934-6270,COUNTY,OPEN,80,SANTA BARBARA,06083,USA,922140,CORRECTIONAL INSTITUTIONS,http://www.countyofsb.org/probation/home.c,2/15/2016,IMAGERY,2018/02/16 00:00:00,http://www.countyofsb.org/probation/home.c,JUVENILE,140,0.00641300764873,783.924656315675,1.63136601901e-06
444,428,10002875,AUSTIN COUNTY JAIL,417 N CHESLEY ST,BELLVILLE,TX,77418,NOT AVAILABLE,(979) 865-5321,COUNTY,CLOSED,0,AUSTIN,48015,USA,922140,CORRECTIONAL INSTITUTIONS,http://austincountyso.org/jail.htm,4/25/2018,IMAGERY,2018/04/25 00:00:00,NOT AVAILABLE,MAXIMUM,90,0.00223722999436,265.595041335569,2.29077482932e-07
445,429,10002715,BAILEY COUNTY JAIL,405 W 2ND ST,MULESHOE,TX,79347,NOT AVAILABLE,NOT AVAILABLE,COUNTY,OPEN,54,BAILEY,48017,USA,922140,CORRECTIONAL INSTITUTIONS,"https://www.tcjs.state.tx.us/index.php?linkID=325, https://texasjailproject.org/list_of_county_jails/",3/1/2018,IMAGERY,2018/04/25 00:00:00,NOT AVAILABLE,NOT AVAILABLE,96,0.00214170471198,261.000322615934,1.99970331034e-07
446,430,10004711,CUMBERLAND COUNTY JAIL,166 COURT HOUSE SQUARE,TOLEDO,IL,62468,NOT AVAILABLE,(217) 849-2571,COUNTY,OPEN,-999,CUMBERLAND,17035,USA,922140,CORRECTIONAL INSTITUTIONS,http://www.ilsheriff.org/index.php/directory,3/1/2018,IMAGERY,2018/03/01 00:00:00,NOT AVAILABLE,NOT AVAILABLE,33,0.00132783977211,168.219330110119,1.09873510076e-07
447,431,10004536,ALBANY TRANSITIONAL CENTER,304 NORTH WASHINGTON STREET,ALBANY,GA,31701,NOT AVAILABLE,(229) 430-3888,STATE,OPEN,156,DOUGHERTY,13095,USA,922140,CORRECTIONAL INSTITUTIONS,"http://www.dcor.state.ga.us/Research/Monthly_Profile_all_inmates, http://www.dcor.state.ga.us/facility-finder",11/2/2017,IMAGERY,2017/11/10 00:00:00,http://www.dcor.state.ga.us/facility-finder,MINIMUM,155,0.00197335315398,241.521301529827,2.03706659557e-07
448,432,10004527,APPLING INTEGRATED TREATMENT FACILITY,252 WEST PARK DRIVE,BAXLEY,GA,31513,NOT AVAILABLE,(912) 367-1761,STATE,OPEN,191,APPLING,13001,USA,922140,CORRECTIONAL INSTITUTIONS,http://www.dcor.state.ga.us/facility-finder,11/10/2017,IMAGERY,2017/11/10 00:00:00,http://www.dcor.state.ga.us/facility-finder,MEDIUM,232,0.00539579359355,655.896310156387,1.72525469939e-06
449,433,10002102,ARRENDALE STATE PRISON,2023 GAINESVILLE HWY,ALTO,GA,30510,NOT AVAILABLE,(706) 776-4700,STATE,OPEN,1596,HABERSHAM,13137,USA,922140,CORRECTIONAL INSTITUTIONS,"http://www.dcor.state.ga.us/Research/Monthly_Profile_all_inmates, http://www.dcor.state.ga.us/facility-finder",11/2/2017,IMAGERY,2017/11/10 00:00:00,http://www.dcor.state.ga.us/facility-finder,MEDIUM,1476,0.0172126623465,2067.91823071233,1.7954352311e-05
450,434,10001411,ATLANTA TRANSITIONAL CENTER,332 PONCE DE LEON AVE NE,ATLANTA,GA,30308,NOT AVAILABLE,(404) 206-5103,STATE,OPEN,281,FULTON,13121,USA,922140,CORRECTIONAL INSTITUTIONS,"http://www.dcor.state.ga.us/Research/Monthly_Profile_all_inmates, http://www.dcor.state.ga.us/facility-finder",11/2/2017,IMAGERY,2017/11/10 00:00:00,http://www.dcor.state.ga.us/facility-finder,MINIMUM,257,0.00187097579084,223.588673685382,1.80081214475e-07
451,435,10006153,AUGUSTA STATE MEDICAL PRISON,3001 GORDON HWY,GROVETOWN,GA,30813,NOT AVAILABLE,(706) 855-4700,STATE,OPEN,1160,COLUMBIA,13073,USA,922140,CORRECTIONAL INSTITUTIONS,"http://www.dcor.state.ga.us/Research/Monthly_Profile_all_inmates, http://www.dcor.state.ga.us/facility-finder",11/2/2017,IMAGERY,2017/11/10 00:00:00,http://www.dcor.state.ga.us/facility-finder,CLOSE,1326,0.0166269700027,2030.04775673254,1.23098937335e-05
452,436,10004475,AUGUSTA TRANSITIONAL CENTER,601 TAYLOR STREET,AUGUSTA,GA,30906,NOT AVAILABLE,(706) 721-1650,STATE,OPEN,226,RICHMOND,13245,USA,922140,CORRECTIONAL INSTITUTIONS,"http://www.dcor.state.ga.us/Research/Monthly_Profile_all_inmates, http://www.dcor.state.ga.us/facility-finder",11/2/2017,IMAGERY,2017/11/10 00:00:00,http://www.dcor.state.ga.us/facility-finder,MINIMUM,205,0.00361585998653,437.128772792167,5.31005424332e-07
453,437,10006710,LOS PRIETOS BOYS CAMP,3900 PARADISE ROAD,SANTA BARBARA,CA,93105,NOT AVAILABLE,(805) 692-1750,COUNTY,OPEN,-999,SANTA BARBARA,06083,USA,922140,CORRECTIONAL INSTITUTIONS,http://www.countyofsb.org/probation/home.c,2/16/2018,IMAGERY,2018/02/16 00:00:00,http://www.countyofsb.org/probation/home.c,JUVENILE,-999,0.00547987960475,657.78649057363,1.78806056049e-06
454,438,10002333,ELMWOOD CORRECTIONAL COMPLEX,701 SOUTH ABEL STREET,MILPITAS,CA,95035,NOT AVAILABLE,NOT AVAILABLE,COUNTY,OPEN,2529,SANTA CLARA,06085,USA,922140,CORRECTIONAL INSTITUTIONS,https://www.sccgov.org/sites/sheriff/pages/custody.aspx,2/16/2018,IMAGERY,2018/02/16 00:00:00,https://www.sccgov.org/sites/sheriff/pages/custody.aspx,MAXIMUM,2600,0.0174256463912,2205.64997231713,1.90832173021e-05
455,439,10001156,GREAT FALLS WOMEN'S PRE-RELEASE CENTER,1019 15TH ST N,GREAT FALLS,MT,59401,NOT AVAILABLE,(406) 727-0944,STATE,OPEN,27,CASCADE,30013,USA,922140,CORRECTIONAL INSTITUTIONS,"https://cor.mt.gov/publications, http://www.gfprc.org/history.html",12/8/2017,IMAGERY,2017/12/11 00:00:00,http://www.gfprc.org/index.html,MINIMUM,40,0.00355235927949,456.832344458409,5.44076811588e-07
456,440,10000243,CLEMENS PRISON,11034 HWY 36,BRAZORIA,TX,77422,NOT AVAILABLE,(979) 798-2188,STATE,OPEN,1174,BRAZORIA,48039,USA,922140,CORRECTIONAL INSTITUTIONS,"https://www.texastribune.org/library/data/texas-prisons/units/, http://www.tdcj.state.tx.us/unit_directory/index.html",9/15/2016,IMAGERY,2018/01/10 00:00:00,http://www.tdcj.state.tx.us/unit_directory/index.html,MAXIMUM,1215,0.00892090779348,1057.68902775843,3.93121491118e-06
457,441,10001656,ST. TAMMANY PARISH JAIL,1200 CHAMPAGNE ST,COVINGTON,LA,70433,NOT AVAILABLE,(985) 276-1000,COUNTY,OPEN,1006,ST. TAMMANY,22103,USA,922140,CORRECTIONAL INSTITUTIONS,http://doc.louisiana.gov/briefing-book,9/29/2017,IMAGERY,2018/03/16 00:00:00,https://www.stpso.com/,MAXIMUM,1192,0.00788070671171,940.253205043811,2.27716807815e-06
458,442,10002878,BANDERA COUNTY JAIL,3360 STATE HWY. 173 NORTH,BANDERA,TX,78003,NOT AVAILABLE,(830) 796-7759,COUNTY,OPEN,60,BANDERA,48019,USA,922140,CORRECTIONAL INSTITUTIONS,"https://www.tcjs.state.tx.us/index.php?linkID=325, http://www.banderacounty.org/departments/sheriff.htm",3/1/2018,IMAGERY,2018/04/25 00:00:00,NOT AVAILABLE,NOT AVAILABLE,96,0.00342519133895,406.867061860197,5.99141156891e-07
459,443,10000325,AUTRY STATE PRISON,3178 MOUNT ZION CHURCH RD,PELHAM,GA,31779,NOT AVAILABLE,(229) 294-2940,STATE,OPEN,1715,MITCHELL,13205,USA,922140,CORRECTIONAL INSTITUTIONS,"http://www.dcor.state.ga.us/Research/Monthly_Profile_all_inmates, http://www.dcor.state.ga.us/facility-finder",11/2/2017,IMAGERY,2017/11/10 00:00:00,http://www.dcor.state.ga.us/facility-finder,MEDIUM,1698,0.0131388448746,1588.82310177608,1.20955618343e-05
460,444,10006339,BAINBRIDGE SUBSTANCE ABUSE CENTER,235 STATE HOSPITAL ROAD,BAINBRIDGE,GA,39817,NOT AVAILABLE,(229) 248-2416,STATE,OPEN,-999,DECATUR,13087,USA,922140,CORRECTIONAL INSTITUTIONS,http://www.dcor.state.ga.us/facility-finder,11/10/2017,IMAGERY,2017/11/10 00:00:00,http://www.dcor.state.ga.us/facility-finder,NOT AVAILABLE,400,0.0132660398593,1607.01854958694,9.01873742413e-06
461,445,10002129,BALDWIN STATE PRISON,140 LAYING FARM RD,HARDWICK,GA,31034,NOT AVAILABLE,(478) 445-5218,STATE,OPEN,953,BALDWIN,13009,USA,922140,CORRECTIONAL INSTITUTIONS,"http://www.dcor.state.ga.us/Research/Monthly_Profile_all_inmates, http://www.dcor.state.ga.us/facility-finder",11/2/2017,IMAGERY,2017/11/10 00:00:00,http://www.dcor.state.ga.us/facility-finder,MEDIUM,925,0.0141927164742,1734.8415304012,6.95395778913e-06
462,446,10001421,BURRUSS CORRECTIONAL TRAINING CENTER,1000 INDIAN SPRINGS DR,FORSYTH,GA,31029,NOT AVAILABLE,(478) 994-7511,STATE,OPEN,750,MONROE,13207,USA,922140,CORRECTIONAL INSTITUTIONS,"http://www.dcor.state.ga.us/Research/Monthly_Profile_all_inmates, http://www.dcor.state.ga.us/facility-finder",11/2/2017,IMAGERY,2017/11/10 00:00:00,http://www.dcor.state.ga.us/facility-finder,MEDIUM,806,0.0115982459833,1391.02587935765,7.17305640091e-06
463,447,10005315,SANTA CLARA COUNTY MAIN JAIL COMPLEX (NORTH),150 WEST HEDDING STREET,SAN JOSE,CA,95110,NOT AVAILABLE,NOT AVAILABLE,COUNTY,OPEN,-999,SANTA CLARA,06085,USA,922140,CORRECTIONAL INSTITUTIONS,https://www.sccgov.org/sites/sheriff/pages/custody.aspx,2/16/2018,IMAGERY,2018/02/16 00:00:00,https://www.sccgov.org/sites/sheriff/pages/custody.aspx,NOT AVAILABLE,919,0.00262652775241,323.802135974642,3.9433273796e-07
464,448,10006232,SANTA CLARA COUNTY MAIN JAIL COMPLEX (SOUTH),150 WEST HEDDING STREET,SAN JOSE,CA,95110,NOT AVAILABLE,NOT AVAILABLE,COUNTY,OPEN,-999,SANTA CLARA,06085,USA,922140,CORRECTIONAL INSTITUTIONS,https://www.sccgov.org/sites/sheriff/pages/custody.aspx,2/16/2018,IMAGERY,2018/02/16 00:00:00,https://www.sccgov.org/sites/sheriff/pages/custody.aspx,NOT AVAILABLE,674,0.00283974955195,342.77616291658,3.85278916241e-07
465,449,10000154,CLEMENTS PRISON,9601 SPUR 591,AMARILLO,TX,79107,9606,(806) 381-7080,STATE,OPEN,3774,POTTER,48375,USA,922140,CORRECTIONAL INSTITUTIONS,"https://www.texastribune.org/library/data/texas-prisons/units/, http://www.tdcj.state.tx.us/unit_directory/index.html",9/15/2016,IMAGERY,2018/01/10 00:00:00,http://www.tdcj.state.tx.us/unit_directory/index.html,MAXIMUM,3798,0.0199248023794,2425.74680785721,2.23005686544e-05
466,450,10003880,C H COLWELL DETENTION CENTER,189 BEASLEY STREET,BLAIRSVILLE,GA,30512,NOT AVAILABLE,(706) 745-3610,STATE,OPEN,-999,UNION,13291,USA,922140,CORRECTIONAL INSTITUTIONS,http://www.dcor.state.ga.us/facility-finder,11/2/2017,IMAGERY,2017/11/10 00:00:00,http://www.dcor.state.ga.us/facility-finder,MINIMUM,208,0.00431416601788,530.670997572766,1.17824351512e-06
467,451,10000187,COFFIELD UNIT,2661 FM 2054,TENNESSEE COLONY,TX,75884,NOT AVAILABLE,(903) 928-2211,STATE,OPEN,4085,ANDERSON,48001,USA,922140,CORRECTIONAL INSTITUTIONS,"https://www.texastribune.org/library/data/texas-prisons/units/, http://www.tdcj.state.tx.us/unit_directory/index.html",9/15/2016,IMAGERY/OTHER,2018/01/10 00:00:00,http://www.tdcj.state.tx.us/unit_directory/index.html,MAXIMUM,4139,0.025718465731,3106.59213226003,2.67048533442e-05
468,452,10004669,DEKALB COUNTY JAIL,150 NORTH MAIN STREET,SYCAMORE,IL,60178,NOT AVAILABLE,(815) 895-4177,COUNTY,OPEN,-999,DEKALB,17037,USA,922140,CORRECTIONAL INSTITUTIONS,http://dekalbcounty.org/sheriff/index.html,3/1/2018,IMAGERY,2018/03/01 00:00:00,http://dekalbcounty.org/sheriff/index.html,NOT AVAILABLE,89,0.00168092402034,214.980751622139,1.7310586492e-07
469,453,10005924,ST. TAMMANY PARISH WORK RELEASE FACILITY,141 PRODUCTION DRIVE,SLIDELL,LA,70460,NOT AVAILABLE,NOT AVAILABLE,COUNTY,CLOSED,0,ST. TAMMANY,22103,USA,922140,CORRECTIONAL INSTITUTIONS,http://www.theadvocate.com/new_orleans/news/communities/st_tammany/article_2f4c9e78-4634-11e7-9acf-3b3cab5d8a06.html,5/31/2017,IMAGERY/OTHER,2018/03/16 00:00:00,NOT AVAILABLE,MINIMUM,90,0.00491290866443,586.063750087115,1.4928499089e-06
470,454,10002847,BASTROP COUNTY JAIL,200 JACKSON ST,BASTROP,TX,78602,NOT AVAILABLE,NOT AVAILABLE,COUNTY,OPEN,286,BASTROP,48021,USA,922140,CORRECTIONAL INSTITUTIONS,https://www.tcjs.state.tx.us/index.php?linkID=325,3/1/2018,IMAGERY,2018/04/25 00:00:00,http://www.co.bastrop.tx.us/page/lec.sheriff,NOT AVAILABLE,400,0.00651765606151,772.447805211212,1.80008967698e-06
471,455,10002146,CALHOUN STATE PRISON,27823 MAIN ST,MORGAN,GA,39866,NOT AVAILABLE,(229) 849-5000,STATE,OPEN,1638,CALHOUN,13037,USA,922140,CORRECTIONAL INSTITUTIONS,"http://www.dcor.state.ga.us/Research/Monthly_Profile_all_inmates, http://www.dcor.state.ga.us/facility-finder",11/2/2017,IMAGERY,2017/11/10 00:00:00,http://www.dcor.state.ga.us/facility-finder,MEDIUM,1677,0.0131776984332,1552.86219890948,1.15620840983e-05
472,456,10002726,COLE STATE JAIL,3801 SILO RD,BONHAM,TX,75418,NOT AVAILABLE,(903) 583-1100,STATE,OPEN,826,FANNIN,48147,USA,922140,CORRECTIONAL INSTITUTIONS,"https://www.texastribune.org/library/data/texas-prisons/units/, http://www.tdcj.state.tx.us/unit_directory/index.html",9/15/2016,IMAGERY,2018/01/10 00:00:00,http://www.tdcj.state.tx.us/unit_directory/index.html,MAXIMUM,900,0.0099132314687,1197.10973473589,5.88981658215e-06
473,457,10002134,CENTRAL STATE PRISON,4600 FULTON MILL RD,MACON,GA,31208,NOT AVAILABLE,(478) 471-2906,STATE,OPEN,1136,BIBB,13021,USA,922140,CORRECTIONAL INSTITUTIONS,"http://www.dcor.state.ga.us/Research/Monthly_Profile_all_inmates, http://www.dcor.state.ga.us/facility-finder",11/2/2017,IMAGERY,2017/11/10 00:00:00,http://www.dcor.state.ga.us/facility-finder,MEDIUM,1153,0.0144119989791,1745.79193159591,9.04293523086e-06
474,458,10005314,SANTA CLARA COUNTY JUVENILE HALL,840 GUADALUPE PARKWAY,SAN JOSE,CA,95110,NOT AVAILABLE,(408) 278-5820,COUNTY,OPEN,83,SANTA CLARA,06085,USA,922140,CORRECTIONAL INSTITUTIONS,https://www.sccgov.org/sites/probation/reports/Pages/Annual-Reports.aspx,2/16/2018,IMAGERY,2018/02/16 00:00:00,https://www.sccgov.org/sites/probation/juvinst/pages/default.aspx,JUVENILE,390,0.00697795378025,853.7242600366,2.61886922347e-06
475,459,10003928,CHARLES D. HUDSON TRANSFER CENTER,100 JIM HESTER ROAD,LAGRANGE,GA,30241,NOT AVAILABLE,(706) 845-4018,STATE,OPEN,150,TROUP,13285,USA,922140,CORRECTIONAL INSTITUTIONS,"http://www.dcor.state.ga.us/Research/Monthly_Profile_all_inmates, http://www.dcor.state.ga.us/facility-finder",11/2/2017,IMAGERY,2017/11/10 00:00:00,http://www.dcor.state.ga.us/facility-finder,MINIMUM,155,0.00304237065415,360.645581725081,4.47175852746e-07
476,460,10006580,GREAT FALLS PRE-RELEASE EAST CAMPUS,1715 10TH AVE NORTH,GREAT FALLS,MT,59401,NOT AVAILABLE,(406) 727-0944,STATE,OPEN,155,CASCADE,30013,USA,922140,CORRECTIONAL INSTITUTIONS,https://cor.mt.gov/publications,12/8/2017,IMAGERY,2017/12/11 00:00:00,http://www.gfprc.org/index.html,NOT AVAILABLE,148,0.00260691020363,337.258630692451,2.2894754966e-07
477,461,10006579,GALLATIN COUNTY REENTRY PROGRAM,675 SOUTH 16TH AVENUE,BOZEMAN,MT,59715,NOT AVAILABLE,(406) 994-0300,COUNTY,OPEN,41,GALLATIN,30031,USA,922140,CORRECTIONAL INSTITUTIONS,"https://cor.mt.gov/publications, http://www.cccscorp.com/programs/",12/8/2017,IMAGERY,2017/12/11 00:00:00,http://www.cccscorp.com/programs/,NOT AVAILABLE,40,0.00159978845231,207.590632495051,1.37990406639e-07
478,462,10006578,ALPHA HOUSE PRE-RELEASE CENTER,3109 1ST AVENUE NORTH,BILLINGS,MT,59101,NOT AVAILABLE,(406) 259-9695,STATE,OPEN,-999,YELLOWSTONE,30111,USA,922140,CORRECTIONAL INSTITUTIONS,http://cor.mt.gov/FamilyFriends/Visiting,12/11/2017,IMAGERY,2017/12/11 00:00:00,http://altinc.net/,NOT AVAILABLE,-999,0.00192783198687,251.726424697352,2.21737163179e-07
479,463,10004696,DEWITT COUNTY JAIL,101 WEST WASHINGTON STREET,CLINTON,IL,61727,NOT AVAILABLE,(217) 935-2913,COUNTY,OPEN,-999,DE WITT,17039,USA,922140,CORRECTIONAL INSTITUTIONS,http://www.dewittsheriff.com/,3/1/2018,IMAGERY,2018/03/01 00:00:00,http://www.dewittsheriff.com/,NOT AVAILABLE,90,0.00288979121518,363.19448632162,3.67611472598e-07
480,464,10004749,ST. HELENA PARISH JAIL,387 SITMAN STREET,GREENSBURG,LA,70441,NOT AVAILABLE,(888) 200-4905,COUNTY,OPEN,41,ST. HELENA,22091,USA,922140,CORRECTIONAL INSTITUTIONS,http://doc.louisiana.gov/briefing-book,9/29/2017,IMAGERY,2018/03/16 00:00:00,http://www.sthelenaso.org/Default.aspx,NOT AVAILABLE,56,0.00243346212647,289.023717920169,2.05805795479e-07
481,465,10001292,BEE COUNTY JAIL,1511 E TOLEDO ST,BEEVILLE,TX,78102,NOT AVAILABLE,NOT AVAILABLE,COUNTY,OPEN,109,BEE,48025,USA,922140,CORRECTIONAL INSTITUTIONS,"https://www.tcjs.state.tx.us/index.php?linkID=325, http://www.co.bee.tx.us/default.aspx?Bee_County/Sheriff",3/1/2018,IMAGERY,2018/04/25 00:00:00,NOT AVAILABLE,NOT AVAILABLE,128,0.00247457452,293.471901857349,3.01272086509e-07
482,466,10006831,RED WILLOW COUNTY JAIL,516 NORRIS AVE,MCCOOK,NE,69001,NOT AVAILABLE,(308) 345-8682,COUNTY,OPEN,17,RED WILLOW,31145,USA,922140,CORRECTIONAL INSTITUTIONS,https://ncc.nebraska.gov/jail-standards-inspection-reports,4/5/2018,IMAGERY,2018/04/05 00:00:00,http://www.rwsheriff.org/services,NOT AVAILABLE,30,0.0024280462809,321.212170962983,3.14554001458e-07
483,467,10002609,RACINE COUNTY SECURE JUVENILE DETENTION CENTER,1717 TAYLOR AVE,RACINE,WI,53403,NOT AVAILABLE,NOT AVAILABLE,COUNTY,OPEN,-999,RACINE,55101,USA,922140,CORRECTIONAL INSTITUTIONS,http://racinecounty.com/government/human-services,5/9/2018,IMAGERY,2018/05/09 00:00:00,NOT AVAILABLE,JUVENILE,121,0.00248245207746,345.240006319546,3.29088150173e-07
484,468,10002121,CLAYTON TRANSITIONAL CENTER,242 FALCON DR,FOREST PARK,GA,30297,NOT AVAILABLE,(404) 675-1500,STATE,OPEN,379,CLAYTON,13063,USA,922140,CORRECTIONAL INSTITUTIONS,"http://www.dcor.state.ga.us/Research/Monthly_Profile_all_inmates, http://www.dcor.state.ga.us/facility-finder",11/2/2017,IMAGERY,2017/11/10 00:00:00,http://www.dcor.state.ga.us/facility-finder,MINIMUM,351,0.00391690114138,461.755294580595,3.52779192025e-07
485,469,10002905,CONNALLY PRISON,899 FM 632,KENEDY,TX,78119,NOT AVAILABLE,(830) 583-4003,STATE,OPEN,2514,KARNES,48255,USA,922140,CORRECTIONAL INSTITUTIONS,"https://www.texastribune.org/library/data/texas-prisons/units/, http://www.tdcj.state.tx.us/unit_directory/index.html",9/15/2016,IMAGERY,2018/01/10 00:00:00,http://www.tdcj.state.tx.us/unit_directory/index.html,MAXIMUM,2148,0.0179527194091,2128.76970640291,2.24501576265e-05
486,470,10000314,COASTAL STATE PRISON,200 GULF STREAM RD,GARDEN CITY,GA,31418,NOT AVAILABLE,(912) 965-6330,STATE,OPEN,1638,CHATHAM,13051,USA,922140,CORRECTIONAL INSTITUTIONS,"http://www.dcor.state.ga.us/Research/Monthly_Profile_all_inmates, http://www.dcor.state.ga.us/facility-finder",11/2/2017,IMAGERY,2017/11/10 00:00:00,http://www.dcor.state.ga.us/facility-finder,MEDIUM,1836,0.0119715065695,1463.41532913312,9.31855880418e-06
487,471,10000313,COASTAL TRANSITION CENTER,309 STILES AVE,SAVANNAH,GA,31415,NOT AVAILABLE,(912) 651-0900,STATE,OPEN,260,CHATHAM,13051,USA,922140,CORRECTIONAL INSTITUTIONS,"http://www.dcor.state.ga.us/Research/Monthly_Profile_all_inmates, http://www.dcor.state.ga.us/facility-finder",11/2/2017,IMAGERY,2017/11/10 00:00:00,http://www.dcor.state.ga.us/facility-finder,MINIMUM,262,0.00473280312118,567.729036859217,6.92334430787e-07
488,472,10001154,HELENA PRE-RELEASE CENTER,805 COLLEEN ST,HELENA,MT,59601,NOT AVAILABLE,(406) 442-6572,STATE,OPEN,111,LEWIS AND CLARK,30049,USA,922140,CORRECTIONAL INSTITUTIONS,https://cor.mt.gov/publications,12/8/2017,IMAGERY,2017/12/11 00:00:00,https://www.boydandrew.com/services/,MINIMUM,121,0.00353539202502,470.860739287074,3.14329498506e-07
489,473,10002920,COTULLA TRANSFER FACILITY,610 FM 624,COTULLA,TX,78014,NOT AVAILABLE,(830) 879-3077,STATE,OPEN,585,LA SALLE,48283,USA,922140,CORRECTIONAL INSTITUTIONS,"https://www.texastribune.org/library/data/texas-prisons/units/, http://www.tdcj.state.tx.us/unit_directory/index.html",9/15/2016,IMAGERY,2018/01/10 00:00:00,http://www.tdcj.state.tx.us/unit_directory/index.html,MAXIMUM,606,0.00881602868089,1044.45119317931,3.31979407982e-06
490,474,10004704,DOUGLAS COUNTY JAIL,920 SOUTH WASHINGTON STREET,TUSCOLA,IL,61953,NOT AVAILABLE,(217) 253-2913,COUNTY,OPEN,13,DOUGLAS,17041,USA,922140,CORRECTIONAL INSTITUTIONS,http://www.douglascountyil.com/sheriffoffice.html,3/1/2018,IMAGERY,2018/03/01 00:00:00,http://www.douglascountyil.com/sheriffoffice.html,NOT AVAILABLE,36,0.00254701663492,315.033954055618,1.56855035655e-07
491,475,10006068,ROCK COUNTY JAIL,400 STATE STREET,BASSETT,NE,68714,NOT AVAILABLE,NOT AVAILABLE,COUNTY,OPEN,-999,ROCK,31149,USA,922140,CORRECTIONAL INSTITUTIONS,https://ncc.nebraska.gov/jail-standards-inspection-reports,4/5/2018,IMAGERY,2018/04/05 00:00:00,NOT AVAILABLE,NOT AVAILABLE,6,0.00087179896393,114.936424356035,4.74610566842e-08
492,476,10002602,ROCK COUNTY JAIL / SHERIFF,200 E US HWY 14,JANESVILLE,WI,53545,NOT AVAILABLE,(608) 757-7968,COUNTY,OPEN,579,ROCK,55105,USA,922140,CORRECTIONAL INSTITUTIONS,http://www.co.rock.wi.us/sheriff,5/9/2018,IMAGERY,2018/05/09 00:00:00,http://www.co.rock.wi.us/sheriff,NOT AVAILABLE,477,0.00603549818135,770.073162022493,7.6924207399e-07
493,477,10002138,DODGE STATE PRISON,2971 OLD BETHEL CHURCH ROAD,CHESTER,GA,31012,NOT AVAILABLE,(478) 358-7200,STATE,OPEN,1228,DODGE,13091,USA,922140,CORRECTIONAL INSTITUTIONS,"http://www.dcor.state.ga.us/Research/Monthly_Profile_all_inmates, http://www.dcor.state.ga.us/facility-finder",11/2/2017,IMAGERY,2017/11/10 00:00:00,http://www.dcor.state.ga.us/facility-finder,MEDIUM,1236,0.012167938804,1478.34130195159,9.19395758436e-06
494,478,10002144,COFFEE CORRECTIONAL FACILITY,1153 NORTH LIBERTY STREET,NICHOLLS,GA,31554,NOT AVAILABLE,(912) 345-5058,STATE,OPEN,2657,COFFEE,13069,USA,922140,CORRECTIONAL INSTITUTIONS,"http://www.dcor.state.ga.us/Research/Monthly_Profile_all_inmates, http://www.cca.com/locations",11/2/2017,IMAGERY,2017/11/10 00:00:00,http://www.cca.com/locations,MEDIUM,2312,0.0130592969114,1576.00818868872,9.53083028107e-06
495,479,10005317,WILLIAM F. JAMES RANCH,19050 MALAGUERRA AVENUE,MORGAN HILL,CA,95037,NOT AVAILABLE,(408) 201-7600,COUNTY,OPEN,-999,SANTA CLARA,06085,USA,922140,CORRECTIONAL INSTITUTIONS,https://www.sccgov.org/sites/probation/reports/Pages/Annual-Reports.aspx,2/16/2018,IMAGERY,2018/02/16 00:00:00,https://www.sccgov.org/sites/probation/juvinst/pages/default.aspx,JUVENILE,96,0.0110488315768,1346.81910998787,6.7466566145e-06
496,480,10004671,DUPAGE COUNTY JAIL,501 NORTH COUNTY FARM ROAD,WHEATON,IL,60187,NOT AVAILABLE,(630) 682-7256,COUNTY,OPEN,630,DUPAGE,17043,USA,922140,CORRECTIONAL INSTITUTIONS,http://www.dupagesheriff.org/,3/1/2018,IMAGERY,2018/03/01 00:00:00,http://www.dupagesheriff.org/,MAXIMUM,825,0.00587155880934,740.047630496019,1.5369392007e-06
497,481,10006154,DOOLY STATE PRISON,1412 PLUNKETT ROAD,UNADILLA,GA,31091,NOT AVAILABLE,(478) 627-2000,STATE,OPEN,1661,HOUSTON,13093,USA,922140,CORRECTIONAL INSTITUTIONS,"http://www.dcor.state.ga.us/Research/Monthly_Profile_all_inmates, http://www.dcor.state.ga.us/facility-finder",11/2/2017,IMAGERY,2017/11/10 00:00:00,http://www.dcor.state.ga.us/facility-finder,MEDIUM,1702,0.0125691778139,1547.58357769761,1.12572336548e-05
498,482,10001426,COLUMBUS TRANSITIONAL CENTER,3900 SCHATULGA ROAD,COLUMBUS,GA,31907,NOT AVAILABLE,(706) 568-2167,STATE,OPEN,139,MUSCOGEE,13215,USA,922140,CORRECTIONAL INSTITUTIONS,"http://www.dcor.state.ga.us/Research/Monthly_Profile_all_inmates, http://www.dcor.state.ga.us/facility-finder",11/2/2017,IMAGERY,2017/11/10 00:00:00,http://www.dcor.state.ga.us/facility-finder,MINIMUM,182,0.00256037574823,318.410492564458,3.48588304953e-07
499,483,10004703,EDGAR COUNTY JAIL,228 NORTH CENTRAL AVENUE,PARIS,IL,61944,NOT AVAILABLE,(217) 465-4166,COUNTY,OPEN,-999,EDGAR,17045,USA,922140,CORRECTIONAL INSTITUTIONS,https://edgarcountyillinois.com/offices/sheriffs-department/,3/1/2018,IMAGERY,2018/03/01 00:00:00,https://edgarcountyillinois.com/offices/sheriffs-department/,NOT AVAILABLE,28,0.00146833000008,188.516000002623,1.34637974289e-07
500,484,10005321,SANTA CRUZ ROUNTREE MEDIUM SECURITY FACILITY,90 ROUNTREE LANE,WATSONVILLE,CA,95076,NOT AVAILABLE,(831) 454-7873,COUNTY,OPEN,64,SANTA CRUZ,06087,USA,922140,CORRECTIONAL INSTITUTIONS,"http://www.scsheriff.com/Home/Corrections.aspx, http://www.santacruzsentinel.com/santacruz/ci_24268552/grant-could-ease-crowding-at-santa-cruz-county",10/8/2013,IMAGERY,2018/02/16 00:00:00,http://www.scsheriff.com/Home/Corrections.aspx,MEDIUM,94,0.00246831521797,309.270823296458,2.64606281809e-07
501,485,10004496,EMANUEL WOMEN'S FACILITY,714 GUMLOG ROAD,SWAINSBORO,GA,30401,NOT AVAILABLE,(478) 289-2748,STATE,OPEN,395,EMANUEL,13107,USA,922140,CORRECTIONAL INSTITUTIONS,"http://www.dcor.state.ga.us/Research/Monthly_Profile_all_inmates, http://www.dcor.state.ga.us/facility-finder",11/2/2017,IMAGERY,2017/11/10 00:00:00,http://www.dcor.state.ga.us/facility-finder,MEDIUM,415,0.00781848066942,951.367767509334,4.02375856116e-06
502,486,10004497,EMANUEL PROBATION DETENTION CENTER,121 CASA DRIVE,TWIN CITY,GA,30471,NOT AVAILABLE,(478) 763-2400,STATE,OPEN,-999,EMANUEL,13107,USA,922140,CORRECTIONAL INSTITUTIONS,http://www.dcor.state.ga.us/NewsRoom/PressReleases/new-superintendent-named-emanuel-probation-detention-center,11/10/2017,IMAGERY,2017/11/10 00:00:00,http://www.dcor.state.ga.us/facility-finder,MINIMUM,331,0.00801017883504,967.446802566403,2.79736255268e-06
503,487,10004132,SARPY COUNTY LAW ENFORCEMENT CENTER,1208 GOLDEN GATE DR,PAPILLION,NE,68046,NOT AVAILABLE,NOT AVAILABLE,COUNTY,OPEN,145,SARPY,31153,USA,922140,CORRECTIONAL INSTITUTIONS,https://ncc.nebraska.gov/jail-standards-inspection-reports,4/5/2018,IMAGERY/OTHER,2018/04/05 00:00:00,https://apps.sarpy.com/sheriff/index.html,NOT AVAILABLE,148,0.0022459357452,272.533289711878,2.34857183357e-07
504,488,10000298,GA DIAGNOSTIC & CLASSIFICATION STATE PRISON,2978 STATE HWYY 36 W PRISON BLVD,JACKSON,GA,30233,NOT AVAILABLE,(770) 504-2000,STATE,OPEN,3371,BUTTS,13035,USA,922140,CORRECTIONAL INSTITUTIONS,"http://www.dcor.state.ga.us/Research/Monthly_Profile_all_inmates, http://www.dcor.state.ga.us/facility-finder",11/2/2017,IMAGERY,2017/11/10 00:00:00,http://www.dcor.state.ga.us/facility-finder,CLOSE,2487,0.0211292106249,2522.37115812771,1.93551374632e-05
505,489,10002141,GEORGIA STATE PRISON,300 1ST AVENUE SOUTH,REIDSVILLE,GA,30453,NOT AVAILABLE,(912) 557-7301,STATE,OPEN,1454,TATTNALL,13267,USA,922140,CORRECTIONAL INSTITUTIONS,"http://www.dcor.state.ga.us/Research/Monthly_Profile_all_inmates, http://www.dcor.state.ga.us/facility-finder",11/2/2017,IMAGERY,2017/11/10 00:00:00,http://www.dcor.state.ga.us/facility-finder,MAXIMUM,1530,0.0235133922461,2834.16363655345,1.69790130962e-05
506,490,10000297,HANCOCK STATE PRISON,701 PRISON BLVD,SPARTA,GA,31087,NOT AVAILABLE,(706) 444-1000,STATE,OPEN,1143,HANCOCK,13141,USA,922140,CORRECTIONAL INSTITUTIONS,"http://www.dcor.state.ga.us/Research/Monthly_Profile_all_inmates, http://www.dcor.state.ga.us/facility-finder",11/2/2017,IMAGERY,2017/11/10 00:00:00,http://www.dcor.state.ga.us/facility-finder,CLOSE,1191,0.0131727625204,1561.91605705465,1.13224148003e-05
507,491,10001528,SANTA CRUZ BLAINE STREET FACILITY,141 BLAINE STREET,SANTA CRUZ,CA,95060,NOT AVAILABLE,(831) 454-2177,COUNTY,OPEN,14,SANTA CRUZ,06087,USA,922140,CORRECTIONAL INSTITUTIONS,http://www.scsheriff.com/Home/Corrections.aspx,2/15/2016,IMAGERY,2018/02/16 00:00:00,http://www.scsheriff.com/Home/Corrections.aspx,MINIMUM,32,0.00107452192661,129.969358298694,4.74626316233e-08
508,492,10004725,EDWARDS COUNTY JAIL,50 EAST MAIN STREET,ALBION,IL,62806,NOT AVAILABLE,(618) 445-2721,COUNTY,OPEN,-999,EDWARDS,17047,USA,922140,CORRECTIONAL INSTITUTIONS,http://www.ecsheriff.org/,3/1/2018,IMAGERY,2018/03/01 00:00:00,http://www.ecsheriff.org/,NOT AVAILABLE,1,0.00154667666812,197.288414836092,1.48996720847e-07
509,493,10006779,FLORIDA PARISHES JUVENILE DETENTION CENTER,28528 HIGHWAY 190,COVINGTON,LA,70433,NOT AVAILABLE,(985) 893-6292,COUNTY,OPEN,-999,TANGIPAHOA,22105,USA,922140,CORRECTIONAL INSTITUTIONS,http://fpjdc.org/,3/16/2018,IMAGERY,2018/03/16 00:00:00,http://fpjdc.org/,JUVENILE,133,0.00992200180255,1203.26443500169,2.43004174885e-06
510,494,10002603,ROCK COUNTY JUVENILE DETENTION CENTER,210 E US HWY 14,JANESVILLE,WI,53545,NOT AVAILABLE,NOT AVAILABLE,COUNTY,OPEN,-999,ROCK,55105,USA,922140,CORRECTIONAL INSTITUTIONS,http://www.co.rock.wi.us/hsd-youth-services-center,5/9/2018,IMAGERY,2018/05/09 00:00:00,NOT AVAILABLE,JUVENILE,-999,0.00260014091434,329.632021229541,2.65199802184e-07
511,495,10004131,PATRICK J THOMAS JUVENILE JUSTICE CENTER,9701 PORTAL RD,PAPILLION,NE,68046,NOT AVAILABLE,(402) 537-7000,COUNTY,OPEN,9,SARPY,31153,USA,922140,CORRECTIONAL INSTITUTIONS,https://ncc.nebraska.gov/jail-standards-inspection-reports,4/5/2018,IMAGERY,2018/04/05 00:00:00,https://apps.sarpy.com/sheriff/index.html,JUVENILE,36,0.00334793605209,419.497487858174,4.49560683341e-07
512,496,10005218,ARCHULETA COUNTY JAIL,449 SAN JUAN STREET,PAGOSA SPRINGS,CO,81147,NOT AVAILABLE,(970) 264-8461,COUNTY,OPEN,-999,ARCHULETA,08007,USA,922140,CORRECTIONAL INSTITUTIONS,http://www.archuletacounty.org/95/Sheriff,2/19/2018,IMAGERY,2018/02/19 00:00:00,http://www.archuletacounty.org/95/Sheriff,NOT AVAILABLE,8,0.00160396656276,200.819574482616,1.60669754814e-07
513,497,10004715,EFFINGHAM COUNTY JAIL,101 NORTH 4TH STREET,EFFINGHAM,IL,62401,NOT AVAILABLE,(217) 342-3866,COUNTY,OPEN,-999,EFFINGHAM,17049,USA,922140,CORRECTIONAL INSTITUTIONS,http://www.ilsheriff.org/index.php/directory,3/1/2018,IMAGERY,2018/03/01 00:00:00,http://co.effingham.il.us/sheriff-department,NOT AVAILABLE,60,0.00314664485269,379.264875645138,4.37013756646e-07
514,498,10001480,FAYETTE COUNTY JAIL,"221 SOUTH 7TH STREET, ROOM 500",VANDALIA,IL,62471,NOT AVAILABLE,(618) 283-2141,COUNTY,OPEN,-999,FAYETTE,17051,USA,922140,CORRECTIONAL INSTITUTIONS,http://il-fayettecounty.civicplus.com/2164/County-Sheriff,3/1/2018,IMAGERY,2018/03/01 00:00:00,http://il-fayettecounty.civicplus.com/2164/County-Sheriff,NOT AVAILABLE,70,0.00195612934884,243.389237374005,1.7416180603e-07
515,499,10006581,MISSOULA PRE-RELEASE CENTER,2350 MULLAN RD,MISSOULA,MT,59808,NOT AVAILABLE,(406) 541-9200,STATE,OPEN,172,MISSOULA,30063,USA,922140,CORRECTIONAL INSTITUTIONS,https://cor.mt.gov/publications,12/8/2017,IMAGERY,2017/12/11 00:00:00,http://cor.mt.gov/FamilyFriends/Visiting,NOT AVAILABLE,134,0.00288188270327,375.56929066532,3.90653462225e-07
516,500,10000284,HAYS STATE PRISON,777 UNDERWOOD DRIVE,TRION,GA,30753,NOT AVAILABLE,(706) 857-0400,STATE,OPEN,1065,CHATTOOGA,13055,USA,922140,CORRECTIONAL INSTITUTIONS,"http://www.dcor.state.ga.us/Research/Monthly_Profile_all_inmates, http://www.dcor.state.ga.us/facility-finder",11/2/2017,IMAGERY,2017/11/10 00:00:00,http://www.dcor.state.ga.us/facility-finder,CLOSE,1100,0.0128047261564,1619.56419707995,1.11686953166e-05
517,501,10000151,DALHART PRISON,11950 FM 998,DALHART,TX,79022,NOT AVAILABLE,(806) 249-8655,STATE,OPEN,1027,HARTLEY,48205,USA,922140,CORRECTIONAL INSTITUTIONS,"https://www.texastribune.org/library/data/texas-prisons/units/, http://www.tdcj.state.tx.us/unit_directory/index.html",9/15/2016,IMAGERY,2018/01/11 00:00:00,http://www.tdcj.state.tx.us/unit_directory/index.html,MAXIMUM,1398,0.0133086240834,1640.34534076818,1.12005254456e-05
518,502,10005260,SHASTA COUNTY JAIL,1655 WEST STREET,REDDING,CA,96001,NOT AVAILABLE,NOT AVAILABLE,COUNTY,OPEN,337,SHASTA,06089,USA,922140,CORRECTIONAL INSTITUTIONS,"http://www.bscc.ca.gov/s_fsojailprofilesurvey.php, https://www.co.shasta.ca.us/index/sheriff_index/divisions/custody.aspx",2/16/2018,IMAGERY,2018/02/16 00:00:00,https://www.co.shasta.ca.us/index/sheriff_index/divisions/custody.aspx,NOT AVAILABLE,381,0.00242252312757,310.743086610259,3.61208199106e-07
519,503,10000174,PRICE DANIEL UNIT,938 S FM 1673,SNYDER,TX,79549,NOT AVAILABLE,(325) 573-1114,STATE,OPEN,1340,SCURRY,48415,USA,922140,CORRECTIONAL INSTITUTIONS,"https://www.texastribune.org/library/data/texas-prisons/units/, http://www.tdcj.state.tx.us/unit_directory/index.html",9/15/2016,IMAGERY,2018/01/11 00:00:00,http://www.tdcj.state.tx.us/unit_directory/index.html,MAXIMUM,1384,0.0125213516451,1525.70165076474,1.01525985447e-05
520,504,10001415,HELMS FACILITY,1275 CONSTITUTION ROAD SE,ATLANTA,GA,30316,NOT AVAILABLE,(404) 624-2413,STATE,OPEN,28,DEKALB,13089,USA,922140,CORRECTIONAL INSTITUTIONS,"http://www.dcor.state.ga.us/Research/Monthly_Profile_all_inmates, http://www.dcor.state.ga.us/facility-finder",11/2/2017,IMAGERY,2017/11/10 00:00:00,http://www.dcor.state.ga.us/facility-finder,MINIMUM,64,0.00393797788159,471.912373262576,7.30486565373e-07
521,505,10000246,DARRINGTON UNIT,59 DARRINGTON RD,ROSHARON,TX,77583,NOT AVAILABLE,(281) 595-3465,STATE,OPEN,1837,BRAZORIA,48039,USA,922140,CORRECTIONAL INSTITUTIONS,"https://www.texastribune.org/library/data/texas-prisons/units/, http://www.tdcj.state.tx.us/unit_directory/index.html",9/15/2016,IMAGERY,2018/01/11 00:00:00,http://www.tdcj.state.tx.us/unit_directory/index.html,MAXIMUM,1931,0.0132497799352,1545.4167631885,6.47593355919e-06
522,506,10005259,SHASTA COUNTY JUVENILE HALL,2680 RADIO LANE,REDDING,CA,96001,NOT AVAILABLE,(530) 225-5230,COUNTY,OPEN,35,SHASTA,06089,USA,922140,CORRECTIONAL INSTITUTIONS,http://www.co.shasta.ca.us/html/Grand_Jury/docs/0910_Reports/CriminalGJRpt2009-10.pdf,2/15/2016,IMAGERY,2018/02/16 00:00:00,https://www.co.shasta.ca.us/index/probation_index/juvenile_division.aspx,JUVENILE,90,0.00786768460753,959.60707566868,1.4619348373e-06
523,507,10001654,TANGIPAHOA PARISH PRISON,101 CAMPO LANE,AMITE,LA,70422,NOT AVAILABLE,(985) 748-3363,COUNTY,OPEN,498,TANGIPAHOA,22105,USA,922140,CORRECTIONAL INSTITUTIONS,http://doc.louisiana.gov/briefing-book,9/29/2017,IMAGERY,2018/03/16 00:00:00,https://tpso.org/,MINIMUM,561,0.00626732309546,756.294986345114,2.0062135745e-06
524,508,10002539,ST CROIX COUNTY JAIL,"1101 CARMICHAEL RD, LOWER LEVEL",HUDSON,WI,54016,NOT AVAILABLE,(715) 386-4752,COUNTY,OPEN,105,ST. CROIX,55109,USA,922140,CORRECTIONAL INSTITUTIONS,https://www.sccwi.gov/618/Safety-and-Justice,5/9/2018,IMAGERY,2018/05/09 00:00:00,NOT AVAILABLE,NOT AVAILABLE,-999,0.00543853237759,699.827635437587,8.79279731573e-07
525,509,10006453,JENKINS CORRECTIONAL FACILITY,3404 KENT FARM DRIVE,MILLEN,GA,30442,NOT AVAILABLE,(478) 982-6300,STATE,OPEN,1171,JENKINS,13165,USA,922140,CORRECTIONAL INSTITUTIONS,"http://www.dcor.state.ga.us/Research/Monthly_Profile_all_inmates, http://www.cca.com/locations",11/2/2017,IMAGERY,2017/11/10 00:00:00,http://www.cca.com/locations,MEDIUM,1124,0.0107194421525,1296.81261444207,7.45026525078e-06
526,510,10000303,JOHNSON STATE PRISON,290 DONOVAN-HARRISON ROAD,WRIGHTSVILLE,GA,31096,NOT AVAILABLE,(478) 864-4100,STATE,OPEN,1583,JOHNSON,13167,USA,922140,CORRECTIONAL INSTITUTIONS,"http://www.dcor.state.ga.us/Research/Monthly_Profile_all_inmates, http://www.dcor.state.ga.us/facility-finder",11/2/2017,IMAGERY,2017/11/10 00:00:00,http://www.dcor.state.ga.us/facility-finder,MEDIUM,1612,0.012737197028,1554.60833248068,1.13071645271e-05
527,511,10000323,LEE STATE PRISON,153 PINEWOOD DRIVE,LEESBURG,GA,31763,NOT AVAILABLE,(229) 759-3110,STATE,OPEN,740,LEE,13177,USA,922140,CORRECTIONAL INSTITUTIONS,"http://www.dcor.state.ga.us/Research/Monthly_Profile_all_inmates, http://www.dcor.state.ga.us/facility-finder",11/2/2017,IMAGERY,2017/11/10 00:00:00,http://www.dcor.state.ga.us/facility-finder,MEDIUM,762,0.00982250823384,1181.33155313757,6.37298812404e-06
528,512,10003628,MONTANA STATE HOSPITAL - FORENSIC MENTAL HEALTH FACILITY,1316 GALEN RD,DEER LODGE,MT,59722,NOT AVAILABLE,NOT AVAILABLE,STATE,OPEN,-999,DEER LODGE,30023,USA,922140,CORRECTIONAL INSTITUTIONS,http://helenair.com/news/politics/state/forensic-mental-health-facility-opening-soon-in-galen/article_04240244-c902-51e8-9fc1-d77f1ed1c305.html,1/11/2016,IMAGERY,2017/12/12 00:00:00,NOT AVAILABLE,NOT AVAILABLE,60,0.00525577578181,672.484779764901,1.22888403541e-06
529,513,10005199,LONG STATE PRISON,1434 US HWY 84 EAST,LUDOWICI,GA,31316,NOT AVAILABLE,(912) 545-3777,STATE,OPEN,208,LONG,13183,USA,922140,CORRECTIONAL INSTITUTIONS,"http://www.dcor.state.ga.us/Research/Monthly_Profile_all_inmates, http://www.dcor.state.ga.us/facility-finder",11/2/2017,IMAGERY,2017/11/10 00:00:00,http://www.dcor.state.ga.us/facility-finder,MEDIUM,232,0.00489736687664,606.093059579745,1.50993025954e-06
530,514,10005277,SIERRA COUNTY JAIL,100 COURTHOUSE SQUARE,DOWNIEVILLE,CA,95936,NOT AVAILABLE,(530) 289-3700,COUNTY,OPEN,-999,SIERRA,06091,USA,922140,CORRECTIONAL INSTITUTIONS,https://www.sierracounty.ca.gov/298/Sheriff-Coroner,2/16/2018,IMAGERY,2018/02/16 00:00:00,https://www.sierracounty.ca.gov/298/Sheriff-Coroner,NOT AVAILABLE,-999,0.00122495953385,158.900329870959,9.49349874394e-08
531,515,10000197,DIBOLL CORRECTIONAL CENTER,1604 S 1ST ST,DIBOLL,TX,75941,NOT AVAILABLE,(936) 829-2295,STATE,OPEN,511,ANGELINA,48005,USA,922140,CORRECTIONAL INSTITUTIONS,"https://www.texastribune.org/library/data/texas-prisons/units/, http://www.tdcj.state.tx.us/unit_directory/index.html",9/15/2016,IMAGERY,2018/01/11 00:00:00,http://www.mtctrains.com/corrections/#locations,MEDIUM,518,0.0163944301943,2012.23191613636,1.51602677777e-05
532,516,10005912,TENSAS PARISH JAIL,203 HANCOCK,SAINT JOSEPH,LA,71366,NOT AVAILABLE,(318) 766-3961,COUNTY,NOT AVAILABLE,18,TENSAS,22107,USA,922140,CORRECTIONAL INSTITUTIONS,http://www.tensas.lavns.org/,3/4/2016,UNVERIFIED,2018/03/16 00:00:00,NOT AVAILABLE,NOT AVAILABLE,-999,0.00346792930981,410.606035713334,7.27945459444e-07
533,517,10005246,CHARLIE BYRD YOUTH CORRECTIONS CENTER,269 SHARPS ROAD,YREKA,CA,96097,NOT AVAILABLE,(530) 841-4180,COUNTY,OPEN,20,SISKIYOU,06093,USA,922140,CORRECTIONAL INSTITUTIONS,http://www.co.siskiyou.ca.us/page/probation-department,2/16/2018,IMAGERY,2018/02/16 00:00:00,http://www.co.siskiyou.ca.us/page/probation-department,JUVENILE,40,0.00333093862013,425.825235614014,3.56039787798e-07
534,518,10006078,SCOTTS BLUFF COUNTY DETENTION CENTER,2522 7TH STREET,GERING,NE,69341,NOT AVAILABLE,(308) 436-7300,COUNTY,OPEN,195,SCOTTS BLUFF,31157,USA,922140,CORRECTIONAL INSTITUTIONS,https://ncc.nebraska.gov/jail-standards-inspection-reports,4/5/2018,IMAGERY/OTHER,2018/04/05 00:00:00,http://www.scottsbluffcounty.org/justice-system.html,NOT AVAILABLE,176,0.00466894818787,626.480123493492,8.39607321569e-07
535,519,10006863,BELL COUNTY LOOP JAIL,2405 S. LOOP 121,BELTON,TX,76513,NOT AVAILABLE,(254) 933-5400,COUNTY,OPEN,-999,BELL,48027,USA,922140,CORRECTIONAL INSTITUTIONS,http://www.bellcountytx.com/county_government/sheriff/index.php,4/25/2018,IMAGERY,2018/04/25 00:00:00,http://www.bellcountytx.com/county_government/sheriff/index.php,NOT AVAILABLE,-999,0.00643793357291,758.562579484372,1.19059557274e-06
536,520,10001161,MONTANA CHEMICAL DEPENDENCY CENTER,525 E. MERCURY,BUTTE,MT,59701,NOT AVAILABLE,(406) 496-5400,STATE,OPEN,0,SILVER BOW,30093,USA,922140,CORRECTIONAL INSTITUTIONS,https://cor.mt.gov/publications,12/8/2017,IMAGERY,2017/12/12 00:00:00,http://dphhs.mt.gov/amdd/MCDC,NOT AVAILABLE,5,0.00462644306346,585.471088434577,1.14563801073e-06
537,521,10002137,MACON STATE PRISON,2728 SOUTH 49 HWY,OGLETHORPE,GA,31068,NOT AVAILABLE,(478) 472-3400,STATE,OPEN,1703,MACON,13193,USA,922140,CORRECTIONAL INSTITUTIONS,http://www.dcor.state.ga.us/Research/Monthly_Profile_all_inmates,11/2/2017,IMAGERY,2017/11/10 00:00:00,http://www.dcor.state.ga.us/facility-finder,CLOSE,1762,0.0137086664549,1635.85833980949,1.19947039878e-05
538,522,10003629,MONTANA STATE HOSPITAL,300 GARNET WAY,WARM SPRINGS,MT,59756,NOT AVAILABLE,(406) 693-7000,STATE,OPEN,168,DEER LODGE,30023,USA,922140,CORRECTIONAL INSTITUTIONS,http://dphhs.mt.gov/amdd/MSH,12/12/2017,IMAGERY,2017/12/12 00:00:00,http://dphhs.mt.gov/amdd/MSH,MAXIMUM,200,0.0177773736766,2460.20682611243,1.81712977562e-05
539,523,10002893,DOMINGUEZ STATE PRISON,6535 CAGNON RD,SAN ANTONIO,TX,78252,2202,(210) 675-6620,STATE,OPEN,2098,BEXAR,48029,USA,922140,CORRECTIONAL INSTITUTIONS,"https://www.texastribune.org/library/data/texas-prisons/units/, http://www.tdcj.state.tx.us/unit_directory/index.html",9/15/2016,IMAGERY,2018/01/11 00:00:00,http://www.tdcj.state.tx.us/unit_directory/index.html,MAXIMUM,2276,0.0140062844518,1626.45222398325,9.89007544817e-06
540,524,10001423,MACON TRANSITIONAL CENTER,200 HENRY ST,MACON,GA,31206,NOT AVAILABLE,(478) 751-6090,STATE,OPEN,157,BIBB,13021,USA,922140,CORRECTIONAL INSTITUTIONS,"http://www.dcor.state.ga.us/Research/Monthly_Profile_all_inmates, http://www.dcor.state.ga.us/facility-finder",11/2/2017,IMAGERY,2017/11/10 00:00:00,http://www.dcor.state.ga.us/facility-finder,MINIMUM,156,0.0037672341012,447.604604073218,5.06989569487e-07
541,525,10001157,TREASURE STATE CORRECTIONAL TRAINING CENTER,1100 CONLEY LAKE RD,DEER LODGE,MT,59722,NOT AVAILABLE,NOT AVAILABLE,STATE,CLOSED,0,POWELL,30077,USA,922140,CORRECTIONAL INSTITUTIONS,"https://cor.mt.gov/publications, http://www.greatfallstribune.com/story/news/local/2017/04/13/senators-fight-keep-boot-camp-program/100426912/",4/13/2017,IMAGERY,2017/12/12 00:00:00,NOT AVAILABLE,MINIMUM,60,0.00363212120537,447.998197405024,2.98266240494e-07
542,526,10006733,FORD COUNTY JAIL,235 N. AMERICAN,PAXTON,IL,60957,NOT AVAILABLE,(217) 379-2324,COUNTY,OPEN,-999,FORD,17053,USA,922140,CORRECTIONAL INSTITUTIONS,http://www.ilsheriff.org/index.php/directory,3/1/2018,IMAGERY,2018/03/01 00:00:00,http://fordcounty.illinois.gov/sheriff/,NOT AVAILABLE,61,0.00181832387373,228.116154472294,1.54840023315e-07
543,527,10000787,SOLANO COUNTY CLAYBANK DETENTION FACILITY,2500 CLAYBANK ROAD,FAIRFIELD,CA,94533,NOT AVAILABLE,NOT AVAILABLE,COUNTY,OPEN,236,SOLANO,06095,USA,922140,CORRECTIONAL INSTITUTIONS,http://www.bscc.ca.gov/s_fsojailprofilesurvey.php,2/16/2018,IMAGERY,2018/02/16 00:00:00,http://www.co.solano.ca.us/depts/sheriff/custody_division/default.asp,NOT AVAILABLE,419,0.00488800558686,596.432202431343,8.49728313917e-07
544,528,10002892,BEXAR COUNTY ADULT DETENTION CENTER,200 N COMAL ST,SAN ANTONIO,TX,78207,NOT AVAILABLE,(210) 335-6219,COUNTY,OPEN,-999,BEXAR,48029,USA,922140,CORRECTIONAL INSTITUTIONS,http://www.bexar.org/2562/Adult-Detention-Bureau,4/25/2018,IMAGERY,2018/04/25 00:00:00,http://www.bexar.org/2562/Adult-Detention-Bureau,NOT AVAILABLE,2830,0.00559318910869,685.958546910807,1.05562767249e-06
545,529,10002582,SAUK COUNTY JAIL,1300 LANGE COURT,BARABOO,WI,53913,NOT AVAILABLE,(608) 355-3210,COUNTY,OPEN,185,SAUK,55111,USA,922140,CORRECTIONAL INSTITUTIONS,https://www.co.sauk.wi.us/sheriffsoffice,5/9/2018,IMAGERY,2018/05/09 00:00:00,NOT AVAILABLE,MAXIMUM,463,0.00671863724163,922.366750829362,1.55262009281e-06
546,530,10000198,DUNCAN GERIATRIC FACILITY,1502 S 1ST ST,DIBOLL,TX,75941,NOT AVAILABLE,(936) 829-2616,STATE,OPEN,538,ANGELINA,48005,USA,922140,CORRECTIONAL INSTITUTIONS,"https://www.texastribune.org/library/data/texas-prisons/units/, http://www.tdcj.state.tx.us/unit_directory/index.html",9/15/2016,IMAGERY,2018/01/11 00:00:00,http://www.tdcj.state.tx.us/unit_directory/index.html,NOT AVAILABLE,606,0.008539713039,1044.75183794492,3.73871033277e-06
547,531,10001786,ALBEMARLE CORRECTIONAL INSTITUTION,44150 AIRPORT RD,NEW LONDON,NC,28127,NOT AVAILABLE,(704) 422-3036,STATE,OPEN,850,STANLY,37167,USA,922140,CORRECTIONAL INSTITUTIONS,"http://webapps6.doc.state.nc.us/apps/asqExt/ASQ, https://www.ncdps.gov/Adult-Corrections/Prisons/Prison-Facilities",10/31/2017,IMAGERY,2017/12/12 00:00:00,https://www.ncdps.gov/Adult-Corrections/Prisons/Prison-Facilities,MEDIUM,816,0.0122653387024,1465.69847082272,9.09070581246e-06
548,532,10001414,METRO TRANSITIONAL CENTER,1303 CONSTITUTION ROAD,ATLANTA,GA,30316,NOT AVAILABLE,(404) 624-2380,STATE,OPEN,229,DEKALB,13089,USA,922140,CORRECTIONAL INSTITUTIONS,"http://www.dcor.state.ga.us/Research/Monthly_Profile_all_inmates, http://www.dcor.state.ga.us/facility-finder",11/2/2017,IMAGERY,2017/11/10 00:00:00,http://www.dcor.state.ga.us/facility-finder,MINIMUM,235,0.00221878357523,266.511611024131,2.40990079764e-07
549,533,10002784,EAST TEXAS TREATMENT FACILITY,900 INDUSTRIAL DR,HENDERSON,TX,75652,NOT AVAILABLE,(903) 655-3300,STATE,OPEN,482,RUSK,48401,USA,922140,CORRECTIONAL INSTITUTIONS,"https://www.texastribune.org/library/data/texas-prisons/units/, http://www.tdcj.state.tx.us/unit_directory/index.html",9/15/2016,IMAGERY,2018/01/11 00:00:00,http://www.mtctrains.com/corrections/#locations,MINIMUM,2236,0.0095143109909,1140.26715779123,4.33005842378e-06
550,534,10006098,SEWARD COUNTY JAIL,261 SOUTH 8TH STREET,SEWARD,NE,68434,NOT AVAILABLE,(402) 643-9453,COUNTY,OPEN,16,SEWARD,31159,USA,922140,CORRECTIONAL INSTITUTIONS,https://ncc.nebraska.gov/jail-standards-inspection-reports,4/5/2018,IMAGERY,2018/04/05 00:00:00,http://www.countyofsewardne.com/jail,NOT AVAILABLE,58,0.00269162379883,343.941179548168,2.66269710782e-07
551,535,10001023,ALEXANDER CORRECTIONAL INSTITUTION,633 OLD LANDFILL RD,TAYLORSVILLE,NC,28681,NOT AVAILABLE,(828) 632-1331,STATE,OPEN,1197,ALEXANDER,37003,USA,922140,CORRECTIONAL INSTITUTIONS,"http://webapps6.doc.state.nc.us/apps/asqExt/ASQ, https://www.ncdps.gov/Adult-Corrections/Prisons/Prison-Facilities",10/31/2017,IMAGERY,2017/12/12 00:00:00,https://www.ncdps.gov/Adult-Corrections/Prisons/Prison-Facilities,CLOSE,1180,0.0174076171778,2141.99940354628,1.11571484467e-05
552,536,10004729,FRANKLIN COUNTY JAIL,403 EAST MAIN STREET,BENTON,IL,62812,NOT AVAILABLE,(618) 439-9553,COUNTY,OPEN,8,FRANKLIN,17055,USA,922140,CORRECTIONAL INSTITUTIONS,"http://www.franklincountyil.gov/sheriff, http://www.ilsheriff.org/index.php/directory",3/1/2018,IMAGERY,2018/03/01 00:00:00,http://www.franklincountyil.gov/sheriff,NOT AVAILABLE,101,0.00238473445318,307.780599765141,3.11457395119e-07
553,537,10006780,TERREBONNE PARISH JUVENILE JUSTICE COMPLEX,180 GOVERNMENT STREET,GRAY,LA,70359,NOT AVAILABLE,(985) 853-1201,COUNTY,OPEN,-999,TERREBONNE,22109,USA,922140,CORRECTIONAL INSTITUTIONS,https://www.tpcg.org/index.php?f=juvenile,3/16/2018,IMAGERY,2018/03/16 00:00:00,https://www.tpcg.org/index.php?f=juvenile,JUVENILE,-999,0.00305701751343,355.020800582708,4.10960571103e-07
554,538,10001639,UNION PARISH DETENTION CENTER,707 RODEO CIRCLE,FARMERVILLE,LA,71241,NOT AVAILABLE,(318) 368-9827,COUNTY,OPEN,381,UNION,22111,USA,922140,CORRECTIONAL INSTITUTIONS,http://doc.louisiana.gov/briefing-book,9/29/2017,IMAGERY,2018/03/16 00:00:00,http://www.unionsheriff.com/unionparishdetentioncenter.htm,NOT AVAILABLE,388,0.00547844052243,660.357908156814,1.64303877732e-06
555,539,10006074,THURSTON COUNTY JAIL,106 SOUTH 5TH STREET,PENDER,NE,68047,NOT AVAILABLE,NOT AVAILABLE,COUNTY,OPEN,12,THURSTON,31173,USA,922140,CORRECTIONAL INSTITUTIONS,https://ncc.nebraska.gov/jail-standards-inspection-reports,4/5/2018,IMAGERY,2018/04/05 00:00:00,NOT AVAILABLE,NOT AVAILABLE,24,0.00161041799993,199.073399998248,1.08483255466e-07
556,540,10006322,RIVERBEND CORRECTIONAL FACILITY,196 LAYING FARM ROAD,MILLEDGEVILLE,GA,31061,NOT AVAILABLE,(478) 414-2300,STATE,OPEN,1497,BALDWIN,13009,USA,922140,CORRECTIONAL INSTITUTIONS,"http://www.dcor.state.ga.us/Research/Monthly_Profile_all_inmates, https://www.geogroup.com/Locations",11/2/2017,IMAGERY,2017/11/13 00:00:00,https://www.geogroup.com/Locations,MEDIUM,1500,0.0101021004765,1213.29143051412,6.45353991574e-06
557,541,10002108,PAULDING PROBATION DETENTION CENTER,1295 N INDUSTRIAL BLVD,DALLAS,GA,30132,NOT AVAILABLE,(770) 443-7807,STATE,OPEN,150,PAULDING,13223,USA,922140,CORRECTIONAL INSTITUTIONS,http://www.dcor.state.ga.us/facility-finder,9/1/2014,IMAGERY,2017/11/13 00:00:00,http://www.dcor.state.ga.us/facility-finder,MINIMUM,260,0.00536453818728,638.977132651452,1.89958175153e-06
558,542,10000304,RUTLEDGE STATE PRISON,7175 MANOR ROAD,COLUMBUS,GA,31907,NOT AVAILABLE,(706) 568-2340,STATE,OPEN,601,MUSCOGEE,13215,USA,922140,CORRECTIONAL INSTITUTIONS,"http://www.dcor.state.ga.us/Research/Monthly_Profile_all_inmates, http://www.dcor.state.ga.us/facility-finder",11/2/2017,IMAGERY,2017/11/13 00:00:00,http://www.dcor.state.ga.us/facility-finder,MEDIUM,640,0.0100732091241,1214.30427900753,5.81730633169e-06
559,543,10002822,EASTHAM PRISON AND TRUSTY CAMP,2665 PRISON ROAD #1,LOVELADY,TX,75851,NOT AVAILABLE,(936) 636-7321,STATE,OPEN,2425,HOUSTON,48225,USA,922140,CORRECTIONAL INSTITUTIONS,"https://www.texastribune.org/library/data/texas-prisons/units/, http://www.tdcj.state.tx.us/unit_directory/index.html",9/15/2016,IMAGERY,2018/01/11 00:00:00,http://www.tdcj.state.tx.us/unit_directory/index.html,MAXIMUM,2474,0.0188594280391,2275.48846585934,9.87836435756e-06
560,544,10004515,SMITH TRANSITIONAL CENTER,8631 UNITED STATES HIGHWAY 301 NORTH,CLAXTON,GA,30417,NOT AVAILABLE,(912) 739-1911,STATE,OPEN,199,EVANS,13109,USA,922140,CORRECTIONAL INSTITUTIONS,"http://www.dcor.state.ga.us/Research/Monthly_Profile_all_inmates, http://www.dcor.state.ga.us/facility-finder",11/2/2017,IMAGERY,2017/11/13 00:00:00,http://www.dcor.state.ga.us/facility-finder,MINIMUM,213,0.00395288144444,476.711905262674,1.03713700061e-06
561,545,10000309,SMITH STATE PRISON & PROBATION CENTER,9676 UNITED STATES HIGHWAY 301 NORTH,GLENNVILLE,GA,30427,NOT AVAILABLE,(912) 654-5000,STATE,OPEN,1514,TATTNALL,13267,USA,922140,CORRECTIONAL INSTITUTIONS,"http://www.dcor.state.ga.us/Research/Monthly_Profile_all_inmates, http://www.dcor.state.ga.us/facility-finder",11/2/2017,IMAGERY,2017/11/13 00:00:00,http://www.dcor.state.ga.us/facility-finder,CLOSE,1615,0.0128059042637,1545.43536613729,1.1369854902e-05
562,546,10002105,PHILLIPS TRANSITIONAL CENTER,2989 W ROCK QUARRY ROAD,BUFORD,GA,30519,NOT AVAILABLE,(770) 932-4646,STATE,OPEN,194,GWINNETT,13135,USA,922140,CORRECTIONAL INSTITUTIONS,"http://www.dcor.state.ga.us/Research/Monthly_Profile_all_inmates, http://www.dcor.state.ga.us/facility-finder",11/2/2017,IMAGERY,2017/11/13 00:00:00,http://www.dcor.state.ga.us/facility-finder,MINIMUM,300,0.00308356825603,366.184128862791,5.69232345735e-07
563,547,10002106,PHILLIPS STATE PRISON,2989 WEST ROCK QUARRY ROAD,BUFORD,GA,30519,NOT AVAILABLE,(770) 932-4500,STATE,OPEN,1048,GWINNETT,13135,USA,922140,CORRECTIONAL INSTITUTIONS,"http://www.dcor.state.ga.us/Research/Monthly_Profile_all_inmates, http://www.dcor.state.ga.us/facility-finder",11/2/2017,IMAGERY,2017/11/13 00:00:00,http://www.dcor.state.ga.us/facility-finder,MEDIUM,918,0.0141606071534,1683.8783756216,1.16787545293e-05
564,548,10000307,PULASKI STATE PRISON,373 UPPER RIVER ROAD,HAWKINSVILLE,GA,31036,NOT AVAILABLE,(478) 783-6000,STATE,OPEN,1162,PULASKI,13235,USA,922140,CORRECTIONAL INSTITUTIONS,"http://www.dcor.state.ga.us/Research/Monthly_Profile_all_inmates, http://www.dcor.state.ga.us/facility-finder",11/2/2017,IMAGERY,2017/11/13 00:00:00,http://www.dcor.state.ga.us/facility-finder,MEDIUM,1223,0.012315848246,1486.54172364696,1.11242890474e-05
565,549,10000310,ROGERS STATE PRISON,1978 GEORGIA HIGHWAY 147,REIDSVILLE,GA,30453,NOT AVAILABLE,(912) 557-7771,STATE,OPEN,1398,TATTNALL,13267,USA,922140,CORRECTIONAL INSTITUTIONS,"http://www.dcor.state.ga.us/Research/Monthly_Profile_all_inmates, http://www.dcor.state.ga.us/facility-finder",11/2/2017,IMAGERY,2017/11/13 00:00:00,http://www.dcor.state.ga.us/facility-finder,MEDIUM,1391,0.014742851126,1748.43757420892,9.53570822157e-06
566,550,10005201,TURNER,514 SOUTH RAILROAD AVE,SYCAMORE,GA,31790,NOT AVAILABLE,(229) 567-4301,STATE,OPEN,1,TURNER,13287,USA,922140,CORRECTIONAL INSTITUTIONS,http://www.dcor.state.ga.us/facility-finder,9/1/2014,IMAGERY,2017/11/13 00:00:00,http://www.dcor.state.ga.us/facility-finder,MEDIUM,232,0.00515294812455,609.687070588678,1.53937683434e-06
567,551,10006711,SOLANO COUNTY STANTON CORRECTIONAL FACILITY,2450 CLAYBANK ROAD,FAIRFIELD,CA,94533,NOT AVAILABLE,NOT AVAILABLE,COUNTY,OPEN,272,SOLANO,06095,USA,922140,CORRECTIONAL INSTITUTIONS,http://www.bscc.ca.gov/s_fsojailprofilesurvey.php,2/16/2018,IMAGERY/OTHER,2018/02/16 00:00:00,https://www.solanocounty.com/depts/sheriff/custody_division/default.asp,NOT AVAILABLE,-999,0.00558303873402,680.696726194688,1.06945306671e-06
568,552,10004730,FRANKLIN COUNTY JUVENILE DETENTION CENTER,409 EAST WASHINGTON STREET,BENTON,IL,62812,NOT AVAILABLE,(618) 438-2222,COUNTY,OPEN,30,FRANKLIN,17055,USA,922140,CORRECTIONAL INSTITUTIONS,http://illinoissecondcircuit.info/franklin-county-detention-center,3/1/2018,IMAGERY,2018/03/01 00:00:00,http://illinoissecondcircuit.info/franklin-county-detention-center,JUVENILE,38,0.00310888268486,393.843903515725,3.77033214692e-07
569,553,10000328,VALDOSTA STATE PRISON,3259 VALTECH RD,VALDOSTA,GA,31601,NOT AVAILABLE,(229) 333-7900,STATE,OPEN,1000,LOWNDES,13185,USA,922140,CORRECTIONAL INSTITUTIONS,"http://www.dcor.state.ga.us/Research/Monthly_Profile_all_inmates, http://www.dcor.state.ga.us/facility-finder",11/2/2017,IMAGERY,2017/11/13 00:00:00,http://www.dcor.state.ga.us/facility-finder,CLOSE,1312,0.014314781675,1731.44256752594,1.45466555775e-05
570,554,10006147,AVERY-MITCHELL CORRECTIONAL INSTITUTION,600 AMITY PARK RD,SPRUCE PINE,NC,28777,NOT AVAILABLE,(828) 765-0229,STATE,OPEN,844,AVERY,37011,USA,922140,CORRECTIONAL INSTITUTIONS,"http://webapps6.doc.state.nc.us/apps/asqExt/ASQ, https://www.ncdps.gov/Adult-Corrections/Prisons/Prison-Facilities",10/31/2017,IMAGERY,2017/12/12 00:00:00,https://www.ncdps.gov/Adult-Corrections/Prisons/Prison-Facilities,MEDIUM,816,0.0112822029243,1419.3257823422,9.01099170537e-06
571,555,10001432,VALDOSTA TRANSITIONAL CENTER,263 GILL HARBIN INDUSTRIAL BLVD.,VALDOSTA,GA,31601,NOT AVAILABLE,(229) 293-6280,STATE,OPEN,164,LOWNDES,13185,USA,922140,CORRECTIONAL INSTITUTIONS,"http://www.dcor.state.ga.us/Research/Monthly_Profile_all_inmates, http://www.dcor.state.ga.us/facility-finder",11/2/2017,IMAGERY,2017/11/13 00:00:00,http://www.dcor.state.ga.us/facility-finder,MINIMUM,164,0.0028190138195,331.458750453349,2.7577961725e-07
572,556,10002147,WARE STATE PRISON,3620 NORTH HARRIS ROAD,WAYCROSS,GA,31501,NOT AVAILABLE,(912) 285-6400,STATE,OPEN,1485,WARE,13299,USA,922140,CORRECTIONAL INSTITUTIONS,"http://www.dcor.state.ga.us/Research/Monthly_Profile_all_inmates, http://www.dcor.state.ga.us/facility-finder",11/2/2017,IMAGERY,2017/11/13 00:00:00,http://www.dcor.state.ga.us/facility-finder,CLOSE,1546,0.0149154639569,1758.60752621567,1.32077310463e-05
573,557,10000283,WALKER STATE PRISON,97 KEVIN LANE,ROCK SPRING,GA,30739,NOT AVAILABLE,(706) 764-3600,STATE,OPEN,406,WALKER,13295,USA,922140,CORRECTIONAL INSTITUTIONS,"http://www.dcor.state.ga.us/Research/Monthly_Profile_all_inmates, http://www.dcor.state.ga.us/facility-finder",11/2/2017,IMAGERY,2017/11/13 00:00:00,http://www.dcor.state.ga.us/facility-finder,MEDIUM,444,0.0103784402581,1279.67519653782,5.44606568517e-06
574,558,10005297,SOLANO COUNTY JUVENILE DETENTION FACILITY,740 BECK AVENUE,FAIRFIELD,CA,94533,NOT AVAILABLE,(707) 784-6570,COUNTY,OPEN,80,SOLANO,06095,USA,922140,CORRECTIONAL INSTITUTIONS,https://www.solanocounty.com/depts/probation/default.asp,2/15/2016,IMAGERY,2018/02/16 00:00:00,https://www.solanocounty.com/depts/probation/default.asp,JUVENILE,148,0.00636375858648,800.806842341967,1.35945816895e-06
575,559,10000661,FULTON COUNTY JAIL,268 WEST WASHINGTON AVENUE,LEWISTOWN,IL,61542,NOT AVAILABLE,(309) 547-2277,COUNTY,OPEN,-999,FULTON,17057,USA,922140,CORRECTIONAL INSTITUTIONS,http://www.ilsheriff.org/index.php/directory,3/1/2018,IMAGERY,2018/03/01 00:00:00,http://www.fultonco.org/officials/elected/the-county-police/,NOT AVAILABLE,80,0.00123467253828,157.659560545942,8.85878287807e-08
576,560,10001759,BERTIE CORRECTIONAL INSTITUTION,218 COOPER HILL RD,WINDSOR,NC,27983,NOT AVAILABLE,(252) 794-8600,STATE,OPEN,1057,BERTIE,37015,USA,922140,CORRECTIONAL INSTITUTIONS,"http://webapps6.doc.state.nc.us/apps/asqExt/ASQ, https://www.ncdps.gov/Adult-Corrections/Prisons/Prison-Facilities",10/31/2017,IMAGERY,2017/12/12 00:00:00,https://www.ncdps.gov/Adult-Corrections/Prisons/Prison-Facilities,CLOSE,1504,0.0125473763221,1565.88723107809,9.79962755799e-06
577,561,10000212,ELLIS PRISON,1697 FM 980,HUNTSVILLE,TX,77343,NOT AVAILABLE,(936) 295-5756,STATE,OPEN,2386,WALKER,48471,USA,922140,CORRECTIONAL INSTITUTIONS,"https://www.texastribune.org/library/data/texas-prisons/units/, http://www.tdcj.state.tx.us/unit_directory/index.html",9/15/2016,IMAGERY,2018/01/11 00:00:00,http://www.tdcj.state.tx.us/unit_directory/index.html,MAXIMUM,2482,0.0207233210734,2487.16179708536,1.26449611521e-05
578,562,10001651,WASHINGTON PARISH JAIL,1002 MAIN ST,FRANKLINTON,LA,70438,NOT AVAILABLE,(985) 839-3434,COUNTY,OPEN,157,WASHINGTON,22117,USA,922140,CORRECTIONAL INSTITUTIONS,"http://wpso.la.gov/, http://doc.louisiana.gov/briefing-book",9/29/2017,IMAGERY,2018/03/16 00:00:00,http://wpso.la.gov/,NOT AVAILABLE,144,0.00265729703997,317.347604212113,3.16152993032e-07
579,563,10002418,WEST BATON ROUGE PARISH DETENTION CENTER,1150 NORTHWEST DR,PORT ALLEN,LA,70767,NOT AVAILABLE,(225) 346-6400,COUNTY,OPEN,303,WEST BATON ROUGE,22121,USA,922140,CORRECTIONAL INSTITUTIONS,http://doc.louisiana.gov/briefing-book,9/29/2017,IMAGERY,2018/03/16 00:00:00,http://www.wbrsheriff.org/,NOT AVAILABLE,333,0.00577789613021,692.574703339062,8.90418516895e-07
580,564,10002126,WASHINGTON STATE PRISON / ANNEX,13262 HWY 24 E,DAVISBORO,GA,31018,NOT AVAILABLE,(478) 348-2336,STATE,OPEN,1334,WASHINGTON,13303,USA,922140,CORRECTIONAL INSTITUTIONS,"http://www.dcor.state.ga.us/Research/Monthly_Profile_all_inmates, http://www.dcor.state.ga.us/facility-finder",11/2/2017,IMAGERY,2017/11/13 00:00:00,http://www.dcor.state.ga.us/facility-finder,MEDIUM,1548,0.0156711347593,1891.89784586862,1.36085823257e-05
581,565,10004170,CALDWELL CORRECTIONAL CENTER,480 PLEASANT HILL RD,LENOIR,NC,28645,NOT AVAILABLE,(828) 726-2509,STATE,OPEN,264,CALDWELL,37027,USA,922140,CORRECTIONAL INSTITUTIONS,"http://webapps6.doc.state.nc.us/apps/asqExt/ASQ, https://www.ncdps.gov/Adult-Corrections/Prisons/Prison-Facilities",10/31/2017,IMAGERY,2017/12/12 00:00:00,https://www.ncdps.gov/Adult-Corrections/Prisons/Prison-Facilities,MINIMUM,238,0.00666623977096,843.529479564713,2.11379055964e-06
582,566,10002321,SONOMA COUNTY MAIN ADULT DETENTION FACILITY,2777 VENTURA AVENUE,SANTA ROSA,CA,95403,NOT AVAILABLE,(707) 565-1400,COUNTY,OPEN,710,SONOMA,06097,USA,922140,CORRECTIONAL INSTITUTIONS,http://www.bscc.ca.gov/s_fsojailprofilesurvey.php,2/16/2018,IMAGERY,2018/02/16 00:00:00,https://www.sonomasheriff.org/,MAXIMUM,790,0.0100233104629,1254.70607905575,2.43371890276e-06
583,567,10004487,WEST CENTRAL CENTER,1070 COUNTY FARM ROAD,ZEBULON,GA,30295,NOT AVAILABLE,(770) 567-0531,STATE,OPEN,-999,PIKE,13231,USA,922140,CORRECTIONAL INSTITUTIONS,http://www.dcor.state.ga.us/facility-finder,11/13/2017,IMAGERY,2017/11/13 00:00:00,http://www.dcor.state.ga.us/facility-finder,MEDIUM,194,0.00605073271822,709.332720706354,1.87579871119e-06
584,568,10002142,WHEELER CORRECTIONAL FACILITY,195 NORTH BROAD STREET,ALAMO,GA,30411,NOT AVAILABLE,(912) 568-1732,STATE,OPEN,2636,WHEELER,13309,USA,922140,CORRECTIONAL INSTITUTIONS,"http://www.dcor.state.ga.us/Research/Monthly_Profile_all_inmates, http://www.cca.com/locations",11/2/2017,IMAGERY,2017/11/13 00:00:00,http://www.cca.com/locations,MEDIUM,2312,0.0101445730781,1217.88023928825,7.0305852333e-06
585,569,10002633,CALEDONIA CORRECTIONAL INSTITUTION,2787 CALEDONIA DR,TILLERY,NC,27882,NOT AVAILABLE,(252) 826-5621,STATE,OPEN,983,HALIFAX,37083,USA,922140,CORRECTIONAL INSTITUTIONS,"http://webapps6.doc.state.nc.us/apps/asqExt/ASQ, https://www.ncdps.gov/Adult-Corrections/Prisons/Prison-Facilities",10/31/2017,IMAGERY,2017/12/12 00:00:00,https://www.ncdps.gov/Adult-Corrections/Prisons/Prison-Facilities,MEDIUM,1038,0.0111190765535,1355.09547999849,8.21992997727e-06
586,570,10000215,ESTELLE PRISON,264 FM 3478,HUNTSVILLE,TX,77320,3320,(936) 291-4200,STATE,OPEN,3020,WALKER,48471,USA,922140,CORRECTIONAL INSTITUTIONS,"https://www.texastribune.org/library/data/texas-prisons/units/, http://www.tdcj.state.tx.us/unit_directory/index.html",9/15/2016,IMAGERY,2018/01/11 00:00:00,http://www.tdcj.state.tx.us/unit_directory/index.html,MAXIMUM,3480,0.0269855769991,3235.57247555652,1.90927833336e-05
587,571,10001479,GREENE COUNTY JAIL,403 7TH STREET,CARROLLTON,IL,62016,NOT AVAILABLE,NOT AVAILABLE,COUNTY,NOT AVAILABLE,-999,GREENE,17061,USA,922140,CORRECTIONAL INSTITUTIONS,http://www.ilsheriff.org/index.php/directory,3/2/2018,IMAGERY,2018/03/02 00:00:00,NOT AVAILABLE,NOT AVAILABLE,20,0.00108592935083,138.658914771851,4.37958401951e-08
588,572,10000692,JACKSON COUNTY JAIL,1001 MULBERRY STREET,MURPHYSBORO,IL,62966,NOT AVAILABLE,(618) 684-2177,COUNTY,OPEN,138,JACKSON,17077,USA,922140,CORRECTIONAL INSTITUTIONS,https://www.jacksoncounty-il.gov/government/departments-a-z/sheriff-s-office,1/11/2017,IMAGERY,2018/03/02 00:00:00,https://www.jacksoncounty-il.gov/government/departments-a-z/sheriff-s-office,MAXIMUM,199,0.00399205965507,485.282264313963,6.88239508384e-07
589,573,10004679,GRUNDY COUNTY JAIL,111 EAST WASHINGTON STREET,MORRIS,IL,60450,NOT AVAILABLE,(815) 941-3243,COUNTY,OPEN,-999,GRUNDY,17063,USA,922140,CORRECTIONAL INSTITUTIONS,https://www.grundyco.org/sheriff/,3/2/2018,IMAGERY,2018/03/02 00:00:00,https://www.grundyco.org/sheriff/,NOT AVAILABLE,65,0.00278074698331,345.19348426314,3.0566929652e-07
590,574,10004691,HANCOCK COUNTY JAIL,98 BUCHANAN STREET,CARTHAGE,IL,62321,NOT AVAILABLE,(217) 357-2115,COUNTY,OPEN,-999,HANCOCK,17067,USA,922140,CORRECTIONAL INSTITUTIONS,https://www.hancockcounty-il.gov/sheriff/,3/2/2018,IMAGERY,2018/03/02 00:00:00,https://www.hancockcounty-il.gov/sheriff/,MAXIMUM,43,0.00169606466389,215.992141486076,1.73637106598e-07
591,575,10004685,HENDERSON COUNTY JAIL,FOURTH AND WARREN STREET,OQUAWKA,IL,61469,NOT AVAILABLE,(309) 867-4291,COUNTY,OPEN,-999,HENDERSON,17071,USA,922140,CORRECTIONAL INSTITUTIONS,http://www.ilsheriff.org/index.php/directory,3/2/2018,IMAGERY,2018/03/02 00:00:00,NOT AVAILABLE,NOT AVAILABLE,14,0.00194715524803,245.413665043036,2.28909924549e-07
592,576,10004717,JASPER COUNTY JAIL,106 EAST MORGAN STREET,NEWTON,IL,62448,NOT AVAILABLE,(618) 783-3057,COUNTY,OPEN,6,JASPER,17079,USA,922140,CORRECTIONAL INSTITUTIONS,http://www.jaspercountysheriff.net/,3/2/2018,IMAGERY,2018/03/02 00:00:00,http://www.jaspercountysheriff.net/,NOT AVAILABLE,27,0.00123143394263,158.723482081738,9.37916606716e-08
593,577,10004453,WHITWORTH WOMEN'S FACILITY,414 VALLEY HART ROAD,HARTWELL,GA,30643,NOT AVAILABLE,(706) 856-2601,STATE,OPEN,436,HART,13147,USA,922140,CORRECTIONAL INSTITUTIONS,"http://www.dcor.state.ga.us/Research/Monthly_Profile_all_inmates, http://www.dcor.state.ga.us/facility-finder",11/2/2017,IMAGERY,2017/11/13 00:00:00,http://www.dcor.state.ga.us/facility-finder,MEDIUM,442,0.00629240263099,780.92605547006,2.24689650541e-06
594,578,10001640,WEST CARROLL DETENTION CENTER,180 CAPITAL BANK DR,EPPS,LA,71237,NOT AVAILABLE,NOT AVAILABLE,COUNTY,CLOSED,0,WEST CARROLL,22123,USA,922140,CORRECTIONAL INSTITUTIONS,https://www.myarklamiss.com/news/inmates-being-moved-out-of-west-carroll-detention-center/168315667,3/16/2018,IMAGERY,2018/03/16 00:00:00,NOT AVAILABLE,MEDIUM,-999,0.00792158620251,947.165445479186,3.11882830881e-06
595,579,10000318,WILCOX STATE PRISON,470 SOUTH BROAD STREET,ABBEVILLE,GA,31001,NOT AVAILABLE,(229) 467-3000,STATE,OPEN,1789,WILCOX,13315,USA,922140,CORRECTIONAL INSTITUTIONS,"http://www.dcor.state.ga.us/Research/Monthly_Profile_all_inmates, http://www.dcor.state.ga.us/facility-finder",11/2/2017,IMAGERY,2017/11/13 00:00:00,http://www.dcor.state.ga.us/facility-finder,MEDIUM,1827,0.0125960011341,1534.6482785404,1.11076269034e-05
596,580,10000640,KANE COUNTY JAIL,37W755 IL RTE. 38,ST CHARLES,IL,60175,NOT AVAILABLE,(630) 232-6677,COUNTY,OPEN,519,KANE,17089,USA,922140,CORRECTIONAL INSTITUTIONS,"http://www.kanesheriff.com/, http://www.ilsheriff.org/index.php/directory",3/2/2018,IMAGERY,2018/03/02 00:00:00,http://www.kanesheriff.com/,MAXIMUM,640,0.00456239466837,611.378395741644,9.42629474932e-07
597,581,10004514,WOMEN'S DETENTION CENTER,8662 UNITED STATES HIGHWAY 301 NORTH,CLAXTON,GA,30417,NOT AVAILABLE,(912) 739-0716,STATE,OPEN,1,EVANS,13109,USA,922140,CORRECTIONAL INSTITUTIONS,http://www.dcor.state.ga.us/facility-finder,11/13/2017,IMAGERY,2017/11/13 00:00:00,http://www.dcor.state.ga.us/facility-finder,MINIMUM,236,0.00555111303556,671.2981590604,1.62292318749e-06
598,582,10005127,BLANCO COUNTY JAIL,400 S. US 281,JOHNSON CITY,TX,78636,NOT AVAILABLE,NOT AVAILABLE,COUNTY,OPEN,36,BLANCO,48031,USA,922140,CORRECTIONAL INSTITUTIONS,"https://www.tcjs.state.tx.us/index.php?linkID=325, http://www.co.blanco.tx.us/default.aspx?Blanco_County/Sheriff",3/1/2018,UNVERIFIED,2018/04/25 00:00:00,NOT AVAILABLE,NOT AVAILABLE,56,0.00197764788186,237.673407993418,2.12522629737e-07
599,583,10002320,NORTH COUNTY DETENTION FACILITY,2254 ORDINANCE ROAD,SANTA ROSA,CA,95403,NOT AVAILABLE,(707) 565-1400,COUNTY,OPEN,335,SONOMA,06097,USA,922140,CORRECTIONAL INSTITUTIONS,http://www.bscc.ca.gov/s_fsojailprofilesurvey.php,2/16/2018,IMAGERY,2018/02/16 00:00:00,https://www.sonomasheriff.org/,MINIMUM,1200,0.00569772684715,719.787206507701,1.32856973429e-06
600,584,10005907,WEST CARROLL PARISH JAIL,305 EAST MAIN STREET,OAK GROVE,LA,71263,NOT AVAILABLE,(318) 428-2331,COUNTY,OPEN,13,WEST CARROLL,22123,USA,922140,CORRECTIONAL INSTITUTIONS,"http://doc.louisiana.gov/briefing-book, http://doc.louisiana.gov/contact-us/local-facilities",9/29/2017,IMAGERY/OTHER,2018/03/16 00:00:00,http://www.westcarrollsheriff.net/,NOT AVAILABLE,26,0.00217863399996,264.563200000674,1.77601644343e-07
601,585,10005294,SONOMA COUNTY PROBATION CAMP,7400 STEVE OLSEN LANE,FORESTVILLE,CA,95436,NOT AVAILABLE,(707) 565-8900,COUNTY,OPEN,-999,SONOMA,06097,USA,922140,CORRECTIONAL INSTITUTIONS,http://www.sonoma-county.org/probation/juvenile_facilities/index.htm,2/16/2018,IMAGERY,2018/02/16 00:00:00,http://www.sonoma-county.org/probation/juvenile_facilities/index.htm,JUVENILE,24,0.00228877436701,284.412859638856,2.18679622846e-07
602,586,10006082,VALLEY COUNTY JAIL,125 SOUTH 15TH STREET,ORD,NE,68862,NOT AVAILABLE,(308) 728-3906,COUNTY,OPEN,4,VALLEY,31175,USA,922140,CORRECTIONAL INSTITUTIONS,"https://vcsodispatchers.wixsite.com/jail, https://ncc.nebraska.gov/jail-standards-inspection-reports",4/5/2018,IMAGERY,2018/04/05 00:00:00,https://vcsodispatchers.wixsite.com/jail,NOT AVAILABLE,10,0.00132059999999,176.761199999601,9.16480141873e-08
603,587,10002521,SAWYER COUNTY JAIL,15880 5TH ST,HAYWARD,WI,54843,NOT AVAILABLE,NOT AVAILABLE,COUNTY,OPEN,97,SAWYER,55113,USA,922140,CORRECTIONAL INSTITUTIONS,http://www.sawyersheriff.org/,5/9/2018,IMAGERY,2018/05/09 00:00:00,http://www.sawyersheriff.org/,NOT AVAILABLE,92,0.00319592389702,411.842708633647,3.30004732721e-07
604,588,10002125,SPALDING COUNTY CORRECTIONAL INSTITUTION,295 JUSTICE BLVD,GRIFFIN,GA,30223,NOT AVAILABLE,(770) 467-4760,COUNTY,OPEN,376,SPALDING,13255,USA,922140,CORRECTIONAL INSTITUTIONS,"http://www.dcor.state.ga.us/Research/Monthly, http://spaldingcounty.com/correctional_institution.php",2/1/2018,IMAGERY,2018/02/26 00:00:00,http://spaldingcounty.com/correctional_institution.php,MEDIUM,384,0.00512460849403,621.217726881079,1.77739909742e-06
605,589,10002135,AARON COHN REGIONAL YOUTH DETENTION CENTER,7700 CHATSWORTH ROAD,MIDLAND,GA,31820,NOT AVAILABLE,(706) 565-4374,STATE,OPEN,9,MUSCOGEE,13215,USA,922140,CORRECTIONAL INSTITUTIONS,https://nces.ed.gov/ccd/schoolsearch/,11/13/2017,IMAGERY,2017/11/13 00:00:00,https://djj.georgia.gov/locations/regional-youth-detention-centers,JUVENILE,64,0.00501819467759,625.335899537481,1.25473889578e-06
606,590,10004517,CLAXTON REGIONAL YOUTH DETENTION CENTER,3609 BILL HODGES ROAD,CLAXTON,GA,30417,6235,(912) 739-4807,STATE,OPEN,5,EVANS,13109,USA,922140,CORRECTIONAL INSTITUTIONS,https://nces.ed.gov/ccd/schoolsearch/,11/13/2017,IMAGERY,2017/11/13 00:00:00,https://djj.georgia.gov/locations/regional-youth-detention-centers,JUVENILE,30,0.00526405730247,626.64770756029,1.67526123344e-06
607,591,10004476,AUGUSTA REGIONAL YOUTH DETENTION CENTER,3485 MIKE PADGET HIGHWAY,AUGUSTA,GA,30906,3815,(706) 771-4881,STATE,OPEN,12,RICHMOND,13245,USA,922140,CORRECTIONAL INSTITUTIONS,https://nces.ed.gov/ccd/schoolsearch/,11/13/2017,IMAGERY,2017/11/13 00:00:00,https://djj.georgia.gov/locations/regional-youth-detention-centers,JUVENILE,64,0.00725633296469,875.164012862363,3.36226187762e-06
608,592,10004216,CARTERET CORRECTIONAL CENTER,1084 ORANGE ST,NEWPORT,NC,28570,NOT AVAILABLE,(252) 223-5100,STATE,OPEN,303,CARTERET,37031,USA,922140,CORRECTIONAL INSTITUTIONS,"http://webapps6.doc.state.nc.us/apps/asqExt/ASQ, https://www.ncdps.gov/Adult-Corrections/Prisons/Prison-Facilities",10/31/2017,IMAGERY,2017/12/12 00:00:00,https://www.ncdps.gov/Adult-Corrections/Prisons/Prison-Facilities,MINIMUM,300,0.00710507264064,879.320529746925,2.36444779325e-06
609,593,10000295,DEKALB REGIONAL YOUTH DETENTION CENTER,2946 CLIFTON SPRINGS ROAD,DECATUR,GA,30034,3820,(404) 244-2183,STATE,OPEN,10,DEKALB,13089,USA,922140,CORRECTIONAL INSTITUTIONS,https://nces.ed.gov/ccd/schoolsearch/,11/13/2017,IMAGERY,2017/11/13 00:00:00,https://djj.georgia.gov/locations/regional-youth-detention-centers,JUVENILE,64,0.00481911525845,597.71943508109,1.36394148374e-06
610,594,10004522,CRISP REGIONAL YOUTH DETENTION CENTER,130 HARALSON ROAD,CORDELE,GA,31015,NOT AVAILABLE,(229) 271-4900,STATE,OPEN,10,CRISP,13081,USA,922140,CORRECTIONAL INSTITUTIONS,https://nces.ed.gov/ccd/schoolsearch/,11/13/2017,IMAGERY,2017/11/13 00:00:00,https://djj.georgia.gov/locations/regional-youth-detention-centers,JUVENILE,64,0.00516129510781,623.429533392689,1.61141537499e-06
611,595,10003891,BOB RICHARDS REGIONAL YOUTH DETENTION CENTER,200 MARABLE WAY,ROME,GA,30165,1387,(706) 295-6035,STATE,OPEN,7,FLOYD,13115,USA,922140,CORRECTIONAL INSTITUTIONS,https://nces.ed.gov/ccd/schoolsearch/,11/13/2017,IMAGERY,2017/11/13 00:00:00,https://djj.georgia.gov/locations/regional-youth-detention-centers,JUVENILE,64,0.00441419145775,539.809536719905,1.22851277873e-06
612,596,10002140,EASTMAN REGIONAL YOUTH DETENTION CENTER,181 INDUSTRIAL BLVD,EASTMAN,GA,31023,7113,(478) 374-6766,STATE,OPEN,1,DODGE,13091,USA,922140,CORRECTIONAL INSTITUTIONS,https://nces.ed.gov/ccd/schoolsearch/,11/13/2017,IMAGERY,2017/11/13 00:00:00,https://djj.georgia.gov/locations/regional-youth-detention-centers,JUVENILE,30,0.00363704661453,436.775341442295,5.49585971697e-07
613,597,10000206,FERGUSON PRISON,12120 SAVAGE DR,MIDWAY,TX,75852,NOT AVAILABLE,(936) 348-3751,STATE,OPEN,2366,MADISON,48313,USA,922140,CORRECTIONAL INSTITUTIONS,"https://www.texastribune.org/library/data/texas-prisons/units/, http://www.tdcj.state.tx.us/unit_directory/index.html",9/15/2016,IMAGERY,2018/01/11 00:00:00,http://www.tdcj.state.tx.us/unit_directory/index.html,MAXIMUM,2421,0.0185196916606,2256.85536001223,1.01424737462e-05
614,598,10003900,GAINESVILLE REGIONAL YOUTH DETENTION CENTER,450 CRESCENT DRIVE,GAINESVILLE,GA,30501,2536,(770) 535-5465,STATE,OPEN,7,HALL,13139,USA,922140,CORRECTIONAL INSTITUTIONS,https://nces.ed.gov/ccd/schoolsearch/,11/13/2017,IMAGERY,2017/11/13 00:00:00,https://djj.georgia.gov/locations/regional-youth-detention-centers,JUVENILE,64,0.00445745947563,544.049042896665,1.21144013508e-06
615,599,10003878,ELBERT SHAW REGIONAL YOUTH DETENTION CENTER,2735 UNDERWOOD ROAD NORTHEAST,DALTON,GA,30721,7499,(706) 272-2309,STATE,OPEN,3,WHITFIELD,13313,USA,922140,CORRECTIONAL INSTITUTIONS,https://nces.ed.gov/ccd/schoolsearch/,11/13/2017,IMAGERY,2017/11/13 00:00:00,https://djj.georgia.gov/locations/regional-youth-detention-centers,JUVENILE,30,0.00333924027943,404.284381771011,6.01777293406e-07
616,600,10003943,JUDGE THOMAS JEFFERSON LOFTISS II RYDC,"400 SOUTH PINETREE BOULEVARD, BLDG 600",THOMASVILLE,GA,31792,7128,(229) 227-2764,STATE,OPEN,30,THOMAS,13275,USA,922140,CORRECTIONAL INSTITUTIONS,https://djj.georgia.gov/locations/regional-youth-detention-centers,9/1/2014,UNVERIFIED,2017/11/13 00:00:00,https://djj.georgia.gov/locations/regional-youth-detention-centers,JUVENILE,30,0.00436754759156,519.446492432255,8.44152137464e-07
617,601,10000293,METRO REGIONAL YOUTH DETENTION CENTER,1300 CONSTITUTION ROAD SOUTHEAST,ATLANTA,GA,30316,4604,(404) 635-4400,STATE,OPEN,38,DEKALB,13089,USA,922140,CORRECTIONAL INSTITUTIONS,https://nces.ed.gov/ccd/schoolsearch/,11/13/2017,IMAGERY,2017/11/13 00:00:00,https://djj.georgia.gov/locations/regional-youth-detention-centers,JUVENILE,200,0.00762429149899,909.078925124869,3.1563009006e-06
618,602,10001424,MACON REGIONAL YOUTH DETENTION CENTER,4164 RIGGINS MILL RD,MACON,GA,31217,5999,(478) 751-3407,STATE,OPEN,10,BIBB,13021,USA,922140,CORRECTIONAL INSTITUTIONS,https://nces.ed.gov/ccd/schoolsearch/,11/13/2017,IMAGERY,2017/11/13 00:00:00,https://djj.georgia.gov/locations/regional-youth-detention-centers,JUVENILE,64,0.0049419371617,591.694710250126,1.56228535756e-06
619,603,10002118,MARTHA K GLAZE REG YOUTH DETENTION CENTER,11850 HASTINGS BRIDGE RD,HAMPTON,GA,30228,NOT AVAILABLE,(770) 473-2100,STATE,OPEN,26,CLAYTON,13063,USA,922140,CORRECTIONAL INSTITUTIONS,https://djj.georgia.gov/locations/regional-youth-detention-centers,2/15/2016,IMAGERY,2017/11/13 00:00:00,https://djj.georgia.gov/locations/regional-youth-detention-centers,JUVENILE,50,0.00459595676038,562.418904638969,1.19628292327e-06
620,604,10001749,CASWELL CORRECTIONAL CENTER,444 COUNTY HOME RD,BLANCH,NC,27212,NOT AVAILABLE,(336) 694-4531,STATE,OPEN,478,CASWELL,37033,USA,922140,CORRECTIONAL INSTITUTIONS,"http://webapps6.doc.state.nc.us/apps/asqExt/ASQ, https://www.ncdps.gov/Adult-Corrections/Prisons/Prison-Facilities",10/31/2017,IMAGERY,2017/12/12 00:00:00,https://www.ncdps.gov/Adult-Corrections/Prisons/Prison-Facilities,MEDIUM,460,0.00700125420161,851.308635833989,2.98401702402e-06
621,605,10002115,ROCKDALE REGIONAL YOUTH DETENTION CENTER,2165 CHAMBERS DRIVE NW,CONYERS,GA,30012,3401,(770) 785-2496,STATE,OPEN,8,ROCKDALE,13247,USA,922140,CORRECTIONAL INSTITUTIONS,https://nces.ed.gov/ccd/schoolsearch/,11/13/2017,IMAGERY,2017/11/13 00:00:00,https://djj.georgia.gov/locations/regional-youth-detention-centers,MINIMUM,52,0.00453122454248,568.247420107335,1.26444085121e-06
622,606,10003911,MARIETTA REGIONAL YOUTH DETENTION CENTER,1575 COUNTY SERVICES PARKWAY,MARIETTA,GA,30008,4007,(770) 528-4247,STATE,OPEN,5,COBB,13067,USA,922140,CORRECTIONAL INSTITUTIONS,https://nces.ed.gov/ccd/schoolsearch/,11/13/2017,IMAGERY,2017/11/13 00:00:00,https://djj.georgia.gov/locations/regional-youth-detention-centers,JUVENILE,70,0.00377458882399,463.597388909096,7.96412803887e-07
623,607,10005293,SONOMA COUNTY JUVENILE HALL,"7425 RANCHO LOS GUILICOS ROAD, DEPT A",SANTA ROSA,CA,95409,6595,(707) 565-6300,COUNTY,OPEN,-999,SONOMA,06097,USA,922140,CORRECTIONAL INSTITUTIONS,http://www.sonoma-county.org/probation/juvenile_facilities/index.htm,2/16/2018,IMAGERY,2018/02/16 00:00:00,http://www.sonoma-county.org/probation/juvenile_facilities/index.htm,JUVENILE,240,0.00821195743297,1012.91565002349,3.17913436667e-06
624,608,10004484,SANDERSVILLE REGIONAL YOUTH DETENTION CENTER,423 INDUSTRIAL DRIVE,SANDERSVILLE,GA,31082,7007,(478) 553-2400,STATE,OPEN,7,WASHINGTON,13303,USA,922140,CORRECTIONAL INSTITUTIONS,https://nces.ed.gov/ccd/schoolsearch/,11/13/2017,IMAGERY,2017/11/13 00:00:00,https://djj.georgia.gov/locations/regional-youth-detention-centers,JUVENILE,30,0.00377006284685,453.992226873182,9.03688971705e-07
625,609,10002714,FORMBY STATE JAIL,998 COUNTY RD AA,PLAINVIEW,TX,79072,NOT AVAILABLE,(806) 296-2448,STATE,OPEN,974,HALE,48189,USA,922140,CORRECTIONAL INSTITUTIONS,"https://www.texastribune.org/library/data/texas-prisons/units/, http://www.tdcj.state.tx.us/unit_directory/index.html",9/15/2016,IMAGERY,2018/01/11 00:00:00,http://www.tdcj.state.tx.us/unit_directory/index.html,MEDIUM,1100,0.0101238764586,1229.91107141747,6.26335494342e-06
626,610,10002328,STANISLAUS COUNTY PUBLIC SAFETY CENTER,200 E HACKETT RD,MODESTO,CA,95358,NOT AVAILABLE,(209) 525-5630,COUNTY,OPEN,650,STANISLAUS,06099,USA,922140,CORRECTIONAL INSTITUTIONS,https://www.scsdonline.com/ad/detention-facilities.html,2/16/2018,IMAGERY,2018/02/16 00:00:00,https://www.scsdonline.com/ad/detention-facilities.html,MAXIMUM,918,0.00589382644087,753.937089382793,1.87954468175e-06
627,611,10005121,BOSQUE COUNTY JAIL,305 WEST MORGAN STREET,MERIDIAN,TX,76665,NOT AVAILABLE,NOT AVAILABLE,COUNTY,OPEN,16,BOSQUE,48035,USA,922140,CORRECTIONAL INSTITUTIONS,"https://www.tcjs.state.tx.us/index.php?linkID=325, https://www.sheriffbosquecounty.com/",3/1/2018,IMAGERY/OTHER,2018/04/25 00:00:00,https://www.sheriffbosquecounty.com/,NOT AVAILABLE,35,0.00160830994298,193.466326576193,1.24829213148e-07
628,612,10001655,WEST FELICIANA PARISH DETENTION CENTER,4834 FELICIANA ST,ST. FRANCISVILLE,LA,70775,NOT AVAILABLE,(225) 784-3158,COUNTY,OPEN,38,WEST FELICIANA,22125,USA,922140,CORRECTIONAL INSTITUTIONS,http://doc.louisiana.gov/briefing-book,9/29/2017,IMAGERY,2018/03/16 00:00:00,http://www.wfpso.org/,NOT AVAILABLE,39,0.00173704454199,209.410965616635,1.65272599164e-07
629,613,10000312,SAVANNAH REGIONAL YOUTH DETENTION CENTER,191 CARL GRIFFIN DR,SAVANNAH,GA,31405,1362,(912) 652-3880,STATE,OPEN,127,CHATHAM,13051,USA,922140,CORRECTIONAL INSTITUTIONS,https://djj.georgia.gov/locations/regional-youth-detention-centers,11/13/2017,IMAGERY,2017/11/13 00:00:00,https://djj.georgia.gov/locations/regional-youth-detention-centers,JUVENILE,100,0.00522739746507,621.723964291742,1.40108918751e-06
630,614,10002638,CATAWBA CORRECTIONAL CENTER,1347 PRISON CAMP RD,NEWTON,NC,28658,NOT AVAILABLE,(828) 466-5521,STATE,OPEN,243,CATAWBA,37035,USA,922140,CORRECTIONAL INSTITUTIONS,"http://webapps6.doc.state.nc.us/apps/asqExt/ASQ, https://www.ncdps.gov/Adult-Corrections/Prisons/Prison-Facilities",10/31/2017,IMAGERY,2017/12/12 00:00:00,https://www.ncdps.gov/Adult-Corrections/Prisons/Prison-Facilities,MINIMUM,246,0.0055089313619,668.68850101866,1.38443006807e-06
631,615,10006344,ATLANTA YOUTH DEVELOPMENT CAMPUS,5651 STONEWALL TELL ROAD,COLLEGE PARK,GA,30349,2462,(770) 306-6526,STATE,OPEN,22,FULTON,13121,USA,922140,CORRECTIONAL INSTITUTIONS,https://nces.ed.gov/ccd/schoolsearch/,11/13/2017,IMAGERY,2017/11/13 00:00:00,https://djj.georgia.gov/locations/youth-development-campuses,JUVENILE,-999,0.00489181166726,602.225688652429,1.48868201485e-06
632,616,10004525,TERRELL REGIONAL YOUTH DETENTION CENTER,1666 ALBANY HIGHWAY,DAWSON,GA,39842,NOT AVAILABLE,(229) 995-8554,STATE,OPEN,-999,TERRELL,13273,USA,922140,CORRECTIONAL INSTITUTIONS,http://www.djjnewsandviews.org/whatsnewatdjj/viewnews.asp?newsID=382,11/13/2017,IMAGERY,2017/11/13 00:00:00,https://djj.georgia.gov/locations/regional-youth-detention-centers,NOT AVAILABLE,56,0.00628247343594,745.781210558937,2.36669891106e-06
633,617,10001766,CENTRAL PRISON,1300 WESTERN BLVD,RALEIGH,NC,27606,NOT AVAILABLE,(919) 733-0800,STATE,OPEN,930,WAKE,37183,USA,922140,CORRECTIONAL INSTITUTIONS,"http://webapps6.doc.state.nc.us/apps/asqExt/ASQ, https://www.ncdps.gov/Adult-Corrections/Prisons/Prison-Facilities",10/31/2017,IMAGERY,2017/12/12 00:00:00,https://www.ncdps.gov/Adult-Corrections/Prisons/Prison-Facilities,CLOSE,752,0.0160317895946,1940.8596274025,1.09681764036e-05
634,618,10005208,WAYCROSS REGIONAL YOUTH DETENTION CENTER,3275 HARRIS ROAD,WAYCROSS,GA,31503,8956,(912) 287-6680,STATE,OPEN,4,WARE,13299,USA,922140,CORRECTIONAL INSTITUTIONS,https://nces.ed.gov/ccd/schoolsearch/,11/13/2017,IMAGERY,2017/11/13 00:00:00,https://djj.georgia.gov/locations/regional-youth-detention-centers,JUVENILE,30,0.00402970154782,487.446875068021,7.30639950293e-07
635,619,10000200,FORT STOCKTON TRANSFER FACILITY,1536 INTERSTATE HWY 10 E,FORT STOCKTON,TX,79735,NOT AVAILABLE,(432) 336-7676,STATE,OPEN,594,PECOS,48371,USA,922140,CORRECTIONAL INSTITUTIONS,"https://www.texastribune.org/library/data/texas-prisons/units/, http://www.tdcj.state.tx.us/unit_directory/index.html",9/15/2016,IMAGERY,2018/01/11 00:00:00,http://www.tdcj.state.tx.us/unit_directory/index.html,MEDIUM,606,0.00819605149757,959.049442785815,3.89185316181e-06
636,620,10006115,WEBSTER COUNTY JAIL,641 NORTH CEDAR STREET,RED CLOUD,NE,68970,NOT AVAILABLE,NOT AVAILABLE,COUNTY,OPEN,4,WEBSTER,31181,USA,922140,CORRECTIONAL INSTITUTIONS,https://ncc.nebraska.gov/jail-standards-inspection-reports,4/5/2018,IMAGERY,2018/04/05 00:00:00,NOT AVAILABLE,NOT AVAILABLE,10,0.000799261567835,97.6443981044729,3.45438739611e-08
637,621,10006734,KANE COUNTY JUVENILE JUSTICE CENTER,37W655 IL. RT. 38,ST. CHARLES,IL,60175,NOT AVAILABLE,(630) 762-2169,COUNTY,OPEN,-999,KANE,17089,USA,922140,CORRECTIONAL INSTITUTIONS,http://courtservices.countyofkane.org/,3/2/2018,IMAGERY,2018/03/02 00:00:00,http://courtservices.countyofkane.org/,JUVENILE,80,0.00532260079509,679.396573036906,7.98074701169e-07
638,622,10006075,NORTHEAST NEBRASKA JUVENILE SERVICES CENTER,1313 1/2 NORTH MAIN,MADISON,NE,68748,NOT AVAILABLE,(402) 454-3955,COUNTY,OPEN,26,MADISON,31119,USA,922140,CORRECTIONAL INSTITUTIONS,"https://ncc.nebraska.gov/jail-standards-inspection-reports, http://www.megavision.net/nnjsc/",4/5/2018,IMAGERY,2018/04/05 00:00:00,http://www.megavision.net/nnjsc/,JUVENILE,34,0.00240706199997,302.664799999446,2.87447584036e-07
639,623,10002545,SHAWANO COUNTY JAIL,405 N MAIN ST,SHAWANO,WI,54166,NOT AVAILABLE,(715) 526-7950,COUNTY,OPEN,235,SHAWANO,55115,USA,922140,CORRECTIONAL INSTITUTIONS,http://www.co.shawano.wi.us/departments/?department=caa27d351746,5/9/2018,IMAGERY,2018/05/09 00:00:00,NOT AVAILABLE,NOT AVAILABLE,299,0.00294374351559,395.822448515555,3.49022976403e-07
640,624,10002917,GARZA EAST TRANSFER FACILITY,4304 HWY 202,BEEVILLE,TX,78102,NOT AVAILABLE,(361) 358-9880,STATE,OPEN,1930,BEE,48025,USA,922140,CORRECTIONAL INSTITUTIONS,"https://www.texastribune.org/library/data/texas-prisons/units/, http://www.tdcj.state.tx.us/unit_directory/index.html",9/15/2016,IMAGERY,2018/01/11 00:00:00,http://www.tdcj.state.tx.us/unit_directory/index.html,MAXIMUM,2458,0.0137173069535,1659.65330417102,1.07510766717e-05
641,625,10001798,COLUMBUS CORRECTIONAL INSTITUTION,1255 PRISON CAMP RD,WHITEVILLE,NC,28472,NOT AVAILABLE,(910) 642-3285,STATE,OPEN,696,COLUMBUS,37047,USA,922140,CORRECTIONAL INSTITUTIONS,"http://webapps6.doc.state.nc.us/apps/asqExt/ASQ, https://www.ncdps.gov/Adult-Corrections/Prisons/Prison-Facilities",10/31/2017,IMAGERY,2017/12/12 00:00:00,https://www.ncdps.gov/Adult-Corrections/Prisons/Prison-Facilities,MEDIUM,698,0.0117711307127,1420.32385267924,5.64695746867e-06
642,626,10006345,AUGUSTA YOUTH DEVELOPMENT CAMPUS,3481 MIKE PADGET HIGHWAY,AUGUSTA,GA,30906,3815,(706) 792-7500,STATE,OPEN,30,RICHMOND,13245,USA,922140,CORRECTIONAL INSTITUTIONS,https://nces.ed.gov/ccd/schoolsearch/,11/13/2017,IMAGERY,2017/11/13 00:00:00,https://djj.georgia.gov/locations/youth-development-campuses,JUVENILE,-999,0.0224594098955,2707.58375779299,2.35342578654e-05
643,627,10002139,EASTMAN YOUTH DEVELOPMENT CAMPUS,176 FREAMON GRAHAM BOULEVARD,EASTMAN,GA,31023,8003,(478) 374-6900,STATE,OPEN,350,DODGE,13091,USA,922140,CORRECTIONAL INSTITUTIONS,https://djj.georgia.gov/locations/youth-development-campuses,9/1/2014,IMAGERY,2017/11/13 00:00:00,https://djj.georgia.gov/locations/youth-development-campuses,JUVENILE,330,0.00942029030946,1136.75872600505,6.32206832262e-06
644,628,10004117,BELKNAP COUNTY HOUSE OF CORRECTIONS,76 COUNTY DR,LACONIA,NH,03246,NOT AVAILABLE,(603) 527-5480,COUNTY,OPEN,96,BELKNAP,33001,USA,922140,CORRECTIONAL INSTITUTIONS,http://www.belknapcounty.org/pages/BelknapCounty_corrections/Index,4/5/2018,IMAGERY,2018/04/05 00:00:00,http://www.belknapcounty.org/pages/BelknapCounty_corrections/Index,MAXIMUM,110,0.00315834011262,411.166022162244,4.06372508955e-07
645,629,10002640,CRAGGY CORRECTIONAL CENTER,2992 RIVERSIDE DRIVE,ASHEVILLE,NC,28804,NOT AVAILABLE,(828) 645-5315,STATE,OPEN,594,BUNCOMBE,37021,USA,922140,CORRECTIONAL INSTITUTIONS,"http://webapps6.doc.state.nc.us/apps/asqExt/ASQ, https://www.ncdps.gov/Adult-Corrections/Prisons/Prison-Facilities",10/31/2017,IMAGERY,2017/12/12 00:00:00,https://www.ncdps.gov/Adult-Corrections/Prisons/Prison-Facilities,MEDIUM,408,0.0096149588317,1176.21339792351,3.90338903826e-06
646,630,10002916,GARZA WEST TRANSFER FACILITY,4250 HWY 202,BEEVILLE,TX,78102,NOT AVAILABLE,(361) 358-9890,STATE,OPEN,2062,BEE,48025,USA,922140,CORRECTIONAL INSTITUTIONS,"https://www.texastribune.org/library/data/texas-prisons/units/, http://www.tdcj.state.tx.us/unit_directory/index.html",9/15/2016,IMAGERY,2018/01/11 00:00:00,http://www.tdcj.state.tx.us/unit_directory/index.html,MAXIMUM,2278,0.0156356992748,1866.97200739301,1.43416493129e-05
647,631,10006058,CARROLL COUNTY JAIL,50 COUNTY FARM RD,OSSIPEE,NH,03864,NOT AVAILABLE,(603) 539-2282,COUNTY,OPEN,61,CARROLL,33003,USA,922140,CORRECTIONAL INSTITUTIONS,"https://www.nh.gov/nhdoc/divisions/publicinformation/documents/012010_justice_rein_analyses.pdf, http://www.carrollcountynh.net/pages/CarrollcountyNH_WebDocs/Depts",4/5/2018,IMAGERY/OTHER,2018/04/05 00:00:00,http://www.carrollcountynh.net/pages/CarrollcountyNH_WebDocs/Depts,NOT AVAILABLE,220,0.00412865337021,533.254017736996,6.4399279712e-07
648,632,10006712,STANISLAUS COUNTY PUBLIC SAFETY CENTER UNIT 1 AND UNIT 2,200 EAST HACKETT RD,MODESTO,CA,95358,NOT AVAILABLE,(209) 525-5630,COUNTY,OPEN,335,STANISLAUS,06099,USA,922140,CORRECTIONAL INSTITUTIONS,"http://www.bscc.ca.gov/s_fsojailprofilesurvey.php, https://www.scsdonline.com/ad/detention-facilities.html",2/16/2018,UNVERIFIED,2018/02/16 00:00:00,https://www.scsdonline.com/ad/detention-facilities.html,NOT AVAILABLE,392,0.00541814504207,693.709837845393,1.402288587e-06
649,633,10005112,RECOVERY CENTER OF BOWIE COUNTY,141 PLAZA WEST,TEXARKANA,TX,75501,NOT AVAILABLE,(903) 832-2100,COUNTY,OPEN,-999,BOWIE,48037,USA,922140,CORRECTIONAL INSTITUTIONS,http://bowiecountycscd.com/index_files/Page381.htm,4/25/2018,IMAGERY/OTHER,2018/04/25 00:00:00,http://bowiecountycscd.com/index_files/Page381.htm,NOT AVAILABLE,-999,0.00530116443586,643.141705726472,1.59429056427e-06
650,634,10000302,MACON YOUTH DEVELOPMENT CAMPUS,4160 RIGGINS MILL RD,MACON,GA,31217,5440,(478) 751-3415,STATE,OPEN,4,BIBB,13021,USA,922140,CORRECTIONAL INSTITUTIONS,https://nces.ed.gov/ccd/schoolsearch/,11/13/2017,UNVERIFIED,2017/11/13 00:00:00,https://djj.georgia.gov/locations/youth-development-campuses,JUVENILE,150,0.0119297209574,1414.75064687835,4.73729442389e-06
651,635,10006237,KANKAKEE COUNTY DETENTION CENTER,3000 S JUSTICE WAY,KANKAKEE,IL,60901,NOT AVAILABLE,(815) 802-7100,COUNTY,OPEN,-999,KANKAKEE,17091,USA,922140,CORRECTIONAL INSTITUTIONS,http://kankakeecountysheriff.com/,3/2/2018,IMAGERY,2018/03/02 00:00:00,http://kankakeecountysheriff.com/,NOT AVAILABLE,244,0.00366457531487,470.98857915327,7.26449063394e-07
652,636,10002857,GIST STATE JAIL,3295 FM 3514,BEAUMONT,TX,77705,NOT AVAILABLE,(409) 727-8400,STATE,OPEN,2042,JEFFERSON,48245,USA,922140,CORRECTIONAL INSTITUTIONS,"https://www.texastribune.org/library/data/texas-prisons/units/, http://www.tdcj.state.tx.us/unit_directory/index.html",9/15/2016,IMAGERY,2018/01/11 00:00:00,http://www.tdcj.state.tx.us/unit_directory/index.html,MAXIMUM,2276,0.01385594514,1612.33550565693,9.73905421182e-06
653,637,10001787,CRAVEN CORRECTIONAL INSTITUTION,600 ALLIGATOR RD,VANCEBORO,NC,28586,NOT AVAILABLE,(252) 244-3337,STATE,OPEN,758,CRAVEN,37049,USA,922140,CORRECTIONAL INSTITUTIONS,"http://webapps6.doc.state.nc.us/apps/asqExt/ASQ, https://www.ncdps.gov/Adult-Corrections/Prisons/Prison-Facilities",10/31/2017,IMAGERY,2017/12/12 00:00:00,https://www.ncdps.gov/Adult-Corrections/Prisons/Prison-Facilities,MEDIUM,850,0.00983246520728,1191.06339499653,6.85501950247e-06
654,638,10001750,DAN RIVER PRISON WORK FARM,981 MURRAY RD,BLANCH,NC,27212,NOT AVAILABLE,(336) 694-1583,STATE,OPEN,614,CASWELL,37033,USA,922140,CORRECTIONAL INSTITUTIONS,"http://webapps6.doc.state.nc.us/apps/asqExt/ASQ, https://www.ncdps.gov/Adult-Corrections/Prisons/Prison-Facilities",10/31/2017,IMAGERY,2017/12/12 00:00:00,https://www.ncdps.gov/Adult-Corrections/Prisons/Prison-Facilities,MINIMUM,640,0.00814920636277,1016.24049314094,3.54336137445e-06
655,639,10002329,STANISLAUS COUNTY JUVENILE HALL AND COMMITMENT FACILITY,2215 BLUE GUM AVE,MODESTO,CA,95358,NOT AVAILABLE,(209) 525-5400,COUNTY,OPEN,153,STANISLAUS,06099,USA,922140,CORRECTIONAL INSTITUTIONS,"http://nces.ed.gov/globallocator/sch_info_popup.asp?Type=Public&ID=069104109050, http://webschoolpro.com/CA50105045030069/",2/15/2016,IMAGERY,2018/02/16 00:00:00,http://www.stancounty.com/probation/services.shtm,JUVENILE,144,0.00951481166575,1184.55252374461,3.21364112145e-06
656,640,10005279,MAXINE SINGER YOUTH GUIDANCE CENTER,1023 14TH ST,MARYSVILLE,CA,95901,NOT AVAILABLE,(530) 741-6371,COUNTY,OPEN,-999,YUBA,06115,USA,922140,CORRECTIONAL INSTITUTIONS,https://www.suttercounty.org/doc/government/depts/jh/jh_home,2/15/2016,IMAGERY,2018/02/16 00:00:00,https://www.suttercounty.org/doc/government/depts/jh/jh_home,JUVENILE,60,0.00495822275822,586.733027806075,7.7713758004e-07
657,641,10006781,WEST FELICIANA PARISH TRANSITIONAL WORK PROGRAM,9943 WEST FELICIANA PARKWAY,ST. FRANCISVILLE,LA,70775,NOT AVAILABLE,(225) 635-3807,COUNTY,OPEN,242,WEST FELICIANA,22125,USA,922140,CORRECTIONAL INSTITUTIONS,"http://doc.louisiana.gov/briefing-book, http://doc.louisiana.gov/contact-us/local-facilities",9/29/2017,IMAGERY,2018/03/16 00:00:00,NOT AVAILABLE,NOT AVAILABLE,276,0.00253786012005,301.477307815206,3.3194259462e-07
658,642,10002928,GLOSSBRENNER PRISON-SAFPF,5100 S FM 1329,SAN DIEGO,TX,78384,NOT AVAILABLE,(361) 279-2705,STATE,OPEN,594,DUVAL,48131,USA,922140,CORRECTIONAL INSTITUTIONS,https://www.tdcj.state.tx.us/documents/prea_report/Glossbrenner_2017-02-08.pdf,2/8/2017,IMAGERY,2018/01/11 00:00:00,http://www.tdcj.state.tx.us/unit_directory/index.html,MINIMUM,612,0.00657932910768,773.546816106096,2.13419256768e-06
659,643,10005247,SISKIYOU COUNTY JAIL,315 SOUTH OREGON STREET,YREKA,CA,96097,NOT AVAILABLE,(530) 842-8157,COUNTY,OPEN,98,SISKIYOU,06093,USA,922140,CORRECTIONAL INSTITUTIONS,https://www.co.siskiyou.ca.us/content/sheriffs-office-custody-division,2/16/2018,IMAGERY,2018/02/16 00:00:00,https://www.co.siskiyou.ca.us/content/sheriffs-office-custody-division,NOT AVAILABLE,104,0.00220638864047,277.321398890851,2.5398647299e-07
660,644,10003936,BLAKELY REGIONAL YOUTH DETENTION CENTER,763 JESSE JOHNSON STREET,BLAKELY,GA,39823,NOT AVAILABLE,NOT AVAILABLE,STATE,CLOSED,0,EARLY,13099,USA,922140,CORRECTIONAL INSTITUTIONS,http://jjie.org/2011/03/01/djj-announces-second-youth-detention-center-closing/,3/1/2011,IMAGERY,2017/11/21 00:00:00,NOT AVAILABLE,JUVENILE,-999,0.00416775681256,507.164157002857,9.91745643105e-07
661,645,10002136,MUSCOGEE YOUTH DEVELOPMENT CAMPUS,7700-A CHATTSWORTH ROAD,MIDLAND,GA,31820,9556,(706) 565-4391,STATE,OPEN,11,MUSCOGEE,13215,USA,922140,CORRECTIONAL INSTITUTIONS,https://nces.ed.gov/ccd/schoolsearch/,11/14/2017,IMAGERY,2017/11/14 00:00:00,https://djj.georgia.gov/locations/youth-development-campuses,JUVENILE,-999,0.00741608659787,890.829746037866,2.68184252704e-06
662,646,10004519,SUMTER YOUTH DEVELOPMENT CAMPUS,300 MCMATH MILL RD.,AMERICUS,GA,31714,8669,(229) 931-5800,STATE,OPEN,24,SUMTER,13261,USA,922140,CORRECTIONAL INSTITUTIONS,https://nces.ed.gov/ccd/schoolsearch/,11/14/2017,IMAGERY,2017/11/14 00:00:00,https://djj.georgia.gov/locations/youth-development-campuses,JUVENILE,150,0.00831548075867,1010.93167819176,4.41591285918e-06
663,647,10002114,ALCOVY DIVERSION CENTER,1417 S MADISON AVE,MONROE,GA,30655,NOT AVAILABLE,(770) 207-4171,STATE,CLOSED,0,WALTON,13297,USA,922140,CORRECTIONAL INSTITUTIONS,http://www.waltontribune.com/news/article_a7c67dab-019a-5fab-81d1-d794d2297207.html,6/30/2009,IMAGERY,2017/11/21 00:00:00,http://www.waltontribune.com/news/article_a7c67dab-019a-5fab-81d1-d794d2297207.html,NOT AVAILABLE,-999,0.00212458241007,260.388764287593,2.64013070088e-07
664,648,10004534,BACON PROBATION DETENTION CENTER,165 EAST EASTSIDE INDUSTRIAL BOULEVARD,ALMA,GA,31510,NOT AVAILABLE,NOT AVAILABLE,STATE,OPEN,232,BACON,13005,USA,922140,CORRECTIONAL INSTITUTIONS,http://www.dcor.state.ga.us/AboutGDC/FactSheets/probation-detention-and-transitional-centers,11/21/2017,IMAGERY,2017/11/21 00:00:00,http://www.dcor.state.ga.us/AboutGDC/FactSheets/probation-detention-and-transitional-centers,MINIMUM,232,0.00584918288954,684.322256176235,1.86569086409e-06
665,649,10005188,CENTRAL PROBATION DETENTION CENTER,2839 RAILROAD STREET,CADWELL,GA,31009,NOT AVAILABLE,NOT AVAILABLE,STATE,CLOSED,0,LAURENS,13175,USA,922140,CORRECTIONAL INSTITUTIONS,http://www.13wmaz.com/news/local/expectations-for-cadwell-youth-detention-center/425120001,3/23/2017,IMAGERY,2017/11/21 00:00:00,NOT AVAILABLE,MINIMUM,198,0.00637453281911,761.280949870677,1.67261940493e-06
666,650,10002130,FRANK C SCOTT JR. STATE PRISON,107 LAWRENCE RD,HARDWICK,GA,31034,NOT AVAILABLE,NOT AVAILABLE,STATE,CLOSED,0,BALDWIN,13009,USA,922140,CORRECTIONAL INSTITUTIONS,http://www.macon.com/news/article28568242.html,7/9/2009,IMAGERY,2017/11/22 00:00:00,NOT AVAILABLE,MEDIUM,-999,0.013899824242,1695.48269140756,9.98405703859e-06
667,651,10004480,GRIFFIN REGIONAL YOUTH DETENTION CENTER,105 JUSTICE BOULEVARD,GRIFFIN,GA,30224,NOT AVAILABLE,NOT AVAILABLE,STATE,CLOSED,0,SPALDING,13255,USA,922140,CORRECTIONAL INSTITUTIONS,http://jjie.org/2011/02/28/djj-closes-griffin-facility/,2/28/2011,IMAGERY,2017/11/22 00:00:00,NOT AVAILABLE,JUVENILE,30,0.00372356906393,445.85932315436,6.80823059842e-07
668,652,10004682,JEROME COMBS DETENTION CENTER,3050 S JUSTICE WAY,KANKAKEE,IL,60901,NOT AVAILABLE,(815) 802-7100,COUNTY,OPEN,-999,KANKAKEE,17091,USA,922140,CORRECTIONAL INSTITUTIONS,http://kankakeecountysheriff.com/,3/2/2018,IMAGERY,2018/03/02 00:00:00,http://kankakeecountysheriff.com/,NOT AVAILABLE,456,0.0046236686689,605.000182029139,1.08872624722e-06
669,653,10006056,COOS COUNTY DEPARTMENT OF CORRECTIONS,168 COUNTY FARM ROAD,WEST STEWARTSTOWN,NH,03597,NOT AVAILABLE,(603) 246-3315,COUNTY,OPEN,39,COOS,33007,USA,922140,CORRECTIONAL INSTITUTIONS,"https://www.nh.gov/nhdoc/divisions/publicinformation/documents/012010_justice_rein_analyses.pdf, http://www.cooscountynh.us/departments",2/15/2016,IMAGERY/OTHER,2018/04/05 00:00:00,http://www.cooscountynh.us/departments,NOT AVAILABLE,61,0.00137449876147,193.186611287389,1.09975274167e-07
670,654,10005268,TEHAMA COUNTY JUVENILE DETENTION FACILITY,1790 WALNUT STREET,RED BLUFF,CA,96080,NOT AVAILABLE,(530) 527-5380,COUNTY,OPEN,52,TEHAMA,06103,USA,922140,CORRECTIONAL INSTITUTIONS,http://www.co.tehama.ca.us/depprobation,2/16/2018,IMAGERY,2018/02/16 00:00:00,http://www.co.tehama.ca.us/depprobation,JUVENILE,60,0.00360588197217,450.582449220114,6.83270634043e-07
671,655,10004500,MCEVER PROBATION DETENTION CENTER,2100 KINGS CHAPEL ROAD,PERRY,GA,31069,NOT AVAILABLE,(478) 988-7024,STATE,OPEN,-999,HOUSTON,13153,USA,922140,CORRECTIONAL INSTITUTIONS,http://www.dcor.state.ga.us/NewsRoom/PressReleases/new-superintendent-mcever-probation-detention-center,11/22/2017,IMAGERY,2017/11/22 00:00:00,http://www.dcor.state.ga.us/AboutGDC/FactSheets/probation-detention-and-transitional-centers,MINIMUM,250,0.00453179929815,543.070048378583,1.24805853959e-06
672,656,10004543,PELHAM PRE RELEASE CENTER,410 MIZE STREET,PELHAM,GA,31779,NOT AVAILABLE,NOT AVAILABLE,STATE,CLOSED,0,MITCHELL,13205,USA,922140,CORRECTIONAL INSTITUTIONS,http://www.wctv.tv/home/headlines/Pelham-Jail-Closing--302646851.html,5/5/2015,IMAGERY,2017/11/22 00:00:00,NOT AVAILABLE,MEDIUM,160,0.00680810111068,802.604478251653,2.49881427668e-06
673,657,10002132,RIVERS STATE PRISON,2299 VINSON HWY,MILLEDGEVILLE,GA,31034,NOT AVAILABLE,NOT AVAILABLE,STATE,CLOSED,0,BALDWIN,13009,USA,922140,CORRECTIONAL INSTITUTIONS,https://abandonedsoutheast.com/2017/03/16/milledgeville/,3/16/2017,IMAGERY,2017/11/22 00:00:00,NOT AVAILABLE,MEDIUM,-999,0.00985526856523,1198.01473029591,4.32148235123e-06
674,658,10004551,ROBERT L. PATTEN PROBATION DETENTION CENTER,1009 NORTH 10TH AVENUE,LAKELAND,GA,31635,NOT AVAILABLE,(229) 482-8241,STATE,OPEN,-999,LANIER,13173,USA,922140,CORRECTIONAL INSTITUTIONS,http://www.dcor.state.ga.us/AboutGDC/FactSheets/probation-detention-and-transitional-centers,11/22/2017,IMAGERY,2017/11/22 00:00:00,http://www.dcor.state.ga.us/AboutGDC/FactSheets/probation-detention-and-transitional-centers,MINIMUM,252,0.00489326465365,583.471708930464,1.35990087834e-06
675,659,10004177,DAVIDSON CORRECTIONAL CENTER,1400 THOMASON ST,LEXINGTON,NC,27292,NOT AVAILABLE,(336) 249-7528,STATE,OPEN,258,DAVIDSON,37057,USA,922140,CORRECTIONAL INSTITUTIONS,"http://webapps6.doc.state.nc.us/apps/asqExt/ASQ, https://www.ncdps.gov/Adult-Corrections/Prisons/Prison-Facilities",10/31/2017,IMAGERY,2017/12/12 00:00:00,https://www.ncdps.gov/Adult-Corrections/Prisons/Prison-Facilities,MINIMUM,258,0.00569979067655,691.248086791571,1.59107638331e-06
676,660,10003892,ROME DIVERSION CENTER,100 MARABLE WAY,ROME,GA,30165,NOT AVAILABLE,NOT AVAILABLE,STATE,CLOSED,0,FLOYD,13115,USA,922140,CORRECTIONAL INSTITUTIONS,http://www.northwestgeorgianews.com/rome/news/work-release-center-nears-completion/article_c1bd89c3-8878-55fe-80c3-02f0fed5f5b0.html,11/27/2009,IMAGERY,2017/11/22 00:00:00,NOT AVAILABLE,NOT AVAILABLE,-999,0.00360043708318,435.419513108377,8.29641067429e-07
677,661,10005191,TREUTLEN PROBATION DETENTION CENTER,1 SESSIONS STREET,SOPERTON,GA,30457,NOT AVAILABLE,(912) 529-6760,STATE,OPEN,-999,TREUTLEN,13283,USA,922140,CORRECTIONAL INSTITUTIONS,http://www.dcor.state.ga.us/AboutGDC/FactSheets/probation-detention-and-transitional-centers,11/22/2017,IMAGERY,2017/11/22 00:00:00,http://www.dcor.state.ga.us/AboutGDC/FactSheets/probation-detention-and-transitional-centers,MINIMUM,295,0.00609121124987,732.623858093218,2.0298189124e-06
678,662,10006157,BOWIE COUNTY CORRECTIONAL CENTER,105 W FRONT ST,TEXARKANA,TX,75501,5610,(903) 798-3505,COUNTY,OPEN,790,BOWIE,48037,USA,922140,CORRECTIONAL INSTITUTIONS,"https://www.tcjs.state.tx.us/index.php?linkID=325, http://www.lasallecorrections.com/our-locations-table/",3/1/2018,IMAGERY/OTHER,2018/04/25 00:00:00,http://www.lasallecorrections.com/our-locations-table/,MAXIMUM,921,0.00856197046175,992.735528472422,1.14260705588e-06
679,663,10000204,GOODMAN TRANSFER FACILITY,349 PRIVATE RD 8430,JASPER,TX,75951,NOT AVAILABLE,(409) 383-0012,STATE,OPEN,588,JASPER,48241,USA,922140,CORRECTIONAL INSTITUTIONS,"https://www.texastribune.org/library/data/texas-prisons/units/, http://www.tdcj.state.tx.us/unit_directory/index.html",9/15/2016,IMAGERY,2018/01/11 00:00:00,http://www.tdcj.state.tx.us/unit_directory/index.html,MEDIUM,612,0.00721162175681,856.693774824995,3.25796008634e-06
680,664,10000213,GOREE PRISON AND TRUSTY CAMP,7405 STATE HWY 75 S,HUNTSVILLE,TX,77344,NOT AVAILABLE,(936) 295-6331,STATE,OPEN,1000,WALKER,48471,USA,922140,CORRECTIONAL INSTITUTIONS,"https://www.texastribune.org/library/data/texas-prisons/units/, http://www.tdcj.state.tx.us/unit_directory/index.html",9/15/2016,IMAGERY,2018/01/11 00:00:00,http://www.tdcj.state.tx.us/unit_directory/index.html,MAXIMUM,1321,0.0145085520603,1718.31727058204,4.93754870017e-06
681,665,10006165,GUAM ADULT CORRECTIONAL FACILITY,#1 MASHBURN LANE,MANGILAO,GU,96913,NOT AVAILABLE,(671) 734-3981,STATE,OPEN,559,NOT AVAILABLE,66010,GUM,922140,CORRECTIONAL INSTITUTIONS,http://doc.guam.gov/prison-security/,11/22/2017,IMAGERY/OTHER,2017/11/22 00:00:00,http://doc.guam.gov/prison-security/,MAXIMUM,-999,0.00792229198845,892.057082479523,3.90478434959e-06
682,666,10006164,GUAM WOMEN'S FACILITY,#1 MASHBURN LANE,MANGILAO,GU,96913,NOT AVAILABLE,NOT AVAILABLE,STATE,OPEN,48,NOT AVAILABLE,66010,GUM,922140,CORRECTIONAL INSTITUTIONS,http://doc.guam.gov/reports/,11/15/2017,UNVERIFIED,2017/11/22 00:00:00,http://doc.guam.gov/prison-security/,NOT AVAILABLE,-999,0.0018277733159,205.624694323359,2.11718570539e-07
683,667,10005587,GREENE COUNTY JAIL,300 LAFAYETTE AVENUE,LEAKESVILLE,MS,39451,NOT AVAILABLE,NOT AVAILABLE,COUNTY,NOT AVAILABLE,-999,GREENE,28041,USA,922140,CORRECTIONAL INSTITUTIONS,NOT AVAILABLE,NOT AVAILABLE,IMAGERY,2018/03/28 00:00:00,NOT AVAILABLE,NOT AVAILABLE,-999,0.00161960946336,193.835553360358,1.32507090049e-07
684,668,10004194,EASTERN CORRECTIONAL INSTITUTION,2821 HWY 903,MAURY,NC,28554,NOT AVAILABLE,(252) 747-8101,STATE,OPEN,466,GREENE,37079,USA,922140,CORRECTIONAL INSTITUTIONS,"http://webapps6.doc.state.nc.us/apps/asqExt/ASQ, https://www.ncdps.gov/Adult-Corrections/Prisons/Prison-Facilities",10/31/2017,IMAGERY,2017/12/12 00:00:00,https://www.ncdps.gov/Adult-Corrections/Prisons/Prison-Facilities,MEDIUM,429,0.0105107650738,1278.51044696474,5.88048908833e-06
685,669,10006441,CURTIS E WETTER JUVENILE HALL,1740 WALNUT ST,RED BLUFF,CA,96080,NOT AVAILABLE,NOT AVAILABLE,COUNTY,CLOSED,0,TEHAMA,06103,USA,922140,CORRECTIONAL INSTITUTIONS,http://tehamacountyca.iqm2.com/Citizens/FileOpen.aspx?Type=12&ID=2971,6/30/2009,IMAGERY,2018/02/16 00:00:00,http://www.cde.ca.gov/re/sd/details.asp?cds=52345209006784&Public=Y,JUVENILE,-999,0.00287430685493,360.55362303013,3.91512156014e-07
686,670,10006539,GUAM YOUTH CORRECTIONAL FACILITY,#169 SAN ISIDRO ST,MANGILAO,GU,96923,NOT AVAILABLE,(671) 735-5010,STATE,OPEN,-999,NOT AVAILABLE,66010,GUM,922140,CORRECTIONAL INSTITUTIONS,http://guamopa.net/docs/2010/citizen-centric-report/ccr-dya-2008.pdf,11/22/2017,IMAGERY/OTHER,2017/11/22 00:00:00,http://guamopa.net/docs/2010/citizen-centric-report/ccr-dya-2008.pdf,JUVENILE,-999,0.00443542433242,500.802970272683,1.19180478664e-06
687,671,10001769,FOOTHILLS CORRECTIONAL INSTITUTION,5150 WESTERN AVE,MORGANTON,NC,28655,NOT AVAILABLE,(828) 438-5585,STATE,OPEN,719,BURKE,37023,USA,922140,CORRECTIONAL INSTITUTIONS,"http://webapps6.doc.state.nc.us/apps/asqExt/ASQ, https://www.ncdps.gov/Adult-Corrections/Prisons/Prison-Facilities",10/31/2017,IMAGERY,2017/12/12 00:00:00,https://www.ncdps.gov/Adult-Corrections/Prisons/Prison-Facilities,CLOSE,858,0.0121990278661,1492.53513863517,9.46933846366e-06
688,672,10005914,WINN PARISH JAIL,119 MAIN STREET,WINNFIELD,LA,71483,NOT AVAILABLE,(318) 628-4611,COUNTY,OPEN,43,WINN,22127,USA,922140,CORRECTIONAL INSTITUTIONS,"http://doc.louisiana.gov/briefing-book, http://doc.louisiana.gov/contact-us/local-facilities",9/29/2017,IMAGERY/OTHER,2018/03/16 00:00:00,http://www.sheriffalerts.com/cap_main.php?office=54427,NOT AVAILABLE,47,0.00233114018532,278.808255714009,2.98177193876e-07
689,673,10000184,GURNEY TRANSFER FACILITY,1385 FM 3328,PALESTINE,TX,75803,NOT AVAILABLE,(903) 928-3118,STATE,OPEN,2024,ANDERSON,48001,USA,922140,CORRECTIONAL INSTITUTIONS,"https://www.texastribune.org/library/data/texas-prisons/units/, http://www.tdcj.state.tx.us/unit_directory/index.html",9/15/2016,IMAGERY,2018/01/11 00:00:00,http://www.tdcj.state.tx.us/unit_directory/index.html,MEDIUM,2128,0.0158634315906,1850.73785936501,1.24800834607e-05
690,674,10004675,KENDALL COUNTY JAIL,1102 CORNELL LANE,YORKVILLE,IL,60560,NOT AVAILABLE,(630) 553-7500,COUNTY,OPEN,120,KENDALL,17093,USA,922140,CORRECTIONAL INSTITUTIONS,https://www.co.kendall.il.us/sheriff/,10/26/2016,IMAGERY,2018/03/02 00:00:00,https://www.co.kendall.il.us/sheriff/,NOT AVAILABLE,203,0.00433116377763,549.349832662704,6.82931897602e-07
691,675,10001471,KNOX COUNTY JAIL / SHERIFF,152 SOUTH KELLOGG STREET,GALESBURG,IL,61401,NOT AVAILABLE,(309) 345-3737,COUNTY,OPEN,-999,KNOX,17095,USA,922140,CORRECTIONAL INSTITUTIONS,http://www.ilsheriff.org/index.php/directory,3/2/2018,IMAGERY,2018/03/02 00:00:00,http://www.knoxcountysheriffil.com/index.php,NOT AVAILABLE,120,0.00256444914261,311.165431723249,3.3013865997e-07
692,676,10002835,HALBERT UNIT,800 ELLEN HALBERT DR,BURNET,TX,78611,NOT AVAILABLE,(512) 756-6171,STATE,OPEN,132,BURNET,48053,USA,922140,CORRECTIONAL INSTITUTIONS,"https://www.texastribune.org/library/data/texas-prisons/units/, http://www.tdcj.state.tx.us/unit_directory/index.html",9/15/2016,IMAGERY,2018/01/11 00:00:00,http://www.tdcj.state.tx.us/unit_directory/index.html,NOT AVAILABLE,612,0.00673576842761,801.973628439388,2.08669316532e-06
693,677,10005257,TRINITY COUNTY JAIL,101 MEMORIAL DRIVE,WEAVERVILLE,CA,96093,NOT AVAILABLE,(530) 623-2611,COUNTY,OPEN,51,TRINITY,06105,USA,922140,CORRECTIONAL INSTITUTIONS,http://www.bscc.ca.gov/s_fsojailprofilesurvey.php,2/16/2018,IMAGERY,2018/02/16 00:00:00,http://www.trinitycounty.org/index.aspx?page=80,NOT AVAILABLE,-999,0.00282987620665,360.576567722114,3.14970103207e-07
694,678,10002254,LAKE COUNTY ADULT CORRECTIONAL CENTER,20 S. COUNTY ST.,WAUKEGAN,IL,60085,NOT AVAILABLE,(847) 377-4150,COUNTY,OPEN,634,LAKE,17097,USA,922140,CORRECTIONAL INSTITUTIONS,http://www.lakecountyil.gov/687/Corrections-Division,3/2/2018,IMAGERY,2018/03/02 00:00:00,http://www.lakecountyil.gov/687/Corrections-Division,NOT AVAILABLE,720,0.00343504384625,445.896035293308,6.13561831005e-07
695,679,10000128,KULANI CORRECTIONAL FACILITY,"HC 01, STAINBACK HWY",HILO,HI,96720,NOT AVAILABLE,NOT AVAILABLE,STATE,OPEN,145,HAWAII,15001,USA,922140,CORRECTIONAL INSTITUTIONS,http://dps.hawaii.gov/about/divisions/corrections/,10/31/2017,IMAGERY,2017/11/22 00:00:00,http://dps.hawaii.gov/about/divisions/corrections/,MINIMUM,200,0.0159291679104,1837.44988104384,1.27133501245e-05
696,680,10006540,HAGATNA DETENTION FACILITY,#203 ASPINALL AVENUE,HAGATNA,GU,96910,NOT AVAILABLE,NOT AVAILABLE,STATE,OPEN,-999,NOT AVAILABLE,66010,GUM,922140,CORRECTIONAL INSTITUTIONS,http://doc.guam.gov/prison-security/,11/22/2017,UNVERIFIED,2017/11/22 00:00:00,http://doc.guam.gov/prison-security/,NOT AVAILABLE,-999,0.00313857043949,356.133377313264,5.48144694469e-07
697,681,10004159,FORSYTH CORRECTIONAL CENTER,307 CRAFT DR,WINSTON-SALEM,NC,27105,NOT AVAILABLE,(336) 896-7041,STATE,OPEN,245,FORSYTH,37067,USA,922140,CORRECTIONAL INSTITUTIONS,"http://webapps6.doc.state.nc.us/apps/asqExt/ASQ, https://www.ncdps.gov/Adult-Corrections/Prisons/Prison-Facilities",10/31/2017,IMAGERY,2017/12/12 00:00:00,https://www.ncdps.gov/Adult-Corrections/Prisons/Prison-Facilities,MINIMUM,248,0.00521399873902,637.031245895452,1.13058639625e-06
698,682,10003694,HAWAII COMMUNITY CORRECTIONAL CENTER,60 PUNAHELE STREET,HILO,HI,96720,NOT AVAILABLE,(808) 933-0431,STATE,OPEN,512,HAWAII,15001,USA,922140,CORRECTIONAL INSTITUTIONS,http://dps.hawaii.gov/about/divisions/corrections/,10/31/2017,IMAGERY,2017/11/22 00:00:00,http://dps.hawaii.gov/about/divisions/corrections/,NOT AVAILABLE,226,0.005107652288,588.378223211318,1.60972356381e-06
699,683,10003691,OAHU COMMUNITY CORRECTIONAL CENTER,2199 KAMEHAMEHA HIGHWAY,HONOLULU,HI,96819,NOT AVAILABLE,(808) 832-1777,STATE,OPEN,1419,HONOLULU,15003,USA,922140,CORRECTIONAL INSTITUTIONS,http://dps.hawaii.gov/about/divisions/corrections/,10/31/2017,IMAGERY,2017/11/22 00:00:00,http://dps.hawaii.gov/about/divisions/corrections/,NOT AVAILABLE,950,0.00980996895085,1129.79631887265,5.5966783394e-06
700,684,10003692,KAUAI COMMUNITY CORRECTIONAL CENTER,3-5351 KUHIO HIGHWAY,LIHUE,HI,96766,NOT AVAILABLE,(808) 241-3050,STATE,OPEN,225,KAUAI,15007,USA,922140,CORRECTIONAL INSTITUTIONS,http://dps.hawaii.gov/about/divisions/corrections/,10/31/2017,IMAGERY,2017/11/22 00:00:00,http://dps.hawaii.gov/about/divisions/corrections/,NOT AVAILABLE,130,0.00646845409215,756.951405363277,2.10240131498e-06
701,685,10000127,MAUI COMMUNITY CORRECTIONAL CENTER,600 WAIALE DR,WAILUKU,HI,96793,NOT AVAILABLE,(808) 243-5861,STATE,OPEN,495,MAUI,15009,USA,922140,CORRECTIONAL INSTITUTIONS,http://dps.hawaii.gov/about/divisions/corrections/,10/31/2017,IMAGERY,2017/11/22 00:00:00,http://dps.hawaii.gov/about/divisions/corrections/,NOT AVAILABLE,301,0.00500139373589,583.21717832612,1.5337382272e-06
702,686,10001191,WAIAWA CORRECTIONAL FACILITY,94-560 KAMEHAMEHA HWY,WAIPAHU,HI,96797,NOT AVAILABLE,(808) 677-6150,STATE,OPEN,238,HONOLULU,15003,USA,922140,CORRECTIONAL INSTITUTIONS,http://dps.hawaii.gov/about/divisions/corrections/,10/31/2017,IMAGERY,2017/11/22 00:00:00,http://dps.hawaii.gov/about/divisions/corrections/,MINIMUM,334,0.0122133525778,1402.14679270531,4.14330847244e-06
703,687,10005932,ST. JOHN THE BAPTIST PARISH JAIL / SHERIFF,100 DEP. BARTON GRANIER DR,LAPLACE,LA,70068,NOT AVAILABLE,(985) 359-8627,COUNTY,OPEN,-999,ST. JOHN THE BAPTIST,22095,USA,922140,CORRECTIONAL INSTITUTIONS,http://www.stjohnsheriff.org/directory.php,3/19/2018,UNVERIFIED,2018/03/19 00:00:00,http://www.stjohnsheriff.org/directory.php,NOT AVAILABLE,-999,0.00260823057291,310.454002513473,2.9985698265e-07
704,688,10000124,HALAWA CORRECTIONAL FACILITY,99-902 MOANALUA RD,AIEA,HI,96701,NOT AVAILABLE,(808) 485-5200,STATE,OPEN,752,HONOLULU,15003,USA,922140,CORRECTIONAL INSTITUTIONS,http://dps.hawaii.gov/about/divisions/corrections/,11/27/2017,IMAGERY,2017/11/27 00:00:00,http://dps.hawaii.gov/about/divisions/corrections/,MAXIMUM,1124,0.0138382299778,1588.93526116565,6.82949414476e-06
705,689,10000681,LAWRENCE COUNTY JAIL,1306 LEXINGTON AVENUE,LAWRENCEVILLE,IL,62439,NOT AVAILABLE,NOT AVAILABLE,COUNTY,OPEN,-999,LAWRENCE,17101,USA,922140,CORRECTIONAL INSTITUTIONS,http://www.ilsheriff.org/index.php/directory,3/2/2018,IMAGERY,2018/03/02 00:00:00,NOT AVAILABLE,NOT AVAILABLE,20,0.00136236348709,172.353139647801,8.8669904573e-08
706,690,10003856,BERKSHIRE COUNTY JAIL AND HOUSE OF CORRECTION,467 CHESHIRE ROAD,PITTSFIELD,MA,01201,NOT AVAILABLE,(413) 443-7220,COUNTY,OPEN,227,BERKSHIRE,25003,USA,922140,CORRECTIONAL INSTITUTIONS,"http://www.mass.gov/eopss/docs/doc/research-reports/overcrowding/2017-1stqtr-prisoncapacity-report.pdf, https://bcsoma.org/",3/27/2017,IMAGERY,2018/03/19 00:00:00,https://bcsoma.org/,NOT AVAILABLE,500,0.00800141235138,1022.12382067439,3.1020453761e-06
707,691,10003866,BARNSTABLE COUNTY CORRECTIONAL FACILITY,6000 SHERIFFS PLACE,BOURNE,MA,02532,NOT AVAILABLE,(508) 563-4300,COUNTY,OPEN,373,BARNSTABLE,25001,USA,922140,CORRECTIONAL INSTITUTIONS,"http://www.mass.gov/eopss/docs/doc/research-reports/overcrowding/2017-1stqtr-prisoncapacity-report.pdf, http://www.bsheriff.net/",3/27/2017,IMAGERY,2018/03/19 00:00:00,http://www.bsheriff.net/,NOT AVAILABLE,588,0.00747137116095,949.161329484834,3.85364450486e-06
708,692,10004157,FRANKLIN CORRECTIONAL CENTER,5918 HWY 39 S,BUNN,NC,27508,NOT AVAILABLE,(919) 496-6119,STATE,OPEN,467,FRANKLIN,37069,USA,922140,CORRECTIONAL INSTITUTIONS,"http://webapps6.doc.state.nc.us/apps/asqExt/ASQ, https://www.ncdps.gov/Adult-Corrections/Prisons/Prison-Facilities",10/31/2017,IMAGERY,2017/12/12 00:00:00,https://www.ncdps.gov/Adult-Corrections/Prisons/Prison-Facilities,MEDIUM,452,0.0105028186925,1330.68855936198,4.47794215811e-06
709,693,10000126,WOMEN'S COMMUNITY CORRECTIONAL CENTER,42-477 KALANIANAOLE HWY,KAILUA,HI,96734,NOT AVAILABLE,(808) 266-9580,STATE,OPEN,272,HONOLULU,15003,USA,922140,CORRECTIONAL INSTITUTIONS,http://dps.hawaii.gov/about/divisions/corrections/,10/31/2017,IMAGERY,2017/11/22 00:00:00,http://dps.hawaii.gov/about/divisions/corrections/,MAXIMUM,260,0.0120076878999,1387.73990608237,2.87965604129e-06
710,694,10000216,HAMILTON PRISON (PRE-RELEASE FACILITY),200 LEE MORRISON LANE,BRYAN,TX,77807,NOT AVAILABLE,(979) 779-1633,STATE,OPEN,1086,BRAZOS,48041,USA,922140,CORRECTIONAL INSTITUTIONS,"https://www.texastribune.org/library/data/texas-prisons/units/, http://www.tdcj.state.tx.us/unit_directory/index.html",9/15/2016,IMAGERY,2018/01/11 00:00:00,http://www.tdcj.state.tx.us/unit_directory/index.html,MEDIUM,1166,0.0128135163484,1562.05446925577,8.81056490046e-06
711,695,10003690,HAWAII YOUTH CORRECTIONAL FACILITY,42-477 KALANIANAOLE HIGHWAY,KAILUA,HI,96734,NOT AVAILABLE,(808) 266-9500,STATE,OPEN,-999,HONOLULU,15003,USA,922140,CORRECTIONAL INSTITUTIONS,http://humanservices.hawaii.gov/oys/,11/22/2017,IMAGERY,2017/11/22 00:00:00,http://humanservices.hawaii.gov/oys/,JUVENILE,56,0.00777697587627,881.859439698557,3.08881072573e-06
712,696,10004210,GASTON CORRECTIONAL CENTER,520 JUSTICE COURT,DALLAS,NC,28034,NOT AVAILABLE,(704) 922-3861,STATE,OPEN,242,GASTON,37071,USA,922140,CORRECTIONAL INSTITUTIONS,"http://webapps6.doc.state.nc.us/apps/asqExt/ASQ, https://www.ncdps.gov/Adult-Corrections/Prisons/Prison-Facilities",10/31/2017,IMAGERY,2017/12/12 00:00:00,https://www.ncdps.gov/Adult-Corrections/Prisons/Prison-Facilities,MINIMUM,242,0.00565328284326,705.037926890052,1.58964800617e-06
713,697,10005255,TRINITY COUNTY JUVENILE HALL,333 TOM BELL ROAD,WEAVERVILLE,CA,96093,NOT AVAILABLE,NOT AVAILABLE,COUNTY,OPEN,-999,TRINITY,06105,USA,922140,CORRECTIONAL INSTITUTIONS,http://www.trinitycounty.org/index.aspx?page=78,2/16/2018,IMAGERY,2018/02/16 00:00:00,http://www.trinitycounty.org/index.aspx?page=78,JUVENILE,28,0.00237621239573,295.223833716865,3.14710505781e-07
714,698,10002799,HAVINS PRE-RELEASE FACILITY,500 FM 45 E,BROWNWOOD,TX,76801,NOT AVAILABLE,(325) 643-5575,STATE,OPEN,568,BROWN,48049,USA,922140,CORRECTIONAL INSTITUTIONS,"https://www.texastribune.org/library/data/texas-prisons/units/, http://www.tdcj.state.tx.us/unit_directory/index.html",9/15/2016,IMAGERY,2018/01/11 00:00:00,http://www.tdcj.state.tx.us/unit_directory/index.html,MEDIUM,596,0.00959174810615,1156.49677540075,4.39898194694e-06
715,699,10001775,GREENE CORRECTIONAL INSTITUTION,2699 HWY 903,MAURY,NC,28554,NOT AVAILABLE,(252) 747-3676,STATE,OPEN,646,GREENE,37079,USA,922140,CORRECTIONAL INSTITUTIONS,"http://webapps6.doc.state.nc.us/apps/asqExt/ASQ, https://www.ncdps.gov/Adult-Corrections/Prisons/Prison-Facilities",10/31/2017,IMAGERY/OTHER,2017/12/12 00:00:00,https://www.ncdps.gov/Adult-Corrections/Prisons/Prison-Facilities,MINIMUM,616,0.00755172414727,925.254931444925,3.52198953568e-06
716,700,10002336,TULARE COUNTY JAIL / SHERIFF,2404 WEST BURREL AVENUE,VISALIA,CA,93291,NOT AVAILABLE,(559) 636-4655,COUNTY,OPEN,269,TULARE,06107,USA,922140,CORRECTIONAL INSTITUTIONS,http://www.bscc.ca.gov/s_fsojailprofilesurvey.php,2/16/2018,IMAGERY,2018/02/16 00:00:00,http://tularecounty.ca.gov/sheriff/index.cfm/detentions1/detentions-operations/,NOT AVAILABLE,264,0.00246078759624,293.685570303872,2.38093620112e-07
717,701,10006891,SHAWANO COUNTY WORK RELEASE CENTER,1240 ENGEL DR,SHAWANO,WI,54166,NOT AVAILABLE,(715) 526-7980,COUNTY,OPEN,-999,SHAWANO,55115,USA,922140,CORRECTIONAL INSTITUTIONS,http://www.co.shawano.wi.us/departments/?department=caa27d351746,5/9/2018,IMAGERY,2018/05/09 00:00:00,NOT AVAILABLE,NOT AVAILABLE,-999,0.00264130319306,338.844185191447,2.83227835168e-07
718,702,10001096,MT. PLEASANT CORRECTIONAL FACILITY,1200 EAST WASHINGTON STREET,MOUNT PLEASANT,IA,52641,NOT AVAILABLE,(319) 385-9511,STATE,OPEN,1000,HENRY,19087,USA,922140,CORRECTIONAL INSTITUTIONS,https://doc.iowa.gov/daily-statistics,11/27/2017,IMAGERY,2017/11/27 00:00:00,https://doc.iowa.gov/about-us/about-institutions,MINIMUM,776,0.0233247750835,3033.79593584612,2.29205156263e-05
719,703,10001077,FORT DODGE CORRECTIONAL FACILITY,1550 L STREET,FORT DODGE,IA,50501,NOT AVAILABLE,(515) 574-4700,STATE,OPEN,1296,WEBSTER,19187,USA,922140,CORRECTIONAL INSTITUTIONS,https://doc.iowa.gov/daily-statistics,11/27/2017,IMAGERY,2017/11/27 00:00:00,https://doc.iowa.gov/about-us/about-institutions,MEDIUM,1162,0.013483819786,1691.96768338764,1.16832579053e-05
720,704,10001087,IOWA CORRECTIONAL INSTITUTION FOR WOMEN,420 MILL STREET SOUTHWEST,MITCHELLVILLE,IA,50169,NOT AVAILABLE,(515) 725-5042,STATE,OPEN,711,POLK,19153,USA,922140,CORRECTIONAL INSTITUTIONS,https://doc.iowa.gov/daily-statistics,11/27/2017,IMAGERY,2017/11/27 00:00:00,http://www.doc.state.ia.us/Institutions.asp,MEDIUM,774,0.0159521649507,2056.15856714143,1.20476149597e-05
721,705,10001099,CLARINDA CORRECTIONAL FACILITY,2000 NORTH 16TH STREET,CLARINDA,IA,51632,NOT AVAILABLE,(712) 542-5634,STATE,OPEN,1002,PAGE,19145,USA,922140,CORRECTIONAL INSTITUTIONS,https://doc.iowa.gov/daily-statistics,11/27/2017,IMAGERY,2017/11/27 00:00:00,https://doc.iowa.gov/about-us/about-institutions,MEDIUM,961,0.0175141648572,2224.19098399753,9.97275509469e-06
722,706,10005639,WATERLOO WOMEN'S CENTER FOR CHANGE,1515 LAFAYETTE,WATERLOO,IA,50703,NOT AVAILABLE,(319) 292-0900,STATE,OPEN,39,BLACK HAWK,19013,USA,922140,CORRECTIONAL INSTITUTIONS,https://www.legis.iowa.gov/docs/publications/FCT/860760.pdf,7/1/2016,IMAGERY,2017/11/27 00:00:00,https://doc.iowa.gov/about-us/about-community-based-corrections/1st-judicial-district,NOT AVAILABLE,-999,0.00263363693785,339.405236609497,2.89611338268e-07
723,707,10001100,IOWA STATE PENITENTIARY,2111 330TH AVENUE,FORT MADISON,IA,52627,NOT AVAILABLE,(319) 372-5432,STATE,OPEN,688,LEE,19111,USA,922140,CORRECTIONAL INSTITUTIONS,https://doc.iowa.gov/daily-statistics,11/27/2017,IMAGERY,2017/11/27 00:00:00,http://iowastatepen.com/,MAXIMUM,772,0.0184030126475,2332.33687115078,2.04844456256e-05
724,708,10002845,HENLEY STATE JAIL,7581 HWY 321,DAYTON,TX,77535,NOT AVAILABLE,(936) 258-2476,STATE,OPEN,231,LIBERTY,48291,USA,922140,CORRECTIONAL INSTITUTIONS,"https://www.texastribune.org/library/data/texas-prisons/units/, http://www.tdcj.state.tx.us/unit_directory/index.html",9/15/2016,IMAGERY,2018/01/11 00:00:00,http://www.tdcj.state.tx.us/unit_directory/index.html,MEDIUM,576,0.00683909823342,812.791156528108,3.19450321925e-06
725,709,10002337,TULARE COUNTY ADULT PRE-TRIAL FACILITY,36650 ROAD 112,VISALIA,CA,93291,NOT AVAILABLE,(559) 735-1750,COUNTY,OPEN,345,TULARE,06107,USA,922140,CORRECTIONAL INSTITUTIONS,http://www.bscc.ca.gov/s_fsojailprofilesurvey.php,2/16/2018,IMAGERY,2018/02/16 00:00:00,http://tularecounty.ca.gov/sheriff/index.cfm/detentions1/detentions-operations/,MAXIMUM,230,0.00433363281175,529.783872148946,8.65907087058e-07
726,710,10000643,LEE COUNTY JAIL,122 WEST 3RD STREET,DIXON,IL,61021,NOT AVAILABLE,(815) 284-6631,COUNTY,OPEN,52,LEE,17103,USA,922140,CORRECTIONAL INSTITUTIONS,"https://www.leecountyil.com/index.php?option=com_content&view=article&id=125&Itemid=391, http://www.ilsheriff.org/index.php/directory",3/1/2018,IMAGERY,2018/03/02 00:00:00,https://www.leecountyil.com/index.php?option=com_content&view=article&id=125&Itemid=391,NOT AVAILABLE,44,0.0036334060756,452.235338710029,5.4621436485e-07
727,711,10002656,WATERLOO RESIDENTIAL CORRECTIONAL FACILITY,310-314 E 6TH ST,WATERLOO,IA,50704,NOT AVAILABLE,(319) 291-2015,STATE,OPEN,144,BLACK HAWK,19013,USA,922140,CORRECTIONAL INSTITUTIONS,https://www.legis.iowa.gov/docs/publications/FCT/860760.pdf,7/1/2016,IMAGERY,2017/11/27 00:00:00,https://doc.iowa.gov/about-us/about-community-based-corrections/1st-judicial-district,NOT AVAILABLE,150,0.00282136696813,363.030246062452,3.66411875165e-07
728,712,10001996,BRAZORIA COUNTY DETENTION CENTER,3602 COUNTY RD 45,ANGLETON,TX,77515,NOT AVAILABLE,NOT AVAILABLE,COUNTY,OPEN,789,BRAZORIA,48039,USA,922140,CORRECTIONAL INSTITUTIONS,https://www.tcjs.state.tx.us/index.php?linkID=325,3/1/2018,IMAGERY,2018/04/25 00:00:00,http://brazoriacountytx.gov/departments/sheriff-s-office,NOT AVAILABLE,1170,0.0141007890535,1675.77461671084,3.90652423361e-06
729,713,10006057,GRAFTON COUNTY DEPARTMENT OF CORRECTIONS,3787 DARTMOUTH COLLEGE HIGHWAY,NORTH HAVERHILL,NH,03774,NOT AVAILABLE,(603) 787-2019,COUNTY,OPEN,103,GRAFTON,33009,USA,922140,CORRECTIONAL INSTITUTIONS,"https://www.nh.gov/nhdoc/divisions/publicinformation/documents/012010_justice_rein_analyses.pdf, http://www.co.grafton.nh.us/all-departments/",2/15/2016,IMAGERY/OTHER,2018/04/05 00:00:00,http://www.graftoncountynhdoc.us/grafton-county-department-of-corrections.html,NOT AVAILABLE,150,0.00808429450264,1053.34845269275,1.57764136787e-06
730,714,10001856,DUBUQUE RESIDENTIAL FACILITY,1494 ELM ST,DUBUQUE,IA,52001,NOT AVAILABLE,(563) 556-6196,STATE,OPEN,71,DUBUQUE,19061,USA,922140,CORRECTIONAL INSTITUTIONS,https://www.legis.iowa.gov/docs/publications/FCT/860760.pdf,7/1/2016,IMAGERY,2017/11/27 00:00:00,https://doc.iowa.gov/about-us/about-community-based-corrections/1st-judicial-district,NOT AVAILABLE,80,0.00236474717938,297.668041650337,2.78305849464e-07
731,715,10001025,HARNETT CORRECTIONAL INSTITUTION,1210 E MCNEILL ST,LILLINGTON,NC,27546,NOT AVAILABLE,(910) 893-2751,STATE,OPEN,985,HARNETT,37085,USA,922140,CORRECTIONAL INSTITUTIONS,"http://webapps6.doc.state.nc.us/apps/asqExt/ASQ, https://www.ncdps.gov/Adult-Corrections/Prisons/Prison-Facilities",10/31/2017,IMAGERY,2017/12/12 00:00:00,https://www.ncdps.gov/Adult-Corrections/Prisons/Prison-Facilities,MEDIUM,988,0.0138021470428,1776.47969952561,1.04595504616e-05
732,716,10001853,WEST UNION RESIDENTIAL FACILITY,500 S PINE ST,WEST UNION,IA,52175,NOT AVAILABLE,(563) 422-5758,STATE,OPEN,45,FAYETTE,19065,USA,922140,CORRECTIONAL INSTITUTIONS,https://www.legis.iowa.gov/docs/publications/FCT/860760.pdf,7/1/2016,IMAGERY,2017/11/27 00:00:00,https://doc.iowa.gov/about-us/about-community-based-corrections/1st-judicial-district,NOT AVAILABLE,48,0.00161616014612,206.183394891497,1.14582975637e-07
733,717,10001852,BEJE CLARK RESIDENTIAL CENTER(MASON CITY RES),818 15TH ST SW,MASON CITY,IA,50402,1226,(641) 424-3817,STATE,OPEN,49,CERRO GORDO,19033,USA,922140,CORRECTIONAL INSTITUTIONS,"https://www.legis.iowa.gov/docs/publications/FCT/860760.pdf, https://doc.iowa.gov/about-us/about-community-based-corrections/2nd-judicial-district",7/1/2016,IMAGERY,2017/11/27 00:00:00,https://doc.iowa.gov/about-us/about-community-based-corrections/2nd-judicial-district,NOT AVAILABLE,56,0.00159562669801,206.441191591693,1.02731218298e-07
734,718,10000224,HIGHTOWER PRISON,902 FM 686,DAYTON,TX,77535,NOT AVAILABLE,(936) 258-8013,STATE,OPEN,1367,LIBERTY,48291,USA,922140,CORRECTIONAL INSTITUTIONS,"https://www.texastribune.org/library/data/texas-prisons/units/, http://www.tdcj.state.tx.us/unit_directory/index.html",9/15/2016,IMAGERY,2018/01/11 00:00:00,http://www.tdcj.state.tx.us/unit_directory/index.html,MAXIMUM,1384,0.0123677743458,1485.71566465449,9.88350321672e-06
735,719,10001797,HOKE CORRECTIONAL INSTITUTION,243 OLD HWY 211,RAEFORD,NC,28376,NOT AVAILABLE,(910) 944-7612,STATE,OPEN,607,HOKE,37093,USA,922140,CORRECTIONAL INSTITUTIONS,"http://webapps6.doc.state.nc.us/apps/asqExt/ASQ, https://www.ncdps.gov/Adult-Corrections/Prisons/Prison-Facilities",10/31/2017,IMAGERY,2017/12/12 00:00:00,https://www.ncdps.gov/Adult-Corrections/Prisons/Prison-Facilities,MINIMUM,502,0.0115032273594,1486.69834494305,4.11696785823e-06
736,720,10006782,C. CARLOS CARREIRO IMMIGRATION DETENTION CENTER,400 FAUNCE CORNER ROAD,NORTH DARTMOUTH,MA,02747,NOT AVAILABLE,(508) 995-6400,COUNTY,OPEN,-999,BRISTOL,25005,USA,922140,CORRECTIONAL INSTITUTIONS,http://www.bcso-ma.us/index.htm,3/19/2018,IMAGERY/OTHER,2018/03/19 00:00:00,http://www.bcso-ma.us/index.htm,NOT AVAILABLE,-999,0.00228029105308,290.080502191212,2.15007997285e-07
737,721,10002338,BOB WILEY DETENTION FACILITY,36712 ROAD 112,VISALIA,CA,93291,NOT AVAILABLE,(559) 735-1700,COUNTY,OPEN,677,TULARE,06107,USA,922140,CORRECTIONAL INSTITUTIONS,http://www.bscc.ca.gov/s_fsojailprofilesurvey.php,2/16/2018,IMAGERY,2018/02/16 00:00:00,http://tularecounty.ca.gov/sheriff/index.cfm/detentions1/detentions-operations/,NOT AVAILABLE,690,0.00766645077086,948.525135123464,1.78923527915e-06
738,722,10002827,HOBBY PRISON,742 FM 712,MARLIN,TX,76661,NOT AVAILABLE,(254) 883-5561,STATE,OPEN,1315,FALLS,48145,USA,922140,CORRECTIONAL INSTITUTIONS,"https://www.texastribune.org/library/data/texas-prisons/units/, http://www.tdcj.state.tx.us/unit_directory/index.html",9/15/2016,IMAGERY,2018/01/11 00:00:00,http://www.tdcj.state.tx.us/unit_directory/index.html,MAXIMUM,1384,0.0125739326776,1499.90207650871,9.97336562199e-06
739,723,10002335,TULARE COUNTY JUVENILE DETENTION FACILITY,11200 AVENUE 368,VISALIA,CA,93291,NOT AVAILABLE,(559) 735-1600,COUNTY,OPEN,205,TULARE,06107,USA,922140,CORRECTIONAL INSTITUTIONS,http://tularecounty.ca.gov/probation/index.cfm/departments/,2/16/2018,IMAGERY,2018/02/16 00:00:00,http://tularecounty.ca.gov/probation/index.cfm/departments/,JUVENILE,210,0.00583540037168,697.085448993681,1.67473789031e-06
740,724,10004441,ESSEX COUNTY PRE-RELEASE AND RE-ENTRY CENTER,165 MARSTON STREET,LAWRENCE,MA,01841,NOT AVAILABLE,(978) 750-1900,COUNTY,OPEN,298,ESSEX,25009,USA,922140,CORRECTIONAL INSTITUTIONS,http://www.mass.gov/eopss/docs/doc/research-reports/overcrowding/2017-1stqtr-prisoncapacity-report.pdf,3/27/2017,IMAGERY,2018/03/19 00:00:00,https://www.essexsheriffma.org/home,MINIMUM,340,0.00315942610833,425.209956046893,4.13597356034e-07
741,725,10001865,CURT FORBES RESIDENTIAL CENTER (AMES RES),11 NORTH SHERMAN,AMES,IA,50010,NOT AVAILABLE,(515) 232-3774,STATE,OPEN,40,STORY,19169,USA,922140,CORRECTIONAL INSTITUTIONS,"https://www.legis.iowa.gov/docs/publications/FCT/860760.pdf, https://doc.iowa.gov/about-us/about-community-based-corrections/2nd-judicial-district",7/1/2016,IMAGERY,2017/11/27 00:00:00,https://doc.iowa.gov/about-us/about-community-based-corrections/2nd-judicial-district,NOT AVAILABLE,36,0.00144943337108,174.428218800698,8.47148745023e-08
742,726,10001078,FORT DODGE RESIDENTIAL CENTER,311 1ST AVENUE SOUTH,FORT DODGE,IA,50501,NOT AVAILABLE,(515) 955-6393,STATE,OPEN,52,WEBSTER,19187,USA,922140,CORRECTIONAL INSTITUTIONS,"https://www.legis.iowa.gov/docs/publications/FCT/860760.pdf, https://doc.iowa.gov/about-us/about-community-based-corrections/2nd-judicial-district",7/1/2016,IMAGERY,2017/11/27 00:00:00,https://doc.iowa.gov/about-us/about-community-based-corrections/2nd-judicial-district,NOT AVAILABLE,60,0.00208047610351,263.031674360832,2.54764103375e-07
743,727,10000656,LIVINGSTON COUNTY JAIL,844 WEST LINCOLN STREET,PONTIAC,IL,61764,NOT AVAILABLE,(815) 844-5774,COUNTY,OPEN,125,LIVINGSTON,17105,USA,922140,CORRECTIONAL INSTITUTIONS,http://livingstoncountysheriff.com/,8/18/2016,IMAGERY,2018/03/02 00:00:00,http://livingstoncountysheriff.com/,MAXIMUM,200,0.00376984512102,488.011002548123,6.80553531118e-07
744,728,10004193,HYDE CORRECTIONAL INSTITUTION,620 PRISON RD,FAIRFIELD,NC,27826,NOT AVAILABLE,(252) 926-1810,STATE,OPEN,596,HYDE,37095,USA,922140,CORRECTIONAL INSTITUTIONS,"http://webapps6.doc.state.nc.us/apps/asqExt/ASQ, https://www.ncdps.gov/Adult-Corrections/Prisons/Prison-Facilities",10/31/2017,IMAGERY,2017/12/12 00:00:00,https://www.ncdps.gov/Adult-Corrections/Prisons/Prison-Facilities,MEDIUM,736,0.0143270463031,1750.25078440834,7.67556059042e-06
745,729,10001863,MARSHALLTOWN RESIDENTIAL CENTER,1401 S 17TH AVE,MARSHALLTOWN,IA,50158,NOT AVAILABLE,(641) 753-5571,STATE,OPEN,52,MARSHALL,19127,USA,922140,CORRECTIONAL INSTITUTIONS,"https://www.legis.iowa.gov/docs/publications/FCT/860760.pdf, https://doc.iowa.gov/about-us/about-community-based-corrections/2nd-judicial-district",7/1/2016,IMAGERY,2017/11/27 00:00:00,https://doc.iowa.gov/about-us/about-community-based-corrections/2nd-judicial-district,NOT AVAILABLE,51,0.00190716335507,250.039471395981,1.25042673927e-07
746,730,10003857,FRANKLIN COUNTY JAIL AND HOUSE OF CORRECTION,160 ELM STREET,GREENFIELD,MA,01301,NOT AVAILABLE,(413) 774-4014,COUNTY,OPEN,239,FRANKLIN,25011,USA,922140,CORRECTIONAL INSTITUTIONS,"http://www.mass.gov/eopss/docs/doc/research-reports/overcrowding/2017-1stqtr-prisoncapacity-report.pdf, http://www.fcso-ma.us/PREA.html",11/5/2016,IMAGERY,2018/03/19 00:00:00,http://www.fcso-ma.us/,MAXIMUM,329,0.00687283151701,882.242899343276,1.99829049637e-06
747,731,10003865,HAMPDEN COUNTY CORRECTIONAL CENTER,627 RANDALL ROAD,LUDLOW,MA,01056,NOT AVAILABLE,(413) 858-0000,COUNTY,OPEN,1350,HAMPDEN,25013,USA,922140,CORRECTIONAL INSTITUTIONS,"http://www.hcsdmass.org/home/, http://www.mass.gov/eopss/docs/doc/research-reports/overcrowding/2017-1stqtr-prisoncapacity-report.pdf",3/27/2017,IMAGERY,2018/03/19 00:00:00,http://www.hcsdmass.org/home/,MEDIUM,1178,0.0119214885491,1491.16743808679,4.7714856174e-06
748,732,10000666,LOGAN COUNTY JAIL,911 PEKIN STREET,LINCOLN,IL,62656,NOT AVAILABLE,(217) 735-2610,COUNTY,OPEN,-999,LOGAN,17107,USA,922140,CORRECTIONAL INSTITUTIONS,https://www.logancountyil.gov/index.php?option=com_content&view=article&id=205&Itemid=562&lang=en,3/2/2018,IMAGERY,2018/03/02 00:00:00,https://www.logancountyil.gov/index.php?option=com_content&view=article&id=205&Itemid=562&lang=en,NOT AVAILABLE,65,0.00173329128324,217.717721159896,1.82109601308e-07
749,733,10002791,HODGE UNIT,379 FM 2972 WEST,RUSK,TX,75785,3666,(903) 683-5781,STATE,OPEN,947,CHEROKEE,48073,USA,922140,CORRECTIONAL INSTITUTIONS,"https://www.texastribune.org/library/data/texas-prisons/units/, http://www.tdcj.state.tx.us/unit_directory/index.html",9/15/2016,IMAGERY,2018/01/11 00:00:00,http://www.tdcj.state.tx.us/unit_directory/index.html,MEDIUM,989,0.012227990817,1516.86231687379,5.20214573482e-06
750,734,10004190,JOHNSTON CORRECTIONAL INSTITUTION,2465 US 70 W,SMITHFIELD,NC,27577,NOT AVAILABLE,(919) 934-8386,STATE,OPEN,636,JOHNSTON,37101,USA,922140,CORRECTIONAL INSTITUTIONS,"http://webapps6.doc.state.nc.us/apps/asqExt/ASQ, https://www.ncdps.gov/Adult-Corrections/Prisons/Prison-Facilities",10/31/2017,IMAGERY,2017/12/12 00:00:00,https://www.ncdps.gov/Adult-Corrections/Prisons/Prison-Facilities,MINIMUM,612,0.0187730780609,2277.77741708021,6.79965534845e-06
751,735,10001860,SIOUX CITY RESIDENTIAL TREATMENT FACILITY,515 WATER ST,SIOUX CITY,IA,51103,NOT AVAILABLE,(712) 252-0590,STATE,OPEN,91,WOODBURY,19193,USA,922140,CORRECTIONAL INSTITUTIONS,"https://www.legis.iowa.gov/docs/publications/FCT/860760.pdf, https://doc.iowa.gov/about-us/about-community-based-corrections/3rd-judicial-district",7/1/2016,IMAGERY,2017/11/27 00:00:00,https://doc.iowa.gov/about-us/about-community-based-corrections/3rd-judicial-district,NOT AVAILABLE,99,0.00357272015254,463.839306764384,2.92555015808e-07
752,736,10001076,SHELDON RESIDENTIAL FACILITY,720 WESTERN AVE,SHELDON,IA,51201,NOT AVAILABLE,(712) 324-5384,STATE,OPEN,30,SIOUX,19167,USA,922140,CORRECTIONAL INSTITUTIONS,"https://www.legis.iowa.gov/docs/publications/FCT/860760.pdf, https://doc.iowa.gov/about-us/about-community-based-corrections/3rd-judicial-district",7/1/2016,IMAGERY,2017/11/27 00:00:00,https://doc.iowa.gov/about-us/about-community-based-corrections/3rd-judicial-district,NOT AVAILABLE,30,0.00166658472975,216.329035944075,1.16276989681e-07
753,737,10002334,TULARE COUNTY PROBATION YOUTH FACILITY,11150 AVENUE 368,VISALIA,CA,93291,NOT AVAILABLE,(559) 735-1400,COUNTY,OPEN,-999,TULARE,06107,USA,922140,CORRECTIONAL INSTITUTIONS,http://tularecounty.ca.gov/probation/index.cfm/departments/,2/16/2018,IMAGERY,2018/02/16 00:00:00,http://tularecounty.ca.gov/probation/index.cfm/departments/,JUVENILE,120,0.00398580808345,486.540821854443,5.83787903813e-07
754,738,10004197,LINCOLN CORRECTIONAL CENTER,464 ROPER DR,LINCOLNTON,NC,28092,NOT AVAILABLE,(704) 735-0485,STATE,OPEN,233,LINCOLN,37109,USA,922140,CORRECTIONAL INSTITUTIONS,"http://webapps6.doc.state.nc.us/apps/asqExt/ASQ, https://www.ncdps.gov/Adult-Corrections/Prisons/Prison-Facilities",10/31/2017,IMAGERY,2017/12/12 00:00:00,https://www.ncdps.gov/Adult-Corrections/Prisons/Prison-Facilities,MINIMUM,202,0.00520727521151,639.293293759583,1.39540724073e-06
755,739,10000209,HOLLIDAY TRANSFER FACILITY,295 INTERSTATE HWY 45 N,HUNTSVILLE,TX,77320,8443,(936) 295-8200,STATE,OPEN,2065,WALKER,48471,USA,922140,CORRECTIONAL INSTITUTIONS,"https://www.texastribune.org/library/data/texas-prisons/units/, http://www.tdcj.state.tx.us/unit_directory/index.html",9/15/2016,IMAGERY,2018/01/11 00:00:00,http://www.tdcj.state.tx.us/unit_directory/index.html,NOT AVAILABLE,2128,0.0156758979716,1823.42260095536,1.224953998e-05
756,740,10002117,ROBERT A DEYTON DETENTION FACILITY,"11866 HASTINGS BRIDGE RD, PO BOX 429",LOVEJOY,GA,30250,NOT AVAILABLE,(770) 305-8000,FEDERAL,OPEN,-999,CLAYTON,13063,USA,922140,CORRECTIONAL INSTITUTIONS,https://www.geogroup.com/Locations,10/2/2017,IMAGERY,2017/09/29 00:00:00,https://www.geogroup.com/Locations,NOT AVAILABLE,768,0.00749717714307,899.054788811418,3.22279284604e-06
757,741,10005130,TX DEPARTMENT OF CRIMINAL JUSTICE - HOSPITAL GALVESTON,809 HARBORSIDE DRIVE,GALVESTON,TX,77555,NOT AVAILABLE,(409) 772-2875,STATE,OPEN,196,GALVESTON,48167,USA,922140,CORRECTIONAL INSTITUTIONS,"https://www.texastribune.org/library/data/texas-prisons/units/, http://www.tdcj.state.tx.us/unit_directory/index.html",9/15/2016,IMAGERY/OTHER,2018/01/11 00:00:00,http://www.tdcj.state.tx.us/unit_directory/index.html,MAXIMUM,365,0.00267870278161,316.833312733867,2.92960376088e-07
758,742,10002580,SHEBOYGAN COUNTY ADULT DETENTION CENTER,2923 S 31ST ST,SHEBOYGAN,WI,53081,4612,(920) 459-1300,COUNTY,OPEN,414,SHEBOYGAN,55117,USA,922140,CORRECTIONAL INSTITUTIONS,http://www.sheboygancounty.com/government/departments/sheriff-s-department/correctional-facilities,5/9/2018,IMAGERY,2018/05/09 00:00:00,NOT AVAILABLE,NOT AVAILABLE,295,0.00548516400207,709.545267339114,8.49229031792e-07
759,743,10004692,MCDONOUGH COUNTY JAIL,110 SOUTH MCARTHUR STREET,MACOMB,IL,61455,NOT AVAILABLE,(309) 833-5245,COUNTY,OPEN,-999,MCDONOUGH,17109,USA,922140,CORRECTIONAL INSTITUTIONS,http://www.ilsheriff.org/index.php/directory,3/2/2018,IMAGERY,2018/03/02 00:00:00,https://www.mcdonoughcountysheriff.com/sheriffs-office/,NOT AVAILABLE,53,0.00269892883417,348.286991390721,2.49011960933e-07
760,744,10006541,COUNCIL BLUFFS RESIDENTIAL TREATMENT CENTER,1102 9TH AVENUE,COUNCIL BLUFFS,IA,51501,NOT AVAILABLE,(712) 396-2216,STATE,OPEN,29,POTTAWATTAMIE,19155,USA,922140,CORRECTIONAL INSTITUTIONS,"https://www.legis.iowa.gov/docs/publications/FCT/860760.pdf, https://doc.iowa.gov/about-us/about-community-based-corrections/4th-judicial-district",7/1/2016,IMAGERY,2017/11/27 00:00:00,https://doc.iowa.gov/about-us/about-community-based-corrections/4th-judicial-district,NOT AVAILABLE,44,0.00159929633857,192.049954477603,1.15954748279e-07
761,745,10001027,LUMBERTON CORRECTIONAL INSTITUTION,75 LEGEND RD,LUMBERTON,NC,28359,NOT AVAILABLE,(910) 618-5574,STATE,OPEN,784,ROBESON,37155,USA,922140,CORRECTIONAL INSTITUTIONS,"http://webapps6.doc.state.nc.us/apps/asqExt/ASQ, https://www.ncdps.gov/Adult-Corrections/Prisons/Prison-Facilities",10/31/2017,IMAGERY,2017/12/12 00:00:00,https://www.ncdps.gov/Adult-Corrections/Prisons/Prison-Facilities,MEDIUM,768,0.0115536739925,1439.66588596262,8.51348779062e-06
762,746,10001523,TUOLUMNE COUNTY JAIL,175 YANEY AVENUE,SONORA,CA,95370,NOT AVAILABLE,(888) 243-9939,COUNTY,OPEN,145,TUOLUMNE,06109,USA,922140,CORRECTIONAL INSTITUTIONS,http://www.bscc.ca.gov/s_fsojailprofilesurvey.php,2/16/2018,IMAGERY,2018/02/16 00:00:00,https://www.tuolumnecounty.ca.gov/348/Custody-Division,NOT AVAILABLE,140,0.00175585799941,218.140717886944,1.85174830948e-07
763,747,10001089,FORT DES MOINES COMMUNITY CORRECTIONS COMPLEX,68 THAYER ST,DES MOINES,IA,50315,NOT AVAILABLE,(515) 242-6603,STATE,OPEN,249,POLK,19153,USA,922140,CORRECTIONAL INSTITUTIONS,"https://www.legis.iowa.gov/docs/publications/FCT/860760.pdf, https://doc.iowa.gov/about-us/about-community-based-corrections/5th-judicial-district",7/1/2016,IMAGERY,2017/11/27 00:00:00,https://doc.iowa.gov/about-us/about-community-based-corrections/5th-judicial-district,NOT AVAILABLE,267,0.0170199236177,1989.28600186976,9.38779712816e-06
764,748,10004119,MERRIMACK COUNTY HOUSE OF CORRECTIONS,314 DANIEL WEBSTER HWY,BOSCAWEN,NH,03303,NOT AVAILABLE,NOT AVAILABLE,COUNTY,OPEN,232,MERRIMACK,33013,USA,922140,CORRECTIONAL INSTITUTIONS,"https://www.nh.gov/nhdoc/divisions/publicinformation/documents/012010_justice_rein_analyses.pdf, https://www.merrimackcounty.net/departments/corrections",2/15/2016,IMAGERY/OTHER,2018/04/05 00:00:00,https://www.merrimackcounty.net/departments/corrections,MAXIMUM,237,0.00661607295356,852.298883364106,1.00123548418e-06
765,749,10000196,HUGHES PRISON,3201 FM 929,GATESVILLE,TX,76597,NOT AVAILABLE,(254) 865-6663,STATE,OPEN,2956,CORYELL,48099,USA,922140,CORRECTIONAL INSTITUTIONS,"https://www.texastribune.org/library/data/texas-prisons/units/, http://www.tdcj.state.tx.us/unit_directory/index.html",9/15/2016,IMAGERY,2018/01/11 00:00:00,http://www.tdcj.state.tx.us/unit_directory/index.html,MAXIMUM,2984,0.0174729712728,2110.07200837907,1.99253536826e-05
766,750,10001770,MARION CORRECTIONAL INSTITUTION,355 OLD GLENWOOD DR,MARION,NC,28752,NOT AVAILABLE,(828) 659-7810,STATE,OPEN,654,MCDOWELL,37111,USA,922140,CORRECTIONAL INSTITUTIONS,"http://webapps6.doc.state.nc.us/apps/asqExt/ASQ, https://www.ncdps.gov/Adult-Corrections/Prisons/Prison-Facilities",10/31/2017,IMAGERY,2017/12/12 00:00:00,https://www.ncdps.gov/Adult-Corrections/Prisons/Prison-Facilities,CLOSE,738,0.0114559666873,1410.77083020273,8.43811437982e-06
767,751,10001289,BRAZORIA JUVENILE DETENTION CENTER,20875 COUNTY RD 171,ANGLETON,TX,77515,NOT AVAILABLE,(979) 864-1210,COUNTY,OPEN,45,BRAZORIA,48039,USA,922140,CORRECTIONAL INSTITUTIONS,http://brazoriacountytx.gov/departments/juvenile-probation,3/24/2016,IMAGERY,2018/04/25 00:00:00,http://brazoriacountytx.gov/departments/juvenile-probation,JUVENILE,78,0.00353348625369,426.386655179643,4.51965007611e-07
768,752,10002535,TAYLOR COUNTY JAIL / SHERIFF,224 S SECOND ST,MEDFORD,WI,54451,NOT AVAILABLE,(715) 748-1431,COUNTY,OPEN,-999,TAYLOR,55119,USA,922140,CORRECTIONAL INSTITUTIONS,http://www.co.taylor.wi.us/departments/n-z/sheriff/,5/9/2018,IMAGERY,2018/05/09 00:00:00,NOT AVAILABLE,NOT AVAILABLE,-999,0.00296120355401,378.894205759748,2.84641651877e-07
769,753,10001862,GERALD R HINZMAN CENTER (CEDAR RAPIDS RESIDENTIAL),1051 29TH AVENUE SOUTHWEST,CEDAR RAPIDS,IA,52404,NOT AVAILABLE,(319) 398-3668,STATE,OPEN,84,LINN,19113,USA,922140,CORRECTIONAL INSTITUTIONS,"https://www.legis.iowa.gov/docs/publications/FCT/860760.pdf, https://doc.iowa.gov/6th-judicial-district",7/1/2016,IMAGERY,2017/11/27 00:00:00,https://doc.iowa.gov/6th-judicial-district,MINIMUM,86,0.00354132412583,437.738508186749,7.15732840871e-07
770,754,10001861,LARY A NELSON CENTER (CEDAR RAPIDS WORK RELEASE),1001 29TH AVENUE SOUTHWEST,CEDAR RAPIDS,IA,52404,NOT AVAILABLE,(319) 398-3600,STATE,OPEN,112,LINN,19113,USA,922140,CORRECTIONAL INSTITUTIONS,"https://www.legis.iowa.gov/docs/publications/FCT/860760.pdf, https://doc.iowa.gov/6th-judicial-district",7/1/2016,IMAGERY,2017/11/27 00:00:00,https://doc.iowa.gov/6th-judicial-district,MINIMUM,93,0.00347762348289,451.019512031178,3.09109585058e-07
771,755,10000210,HUNTSVILLE PRISON,815 12TH ST,HUNTSVILLE,TX,77348,NOT AVAILABLE,(936) 437-1555,STATE,OPEN,1656,WALKER,48471,USA,922140,CORRECTIONAL INSTITUTIONS,"https://www.texastribune.org/library/data/texas-prisons/units/, http://www.tdcj.state.tx.us/unit_directory/index.html",9/15/2016,IMAGERY,2018/01/11 00:00:00,http://www.tdcj.state.tx.us/unit_directory/index.html,MAXIMUM,1705,0.00790222625508,965.52296066409,3.75345379294e-06
772,756,10004219,MORRISON CORRECTIONAL INSTITUTION,1573 MCDONALD CHURCH RD,HOFFMAN,NC,28347,NOT AVAILABLE,(910) 281-3161,STATE,OPEN,739,RICHMOND,37153,USA,922140,CORRECTIONAL INSTITUTIONS,"http://webapps6.doc.state.nc.us/apps/asqExt/ASQ, https://www.ncdps.gov/Adult-Corrections/Prisons/Prison-Facilities",10/31/2017,IMAGERY,2017/12/12 00:00:00,https://www.ncdps.gov/Adult-Corrections/Prisons/Prison-Facilities,MEDIUM,801,0.0279324948309,3384.84389040713,1.37496060352e-05
773,757,10001093,HOPE HOUSE,2501 HOLIDAY RD,CORALVILLE,IA,52240,NOT AVAILABLE,(319) 625-2202,STATE,OPEN,59,JOHNSON,19103,USA,922140,CORRECTIONAL INSTITUTIONS,"https://www.legis.iowa.gov/docs/publications/FCT/860760.pdf, https://doc.iowa.gov/6th-judicial-district",7/1/2016,IMAGERY,2017/11/27 00:00:00,https://doc.iowa.gov/6th-judicial-district,MINIMUM,58,0.00233367471454,293.957576241002,2.57213302424e-07
774,758,10001754,MOUNTAIN VIEW CORRECTIONAL INSTITUTION,545 AMITY PARK RD,SPRUCE PINE,NC,28777,NOT AVAILABLE,(828) 766-2555,STATE,OPEN,895,AVERY,37011,USA,922140,CORRECTIONAL INSTITUTIONS,"http://webapps6.doc.state.nc.us/apps/asqExt/ASQ, https://www.ncdps.gov/Adult-Corrections/Prisons/Prison-Facilities",10/31/2017,IMAGERY,2017/12/12 00:00:00,https://www.ncdps.gov/Adult-Corrections/Prisons/Prison-Facilities,MEDIUM,884,0.00882337755565,1099.858171004,5.10575422682e-06
775,759,10000882,VENTURA COUNTY TODD ROAD FACILITY,600 SOUTH TODD ROAD,SANTA PAULA,CA,93060,NOT AVAILABLE,NOT AVAILABLE,COUNTY,OPEN,778,VENTURA,06111,USA,922140,CORRECTIONAL INSTITUTIONS,"http://www.bscc.ca.gov/s_fsojailprofilesurvey.php, http://www.vcsd.org/division-detention.php",2/19/2018,IMAGERY,2018/02/19 00:00:00,http://www.vcsd.org/division-detention.php,NOT AVAILABLE,796,0.00973001115291,1183.3751935838,2.69728177006e-06
776,760,10000886,VENTURA COUNTY PRE-TRIAL DETENTION FACILITY (MAIN JAIL),800 S VICTORIA AVE,VENTURA,CA,93009,NOT AVAILABLE,NOT AVAILABLE,COUNTY,OPEN,785,VENTURA,06111,USA,922140,CORRECTIONAL INSTITUTIONS,"http://www.bscc.ca.gov/s_fsojailprofilesurvey.php, http://www.vcsd.org/division-detention.php",2/19/2018,IMAGERY,2018/02/19 00:00:00,http://www.vcsd.org/division-detention.php,MEDIUM,890,0.00556045310388,663.603617750073,8.58467417192e-07
777,761,10002755,HUTCHINS STATE JAIL,1500 E LANGDON RD,DALLAS,TX,75241,NOT AVAILABLE,(972) 225-1304,STATE,OPEN,2095,DALLAS,48113,USA,922140,CORRECTIONAL INSTITUTIONS,"https://www.texastribune.org/library/data/texas-prisons/units/, http://www.tdcj.state.tx.us/unit_directory/index.html",9/15/2016,IMAGERY,2018/01/11 00:00:00,http://www.tdcj.state.tx.us/unit_directory/index.html,MINIMUM,2276,0.0143032125633,1699.50798018504,1.00098322191e-05
778,762,10006783,WESTERN MASSACHUSETTS REGIONAL WOMEN'S CORRECTIONAL CENTER,701 CENTER STREET,CHICOPEE,MA,01013,NOT AVAILABLE,(413) 730-6800,COUNTY,OPEN,256,HAMPDEN,25013,USA,922140,CORRECTIONAL INSTITUTIONS,http://www.mass.gov/eopss/docs/doc/research-reports/overcrowding/2017-1stqtr-prisoncapacity-report.pdf,3/27/2017,IMAGERY,2018/03/19 00:00:00,http://www.hcsdmass.org/,NOT AVAILABLE,306,0.00514517110402,655.710077154276,1.36821774272e-06
779,763,10000234,JESTER III UNIT / TRUSTY CAMP,3 JESTER RD,RICHMOND,TX,77406,NOT AVAILABLE,(281) 277-7000,STATE,OPEN,1123,FORT BEND,48157,USA,922140,CORRECTIONAL INSTITUTIONS,"https://www.texastribune.org/library/data/texas-prisons/units/, http://www.tdcj.state.tx.us/unit_directory/index.html",9/15/2016,IMAGERY,2018/01/11 00:00:00,http://www.tdcj.state.tx.us/unit_directory/index.html,MEDIUM,1131,0.018620543105,2193.09375785964,1.22100978699e-05
780,764,10001763,NASH CORRECTIONAL INSTITUTION,2869 US 64 ALT,NASHVILLE,NC,27856,NOT AVAILABLE,(252) 459-4455,STATE,OPEN,652,NASH,37127,USA,922140,CORRECTIONAL INSTITUTIONS,"http://webapps6.doc.state.nc.us/apps/asqExt/ASQ, https://www.ncdps.gov/Adult-Corrections/Prisons/Prison-Facilities",10/31/2017,IMAGERY,2017/12/12 00:00:00,https://www.ncdps.gov/Adult-Corrections/Prisons/Prison-Facilities,MEDIUM,654,0.0144915959842,1784.02405917395,1.24123020942e-05
781,765,10002256,MCHENRY COUNTY JAIL,2200 NORTH SEMINARY AVENUE,WOODSTOCK,IL,60098,NOT AVAILABLE,(815) 338-9396,COUNTY,OPEN,237,MCHENRY,17111,USA,922140,CORRECTIONAL INSTITUTIONS,http://mchenrysheriff.org/corrections.aspx,3/2/2018,IMAGERY,2018/03/02 00:00:00,http://mchenrysheriff.org/corrections.aspx,MAXIMUM,650,0.00640875361528,828.97507465727,1.66462843653e-06
782,766,10002313,YUBA COUNTY JAIL,"215 5TH ST, SUITE #150",MARYSVILLE,CA,95901,NOT AVAILABLE,(530) 749-7740,COUNTY,OPEN,339,YUBA,06115,USA,922140,CORRECTIONAL INSTITUTIONS,"http://www.bscc.ca.gov/s_fsojailprofilesurvey.php, http://sheriff.co.yuba.ca.us/index.aspx",2/19/2018,IMAGERY,2018/02/19 00:00:00,http://sheriff.co.yuba.ca.us/index.aspx,NOT AVAILABLE,428,0.00411631351784,514.35406693885,6.56303246035e-07
783,767,10002886,JESTER IV (PSYCHIATRIC FACILITY),4 JESTER RD,RICHMOND,TX,77406,NOT AVAILABLE,(281) 277-3700,STATE,OPEN,444,FORT BEND,48157,USA,922140,CORRECTIONAL INSTITUTIONS,"https://www.texastribune.org/library/data/texas-prisons/units/, http://www.tdcj.state.tx.us/unit_directory/index.html",9/15/2016,IMAGERY,2018/01/11 00:00:00,http://www.tdcj.state.tx.us/unit_directory/index.html,NOT AVAILABLE,550,0.00839546584928,1014.63781224428,4.74367192913e-06
784,768,10006542,ANCHOR CENTER,3115 12TH STREET SW,CEDAR RAPIDS,IA,52404,NOT AVAILABLE,(319) 297-3500,STATE,OPEN,13,LINN,19113,USA,922140,CORRECTIONAL INSTITUTIONS,"https://www.legis.iowa.gov/docs/publications/FCT/860760.pdf, https://doc.iowa.gov/6th-judicial-district",7/1/2016,IMAGERY,2017/11/27 00:00:00,https://doc.iowa.gov/6th-judicial-district,NOT AVAILABLE,26,0.00223612676891,276.380092485795,2.1674371463e-07
785,769,10001095,605 CENTER,605 MAIN STREET,DAVENPORT,IA,52803,5244,(563) 322-7986,STATE,OPEN,50,SCOTT,19163,USA,922140,CORRECTIONAL INSTITUTIONS,"https://www.legis.iowa.gov/docs/publications/FCT/860760.pdf, https://doc.iowa.gov/about-us/about-community-based-corrections/7th-judicial-district",7/1/2016,IMAGERY,2017/11/27 00:00:00,https://doc.iowa.gov/about-us/about-community-based-corrections/7th-judicial-district,NOT AVAILABLE,120,0.00188490054114,219.705126118013,1.07008674176e-07
786,770,10005278,YUBA - SUTTER COUNTY JUVENILE HALL,1023 14TH STREET,MARYSVILLE,CA,95901,NOT AVAILABLE,(530) 741-6371,COUNTY,OPEN,-999,YUBA,06115,USA,922140,CORRECTIONAL INSTITUTIONS,http://www.co.yuba.ca.us/Departments/Probation/default.aspx,2/19/2018,IMAGERY,2018/02/19 00:00:00,http://www.co.yuba.ca.us/Departments/Probation/default.aspx,JUVENILE,60,0.00359404031633,450.315690104366,5.74271117051e-07
787,771,10003860,HAMPSHIRE COUNTY JAIL AND HOUSE OF CORRECTION,205 ROCKY HILL ROAD,NORTHAMPTON,MA,01060,NOT AVAILABLE,(413) 584-5911,COUNTY,OPEN,255,HAMPSHIRE,25015,USA,922140,CORRECTIONAL INSTITUTIONS,http://www.mass.gov/eopss/docs/doc/research-reports/overcrowding/2017-1stqtr-prisoncapacity-report.pdf,3/27/2017,IMAGERY,2018/03/19 00:00:00,http://www.hampshiresheriffs.com/,MEDIUM,287,0.0107420562598,1389.32803536284,4.86265724441e-06
788,772,10004120,STRAFFORD COUNTY CORRECTIONAL CENTER,266 COUNTY FARM RD,DOVER,NH,03820,NOT AVAILABLE,(603) 742-3310,COUNTY,OPEN,407,STRAFFORD,33017,USA,922140,CORRECTIONAL INSTITUTIONS,https://co.strafford.nh.us/2015-03-12-13-09-46,6/23/2016,IMAGERY/OTHER,2018/04/05 00:00:00,https://co.strafford.nh.us/department/jail-doc-corrections,MAXIMUM,495,0.00776677392791,992.455613010212,1.59321728889e-06
789,773,10004952,"RESIDENTIAL CORRECTIONAL FACILITY, DAVENPORT",1330 WEST 3RD STREET,DAVENPORT,IA,52802,NOT AVAILABLE,(563) 324-2131,STATE,OPEN,133,SCOTT,19163,USA,922140,CORRECTIONAL INSTITUTIONS,"https://www.legis.iowa.gov/docs/publications/FCT/860760.pdf, https://doc.iowa.gov/about-us/about-community-based-corrections/7th-judicial-district",7/1/2016,IMAGERY,2017/11/27 00:00:00,https://doc.iowa.gov/about-us/about-community-based-corrections/7th-judicial-district,NOT AVAILABLE,64,0.00193810064425,252.560954481281,2.3468865022e-07
790,774,10001782,NEUSE CORRECTIONAL INSTITUTION,701 STEVENS MILL RD,GOLDSBORO,NC,27533,2087,(919) 731-2023,STATE,OPEN,15,WAYNE,37191,USA,922140,CORRECTIONAL INSTITUTIONS,"http://webapps6.doc.state.nc.us/apps/asqExt/ASQ, https://www.ncdps.gov/Adult-Corrections/Prisons/Prison-Facilities",10/31/2017,IMAGERY,2017/12/12 00:00:00,https://www.ncdps.gov/Adult-Corrections/Prisons/Prison-Facilities,MINIMUM,788,0.0135455295157,1659.22229455045,8.46184749064e-06
791,775,10001871,BURLINGTON RESIDENTIAL FACILITY,835 VALLEY STREET,BURLINGTON,IA,52601,NOT AVAILABLE,(319) 753-5478,STATE,OPEN,59,DES MOINES,19057,USA,922140,CORRECTIONAL INSTITUTIONS,"https://www.legis.iowa.gov/docs/publications/FCT/860760.pdf, https://doc.iowa.gov/about-us/about-community-based-corrections/8th-judicial-district",7/1/2016,IMAGERY,2017/11/27 00:00:00,https://doc.iowa.gov/about-us/about-community-based-corrections/8th-judicial-district,NOT AVAILABLE,63,0.00154972064687,202.892698437372,1.19108272257e-07
792,776,10001869,OTTUMWA RESIDENTIAL FACILITY,245 OSAGE DR,OTTUMWA,IA,52501,NOT AVAILABLE,(641) 682-3069,STATE,OPEN,73,WAPELLO,19179,USA,922140,CORRECTIONAL INSTITUTIONS,"https://www.legis.iowa.gov/docs/publications/FCT/860760.pdf, https://doc.iowa.gov/about-us/about-community-based-corrections/8th-judicial-district",7/1/2016,IMAGERY,2017/11/27 00:00:00,https://doc.iowa.gov/about-us/about-community-based-corrections/8th-judicial-district,NOT AVAILABLE,76,0.00293608876672,375.508242104842,2.55616555694e-07
793,777,10005343,TWIN PINES RANCH,49500 TWIN PINES ROAD,BANNING,CA,92220,NOT AVAILABLE,NOT AVAILABLE,COUNTY,CLOSED,0,RIVERSIDE,06065,USA,922140,CORRECTIONAL INSTITUTIONS,https://www.pe.com/2014/07/14/banning-twin-pines-ranch-closes-after-67-years/,7/14/2014,IMAGERY,2018/02/19 00:00:00,NOT AVAILABLE,JUVENILE,70,0.0101396708709,1278.20455530655,5.30587302636e-06
794,778,10001801,NEW HANOVER CORRECTIONAL CENTER,330 DIVISION DR,WILMINGTON,NC,28402,NOT AVAILABLE,(910) 251-2666,STATE,OPEN,387,NEW HANOVER,37129,USA,922140,CORRECTIONAL INSTITUTIONS,"http://webapps6.doc.state.nc.us/apps/asqExt/ASQ, https://www.ncdps.gov/Adult-Corrections/Prisons/Prison-Facilities",10/31/2017,IMAGERY,2017/12/12 00:00:00,https://www.ncdps.gov/Adult-Corrections/Prisons/Prison-Facilities,MINIMUM,384,0.00803788601238,996.275484099382,3.41922536136e-06
795,779,10000161,JOHNSTON SAFPF,703 AIRPORT RD,WINNSBORO,TX,75494,NOT AVAILABLE,(903) 342-6166,STATE,OPEN,602,WOOD,48499,USA,922140,CORRECTIONAL INSTITUTIONS,https://www.tdcj.state.tx.us/documents/prea_report/Johnston_Unit_2016-09-30.pdf,9/30/2016,IMAGERY,2018/01/11 00:00:00,http://www.tdcj.state.tx.us/unit_directory/index.html,MINIMUM,612,0.00671639011051,817.142351943459,2.44224914908e-06
796,780,10005327,VICTORVILLE JAIL,14455 CIVIC DRIVE,VICTORVILLE,CA,92392,NOT AVAILABLE,(760) 243-8719,COUNTY,NOT AVAILABLE,-999,SAN BERNARDINO,06071,USA,922140,CORRECTIONAL INSTITUTIONS,NOT AVAILABLE,NOT AVAILABLE,IMAGERY/OTHER,2018/02/19 00:00:00,NOT AVAILABLE,NOT AVAILABLE,-999,0.00459353200006,568.389400001615,9.33365577374e-07
797,781,10005213,ADAMS COUNTY DETENTION FACILITY,150 N 19TH AVE,BRIGHTON,CO,80601,NOT AVAILABLE,(303) 654-1850,COUNTY,OPEN,-999,ADAMS,08001,USA,922140,CORRECTIONAL INSTITUTIONS,http://www.adamssheriff.org/,2/19/2018,IMAGERY,2018/02/19 00:00:00,http://www.adamssheriff.org/,MAXIMUM,1600,0.00934544248654,1202.2770501729,4.24798904678e-06
798,782,10004690,MCLEAN COUNTY JAIL,104 WEST FRONT STREET,BLOOMINGTON,IL,61702,NOT AVAILABLE,(309) 888-5034,COUNTY,OPEN,-999,MCLEAN,17113,USA,922140,CORRECTIONAL INSTITUTIONS,http://www.ilsheriff.org/index.php/directory,3/2/2018,IMAGERY,2018/03/02 00:00:00,http://www.mcleancountyil.gov/index.aspx?nid=95,NOT AVAILABLE,225,0.00373767543764,484.457731471991,6.05439697578e-07
799,783,10005183,MIDDLESEX COUNTY JAIL AND HOUSE OF CORRECTION,269 TREBLE COVE RD.,BILLERICA,MA,01862,NOT AVAILABLE,(978) 667-1711,COUNTY,OPEN,985,MIDDLESEX,25017,USA,922140,CORRECTIONAL INSTITUTIONS,http://www.mass.gov/eopss/docs/doc/research-reports/overcrowding/2017-1stqtr-prisoncapacity-report.pdf,3/27/2017,IMAGERY,2018/03/19 00:00:00,https://www.middlesexsheriff.org/departments,MAXIMUM,1501,0.010837958472,1428.49982834327,4.39906922667e-06
800,784,10002555,TREMPEALEAU COUNTY JAIL / SHERIFF,36245 MAIN ST,WHITEHALL,WI,54773,NOT AVAILABLE,(715) 538-2311 EXT 452,COUNTY,OPEN,37,TREMPEALEAU,55121,USA,922140,CORRECTIONAL INSTITUTIONS,http://www.tremplocounty.com/tchome/sheriff/home.aspx,5/9/2018,IMAGERY,2018/05/09 00:00:00,NOT AVAILABLE,NOT AVAILABLE,-999,0.00377395588314,486.750934349711,3.38750717388e-07
801,785,10004286,CENTRAL IOWA JUVENILE DETENTION CENTER,2317 RICK COLLINS WAY,ELDORA,IA,50627,NOT AVAILABLE,(641) 858-3852,STATE,OPEN,12,HARDIN,19083,USA,922140,CORRECTIONAL INSTITUTIONS,http://www.cijdc.com/index.html,2/9/2016,IMAGERY,2017/11/27 00:00:00,http://www.cijdc.com/index.html,JUVENILE,30,0.00323084551098,414.536008609647,5.28916245556e-07
802,786,10004173,NORTH CAROLINA CORRECTIONAL INSTITUTION FOR WOMEN,1034 BRAGG ST,RALEIGH,NC,27610,NOT AVAILABLE,(919) 733-4340,STATE,OPEN,1646,WAKE,37183,USA,922140,CORRECTIONAL INSTITUTIONS,"http://webapps6.doc.state.nc.us/apps/asqExt/ASQ, https://www.ncdps.gov/Adult-Corrections/Prisons/Prison-Facilities",10/31/2017,IMAGERY,2017/12/12 00:00:00,https://www.ncdps.gov/Adult-Corrections/Prisons/Prison-Facilities,CLOSE,1288,0.0207493782114,2663.19661109837,1.24518619453e-05
803,787,10000152,JORDAN PRISON,1992 HELTON RD,PAMPA,TX,79065,NOT AVAILABLE,(806) 665-7070,STATE,OPEN,993,GRAY,48179,USA,922140,CORRECTIONAL INSTITUTIONS,"https://www.texastribune.org/library/data/texas-prisons/units/, http://www.tdcj.state.tx.us/unit_directory/index.html",9/15/2016,IMAGERY,2018/01/11 00:00:00,http://www.tdcj.state.tx.us/unit_directory/index.html,MAXIMUM,1008,0.0134994482543,1637.1508449245,1.12393045445e-05
804,788,10004143,ODOM CORRECTIONAL INSTITUTION,485 ODOM RD,JACKSON,NC,27845,0036,(252) 534-5611,STATE,OPEN,462,NORTHAMPTON,37131,USA,922140,CORRECTIONAL INSTITUTIONS,"http://webapps6.doc.state.nc.us/apps/asqExt/ASQ, https://www.ncdps.gov/Adult-Corrections/Prisons/Prison-Facilities",10/31/2017,IMAGERY,2017/12/12 00:00:00,https://www.ncdps.gov/Adult-Corrections/Prisons/Prison-Facilities,MINIMUM,352,0.00998584417601,1232.15823788376,4.91836644751e-06
805,789,10001966,BATEN ISF,1995 HELTON RD,PAMPA,TX,79065,NOT AVAILABLE,(806) 665-7070,STATE,OPEN,179,GRAY,48179,USA,922140,CORRECTIONAL INSTITUTIONS,https://www.tdcj.state.tx.us/documents/prea_report/Jordan-Baten_Units_2017_09_29.pdf,9/29/2017,IMAGERY,2018/01/11 00:00:00,http://www.tdcj.state.tx.us/unit_directory/index.html,MEDIUM,420,0.00506373880046,606.787303706431,1.3598716267e-06
806,790,10005216,ALAMOSA COUNTY DETENTION CENTER,1315 17TH ST,ALAMOSA,CO,81101,NOT AVAILABLE,NOT AVAILABLE,COUNTY,OPEN,-999,ALAMOSA,08003,USA,922140,CORRECTIONAL INSTITUTIONS,https://www.colorado.gov/pacific/alamosacounty/sheriff-3,2/19/2018,IMAGERY,2018/02/19 00:00:00,https://www.colorado.gov/pacific/alamosacounty/sheriff-3,NOT AVAILABLE,-999,0.00260249229865,311.40446470778,2.32130478912e-07
807,791,10004689,MCLEAN COUNTY JUVENILE DETENTION CENTER,903 NORTH MAIN STREET,NORMAL,IL,61761,NOT AVAILABLE,(309) 888-5550,COUNTY,OPEN,-999,MCLEAN,17113,USA,922140,CORRECTIONAL INSTITUTIONS,http://www.mcleancountyil.gov/index.aspx?NID=254,2/15/2016,IMAGERY,2018/03/02 00:00:00,http://www.mcleancountyil.gov/index.aspx?NID=254,JUVENILE,26,0.00276065630909,348.767638029854,2.98492610044e-07
808,792,10006543,STATE TRAINING SCHOOL FOR BOYS,3211 WEST EDGINGTON,ELDORA,IA,50627,NOT AVAILABLE,(641) 858-5402,STATE,OPEN,-999,HARDIN,19083,USA,922140,CORRECTIONAL INSTITUTIONS,https://dhs.iowa.gov/mhds/mental-health/in-patient/juvenile-facility/eldora,11/27/2017,IMAGERY,2017/11/27 00:00:00,https://dhs.iowa.gov/mhds/mental-health/in-patient/juvenile-facility/eldora,JUVENILE,-999,0.0145833670752,1907.9399303413,1.34892328797e-05
809,793,10004276,NORTHWEST IOWA JUVENILE DETENTION CENTER,1201 WEST CEDAR LOOP,CHEROKEE,IA,51012,NOT AVAILABLE,NOT AVAILABLE,STATE,NOT AVAILABLE,-999,CHEROKEE,19035,USA,922140,CORRECTIONAL INSTITUTIONS,NOT AVAILABLE,NOT AVAILABLE,UNVERIFIED,2017/11/27 00:00:00,NOT AVAILABLE,JUVENILE,-999,0.00798930333437,1022.4407066011,2.89852248828e-06
810,794,10002209,ARAPAHOE COUNTY DETENTION FACILITY,7375 S POTOMAC ST,CENTENNIAL,CO,80112,NOT AVAILABLE,(720) 874-3500,COUNTY,OPEN,-999,ARAPAHOE,08005,USA,922140,CORRECTIONAL INSTITUTIONS,http://www.co.arapahoe.co.us/898/Detention-Services-Bureau,2/19/2018,IMAGERY,2018/02/19 00:00:00,http://www.co.arapahoe.co.us/898/Detention-Services-Bureau,MAXIMUM,1400,0.00877482564324,1102.03348075438,2.56024753867e-06
811,795,10001184,EAST BOISE COMMUNITY REENTRY CENTER,2366 OLD PENITENTIARY RD,BOISE,ID,83712,NOT AVAILABLE,(208) 334-3448,STATE,OPEN,109,ADA,16001,USA,922140,CORRECTIONAL INSTITUTIONS,https://www.idoc.idaho.gov/content/about_us/research_statistics,11/27/2017,IMAGERY,2017/11/27 00:00:00,https://www.idoc.idaho.gov/content/locations,MINIMUM,100,0.00421959737695,568.001738514144,1.14737167695e-06
812,796,10000228,KYLE CORRECTIONAL CENTER,23001 IH-35,KYLE,TX,78640,NOT AVAILABLE,(512) 268-0079,STATE,OPEN,405,HAYS,48209,USA,922140,CORRECTIONAL INSTITUTIONS,"https://www.texastribune.org/library/data/texas-prisons/units/, http://www.tdcj.state.tx.us/unit_directory/index.html",9/15/2016,IMAGERY,2018/01/11 00:00:00,http://www.mtctrains.com/corrections/#locations,MINIMUM,520,0.00724427881103,874.08978740314,2.67051729293e-06
813,797,10004339,TREASURE VALLEY COMMUNITY REENTRY CENTER,14195 S PLEASANT VALLEY RD,KUNA,ID,83634,NOT AVAILABLE,(208) 334-2241,STATE,OPEN,102,ADA,16001,USA,922140,CORRECTIONAL INSTITUTIONS,"https://www.idoc.idaho.gov/content/about_us/research_statistics, https://www.idoc.idaho.gov/content/locations",11/27/2017,IMAGERY,2017/11/27 00:00:00,https://www.idoc.idaho.gov/content/locations,MINIMUM,108,0.00310961079118,394.904210283916,5.54390384901e-07
814,798,10001186,IDAHO FALLS COMMUNITY REENTRY CENTER,3955 BOMBARDIER AVE,IDAHO FALLS,ID,83402,NOT AVAILABLE,(208) 525-7143,STATE,OPEN,95,BONNEVILLE,16019,USA,922140,CORRECTIONAL INSTITUTIONS,"https://www.idoc.idaho.gov/content/about_us/research_statistics, https://www.idoc.idaho.gov/content/locations",11/27/2017,IMAGERY,2017/11/27 00:00:00,https://www.idoc.idaho.gov/content/locations,MINIMUM,108,0.00234901203061,316.282689257777,2.36836448631e-07
815,799,10001177,NAMPA COMMUNITY REENTRY CENTER,1640 11TH AVE N,NAMPA,ID,83687,NOT AVAILABLE,(208) 465-8490,STATE,OPEN,96,CANYON,16027,USA,922140,CORRECTIONAL INSTITUTIONS,"https://www.idoc.idaho.gov/content/about_us/research_statistics, https://www.idoc.idaho.gov/content/locations",11/27/2017,IMAGERY,2017/11/27 00:00:00,https://www.idoc.idaho.gov/content/locations,MINIMUM,108,0.002278872119,295.614738313198,1.32653581854e-07
816,800,10004165,ORANGE CORRECTIONAL CENTER,2110 CLARENCE WALTERS RD,HILLSBOROUGH,NC,27278,NOT AVAILABLE,(919) 732-9301,STATE,OPEN,198,ORANGE,37135,USA,922140,CORRECTIONAL INSTITUTIONS,"http://webapps6.doc.state.nc.us/apps/asqExt/ASQ, https://www.ncdps.gov/Adult-Corrections/Prisons/Prison-Facilities",10/31/2017,IMAGERY,2017/12/12 00:00:00,https://www.ncdps.gov/Adult-Corrections/Prisons/Prison-Facilities,MINIMUM,200,0.00788297314254,942.66540650662,1.9004160161e-06
817,807,10002858,LEBLANC PRE-RELEASE FACILITY,3695 FM 3514,BEAUMONT,TX,77705,NOT AVAILABLE,(409) 724-1515,STATE,OPEN,993,JEFFERSON,48245,USA,922140,CORRECTIONAL INSTITUTIONS,"https://www.texastribune.org/library/data/texas-prisons/units/, http://www.tdcj.state.tx.us/unit_directory/index.html",9/15/2016,IMAGERY,2018/01/11 00:00:00,http://www.tdcj.state.tx.us/unit_directory/index.html,MEDIUM,1224,0.00928986383165,1115.25497610014,5.86024005811e-06
818,808,10001752,PASQUOTANK CORRECTIONAL INSTITUTION,527 COMMERCE DR,ELIZABETH CITY,NC,27906,NOT AVAILABLE,(252) 331-4881,STATE,OPEN,679,PASQUOTANK,37139,USA,922140,CORRECTIONAL INSTITUTIONS,"http://webapps6.doc.state.nc.us/apps/asqExt/ASQ, https://www.ncdps.gov/Adult-Corrections/Prisons/Prison-Facilities",10/31/2017,IMAGERY,2017/12/12 00:00:00,https://www.ncdps.gov/Adult-Corrections/Prisons/Prison-Facilities,CLOSE,896,0.012286551474,1511.97550927345,9.69897065503e-06
819,809,10006544,IDAHO CORRECTIONAL ALTERNATIVE PLACEMENT PROGRAM FACILITY,15505 SOUTH PLEASANT VALLEY ROAD,KUNA,ID,83634,NOT AVAILABLE,(208) 336-9959,STATE,OPEN,431,ADA,16001,USA,922140,CORRECTIONAL INSTITUTIONS,"https://www.idoc.idaho.gov/content/about_us/research_statistics, http://www.mtctrains.com/corrections/#locations",11/27/2017,IMAGERY,2017/11/27 00:00:00,http://www.mtctrains.com/corrections/#locations,MINIMUM,442,0.00537004291357,699.935871628645,1.5688494646e-06
820,810,10004708,MACOUPIN COUNTY JAIL,215 SOUTH EAST STREET,CARLINVILLE,IL,62626,NOT AVAILABLE,(217) 854-3135,COUNTY,OPEN,-999,MACOUPIN,17117,USA,922140,CORRECTIONAL INSTITUTIONS,http://www.ilsheriff.org/index.php/directory,3/2/2018,IMAGERY,2018/03/02 00:00:00,http://www.macoupincountyil.gov/sheriff_dept.htm,NOT AVAILABLE,95,0.00277797706566,354.602769292429,2.77623527603e-07
821,811,10000208,LEWIS PRISON,777 FM 3497,WOODVILLE,TX,75990,NOT AVAILABLE,(409) 283-8181,STATE,OPEN,2203,TYLER,48457,USA,922140,CORRECTIONAL INSTITUTIONS,"https://www.texastribune.org/library/data/texas-prisons/units/, http://www.tdcj.state.tx.us/unit_directory/index.html",9/15/2016,IMAGERY,2018/01/11 00:00:00,http://www.tdcj.state.tx.us/unit_directory/index.html,MAXIMUM,2232,0.017505386035,2133.4551060011,1.36623709093e-05
822,812,10001182,IDAHO MAXIMUM SECURITY INSTITUTION,13400 S PLEASANT VALLEY RD,KUNA,ID,83634,NOT AVAILABLE,(208) 338-1635,STATE,OPEN,553,ADA,16001,USA,922140,CORRECTIONAL INSTITUTIONS,"https://www.idoc.idaho.gov/content/about_us/research_statistics, https://www.idoc.idaho.gov/content/locations",11/27/2017,IMAGERY,2017/11/27 00:00:00,https://www.idoc.idaho.gov/content/locations,MAXIMUM,549,0.00954731388164,1256.19347806226,6.00406574301e-06
823,813,10001183,IDAHO STATE CORRECTIONAL CENTER,14601 S PLEASANT VALLEY RD,KUNA,ID,83634,NOT AVAILABLE,(208) 331-2760,STATE,OPEN,2181,ADA,16001,USA,922140,CORRECTIONAL INSTITUTIONS,"https://www.idoc.idaho.gov/content/about_us/research_statistics, https://www.idoc.idaho.gov/content/locations",11/27/2017,IMAGERY,2017/11/27 00:00:00,https://www.idoc.idaho.gov/content/locations,CLOSE,2170,0.0135807446757,1848.06852196653,1.16569049743e-05
824,814,10001400,SUFFOLK COUNTY JAIL AT NASHUA STREET,200 NASHUA ST,BOSTON,MA,02114,NOT AVAILABLE,(617) 635-1100,COUNTY,OPEN,667,SUFFOLK,25025,USA,922140,CORRECTIONAL INSTITUTIONS,"http://www.mass.gov/eopss/docs/doc/research-reports/overcrowding/2017-1stqtr-prisoncapacity-report.pdf, http://www.scsdma.org/",3/27/2017,IMAGERY/OTHER,2018/03/19 00:00:00,http://www.scsdma.org/,MAXIMUM,654,0.0037894905691,471.97215745913,6.29660547061e-07
825,815,10001986,BRAZOS COUNTY DETENTION CENTER,1835 SANDY POINT RD,BRYAN,TX,77807,NOT AVAILABLE,(979) 361-4800,COUNTY,OPEN,609,BRAZOS,48041,USA,922140,CORRECTIONAL INSTITUTIONS,"https://www.tcjs.state.tx.us/index.php?linkID=325, http://www.brazoscountysheriff.org/",3/1/2018,IMAGERY,2018/04/25 00:00:00,http://www.brazoscountysheriff.org/,MAXIMUM,1087,0.00639082715624,769.202772260348,2.02495723645e-06
826,816,10004421,BREWSTER COUNTY JAIL,307 WEST SUL ROSS AVE,ALPINE,TX,79830,NOT AVAILABLE,(432) 837-5541,COUNTY,OPEN,41,BREWSTER,48043,USA,922140,CORRECTIONAL INSTITUTIONS,"https://www.tcjs.state.tx.us/index.php?linkID=325, https://texasjailproject.org/list_of_county_jails/",3/1/2018,IMAGERY,2018/04/25 00:00:00,NOT AVAILABLE,NOT AVAILABLE,56,0.0031341467807,377.229911771435,4.36635956001e-07
827,817,10001753,PASQUOTANK C.I. MINIMUM SECURITY UNIT,527 COMMERCE DR,ELIZABETH CITY,NC,27906,NOT AVAILABLE,(252) 331-4881,STATE,OPEN,-999,PASQUOTANK,37139,USA,922140,CORRECTIONAL INSTITUTIONS,https://www.ncdps.gov/Adult-Corrections/Prisons/Prison-Facilities,12/12/2017,IMAGERY,2017/12/12 00:00:00,https://www.ncdps.gov/Adult-Corrections/Prisons/Prison-Facilities,MINIMUM,256,0.00438000580411,539.07324382873,1.0770497772e-06
828,818,10001181,IDAHO STATE CORRECTIONAL INSTITUTION,13500 S PLEASANT VALLEY RD,KUNA,ID,83634,NOT AVAILABLE,(208) 336-0740,STATE,OPEN,1473,ADA,16001,USA,922140,CORRECTIONAL INSTITUTIONS,"https://www.idoc.idaho.gov/content/about_us/research_statistics, https://www.idoc.idaho.gov/content/locations",11/27/2017,IMAGERY,2017/11/27 00:00:00,https://www.idoc.idaho.gov/content/locations,MEDIUM,1446,0.0233794969131,2974.83209661629,2.64460046687e-05
829,819,10001185,SOUTH BOISE WOMEN'S CORRECTIONAL CENTER,13200 S PLEASANT VALLEY RD,KUNA,ID,83634,NOT AVAILABLE,(208) 334-2731,STATE,OPEN,293,ADA,16001,USA,922140,CORRECTIONAL INSTITUTIONS,"https://www.idoc.idaho.gov/content/about_us/research_statistics, https://www.idoc.idaho.gov/content/locations",11/27/2017,IMAGERY,2017/11/27 00:00:00,https://www.idoc.idaho.gov/content/locations,MINIMUM,289,0.00682364654886,846.23413451307,1.17775380691e-06
830,820,10001403,SOUTH BAY HOUSE OF CORRECTION,20 BRADSTON ST,BOSTON,MA,02118,NOT AVAILABLE,(617) 635-1000,COUNTY,OPEN,1010,SUFFOLK,25025,USA,922140,CORRECTIONAL INSTITUTIONS,"http://www.mass.gov/eopss/docs/doc/research-reports/overcrowding/2017-1stqtr-prisoncapacity-report.pdf, http://www.scsdma.org/",3/27/2017,IMAGERY,2018/03/19 00:00:00,http://www.scsdma.org/,MAXIMUM,1892,0.0087837896816,1096.08126769087,2.54026089333e-06
831,1208,10000045,SOUTHERN REGIONAL JAIL,1200 AIRPORT RD,BEAVER,WV,25813,NOT AVAILABLE,(304) 256-6726,COUNTY,OPEN,581,RALEIGH,54081,USA,922140,CORRECTIONAL INSTITUTIONS,http://rja.wv.gov/Pages/About-Us.aspx,1/23/2018,IMAGERY,2018/01/23 00:00:00,http://rja.wv.gov/facilityinfo/Pages/default.aspx,NOT AVAILABLE,350,0.00673928719192,861.034155526166,1.88482716489e-06
832,1604,10001328,PRAIRIE CORRECTIONAL FACILITY,445 SOUTH MUNSTERMAN STREET,APPLETON,MN,56208,NOT AVAILABLE,NOT AVAILABLE,STATE,CLOSED,0,SWIFT,27151,USA,922140,CORRECTIONAL INSTITUTIONS,http://correctionalnews.com/2017/04/12/shuttered-minnesota-prison-reopen/,4/12/2017,IMAGERY,2017/12/07 00:00:00,http://www.cca.com/facilities/prairie-correctional-facility,MEDIUM,1600,0.0215510604711,2720.77579048424,1.39971053145e-05
833,821,10005122,BROWN COUNTY JAIL / LAW ENFORCEMENT CENTER,1050 W COMMERCE,BROWNWOOD,TX,76801,NOT AVAILABLE,(325) 641-2481,COUNTY,OPEN,149,BROWN,48049,USA,922140,CORRECTIONAL INSTITUTIONS,"http://browncountytx.net/bok/cgibok108.html, https://www.tcjs.state.tx.us/index.php?linkID=325, https://texasjailproject.org/list_of_county_jails/",3/1/2018,IMAGERY,2018/04/25 00:00:00,NOT AVAILABLE,NOT AVAILABLE,196,0.00544060992146,656.232335610949,8.41729576094e-07
834,822,10004226,PENDER CORRECTIONAL INSTITUTION,906 PENDERLEA HWY,BURGAW,NC,28425,NOT AVAILABLE,(910) 259-8735,STATE,OPEN,747,PENDER,37141,USA,922140,CORRECTIONAL INSTITUTIONS,"http://webapps6.doc.state.nc.us/apps/asqExt/ASQ, https://www.ncdps.gov/Adult-Corrections/Prisons/Prison-Facilities",10/31/2017,IMAGERY,2017/12/12 00:00:00,https://www.ncdps.gov/Adult-Corrections/Prisons/Prison-Facilities,MEDIUM,740,0.0141988314925,1708.42804879587,8.79068401952e-06
835,823,10004720,MADISON COUNTY JAIL,405 RANDLE STREET,EDWARDSVILLE,IL,62025,NOT AVAILABLE,(618) 692-1064,COUNTY,OPEN,299,MADISON,17119,USA,922140,CORRECTIONAL INSTITUTIONS,"http://www.co.madison.il.us/departments/sheriff/jail_division.php, http://www.ilsheriff.org/index.php/directory",3/2/2018,IMAGERY,2018/03/02 00:00:00,http://www.co.madison.il.us/departments/sheriff/jail_division.php,NOT AVAILABLE,306,0.00449900616693,589.700802904391,8.02321579807e-07
836,824,10002876,LOCKHART CORRECTIONAL FACILITY,1400 INDUSTRIAL BLVD,LOCKHART,TX,78644,NOT AVAILABLE,(512) 398-3480,STATE,OPEN,965,CALDWELL,48055,USA,922140,CORRECTIONAL INSTITUTIONS,"https://www.texastribune.org/library/data/texas-prisons/units/, http://www.tdcj.state.tx.us/unit_directory/index.html",9/15/2016,IMAGERY,2018/01/11 00:00:00,http://www.mtctrains.com/corrections/#locations,MINIMUM,1000,0.011200304717,1338.99368098549,6.30125207457e-06
837,825,10002519,VILAS COUNTY JAIL / SHERIFF,330 COURT ST,EAGLE RIVER,WI,54521,NOT AVAILABLE,NOT AVAILABLE,COUNTY,OPEN,110,VILAS,55125,USA,922140,CORRECTIONAL INSTITUTIONS,http://www.vilascountywi.gov/dept/VCSD/index.html,5/9/2018,IMAGERY,2018/05/09 00:00:00,http://www.vilascountywi.gov/dept/VCSD/index.html,NOT AVAILABLE,125,0.00319446008836,394.033233815854,4.06902679753e-07
838,826,10001173,NORTH IDAHO CORRECTIONAL INSTITUTION,236 RADAR RD,COTTONWOOD,ID,83522,NOT AVAILABLE,(208) 962-3276,STATE,OPEN,409,IDAHO,16049,USA,922140,CORRECTIONAL INSTITUTIONS,"https://www.idoc.idaho.gov/content/about_us/research_statistics, https://www.idoc.idaho.gov/content/locations",11/28/2017,IMAGERY,2017/11/28 00:00:00,https://www.idoc.idaho.gov/content/locations,NOT AVAILABLE,414,0.00896524414018,1217.11274306004,3.83124502621e-06
839,827,10004183,PIEDMONT CORRECTIONAL INSTITUTION,1245 CAMP RD,SALISBURY,NC,28147,NOT AVAILABLE,(704) 639-7540,STATE,OPEN,961,ROWAN,37159,USA,922140,CORRECTIONAL INSTITUTIONS,"http://webapps6.doc.state.nc.us/apps/asqExt/ASQ, https://www.ncdps.gov/Adult-Corrections/Prisons/Prison-Facilities",10/31/2017,IMAGERY,2017/12/12 00:00:00,https://www.ncdps.gov/Adult-Corrections/Prisons/Prison-Facilities,MEDIUM,952,0.0116261206325,1425.89210335407,6.46375218828e-06
840,828,10001172,IDAHO CORRECTIONAL INSTITUTION-OROFINO,381 WEST HOSPITAL DRIVE,OROFINO,ID,83544,NOT AVAILABLE,(208) 476-3655,STATE,OPEN,576,CLEARWATER,16035,USA,922140,CORRECTIONAL INSTITUTIONS,"https://www.idoc.idaho.gov/content/about_us/research_statistics, https://www.idoc.idaho.gov/content/locations",11/28/2017,IMAGERY,2017/11/28 00:00:00,https://www.idoc.idaho.gov/content/locations,MEDIUM,580,0.00746820635526,956.940087923619,3.33079944327e-06
841,829,10004184,PIEDMONT CORRECTIONAL INSTITUTION - MINIMUM SECURITY UNIT,4750 S MAIN ST,SALISBURY,NC,28147,NOT AVAILABLE,(704) 639-7540,STATE,OPEN,-999,ROWAN,37159,USA,922140,CORRECTIONAL INSTITUTIONS,https://www.ncdps.gov/Adult-Corrections/Prisons/Prison-Facilities,12/12/2017,IMAGERY,2017/12/12 00:00:00,https://www.ncdps.gov/Adult-Corrections/Prisons/Prison-Facilities,MINIMUM,276,0.00623626115716,762.884688748333,1.73076852872e-06
842,830,10006713,BOULDER COUNTY JUVENILE CENTER,1777 6TH STREET,BOULDER,CO,80302,NOT AVAILABLE,(303) 441-3978,COUNTY,OPEN,-999,BOULDER,08013,USA,922140,CORRECTIONAL INSTITUTIONS,https://www.bouldercounty.org/safety/court-related-services/juvenile-services/,2/19/2018,IMAGERY,2018/02/19 00:00:00,https://www.bouldercounty.org/safety/court-related-services/juvenile-services/,JUVENILE,20,0.00752823170166,906.416153030075,1.27663023534e-06
843,831,10002941,LOPEZ STATE JAIL,1203 EL CIBOLO RD,EDINBURG,TX,78542,NOT AVAILABLE,(956) 316-3810,STATE,OPEN,1023,HIDALGO,48215,USA,922140,CORRECTIONAL INSTITUTIONS,"https://www.texastribune.org/library/data/texas-prisons/units/, http://www.tdcj.state.tx.us/unit_directory/index.html",9/15/2016,IMAGERY/OTHER,2018/01/11 00:00:00,http://www.tdcj.state.tx.us/unit_directory/index.html,MEDIUM,1100,0.00981331467072,1155.67251899643,6.08938318369e-06
844,832,10001397,WORCESTER COUNTY HOUSE OF CORRECTION / JAIL,5 PAUL X TIVNAN DR,WEST BOYLSTON,MA,01583,NOT AVAILABLE,(508) 854-1800,COUNTY,OPEN,1038,WORCESTER,25027,USA,922140,CORRECTIONAL INSTITUTIONS,http://www.mass.gov/eopss/docs/doc/research-reports/overcrowding/2017-1stqtr-prisoncapacity-report.pdf,3/27/2017,IMAGERY,2018/03/19 00:00:00,https://worcestercountysheriff.com/,MAXIMUM,822,0.014070708131,1912.16811360455,7.45885708088e-06
845,833,10005215,CHAFFEE COUNTY DETENTION FACILITY,148 CRESTONE BLVD,SALIDA,CO,81201,NOT AVAILABLE,NOT AVAILABLE,COUNTY,OPEN,-999,CHAFFEE,08015,USA,922140,CORRECTIONAL INSTITUTIONS,http://chaffeesheriff.org/,2/19/2018,IMAGERY,2018/02/19 00:00:00,http://chaffeesheriff.org/,NOT AVAILABLE,105,0.00220566011651,273.297363815318,2.20833618584e-07
846,834,10006832,BERGEN COUNTY JUVENILE DETENTION CENTER,200 NORTH STREET,TETERBORO,NJ,07608,NOT AVAILABLE,(201) 336-3901,COUNTY,OPEN,-999,BERGEN,34003,USA,922140,CORRECTIONAL INSTITUTIONS,http://www.njjda.org/NJJDA%20Directory.pdf,4/6/2018,IMAGERY,2018/04/06 00:00:00,NOT AVAILABLE,NOT AVAILABLE,-999,0.00555281010517,688.34200322788,9.56487819898e-07
847,835,10004418,BURLESON COUNTY JAIL,1334 STATE HWY 21 E,CALDWELL,TX,77836,NOT AVAILABLE,(979) 567-4343,COUNTY,OPEN,76,BURLESON,48051,USA,922140,CORRECTIONAL INSTITUTIONS,"https://www.tcjs.state.tx.us/index.php?linkID=325, http://co.burleson.tx.us/government/sheriff/burleson-county-jail/",3/1/2018,IMAGERY,2018/04/25 00:00:00,NOT AVAILABLE,NOT AVAILABLE,96,0.00247320170122,299.503186593469,3.37581614314e-07
848,836,10002915,CALHOUN COUNTY JAIL / SHERIFF,211 S ANN ST,PORT LAVACA,TX,77979,NOT AVAILABLE,(361) 553-4475,COUNTY,OPEN,87,CALHOUN,48057,USA,922140,CORRECTIONAL INSTITUTIONS,"https://www.tcjs.state.tx.us/index.php?linkID=325, http://www.calhouncotx.org/sheriff.html",3/1/2018,IMAGERY,2018/04/25 00:00:00,NOT AVAILABLE,NOT AVAILABLE,144,0.00279119868853,326.50144654005,3.15849372038e-07
849,837,10000256,CAMERON COUNTY DETENTION CENTER 1,1145 E HARRISON,BROWNSVILLE,TX,78520,NOT AVAILABLE,(956) 544-0836,COUNTY,OPEN,349,CAMERON,48061,USA,922140,CORRECTIONAL INSTITUTIONS,http://www.co.cameron.tx.us/sheriffs/sheriffsoffice.html,4/25/2018,IMAGERY,2018/04/25 00:00:00,http://www.co.cameron.tx.us/sheriffs/sheriffsoffice.html,NOT AVAILABLE,-999,0.00293298300435,342.041683455456,5.29314026289e-07
850,838,10001747,POLK CORRECTIONAL INSTITUTION,1001 VEAZEY RD,BUTNER,NC,27509,NOT AVAILABLE,(919) 575-3070,STATE,OPEN,877,GRANVILLE,37077,USA,922140,CORRECTIONAL INSTITUTIONS,"http://webapps6.doc.state.nc.us/apps/asqExt/ASQ, https://www.ncdps.gov/Adult-Corrections/Prisons/Prison-Facilities",10/31/2017,IMAGERY,2017/12/12 00:00:00,https://www.ncdps.gov/Adult-Corrections/Prisons/Prison-Facilities,CLOSE,904,0.0118091580643,1443.75255922088,9.53527766869e-06
851,839,10001187,POCATELLO WOMEN'S CORRECTIONAL CENTER,1451 FORE RD,POCATELLO,ID,83204,NOT AVAILABLE,(208) 236-6360,STATE,OPEN,323,BANNOCK,16005,USA,922140,CORRECTIONAL INSTITUTIONS,"https://www.idoc.idaho.gov/content/about_us/research_statistics, https://www.idoc.idaho.gov/content/locations",11/28/2017,IMAGERY,2017/11/28 00:00:00,https://www.idoc.idaho.gov/content/locations,MAXIMUM,331,0.00705868328974,859.132192555155,2.45357087722e-06
852,840,10001189,TWIN FALLS COMMUNITY WORK CENTER,616 WASHINGTON ST S,TWIN FALLS,ID,83301,NOT AVAILABLE,NOT AVAILABLE,STATE,CLOSED,0,TWIN FALLS,16083,USA,922140,CORRECTIONAL INSTITUTIONS,https://www.idoc.idaho.gov/content/story/front_news/idoc_to_close_twin_falls_community_work_center,5/20/2011,IMAGERY,2017/11/28 00:00:00,http://www.idoc.idaho.gov/content/locations/community_work_centers/twin_falls,MINIMUM,84,0.00253671758881,320.343504680039,2.31933958694e-07
853,841,10004335,IDAHO JUVENILE CORRECTIONS CENTER - LEWISTON,140 SOUTHPORT AVE,LEWISTON,ID,83501,NOT AVAILABLE,(208) 799-3332,STATE,OPEN,-999,NEZ PERCE,16069,USA,922140,CORRECTIONAL INSTITUTIONS,http://www.idjc.idaho.gov/state-facilities-3,11/28/2017,IMAGERY,2017/11/28 00:00:00,http://www.idjc.idaho.gov/state-facilities-3,JUVENILE,36,0.00452375098643,568.725184911274,9.55916342989e-07
854,842,10001178,IDAHO JUVENILE CORRECTIONS CENTER - NAMPA,1650 11TH AVE N,NAMPA,ID,83687,NOT AVAILABLE,(208) 465-8443,STATE,OPEN,-999,CANYON,16027,USA,922140,CORRECTIONAL INSTITUTIONS,http://www.idjc.idaho.gov/state-facilities-3,11/28/2017,IMAGERY,2017/11/28 00:00:00,http://www.idjc.idaho.gov/state-facilities-3,JUVENILE,84,0.00811428205191,993.699313225029,2.53208999109e-06
855,843,10002862,LYCHNER STATE JAIL,2350 ATASCOCITA ROAD,HUMBLE,TX,77396,NOT AVAILABLE,(281) 454-5036,STATE,OPEN,2098,HARRIS,48201,USA,922140,CORRECTIONAL INSTITUTIONS,"https://www.texastribune.org/library/data/texas-prisons/units/, http://www.tdcj.state.tx.us/unit_directory/index.html",9/15/2016,IMAGERY,2018/01/11 00:00:00,http://www.tdcj.state.tx.us/unit_directory/index.html,MEDIUM,2276,0.0132383366759,1621.16255569667,9.79880257011e-06
856,844,10005783,CONEJOS COUNTY JAIL,14044 COUNTY RD G.5,ANTONITO,CO,81120,NOT AVAILABLE,(719) 376-6778,COUNTY,OPEN,-999,CONEJOS,08021,USA,922140,CORRECTIONAL INSTITUTIONS,https://www.conejoscounty.org/departments/elected/sheriff,2/19/2018,IMAGERY,2018/02/19 00:00:00,https://www.conejoscounty.org/departments/elected/sheriff,NOT AVAILABLE,-999,0.00186729526598,229.391865464387,1.40095796198e-07
857,845,10001771,RANDOLPH CORRECTIONAL CENTER,2760 US HWY 220 BUSINESS,ASHEBORO,NC,27203,NOT AVAILABLE,(336) 625-2578,STATE,OPEN,225,RANDOLPH,37151,USA,922140,CORRECTIONAL INSTITUTIONS,"http://webapps6.doc.state.nc.us/apps/asqExt/ASQ, https://www.ncdps.gov/Adult-Corrections/Prisons/Prison-Facilities",10/31/2017,IMAGERY,2017/12/12 00:00:00,https://www.ncdps.gov/Adult-Corrections/Prisons/Prison-Facilities,MINIMUM,226,0.00677737743311,831.111176836131,2.0034310727e-06
858,846,10004009,BURLINGTON COUNTY JUVENILE DETENTION CENTER,620 PEMBERTON-BROWNS MILLS RD,PEMBERTON,NJ,08068,NOT AVAILABLE,(609) 726-7150,COUNTY,OPEN,-999,BURLINGTON,34005,USA,922140,CORRECTIONAL INSTITUTIONS,http://www.co.burlington.nj.us/458/Juvenile-Detention-Center,4/6/2018,IMAGERY,2018/04/06 00:00:00,http://www.co.burlington.nj.us/458/Juvenile-Detention-Center,JUVENILE,-999,0.00279961232925,358.373752814595,4.76549569849e-07
859,847,10000203,LYNAUGH PRISON,1098 S HWY 2037,FORT STOCKTON,TX,79735,NOT AVAILABLE,(432) 395-2938,STATE,OPEN,1398,PECOS,48371,USA,922140,CORRECTIONAL INSTITUTIONS,"https://www.texastribune.org/library/data/texas-prisons/units/, http://www.tdcj.state.tx.us/unit_directory/index.html",9/15/2016,IMAGERY,2018/01/11 00:00:00,http://www.tdcj.state.tx.us/unit_directory/index.html,MEDIUM,1416,0.0130795024942,1553.09091684933,1.06999121858e-05
860,848,10002307,CAMDEN COUNTY YOUTH CENTER,8 S WOODBURY TURNERSVILLE RD,BLACKWOOD,NJ,08012,NOT AVAILABLE,(856) 374-6100,COUNTY,OPEN,45,CAMDEN,34007,USA,922140,CORRECTIONAL INSTITUTIONS,http://www.camdencounty.com/service/corrections/juvenile-detention-center/,12/22/2015,IMAGERY,2018/04/06 00:00:00,http://www.camdencounty.com/service/corrections/juvenile-detention-center/,JUVENILE,77,0.00641327493689,793.087413667971,2.17551565003e-06
861,849,10001175,IDAHO JUVENILE CORRECTIONS CENTER - ANTHONY,2220 E 600 N,ST. ANTHONY,ID,83445,NOT AVAILABLE,(208) 624-3462,STATE,OPEN,-999,FREMONT,16043,USA,922140,CORRECTIONAL INSTITUTIONS,http://www.idjc.idaho.gov/state-facilities-3,11/28/2017,IMAGERY,2017/11/28 00:00:00,http://www.idjc.idaho.gov/state-facilities-3,JUVENILE,128,0.01839239675,2384.79761344839,1.54941968681e-05
862,850,10000683,CENTRALIA CORRECTIONAL CENTER,9330 SHATTUC ROAD,CENTRALIA,IL,62801,NOT AVAILABLE,(618) 533-4111,STATE,OPEN,1533,CLINTON,17027,USA,922140,CORRECTIONAL INSTITUTIONS,https://www.illinois.gov/idoc/reportsandstatistics/Pages/QuarterlyReports.aspx,8/31/2017,IMAGERY,2017/11/28 00:00:00,https://www.illinois.gov/idoc/facilities/Pages/AllFacilities.aspx,MEDIUM,1572,0.0187518089049,2346.25040692983,2.23494846089e-05
863,851,10000635,CROSSROADS ATC,3210 WEST ARTHINGTON STREET,CHICAGO,IL,60624,NOT AVAILABLE,(773) 533-5000,STATE,OPEN,245,COOK,17031,USA,922140,CORRECTIONAL INSTITUTIONS,https://www.illinois.gov/idoc/reportsandstatistics/Pages/QuarterlyReports.aspx,8/31/2017,IMAGERY,2017/11/28 00:00:00,https://www.illinois.gov/idoc/facilities/Pages/AllFacilities.aspx,MINIMUM,429,0.00319678151674,413.141027566149,6.34321585112e-07
864,852,10001949,3-B JUVENILE DETENTION CENTER,950 ENVIRONMENTAL WAY,IDAHO FALLS,ID,83402,NOT AVAILABLE,(208) 542-2947,STATE,OPEN,42,BONNEVILLE,16019,USA,922140,CORRECTIONAL INSTITUTIONS,"https://nces.ed.gov/ccd/schoolsearch/, http://www.3bdetention.org/",11/28/2017,IMAGERY,2017/11/28 00:00:00,http://www.3bdetention.org/,JUVENILE,27,0.00258317111103,325.440573409705,3.78321972366e-07
865,853,10002828,MARLIN UNIT,2893 STATE HWY 6,MARLIN,TX,76661,6588,(254) 883-3858,STATE,OPEN,588,FALLS,48145,USA,922140,CORRECTIONAL INSTITUTIONS,"https://www.texastribune.org/library/data/texas-prisons/units/, http://www.tdcj.state.tx.us/unit_directory/index.html",9/15/2016,IMAGERY,2018/01/11 00:00:00,http://www.tdcj.state.tx.us/unit_directory/index.html,MINIMUM,606,0.00837047950339,1015.50568270903,3.63338525e-06
866,854,10001778,RUTHERFORD CORRECTIONAL CENTER,549 LEDBETTER RD,SPINDALE,NC,28160,NOT AVAILABLE,(828) 286-4121,STATE,OPEN,236,RUTHERFORD,37161,USA,922140,CORRECTIONAL INSTITUTIONS,"http://webapps6.doc.state.nc.us/apps/asqExt/ASQ, https://www.ncdps.gov/Adult-Corrections/Prisons/Prison-Facilities",10/31/2017,IMAGERY,2017/12/12 00:00:00,https://www.ncdps.gov/Adult-Corrections/Prisons/Prison-Facilities,MINIMUM,236,0.00530056641814,651.949647520463,1.58247113717e-06
867,855,10000662,DANVILLE CORRECTIONAL CENTER,3820 EAST MAIN STREET,DANVILLE,IL,61834,NOT AVAILABLE,(217) 446-0441,STATE,OPEN,1809,VERMILION,17183,USA,922140,CORRECTIONAL INSTITUTIONS,https://www.illinois.gov/idoc/reportsandstatistics/Pages/QuarterlyReports.aspx,8/31/2017,IMAGERY,2017/11/28 00:00:00,https://www.illinois.gov/idoc/facilities/Pages/AllFacilities.aspx,MEDIUM,1864,0.0145498788216,1870.96763361049,1.49019170497e-05
868,856,10005217,COSTILLA COUNTY JAIL,103 GASPER STREET,SAN LUIS,CO,81152,NOT AVAILABLE,(719) 672-0673,COUNTY,OPEN,-999,COSTILLA,08023,USA,922140,CORRECTIONAL INSTITUTIONS,https://www.colorado.gov/pacific/costillacounty/sheriff,2/19/2018,IMAGERY,2018/02/19 00:00:00,https://www.colorado.gov/pacific/costillacounty/sheriff,NOT AVAILABLE,-999,0.00158452208735,200.666610974316,1.20804556104e-07
869,857,10006735,MADISON COUNTY JUVENILE DETENTION CENTER,100 W. 5TH AVENUE,EDWARDSVILLE,IL,62025,NOT AVAILABLE,(618) 692-1002,COUNTY,OPEN,-999,MADISON,17119,USA,922140,CORRECTIONAL INSTITUTIONS,http://www.co.madison.il.us/departments/probation_and_court_services/juvenile_detention_center.php,3/2/2018,IMAGERY,2018/03/02 00:00:00,http://www.co.madison.il.us/departments/probation_and_court_services/juvenile_detention_center.php,JUVENILE,49,0.00427718731583,532.59500968569,8.26183599212e-07
870,858,10002229,CROWLEY COUNTY SHERIFFS OFFICE JAIL,110 EAST 6TH STREET,ORDWAY,CO,81063,NOT AVAILABLE,(719) 267-5555,COUNTY,OPEN,-999,CROWLEY,08025,USA,922140,CORRECTIONAL INSTITUTIONS,https://www.colorado.gov/pacific/crowleycounty/sheriff-0,2/19/2018,IMAGERY,2018/02/19 00:00:00,https://www.colorado.gov/pacific/crowleycounty/sheriff-0,MINIMUM,-999,0.00100932971687,128.785019567239,5.20540681866e-08
871,859,10004021,CAPE MAY COUNTY CORRECTIONAL CENTER,125 CERST HAVEN ROAD,CAPE MAY COURT HOUSE,NJ,08210,NOT AVAILABLE,NOT AVAILABLE,COUNTY,OPEN,246,CAPE MAY,34009,USA,922140,CORRECTIONAL INSTITUTIONS,http://www.cmcsheriff.net/corrections.html,12/7/2016,IMAGERY,2018/04/06 00:00:00,http://www.cmcsheriff.net/corrections.html,MAXIMUM,188,0.00694378332329,844.054301316797,1.31474651354e-06
872,860,10001174,FIVE COUNTY TREATMENT & YOUTH REHABILITATION CENTER,423 N 2300 E,ST. ANTHONY,ID,83445,NOT AVAILABLE,(208) 624-1345,COUNTY,OPEN,22,FREMONT,16043,USA,922140,CORRECTIONAL INSTITUTIONS,"https://nces.ed.gov/ccd/schoolsearch/, http://5cyouthtreatmentcenter.us/",11/28/2017,IMAGERY,2017/11/28 00:00:00,http://5cyouthtreatmentcenter.us/,JUVENILE,56,0.00376818516918,488.840945205893,6.54610593968e-07
873,861,10000669,DECATUR CORRECTIONAL CENTER,2310 EAST MOUND ROAD,DECATUR,IL,62524,NOT AVAILABLE,(217) 877-0353,STATE,OPEN,567,MACON,17115,USA,922140,CORRECTIONAL INSTITUTIONS,https://www.illinois.gov/idoc/reportsandstatistics/Pages/QuarterlyReports.aspx,8/31/2017,IMAGERY,2017/11/28 00:00:00,https://www.illinois.gov/idoc/facilities/Pages/AllFacilities.aspx,MINIMUM,792,0.0134860597539,1731.8848426175,7.74759037836e-06
874,862,10006350,DIXON SPRINGS IMPACT INCARCERATION PROGRAM (IIP),979 STATE HWY 146 W.,GOLCONDA,IL,62938,NOT AVAILABLE,(618) 949-3311,STATE,OPEN,64,POPE,17151,USA,922140,CORRECTIONAL INSTITUTIONS,https://www.illinois.gov/idoc/facilities/Pages/AllFacilities.aspx,4/1/2017,IMAGERY,2017/11/28 00:00:00,https://www.illinois.gov/idoc/facilities/Pages/AllFacilities.aspx,MINIMUM,-999,0.00374013387798,478.567645699683,8.49566585425e-07
875,863,10004213,SAMPSON CORRECTIONAL INSTITUTION,700 NORTHWEST BLVD HWY 421N,CLINTON,NC,28328,NOT AVAILABLE,(910) 592-2151,STATE,OPEN,458,SAMPSON,37163,USA,922140,CORRECTIONAL INSTITUTIONS,"http://webapps6.doc.state.nc.us/apps/asqExt/ASQ, https://www.ncdps.gov/Adult-Corrections/Prisons/Prison-Facilities",10/31/2017,IMAGERY,2017/12/12 00:00:00,https://www.ncdps.gov/Adult-Corrections/Prisons/Prison-Facilities,MEDIUM,452,0.0144900263248,1779.3594463715,4.41088228516e-06
876,864,10000689,DU QUOIN IMPACT INCARCERATION PROGRAM (IIP),275 AGRILAND ACRES DR,DU QUOIN,IL,62832,NOT AVAILABLE,(618) 542-5738,STATE,OPEN,52,PERRY,17145,USA,922140,CORRECTIONAL INSTITUTIONS,https://www.illinois.gov/idoc/facilities/Pages/AllFacilities.aspx,4/1/2017,IMAGERY,2017/11/28 00:00:00,https://www.illinois.gov/idoc/facilities/Pages/AllFacilities.aspx,MINIMUM,200,0.00495978182833,603.146628781295,1.42802857598e-06
877,865,10000248,MCCONNELL PRISON,3001 S EMILY DR,BEEVILLE,TX,78102,NOT AVAILABLE,(361) 362-2300,STATE,OPEN,2887,BEE,48025,USA,922140,CORRECTIONAL INSTITUTIONS,"https://www.texastribune.org/library/data/texas-prisons/units/, http://www.tdcj.state.tx.us/unit_directory/index.html",9/15/2016,IMAGERY,2018/01/11 00:00:00,http://www.tdcj.state.tx.us/unit_directory/index.html,MAXIMUM,2900,0.0177790952372,2107.54910334937,2.22033056495e-05
878,866,10001777,SANFORD CORRECTIONAL CENTER,417 ADVANCEMENT CENTER RD,SANFORD,NC,27330,NOT AVAILABLE,(919) 776-4325,STATE,OPEN,295,LEE,37105,USA,922140,CORRECTIONAL INSTITUTIONS,"http://webapps6.doc.state.nc.us/apps/asqExt/ASQ, https://www.ncdps.gov/Adult-Corrections/Prisons/Prison-Facilities",10/31/2017,IMAGERY,2017/12/12 00:00:00,https://www.ncdps.gov/Adult-Corrections/Prisons/Prison-Facilities,MINIMUM,298,0.00644299356124,808.260526362502,2.36351834239e-06
879,867,10006784,HAMPDEN COUNTY PRE-RELEASE CENTER,325 ALABAMA STREET,LUDLOW,MA,01056,NOT AVAILABLE,(413) 858-0819,COUNTY,OPEN,207,HAMPDEN,25013,USA,922140,CORRECTIONAL INSTITUTIONS,http://www.hcsdmass.org/,3/19/2018,IMAGERY,2018/03/19 00:00:00,http://www.hcsdmass.org/,MINIMUM,-999,0.00376511975544,472.651808852327,4.0270902623e-07
880,868,10002235,CUSTER COUNTY JAIL / SHERIFF,702 ROSITA AVENUE,WESTCLIFFE,CO,81252,NOT AVAILABLE,(719) 783-2270,COUNTY,OPEN,-999,CUSTER,08027,USA,922140,CORRECTIONAL INSTITUTIONS,http://custercountygov.com/index.php?pg=sheriff,2/19/2018,IMAGERY,2018/02/19 00:00:00,http://custercountygov.com/index.php?pg=sheriff,MINIMUM,-999,0.00148981069722,185.728446146889,7.1305177302e-08
881,869,10004684,MARSHALL COUNTY JAIL,520 6TH STREET,LACON,IL,61540,1331,(309) 246-2115,COUNTY,OPEN,-999,MARSHALL,17123,USA,922140,CORRECTIONAL INSTITUTIONS,http://marshallcountyillinois.com/elected-officials/sheriff/,3/2/2018,IMAGERY,2018/03/02 00:00:00,http://marshallcountyillinois.com/elected-officials/sheriff/,NOT AVAILABLE,16,0.00070535285195,92.4609503477626,3.06013917744e-08
882,870,10002585,WASHINGTON COUNTY JAIL / JUVENILE DETENTION,500 N SCHMIDT RD,WEST BEND,WI,53095,NOT AVAILABLE,(262) 335-4427,COUNTY,OPEN,241,WASHINGTON,55131,USA,922140,CORRECTIONAL INSTITUTIONS,http://www.washingtoncountysheriffwi.org/index.php,5/9/2018,IMAGERY,2018/05/09 00:00:00,http://www.washingtoncountysheriffwi.org/index.php,NOT AVAILABLE,-999,0.00739230310645,996.407805596276,1.42834507504e-06
883,871,10000186,MICHAEL STATE PRISON,2664 FM 2054,TENNESSEE COLONY,TX,75886,NOT AVAILABLE,(903) 928-2311,STATE,OPEN,3250,ANDERSON,48001,USA,922140,CORRECTIONAL INSTITUTIONS,"https://www.texastribune.org/library/data/texas-prisons/units/, http://www.tdcj.state.tx.us/unit_directory/index.html",9/15/2016,IMAGERY/OTHER,2018/01/11 00:00:00,http://www.tdcj.state.tx.us/unit_directory/index.html,MAXIMUM,3305,0.0214573704545,2593.04541485764,2.089739704e-05
884,872,10000644,EAST MOLINE CORRECTIONAL CENTER,100 HILLCREST ROAD,EAST MOLINE,IL,61244,NOT AVAILABLE,(309) 755-4511,STATE,OPEN,1298,ROCK ISLAND,17161,USA,922140,CORRECTIONAL INSTITUTIONS,https://www.illinois.gov/idoc/reportsandstatistics/Pages/QuarterlyReports.aspx,8/31/2017,IMAGERY,2017/11/28 00:00:00,https://www.illinois.gov/idoc/facilities/Pages/AllFacilities.aspx,MINIMUM,2219,0.0247691154979,3124.28264149512,1.99375655676e-05
885,873,10004016,CUMBERLAND COUNTY JAIL,54 W BROAD ST,BRIDGETON,NJ,08302,NOT AVAILABLE,(856) 453-4883,COUNTY,OPEN,445,CUMBERLAND,34011,USA,922140,CORRECTIONAL INSTITUTIONS,"http://www.co.cumberland.nj.us/doc-contact, http://www.drugpolicy.org/sites/default/files/New_Jersey_Jail_Population_Analysis_March_2013.pdf",2/15/2016,IMAGERY/OTHER,2018/04/06 00:00:00,NOT AVAILABLE,MEDIUM,550,0.0056409623497,713.271629288215,9.56736900791e-07
886,874,10001793,SCOTLAND CORRECTIONAL INSTITUTION,22385 MCGIRT'S BRIDGE RD,LAURINBURG,NC,28353,NOT AVAILABLE,(910) 844-3078,STATE,OPEN,1615,SCOTLAND,37165,USA,922140,CORRECTIONAL INSTITUTIONS,"http://webapps6.doc.state.nc.us/apps/asqExt/ASQ, https://www.ncdps.gov/Adult-Corrections/Prisons/Prison-Facilities",10/31/2017,IMAGERY,2017/12/12 00:00:00,https://www.ncdps.gov/Adult-Corrections/Prisons/Prison-Facilities,CLOSE,1652,0.0171919762768,2095.68332341716,1.08874365249e-05
887,875,10000176,MIDDLETON TRANSFER FACILITY,13055 FM 3522,ABILENE,TX,79601,NOT AVAILABLE,(325) 548-9075,STATE,OPEN,2008,JONES,48253,USA,922140,CORRECTIONAL INSTITUTIONS,"https://www.texastribune.org/library/data/texas-prisons/units/, http://www.tdcj.state.tx.us/unit_directory/index.html",9/15/2016,IMAGERY,2018/01/11 00:00:00,http://www.tdcj.state.tx.us/unit_directory/index.html,MAXIMUM,2128,0.0149251746056,1865.1654383656,1.25387550862e-05
888,876,10002948,CAMERON COUNTY JAIL,954 E HARRISON ST,BROWNSVILLE,TX,78520,NOT AVAILABLE,(956) 544-0865,COUNTY,OPEN,1077,CAMERON,48061,USA,922140,CORRECTIONAL INSTITUTIONS,https://www.tcjs.state.tx.us/index.php?linkID=325,3/1/2018,IMAGERY,2018/04/25 00:00:00,http://www.co.cameron.tx.us/sheriffs/sheriffsoffice.html,NOT AVAILABLE,1746,0.00411156605789,482.061278799517,4.71370506724e-07
889,877,10004693,MASON COUNTY JAIL,102 WEST MARKET STREET,HAVANA,IL,62644,NOT AVAILABLE,(309) 543-2231,COUNTY,OPEN,42,MASON,17125,USA,922140,CORRECTIONAL INSTITUTIONS,http://www.ilsheriff.org/index.php/directory,3/2/2018,IMAGERY,2018/03/02 00:00:00,NOT AVAILABLE,NOT AVAILABLE,42,0.00157053282961,196.843372245982,1.38697122169e-07
890,878,10001784,SOUTHERN CORRECTIONAL INSTITUTION,272 GLEN RD,TROY,NC,27371,NOT AVAILABLE,(910) 572-3784,STATE,OPEN,672,MONTGOMERY,37123,USA,922140,CORRECTIONAL INSTITUTIONS,"http://webapps6.doc.state.nc.us/apps/asqExt/ASQ, https://www.ncdps.gov/Adult-Corrections/Prisons/Prison-Facilities",10/31/2017,IMAGERY,2017/12/12 00:00:00,https://www.ncdps.gov/Adult-Corrections/Prisons/Prison-Facilities,CLOSE,624,0.00985162747252,1192.14050557221,6.0681115438e-06
891,879,10000559,DENVER COUNTY JAIL,10500 EAST SMITH ROAD,DENVER,CO,80239,NOT AVAILABLE,(720) 913-3642,COUNTY,OPEN,-999,DENVER,08031,USA,922140,CORRECTIONAL INSTITUTIONS,https://www.denvergov.org/content/denvergov/en/sheriff-department.html,2/19/2018,IMAGERY,2018/02/19 00:00:00,https://www.denvergov.org/content/denvergov/en/sheriff-department.html,MAXIMUM,-999,0.00997212476663,1257.32315293717,3.02865594001e-06
892,880,10004020,CUMBERLAND COUNTY JUVENILE DETENTION CENTER,135 SUNNYSLOPE DR,BRIDGETON,NJ,08302,NOT AVAILABLE,NOT AVAILABLE,COUNTY,NOT AVAILABLE,31,CUMBERLAND,34011,USA,922140,CORRECTIONAL INSTITUTIONS,"http://www.nj.gov/lps/jjc/2011-AnnualDetentionStatisticsReport.pdf, http://www.nj.com/cumberland/index.ssf/2015/02/cumberland_county_juvenile_detention_center_to_clo.html, http://www.co.cumberland.nj.us/content/22602/22944/default.aspx",2/15/2016,IMAGERY,2018/04/06 00:00:00,NOT AVAILABLE,JUVENILE,46,0.00538526184949,670.643500394446,1.19929288263e-06
893,881,10000646,JOLIET TREATMENT CENTER,2848 WEST MCDONOUGH,JOLIET,IL,60436,NOT AVAILABLE,(815) 730-4400,STATE,OPEN,-999,WILL,17197,USA,922140,CORRECTIONAL INSTITUTIONS,https://www.illinois.gov/idoc/facilities/Pages/AllFacilities.aspx,11/29/2017,IMAGERY,2017/11/29 00:00:00,https://www.illinois.gov/idoc/facilities/Pages/AllFacilities.aspx,MAXIMUM,486,0.0196195618423,2540.45776253842,2.3892583609e-05
894,882,10000674,GRAHAM CORRECTIONAL CENTER,12078 ILLINOIS ROUTE 185,HILLSBORO,IL,62049,NOT AVAILABLE,(217) 532-6961,STATE,OPEN,1879,MONTGOMERY,17135,USA,922140,CORRECTIONAL INSTITUTIONS,https://www.illinois.gov/idoc/reportsandstatistics/Pages/QuarterlyReports.aspx,8/31/2017,IMAGERY,2017/11/29 00:00:00,https://www.illinois.gov/idoc/facilities/Pages/AllFacilities.aspx,MEDIUM,2013,0.0197780790576,2493.52461016719,2.57802342777e-05
895,883,10000687,MENARD CORRECTIONAL CENTER,711 KASKASKIA STREET,MENARD,IL,62259,NOT AVAILABLE,(618) 826-5071,STATE,OPEN,3345,RANDOLPH,17157,USA,922140,CORRECTIONAL INSTITUTIONS,https://www.illinois.gov/idoc/reportsandstatistics/Pages/QuarterlyReports.aspx,8/31/2017,IMAGERY,2017/11/29 00:00:00,https://www.illinois.gov/idoc/facilities/Pages/AllFacilities.aspx,MAXIMUM,3883,0.0156624683149,1931.40245643514,1.30757606411e-05
896,884,10000660,ILLINOIS RIVER CORRECTIONAL CENTER,1300 WEST LOCUST STREET,CANTON,IL,61520,NOT AVAILABLE,(309) 647-7030,STATE,OPEN,2041,FULTON,17057,USA,922140,CORRECTIONAL INSTITUTIONS,https://www.illinois.gov/idoc/reportsandstatistics/Pages/QuarterlyReports.aspx,8/31/2017,IMAGERY,2017/11/29 00:00:00,https://www.illinois.gov/idoc/facilities/Pages/AllFacilities.aspx,MEDIUM,2338,0.0164741757498,2166.39295368251,1.86440545585e-05
897,885,10000671,JACKSONVILLE CORRECTIONAL CENTER,2268 EAST MORTON AVENUE,JACKSONVILLE,IL,62650,NOT AVAILABLE,(217) 245-1481,STATE,OPEN,1241,MORGAN,17137,USA,922140,CORRECTIONAL INSTITUTIONS,https://www.illinois.gov/idoc/reportsandstatistics/Pages/QuarterlyReports.aspx,8/31/2017,IMAGERY,2017/11/29 00:00:00,https://www.illinois.gov/idoc/facilities/Pages/AllFacilities.aspx,MINIMUM,1628,0.0118618937805,1563.02614406975,8.97742239297e-06
898,886,10000682,LAWRENCE CORRECTIONAL CENTER,10940 LAWRENCE ROAD,SUMNER,IL,62466,NOT AVAILABLE,(618) 936-2064,STATE,OPEN,2175,LAWRENCE,17101,USA,922140,CORRECTIONAL INSTITUTIONS,https://www.illinois.gov/idoc/reportsandstatistics/Pages/QuarterlyReports.aspx,8/31/2017,IMAGERY,2017/11/29 00:00:00,https://www.illinois.gov/idoc/facilities/Pages/AllFacilities.aspx,MEDIUM,2460,0.0140657818762,1843.76177569305,1.38768314104e-05
899,887,10000664,LINCOLN CORRECTIONAL CENTER,1098 1350TH STREET,LINCOLN,IL,62656,NOT AVAILABLE,(217) 735-5411,STATE,OPEN,786,LOGAN,17107,USA,922140,CORRECTIONAL INSTITUTIONS,https://www.illinois.gov/idoc/reportsandstatistics/Pages/QuarterlyReports.aspx,8/31/2017,IMAGERY,2017/11/29 00:00:00,https://www.illinois.gov/idoc/facilities/Pages/AllFacilities.aspx,MINIMUM,1019,0.0119969397979,1585.6183834071,9.15542968504e-06
900,888,10004677,KEWANEE LIFE SKILLS RE-ENTRY CENTER,2021 KENTVILLE ROAD,KEWANEE,IL,61443,NOT AVAILABLE,(309) 852-4601,STATE,OPEN,98,HENRY,17073,USA,922140,CORRECTIONAL INSTITUTIONS,https://www.illinois.gov/idoc/reportsandstatistics/Pages/QuarterlyReports.aspx,8/31/2017,IMAGERY,2017/11/29 00:00:00,https://www.illinois.gov/idoc/facilities/Pages/AllFacilities.aspx,NOT AVAILABLE,589,0.0150706778259,1868.12174077665,1.19019030394e-05
901,889,10006209,MENARD MEDIUM SECURITY UNIT,711 KASKASKIA STREET,MENARD,IL,62259,NOT AVAILABLE,(618) 826-5071,STATE,OPEN,419,RANDOLPH,17157,USA,922140,CORRECTIONAL INSTITUTIONS,https://www.illinois.gov/idoc/facilities/Pages/AllFacilities.aspx,4/1/2017,IMAGERY,2017/11/29 00:00:00,https://www.illinois.gov/idoc/facilities/Pages/AllFacilities.aspx,MEDIUM,-999,0.00801289653155,991.408507455562,3.12147030557e-06
902,890,10006351,NORTHERN RECEPTION AND CLASSIFICATION CENTER,16830 SOUTH BROADWAY STREET,JOLIET,IL,60434,NOT AVAILABLE,(815) 727-3607,STATE,OPEN,1323,WILL,17197,USA,922140,CORRECTIONAL INSTITUTIONS,https://www.illinois.gov/idoc/facilities/Pages/AllFacilities.aspx,4/1/2017,IMAGERY,2017/11/29 00:00:00,https://www.illinois.gov/idoc/facilities/Pages/AllFacilities.aspx,MINIMUM,1800,0.00851406722964,1123.27611185688,4.89165533497e-06
903,891,10000657,PEORIA ATC,607-613 NORTH MAIN,PEORIA,IL,61602,NOT AVAILABLE,(309) 671-3162,STATE,OPEN,141,PEORIA,17143,USA,922140,CORRECTIONAL INSTITUTIONS,https://www.illinois.gov/idoc/reportsandstatistics/Pages/QuarterlyReports.aspx,8/31/2017,IMAGERY,2017/11/29 00:00:00,https://www.illinois.gov/idoc/facilities/Pages/AllFacilities.aspx,MINIMUM,248,0.00184259759879,231.103069967993,1.90051783381e-07
904,892,10000688,PINCKNEYVILLE CORRECTIONAL CENTER,5835 STATE ROUTE 154,PINCKNEYVILLE,IL,62274,NOT AVAILABLE,(618) 357-9722,STATE,OPEN,2269,PERRY,17145,USA,922140,CORRECTIONAL INSTITUTIONS,https://www.illinois.gov/idoc/reportsandstatistics/Pages/QuarterlyReports.aspx,8/31/2017,IMAGERY,2017/11/29 00:00:00,https://www.illinois.gov/idoc/facilities/Pages/AllFacilities.aspx,MEDIUM,2964,0.0173507103426,2188.78439839213,1.85107407218e-05
905,893,10000672,PITTSFIELD WORK CAMP,23540 365TH STREET,PITTSFIELD,IL,62363,NOT AVAILABLE,(217) 285-2280,STATE,OPEN,158,PIKE,17149,USA,922140,CORRECTIONAL INSTITUTIONS,https://www.illinois.gov/idoc/facilities/Pages/AllFacilities.aspx,4/1/2017,IMAGERY,2017/11/29 00:00:00,https://www.illinois.gov/idoc/facilities/Pages/AllFacilities.aspx,MINIMUM,400,0.00849768622302,1113.01341924151,3.85139034335e-06
906,894,10000655,PONTIAC CORRECTIONAL CENTER,700 WEST LINCOLN STREET,PONTIAC,IL,61764,NOT AVAILABLE,(815) 842-2816,STATE,OPEN,1434,LIVINGSTON,17105,USA,922140,CORRECTIONAL INSTITUTIONS,https://www.illinois.gov/idoc/reportsandstatistics/Pages/QuarterlyReports.aspx,8/31/2017,IMAGERY,2017/11/29 00:00:00,https://www.illinois.gov/idoc/facilities/Pages/AllFacilities.aspx,MAXIMUM,2949,0.0151554726771,1868.63688229678,1.28206800302e-05
907,895,10000678,ROBINSON CORRECTIONAL CENTER,13423 EAST 1150TH AVENUE,ROBINSON,IL,62454,NOT AVAILABLE,(618) 546-5659,STATE,OPEN,1190,CRAWFORD,17033,USA,922140,CORRECTIONAL INSTITUTIONS,https://www.illinois.gov/idoc/reportsandstatistics/Pages/QuarterlyReports.aspx,8/31/2017,IMAGERY,2017/11/29 00:00:00,https://www.illinois.gov/idoc/facilities/Pages/AllFacilities.aspx,MINIMUM,1223,0.0149732961872,1945.74266660674,1.2809502363e-05
908,896,10000685,SOUTHWESTERN ILLINOIS CORRECTIONAL CENTER,950 KINGSHIGHWAY ST,EAST ST LOUIS,IL,62203,NOT AVAILABLE,(618) 394-2200,STATE,OPEN,707,ST. CLAIR,17163,USA,922140,CORRECTIONAL INSTITUTIONS,https://www.illinois.gov/idoc/reportsandstatistics/Pages/QuarterlyReports.aspx,8/31/2017,IMAGERY,2017/11/29 00:00:00,https://www.illinois.gov/idoc/facilities/Pages/AllFacilities.aspx,MINIMUM,763,0.00991346610506,1221.75291781723,4.58494783846e-06
909,897,10002203,VAN CISE-SIMONET DETENTION CENTER,490 W COLFAX AVENUE,DENVER,CO,80204,NOT AVAILABLE,(720) 337-0400,COUNTY,OPEN,-999,DENVER,08031,USA,922140,CORRECTIONAL INSTITUTIONS,https://www.denvergov.org/content/denvergov/en/sheriff-department.html,2/19/2018,IMAGERY,2018/02/19 00:00:00,https://www.denvergov.org/content/denvergov/en/sheriff-department.html,MINIMUM,-999,0.00369041741593,490.179213007369,7.81493447228e-07
910,898,10004714,VANDALIA WORK CAMP,UNITED STATES HIGHWAY 51 NORTH,VANDALIA,IL,62471,NOT AVAILABLE,(618) 283-4170,STATE,OPEN,404,FAYETTE,17051,USA,922140,CORRECTIONAL INSTITUTIONS,https://www.illinois.gov/idoc/facilities/Pages/AllFacilities.aspx,7/1/2015,UNVERIFIED,2017/11/29 00:00:00,https://www.illinois.gov/idoc/facilities/Pages/AllFacilities.aspx,MINIMUM,-999,0.00968811636728,1219.29094594343,5.13181643795e-06
911,899,10004724,SOUTHWESTERN ILLINOIS WORK CAMP,950 KINGSHIGHWAY ST,EAST ST LOUIS,IL,62203,NOT AVAILABLE,(618) 394-2200,STATE,OPEN,84,ST. CLAIR,17163,USA,922140,CORRECTIONAL INSTITUTIONS,https://www.illinois.gov/idoc/facilities/Pages/AllFacilities.aspx,4/1/2017,IMAGERY,2017/11/29 00:00:00,https://www.illinois.gov/idoc/facilities/Pages/AllFacilities.aspx,MINIMUM,67,0.00184976451386,249.832185586808,1.54697679073e-07
912,900,10006352,STATEVILLE MINIMUM SECURITY UNIT,16830 SOUTH BROADWAY STREET,JOLIET,IL,60434,NOT AVAILABLE,(815) 727-3607,STATE,OPEN,118,WILL,17197,USA,922140,CORRECTIONAL INSTITUTIONS,https://www.illinois.gov/idoc/facilities/Pages/AllFacilities.aspx,4/1/2017,IMAGERY,2017/11/29 00:00:00,https://www.illinois.gov/idoc/facilities/Pages/AllFacilities.aspx,MINIMUM,-999,0.00884197323651,1139.01197072593,3.64463792218e-06
913,901,10000673,TAYLORVILLE CORRECTIONAL CENTER,1144 ILLINOIS ROUTE 29,TAYLORVILLE,IL,62568,NOT AVAILABLE,(217) 824-4004,STATE,OPEN,1198,CHRISTIAN,17021,USA,922140,CORRECTIONAL INSTITUTIONS,https://www.illinois.gov/idoc/reportsandstatistics/Pages/QuarterlyReports.aspx,8/31/2017,IMAGERY,2017/11/29 00:00:00,https://www.illinois.gov/idoc/facilities/Pages/AllFacilities.aspx,MINIMUM,1221,0.0152469540211,1824.61467743682,1.1788515948e-05
914,902,10004737,MASSAC COUNTY JAIL,515 MARKET STREET,METROPOLIS,IL,62960,NOT AVAILABLE,(618) 524-2912,COUNTY,OPEN,37,MASSAC,17127,USA,922140,CORRECTIONAL INSTITUTIONS,"http://massacsheriffsdept.com/index.html, http://www.ilsheriff.org/index.php/directory",3/2/2018,IMAGERY,2018/03/02 00:00:00,http://massacsheriffsdept.com/index.html,NOT AVAILABLE,42,0.00146720043815,182.500988311831,1.25369086663e-07
915,903,10004667,ILLINOIS YOUTH CENTER CHICAGO,136 NORTH WESTERN AVENUE,CHICAGO,IL,60612,NOT AVAILABLE,(312) 633-5219,STATE,OPEN,67,COOK,17031,USA,922140,CORRECTIONAL INSTITUTIONS,https://www.illinois.gov/idjj/Pages/Facilities.aspx,11/29/2017,IMAGERY,2017/11/29 00:00:00,https://www.illinois.gov/idjj/Pages/Facilities.aspx,JUVENILE,130,0.00580472863199,751.484580209733,1.5788873305e-06
916,904,10003988,ESSEX COUNTY-DELANEY HALL DETENTION FACILITY,451 DOREMUS AVE,NEWARK,NJ,07105,NOT AVAILABLE,(973) 274-0115,COUNTY,OPEN,-999,ESSEX,34013,USA,922140,CORRECTIONAL INSTITUTIONS,"http://www.ice.gov/detention-facilities/facilities/dhdfnj.htm, https://www.geogroup.com/Locations",4/6/2018,IMAGERY,2018/04/06 00:00:00,https://www.ice.gov/detention-facility/delaney-hall-detention-facility,NOT AVAILABLE,1200,0.00566587958877,693.308482421467,1.59728972776e-06
917,905,10003989,ESSEX COUNTY CORRECTIONAL FACILITY,354 DOREMUS AVE,NEWARK,NJ,07105,NOT AVAILABLE,(973) 274-7500,COUNTY,OPEN,1638,ESSEX,34013,USA,922140,CORRECTIONAL INSTITUTIONS,http://essexcountynj.org/corrections/#corrections-facility,4/6/2018,IMAGERY,2018/04/06 00:00:00,http://essexcountynj.org/corrections/#corrections-facility,NOT AVAILABLE,2434,0.0113339685817,1446.98950299357,6.86961366899e-06
918,906,10002729,MONTFORD UNIT - PSYCHIATRIC FACILITY,8602 PEACH ST,LUBBOCK,TX,79404,NOT AVAILABLE,(806) 745-1021,STATE,OPEN,820,LUBBOCK,48303,USA,922140,CORRECTIONAL INSTITUTIONS,"https://www.texastribune.org/library/data/texas-prisons/units/, http://www.tdcj.state.tx.us/unit_directory/index.html",9/15/2016,IMAGERY,2018/01/11 00:00:00,http://www.tdcj.state.tx.us/unit_directory/index.html,NOT AVAILABLE,1044,0.0148639442774,1796.72909153578,7.24243161138e-06
919,907,10000639,ILLINOIS YOUTH CENTER ST. CHARLES,3825 CAMPTON HILLS RD,SAINT CHARLES,IL,60175,NOT AVAILABLE,(630) 584-0506,STATE,OPEN,138,KANE,17089,USA,922140,CORRECTIONAL INSTITUTIONS,https://www.illinois.gov/idjj/Pages/Facilities.aspx,11/29/2017,IMAGERY,2017/11/29 00:00:00,https://www.illinois.gov/idjj/Pages/Facilities.aspx,JUVENILE,348,0.0297802244148,3836.28753309777,5.6423324267e-05
920,908,10002214,DOUGLAS COUNTY SHERIFFS OFFICE JAIL,4000 JUSTICE CENTER,CASTLE ROCK,CO,80109,NOT AVAILABLE,(303) 814-7037,COUNTY,OPEN,349,DOUGLAS,08035,USA,922140,CORRECTIONAL INSTITUTIONS,http://www.dcsheriff.net/sheriffs-office/divisions/,2/15/2016,IMAGERY,2018/02/19 00:00:00,http://www.dcsheriff.net/sheriffs-office/divisions/,MAXIMUM,518,0.0108473739211,1366.7245125675,2.97874005155e-06
921,909,10004013,GLOUCESTER COUNTY JAIL,70 HUNTER ST,WOODBURY,NJ,08096,NOT AVAILABLE,NOT AVAILABLE,COUNTY,CLOSED,0,GLOUCESTER,34015,USA,922140,CORRECTIONAL INSTITUTIONS,"http://www.co.gloucester.nj.us/Government/Departments/Correction/main.cfm, http://www.nj.com/gloucester-county/index.ssf/2013/06/south_jersey_jail_deal_gloucester_county_officials_jail_staff_lock_the_doors_behind_them_as_jail_clo.html",2/15/2016,IMAGERY/OTHER,2018/04/06 00:00:00,NOT AVAILABLE,NOT AVAILABLE,225,0.00606990018906,757.054471545826,9.86460160918e-07
922,910,10000183,BILLY MOORE CORRECTIONAL CENTER,8500 N FM 3053,OVERTON,TX,75684,NOT AVAILABLE,(903) 834-6186,STATE,OPEN,496,RUSK,48401,USA,922140,CORRECTIONAL INSTITUTIONS,"https://www.texastribune.org/library/data/texas-prisons/units/, http://www.tdcj.state.tx.us/unit_directory/index.html",9/15/2016,IMAGERY,2018/01/11 00:00:00,http://www.mtctrains.com/corrections/#locations,MINIMUM,500,0.00696920498266,845.639693939578,3.09514892904e-06
923,911,10004700,MENARD COUNTY JAIL,315 SOUTH 6TH STREET,PETERSBURG,IL,62675,NOT AVAILABLE,(217) 632-2273,COUNTY,OPEN,-999,MENARD,17129,USA,922140,CORRECTIONAL INSTITUTIONS,http://www.ilsheriff.org/index.php/directory,3/2/2018,IMAGERY,2018/03/02 00:00:00,http://menardcountyil.com/elected-officials/sh/,NOT AVAILABLE,25,0.00217399981423,287.170528948199,2.20323252087e-07
924,912,10002201,EAGLE COUNTY DETENTION FACILITY,885 EAST CHAMBERS AVENUE,EAGLE,CO,81631,NOT AVAILABLE,NOT AVAILABLE,COUNTY,OPEN,-999,EAGLE,08037,USA,922140,CORRECTIONAL INSTITUTIONS,http://www.eaglecounty.us/Sheriff/,2/15/2016,IMAGERY,2018/02/19 00:00:00,http://www.eaglecounty.us/Sheriff/,MAXIMUM,-999,0.00443327659859,541.416275731548,6.22035460561e-07
925,913,10001391,NORTH EAST REGIONAL YOUTH SERVICE CENTER,33 GREGORY ST,MIDDLETON,MA,01949,NOT AVAILABLE,(978) 716-1100,STATE,OPEN,-999,ESSEX,25009,USA,922140,CORRECTIONAL INSTITUTIONS,https://www.mass.gov/service-details/dys-middleton-north-east-regional-youth-service-center,3/19/2018,IMAGERY,2018/03/19 00:00:00,https://www.mass.gov/locations/dys-northeast-regional-office,JUVENILE,45,0.00535681438492,659.70185773173,8.86391736841e-07
926,914,10006582,SOUTHERN CORRECTIONAL INSTITUTION - MINIMUM CUSTODY UNIT,272 GLEN RD,TROY,NC,27371,NOT AVAILABLE,(910) 572-3784,STATE,OPEN,-999,MONTGOMERY,37123,USA,922140,CORRECTIONAL INSTITUTIONS,https://www.ncdps.gov/Adult-Corrections/Prisons/Prison-Facilities,12/12/2017,IMAGERY,2017/12/12 00:00:00,https://www.ncdps.gov/Adult-Corrections/Prisons/Prison-Facilities,MINIMUM,200,0.00519282448959,641.208783575053,1.3294438589e-06
927,915,10002596,WAUKESHA COUNTY JAIL / JUVENILE DETENTION CENTER,515 WEST MORELAND BLVD,WAUKESHA,WI,53188,NOT AVAILABLE,NOT AVAILABLE,COUNTY,OPEN,396,WAUKESHA,55133,USA,922140,CORRECTIONAL INSTITUTIONS,https://www.waukeshacounty.gov/jail-division/,5/9/2018,IMAGERY/OTHER,2018/05/09 00:00:00,NOT AVAILABLE,MAXIMUM,469,0.00942046537006,1197.89317621454,1.58448490234e-06
928,916,10006217,SWANNANOA CORRECTIONAL CENTER FOR WOMEN,55 LAKE EDEN ROAD,BLACK MOUNTAIN,NC,28711,NOT AVAILABLE,(828) 259-6000,STATE,OPEN,360,BUNCOMBE,37021,USA,922140,CORRECTIONAL INSTITUTIONS,"http://webapps6.doc.state.nc.us/apps/asqExt/ASQ, https://www.ncdps.gov/Adult-Corrections/Prisons/Prison-Facilities",10/31/2017,IMAGERY,2017/12/12 00:00:00,https://www.ncdps.gov/Adult-Corrections/Prisons/Prison-Facilities,MINIMUM,366,0.0276161892856,3359.56364678471,3.78529734808e-05
929,917,10000641,ILLINOIS YOUTH CENTER WARRENVILLE,30 WEST 200 FERRY ROAD,WARRENVILLE,IL,60555,NOT AVAILABLE,(630) 983-6231,STATE,OPEN,28,DUPAGE,17043,USA,922140,CORRECTIONAL INSTITUTIONS,https://www.illinois.gov/idjj/Pages/Facilities.aspx,11/29/2017,IMAGERY,2017/11/29 00:00:00,https://www.illinois.gov/idjj/Pages/Facilities.aspx,JUVENILE,70,0.0139303936747,1765.95452909182,1.0269303075e-05
930,918,10001394,THE CAMBRIDGE JAIL,40 THORNDIKE ST,CAMBRIDGE,MA,02141,NOT AVAILABLE,NOT AVAILABLE,COUNTY,CLOSED,0,MIDDLESEX,25017,USA,922140,CORRECTIONAL INSTITUTIONS,http://www.wbur.org/news/2014/06/30/middlesex-jail-cambridge-billerica,6/30/2014,IMAGERY,2018/03/19 00:00:00,NOT AVAILABLE,MAXIMUM,400,0.00332512676354,403.48987494121,5.19386809311e-07
931,919,10002725,CHOICE MOORE TRANSFER FACILITY,1700 N FM 87,BONHAM,TX,75418,NOT AVAILABLE,(903) 583-4464,STATE,OPEN,1173,FANNIN,48147,USA,922140,CORRECTIONAL INSTITUTIONS,"https://www.texastribune.org/library/data/texas-prisons/units/, http://www.tdcj.state.tx.us/unit_directory/index.html",9/15/2016,IMAGERY,2018/01/11 00:00:00,http://www.tdcj.state.tx.us/unit_directory/index.html,MEDIUM,1224,0.0105939409077,1286.08102577727,6.2908679885e-06
932,920,10004694,IDHS TREATMENT / DETENTION FACILITY,17019 COUNTY FARM RD,RUSHVILLE,IL,62681,NOT AVAILABLE,NOT AVAILABLE,STATE,OPEN,250,SCHUYLER,17169,USA,922140,CORRECTIONAL INSTITUTIONS,http://www.dhs.state.il.us/page.aspx?item=87812,11/29/2017,IMAGERY,2017/11/29 00:00:00,http://www.dhs.state.il.us/page.aspx?item=87812,MAXIMUM,-999,0.0115888324426,1505.90501106731,8.92405675704e-06
933,921,10000670,DECATUR ATC,2175 EAST PERSHING ROAD,DECATUR,IL,62526,NOT AVAILABLE,(217) 429-9198,STATE,CLOSED,0,MACON,17115,USA,922140,CORRECTIONAL INSTITUTIONS,http://www.wandtv.com/story/20495480/adult-transition-center-closed,1/3/2013,IMAGERY,2017/11/29 00:00:00,http://www.illinois.gov/idoc/facilities/Pages/DecaturAdultTransitionCenter.aspx,MINIMUM,110,0.00517677805494,662.061274729003,1.74857019184e-06
934,922,10000654,DWIGHT CORRECTIONAL CENTER,23813 EAST 3200 NORTH ROAD,DWIGHT,IL,60420,NOT AVAILABLE,(815) 584-2806,STATE,CLOSED,0,LIVINGSTON,17105,USA,922140,CORRECTIONAL INSTITUTIONS,http://progressillinois.com/news/content/2013/04/04/dwight-correctional-center-officially-closed,4/4/2013,IMAGERY,2017/11/29 00:00:00,https://www2.illinois.gov/idoc/facilities/Pages/dwightcorrectionalcenter.aspx,MAXIMUM,-999,0.0258850885839,3351.00257311163,3.42690455318e-05
935,923,10004680,MERCER COUNTY JAIL,906 SOUTHWEST 3RD STREET,ALEDO,IL,61231,NOT AVAILABLE,(309) 582-5194,COUNTY,OPEN,64,MERCER,17131,USA,922140,CORRECTIONAL INSTITUTIONS,http://mercercosheriff.org/index.html,3/2/2018,IMAGERY,2018/03/02 00:00:00,http://mercercosheriff.org/index.html,MAXIMUM,102,0.00214548395117,270.213355785553,2.08889958777e-07
936,924,10004022,ALLEGANY COUNTY DETENTION CENTER,14300 MCMULLEN HWY,CUMBERLAND,MD,21502,NOT AVAILABLE,(301) 729-8540,COUNTY,OPEN,142,ALLEGANY,24001,USA,922140,CORRECTIONAL INSTITUTIONS,"http://dlslibrary.state.md.us/publications/JCR/2016/2016_309.pdf, https://www.alleganysheriff.com/en/",8/30/2016,IMAGERY,2018/03/19 00:00:00,https://www.alleganysheriff.com/en/,NOT AVAILABLE,234,0.00638174413869,780.823082792877,1.6969418182e-06
937,925,10000194,MOUNTAIN VIEW PRISON,2305 RANSOM RD,GATESVILLE,TX,76528,NOT AVAILABLE,(254) 865-7226,STATE,OPEN,619,CORYELL,48099,USA,922140,CORRECTIONAL INSTITUTIONS,"https://www.texastribune.org/library/data/texas-prisons/units/, http://www.tdcj.state.tx.us/unit_directory/index.html",9/15/2016,IMAGERY,2018/01/11 00:00:00,http://www.tdcj.state.tx.us/unit_directory/index.html,MAXIMUM,645,0.016197909329,1950.29204126806,1.63991875652e-05
938,926,10003991,HUDSON COUNTY JUVENILE DETENTION CENTER,635 COUNTY AVENUE,SECAUCUS,NJ,07094,NOT AVAILABLE,NOT AVAILABLE,COUNTY,CLOSED,0,HUDSON,34017,USA,922140,CORRECTIONAL INSTITUTIONS,http://www.nj.com/hudson/index.ssf/2015/03/hudson_county_juvenile_detention_center_closed.html,3/27/2015,IMAGERY/OTHER,2018/04/06 00:00:00,NOT AVAILABLE,JUVENILE,79,0.00383478126194,498.093216112228,3.52113596895e-07
939,927,10002950,CARRIZALES-RUCKER DETENTION CENTER,7100 OLD ALICE RD,OLIMITO,TX,78575,NOT AVAILABLE,(956) 554-6701,COUNTY,OPEN,-999,CAMERON,48061,USA,922140,CORRECTIONAL INSTITUTIONS,http://www.co.cameron.tx.us/sheriffs/sheriffsoffice.html,4/25/2018,IMAGERY,2018/04/25 00:00:00,http://www.co.cameron.tx.us/sheriffs/sheriffsoffice.html,MAXIMUM,652,0.0117231819937,1387.55469692361,5.53817911493e-06
940,928,10004673,KANKAKEE MINIMAL SECURITY UNIT,37040 STATE ROUTE 102,MANTENO,IL,60950,NOT AVAILABLE,NOT AVAILABLE,STATE,CLOSED,0,WILL,17197,USA,922140,CORRECTIONAL INSTITUTIONS,http://www.daily-journal.com/news/local/kankakee-county-kankakee-minimum-security-prison-victim-of-state-budget/article_a046a204-1554-5d8d-89e7-237a44d7f145.html,4/28/2010,IMAGERY,2017/11/29 00:00:00,NOT AVAILABLE,MINIMUM,-999,0.00876026710571,1086.79757608883,4.62205066843e-06
941,929,10000570,EL PASO COUNTY CRIMINAL JUSTICE CENTER,2739 EAST LAS VEGAS STREET,COLORADO SPRINGS,CO,80906,NOT AVAILABLE,(719) 390-2000,COUNTY,OPEN,1432,EL PASO,08041,USA,922140,CORRECTIONAL INSTITUTIONS,https://www.epcsheriffsoffice.com/sections-detention-bureau/operations-division/prison-rape-elimination-act-prea,6/30/2016,IMAGERY,2018/02/19 00:00:00,https://www.epcsheriffsoffice.com/sections/detention-bureau,MAXIMUM,1725,0.00796816215799,1031.17556117617,2.98504270865e-06
942,930,10000698,TAMMS CORRECTIONAL CENTER,200 EAST SUPERMAX ROAD,TAMMS,IL,62988,NOT AVAILABLE,(618) 747-2042,STATE,CLOSED,0,ALEXANDER,17003,USA,922140,CORRECTIONAL INSTITUTIONS,https://www.illinoispolicy.org/illinois-spends-750k-a-year-on-closed-prison-and-some-politicians-want-to-spend-millions-reopening-it/,5/27/2015,IMAGERY,2017/11/29 00:00:00,http://www2.illinois.gov/idoc/facilities/Pages/tammsworkcamp.aspx,MAXIMUM,-999,0.00914079683536,1119.49523998027,5.39617121829e-06
943,931,10004738,TAMMS WORK CAMP,200 EAST SUPERMAX ROAD,TAMMS,IL,62988,NOT AVAILABLE,(618) 747-2042,STATE,CLOSED,0,ALEXANDER,17003,USA,922140,CORRECTIONAL INSTITUTIONS,http://herald-review.com/news/state-and-regional/govt-and-politics/supermax-tamms-prison-unlikely-to-reopen/article_3ef6d962-0ba1-536d-860a-40c50cd45bf8.html,5/17/2015,IMAGERY,2017/11/29 00:00:00,http://www2.illinois.gov/idoc/facilities/Pages/tammsworkcamp.aspx,MINIMUM,-999,0.0134862548562,1675.23475190008,9.90369736646e-06
944,932,10004920,EDINBURGH CORRECTIONAL FACILITY,"P.O. BOX 470, 23RD & SCHOOLHOUSE RD",EDINBURGH,IN,46124,NOT AVAILABLE,(812) 526-8434,STATE,OPEN,328,JOHNSON,18081,USA,922140,CORRECTIONAL INSTITUTIONS,http://www.in.gov/idoc/2376.htm,10/1/2017,IMAGERY,2017/11/29 00:00:00,http://www.in.gov/idoc/2332.htm,MINIMUM,344,0.0174499296816,2265.75025596312,1.46544447085e-05
945,933,10001799,TABOR CORRECTIONAL INSTITUTION,4600 SWAMP FOX HWY W,TABOR CITY,NC,28463,NOT AVAILABLE,(910) 653-6413,STATE,OPEN,1721,COLUMBUS,37047,USA,922140,CORRECTIONAL INSTITUTIONS,"http://webapps6.doc.state.nc.us/apps/asqExt/ASQ, https://www.ncdps.gov/Adult-Corrections/Prisons/Prison-Facilities",10/31/2017,IMAGERY,2017/12/12 00:00:00,https://www.ncdps.gov/Adult-Corrections/Prisons/Prison-Facilities,CLOSE,1752,0.0174757118955,2112.7116758405,1.09964280695e-05
946,934,10001275,CRAIN UNIT,1401 STATE SCHOOL RD,GATESVILLE,TX,76599,2999,(254) 865-8431,STATE,OPEN,1606,CORYELL,48099,USA,922140,CORRECTIONAL INSTITUTIONS,"https://www.texastribune.org/library/data/texas-prisons/units/, http://www.tdcj.state.tx.us/unit_directory/index.html",9/15/2016,IMAGERY,2018/01/11 00:00:00,http://www.tdcj.state.tx.us/unit_directory/index.html,MAXIMUM,2115,0.0577097504182,6963.10865551005,2.73361837567e-05
947,935,10003992,HUNTERDON COUNTY CORRECTIONAL FACILITY,71 PARK AVE,FLEMINGTON,NJ,08822,NOT AVAILABLE,NOT AVAILABLE,COUNTY,CLOSED,0,HUNTERDON,34019,USA,922140,CORRECTIONAL INSTITUTIONS,http://www.nj.com/hunterdon/index.ssf/2016/07/when_the_old_old_hunterdon_county_jail_was_new.html,7/7/2016,IMAGERY,2018/04/06 00:00:00,NOT AVAILABLE,NOT AVAILABLE,156,0.00222008082805,277.74341909926,2.62822183653e-07
948,936,10001021,TYRRELL PRISON WORK FARM,620 SNELL RD,COLUMBIA,NC,27925,NOT AVAILABLE,(252) 796-1085,STATE,OPEN,639,TYRRELL,37177,USA,922140,CORRECTIONAL INSTITUTIONS,"http://webapps6.doc.state.nc.us/apps/asqExt/ASQ, https://www.ncdps.gov/Adult-Corrections/Prisons/Prison-Facilities",10/31/2017,IMAGERY,2017/12/12 00:00:00,https://www.ncdps.gov/Adult-Corrections/Prisons/Prison-Facilities,MINIMUM,620,0.00936433519338,1143.32829514954,4.00683641019e-06
949,937,10001054,SOUTH BEND COMMUNITY RE ENTRY CENTER,4650 OLD CLEVELAND RD,SOUTH BEND,IN,46628,NOT AVAILABLE,(574) 234-4094,STATE,OPEN,132,ST. JOSEPH,18141,USA,922140,CORRECTIONAL INSTITUTIONS,http://www.in.gov/idoc/2376.htm,10/1/2017,IMAGERY,2017/11/29 00:00:00,http://www.in.gov/idoc/2332.htm,MINIMUM,172,0.00680823764989,848.212049732294,2.00700985219e-06
950,938,10006309,HERITAGE TRAIL CORRECTIONAL FACILITY,501 WEST MAIN STREET,PLAINFIELD,IN,46168,NOT AVAILABLE,(317) 839-7751,STATE,OPEN,858,HENDRICKS,18063,USA,922140,CORRECTIONAL INSTITUTIONS,"http://www.in.gov/idoc/2376.htm, https://www.geogroup.com/Locations",10/1/2017,IMAGERY,2017/11/29 00:00:00,https://www.geogroup.com/Locations,MINIMUM,1066,0.0239197191574,2972.81167511916,2.7953677351e-05
951,939,10001060,CORRECTIONAL INDUSTRIAL FACILITY,5124 W REFORMATORY RD,PENDLETON,IN,46064,NOT AVAILABLE,(765) 778-8011,STATE,OPEN,1413,MADISON,18095,USA,922140,CORRECTIONAL INSTITUTIONS,http://www.in.gov/idoc/2376.htm,10/1/2017,IMAGERY,2017/11/29 00:00:00,http://www.in.gov/idoc/2332.htm,MEDIUM,1449,0.0168318105377,2091.83976941331,1.67476528087e-05
952,940,10000571,EL PASO COUNTY METRO DETENTION FACILITY,210 S TEJON ST,COLORADO SPRINGS,CO,80903,NOT AVAILABLE,NOT AVAILABLE,COUNTY,OPEN,-999,EL PASO,08041,USA,922140,CORRECTIONAL INSTITUTIONS,https://www.epcsheriffsoffice.com/sections/detention-bureau,2/19/2018,IMAGERY,2018/02/19 00:00:00,https://www.epcsheriffsoffice.com/sections/detention-bureau,NOT AVAILABLE,-999,0.00202364955711,241.982195209473,1.97485314838e-07
953,941,10004174,WAKE CORRECTIONAL CENTER,1000 ROCK QUARRY RD,RALEIGH,NC,27610,NOT AVAILABLE,(919) 733-7988,STATE,OPEN,407,WAKE,37183,USA,922140,CORRECTIONAL INSTITUTIONS,"http://webapps6.doc.state.nc.us/apps/asqExt/ASQ, https://www.ncdps.gov/Adult-Corrections/Prisons/Prison-Facilities",10/31/2017,IMAGERY,2017/12/12 00:00:00,https://www.ncdps.gov/Adult-Corrections/Prisons/Prison-Facilities,MINIMUM,414,0.00610876470141,741.152193862328,1.6058208785e-06
954,942,10001075,BRANCHVILLE CORRECTIONAL FACILITY,21390 OLD STATE RD 37,BRANCHVILLE,IN,47514,NOT AVAILABLE,(812) 843-5921,STATE,OPEN,1239,PERRY,18123,USA,922140,CORRECTIONAL INSTITUTIONS,http://www.in.gov/idoc/2376.htm,10/1/2017,IMAGERY,2017/11/29 00:00:00,http://www.in.gov/idoc/2332.htm,MEDIUM,1485,0.0155792506273,1882.30481575484,1.05304024819e-05
955,943,10001274,MURRAY PRISON,1916 NORTH HWY 36 BYPASS,GATESVILLE,TX,76596,NOT AVAILABLE,(254) 865-2000,STATE,OPEN,1295,CORYELL,48099,USA,922140,CORRECTIONAL INSTITUTIONS,"https://www.texastribune.org/library/data/texas-prisons/units/, http://www.tdcj.state.tx.us/unit_directory/index.html",9/15/2016,IMAGERY,2018/01/11 00:00:00,http://www.tdcj.state.tx.us/unit_directory/index.html,MAXIMUM,1341,0.0133133778473,1590.07841124734,1.1419533019e-05
956,944,10001967,NEAL PRISON,9055 SPUR 591,AMARILLO,TX,79107,9696,(806) 383-1175,STATE,OPEN,1701,POTTER,48375,USA,922140,CORRECTIONAL INSTITUTIONS,"https://www.texastribune.org/library/data/texas-prisons/units/, http://www.tdcj.state.tx.us/unit_directory/index.html",9/15/2016,IMAGERY,2018/01/11 00:00:00,http://www.tdcj.state.tx.us/unit_directory/index.html,MEDIUM,1732,0.0175139061565,2139.46613242461,1.70522169996e-05
957,945,10006736,MONROE COUNTY JAIL,225 EAST THIRD STREET,WATERLOO,IL,62298,NOT AVAILABLE,(618) 939-8651,COUNTY,OPEN,-999,MONROE,17133,USA,922140,CORRECTIONAL INSTITUTIONS,http://www.ilsheriff.org/index.php/directory,3/2/2018,IMAGERY,2018/03/02 00:00:00,http://www.ilsheriff.org/index.php/directory,NOT AVAILABLE,30,0.00149223877381,180.083087986355,1.29760958253e-07
958,946,10004037,ORDNANCE ROAD CORRECTIONAL CENTER,600 E ORDNANCE RD,GLEN BURNIE,MD,21060,NOT AVAILABLE,(410) 222-6350,COUNTY,OPEN,305,ANNE ARUNDEL,24003,USA,922140,CORRECTIONAL INSTITUTIONS,http://dlslibrary.state.md.us/publications/JCR/2016/2016_309.pdf,8/30/2016,IMAGERY,2018/03/19 00:00:00,http://www.aacounty.org/departments/detention-facilities/,MEDIUM,540,0.00943986409783,1228.22910142067,4.55855480018e-06
959,947,10004039,CALVERT COUNTY DETENTION CENTER,325 STAFFORD RD,PRINCE FREDERICK,MD,20678,NOT AVAILABLE,(410) 535-4300,COUNTY,OPEN,199,CALVERT,24009,USA,922140,CORRECTIONAL INSTITUTIONS,http://dlslibrary.state.md.us/publications/JCR/2016/2016_309.pdf,8/30/2016,IMAGERY,2018/03/19 00:00:00,http://www.co.cal.md.us/residents/safety/law/sheriff/divisions/detention/,MAXIMUM,228,0.00438340451747,540.180641003985,5.78716467951e-07
960,948,10004913,NEW CASTLE CORRECTIONAL FACILITY,1000 VAN NUYS RD,NEW CASTLE,IN,47362,NOT AVAILABLE,(765) 593-0111,STATE,OPEN,2392,HENRY,18065,USA,922140,CORRECTIONAL INSTITUTIONS,http://www.in.gov/idoc/2376.htm,10/1/2017,IMAGERY,2017/11/30 00:00:00,http://www.in.gov/idoc/2332.htm,MEDIUM,2431,0.017600759937,2166.09013625546,1.54697822764e-05
961,949,10001072,WABASH VALLEY CORRECTIONAL FACILITY,6908 S OLD US HWY 41,CARLISLE,IN,47838,NOT AVAILABLE,(812) 398-5050,STATE,OPEN,1713,SULLIVAN,18153,USA,922140,CORRECTIONAL INSTITUTIONS,http://www.in.gov/idoc/2376.htm,10/1/2017,IMAGERY,2017/11/30 00:00:00,http://www.in.gov/idoc/2332.htm,MAXIMUM,1785,0.0215074460963,2683.52757143596,2.82930492232e-05
962,950,10001071,PUTNAMVILLE CORRECTIONAL FACILITY,1946 W US HWY 40,GREENCASTLE,IN,46135,NOT AVAILABLE,(765) 653-8441,STATE,OPEN,1976,PUTNAM,18133,USA,922140,CORRECTIONAL INSTITUTIONS,http://www.in.gov/idoc/2376.htm,10/1/2017,IMAGERY,2017/11/30 00:00:00,http://www.in.gov/idoc/2332.htm,MEDIUM,2510,0.0259126276985,3214.73836676757,1.84040381564e-05
963,951,10001051,WESTVILLE CORRECTIONAL FACILITY,5501 S 1100 W,WESTVILLE,IN,46391,NOT AVAILABLE,(219) 785-2511,STATE,OPEN,2458,LAPORTE,18091,USA,922140,CORRECTIONAL INSTITUTIONS,http://www.in.gov/idoc/2376.htm,10/1/2017,IMAGERY,2017/11/30 00:00:00,http://www.in.gov/idoc/2332.htm,MEDIUM,2941,0.0293031073349,3769.89760743797,4.97029864237e-05
964,952,10004146,WARREN CORRECTIONAL INSTITUTION,379 COLLINS RD,MANSON,NC,27553,NOT AVAILABLE,(252) 456-3400,STATE,OPEN,667,WARREN,37185,USA,922140,CORRECTIONAL INSTITUTIONS,"http://webapps6.doc.state.nc.us/apps/asqExt/ASQ, https://www.ncdps.gov/Adult-Corrections/Prisons/Prison-Facilities",10/31/2017,IMAGERY,2017/12/12 00:00:00,https://www.ncdps.gov/Adult-Corrections/Prisons/Prison-Facilities,CLOSE,809,0.0165040505897,2043.52555881974,1.40044422527e-05
965,953,10001063,ROCKVILLE CORRECTIONAL FACILITY,811 W 50 N,ROCKVILLE,IN,47872,NOT AVAILABLE,(765) 569-3178,STATE,OPEN,1104,PARKE,18121,USA,922140,CORRECTIONAL INSTITUTIONS,http://www.in.gov/idoc/2376.htm,10/1/2017,IMAGERY,2017/11/30 00:00:00,http://www.in.gov/idoc/2332.htm,MEDIUM,1269,0.0159083712295,2035.06570112207,1.27671319184e-05
966,954,10006382,CRAINE HOUSE,6130 N. MICHIGAN ROAD,INDIANAPOLIS,IN,46228,NOT AVAILABLE,(317) 255-4673,STATE,OPEN,15,MARION,18097,USA,922140,CORRECTIONAL INSTITUTIONS,http://www.in.gov/idoc/2376.htm,10/1/2017,IMAGERY,2017/11/30 00:00:00,http://www.crainehouse.org/,MINIMUM,45,0.00319605559935,408.056575359819,5.74384737385e-07
967,955,10001059,MIAMI CORRECTIONAL FACILITY,3038 W 850 S,BUNKER HILL,IN,46914,9810,(765) 689-8920,STATE,OPEN,2932,MIAMI,18103,USA,922140,CORRECTIONAL INSTITUTIONS,http://www.in.gov/idoc/2376.htm,10/1/2017,IMAGERY,2017/11/30 00:00:00,http://www.in.gov/idoc/2332.htm,MAXIMUM,2984,0.0237511717239,2969.22731658185,3.07847912799e-05
968,956,10000583,FREMONT COUNTY DETENTION CENTER,100 JUSTICE CENTER ROAD,CANON CITY,CO,81212,NOT AVAILABLE,(719) 276-5555,COUNTY,OPEN,200,FREMONT,08043,USA,922140,CORRECTIONAL INSTITUTIONS,https://www.fremontco.com/sheriff/detentioncenter.shtml,10/25/2016,IMAGERY,2018/02/19 00:00:00,https://www.fremontco.com/sheriff/detentioncenter.shtml,MAXIMUM,235,0.00386045829325,473.847769270419,5.86578262972e-07
969,957,10002946,DARRELL B HESTER JUVENILE DETENTION CENTER,2310 W HWY 77,SAN BENITO,TX,78586,NOT AVAILABLE,(956) 361-4603,COUNTY,OPEN,-999,CAMERON,48061,USA,922140,CORRECTIONAL INSTITUTIONS,http://www.tjjd.texas.gov/publications/other/searchfacilityregistryresults.aspx?SelectedFacilityType=YKSBbGCMUWM=&SelectedSortBy=laExhobORj5ZHimppFKN0Q==&IncludeInactive=bZL7qeN3IjY=,4/25/2018,IMAGERY,2018/04/25 00:00:00,http://www.co.cameron.tx.us/iJDC/index.html,JUVENILE,61,0.00445651193161,524.641490514413,6.98351462588e-07
970,958,10002567,WAUSHARA COUNTY JAIL,430 E DIVISION ST,WAUTOMA,WI,54982,NOT AVAILABLE,(920) 787-6591,COUNTY,OPEN,113,WAUSHARA,55137,USA,922140,CORRECTIONAL INSTITUTIONS,http://www.co.waushara.wi.us/pview.aspx?id=12727&catid=636,5/9/2018,IMAGERY,2018/05/09 00:00:00,NOT AVAILABLE,NOT AVAILABLE,125,0.00383866504367,507.202183388164,5.4060063339e-07
971,959,10001052,CAMP SUMMIT BOOT CAMP,2407 N 500 W,LA PORTE,IN,46350,NOT AVAILABLE,(219) 326-1188,STATE,OPEN,17,LAPORTE,18091,USA,922140,CORRECTIONAL INSTITUTIONS,http://www.in.gov/idoc/dys/2334.htm,11/30/2017,IMAGERY,2017/11/30 00:00:00,http://www.in.gov/idoc/dys/2334.htm,JUVENILE,94,0.00943889163727,1248.96407155001,4.15386789539e-06
972,960,10000997,WINNEBAGO COUNTY JAIL,4311 JACKSON ST,OSHKOSH,WI,54901,NOT AVAILABLE,(920) 236-7380,COUNTY,OPEN,312,WINNEBAGO,55139,USA,922140,CORRECTIONAL INSTITUTIONS,https://www.co.winnebago.wi.us/sheriff,5/9/2018,IMAGERY,2018/05/09 00:00:00,NOT AVAILABLE,NOT AVAILABLE,355,0.0063684125572,792.904148675897,1.51332047622e-06
973,961,10001040,ELLSWORTH CORRECTIONAL FACILITY / WORK RELEASE,1607 STATE STREET,ELLSWORTH,KS,67439,NOT AVAILABLE,(785) 472-5501,STATE,OPEN,905,ELLSWORTH,20053,USA,922140,CORRECTIONAL INSTITUTIONS,https://www.doc.ks.gov/publications/population-report,11/29/2017,IMAGERY,2017/11/30 00:00:00,https://www.doc.ks.gov/facilities/index,MAXIMUM,913,0.0156384430289,1997.64229753937,1.55069183999e-05
974,962,10006545,MADISON JUVENILE CORRECTIONAL FACILITY,1130 MSH 4TH STREET,MADISON,IN,47250,NOT AVAILABLE,(812) 265-6154,STATE,OPEN,44,JEFFERSON,18077,USA,922140,CORRECTIONAL INSTITUTIONS,http://www.in.gov/idoc/dys/2329.htm,5/1/2014,IMAGERY,2017/11/30 00:00:00,http://www.in.gov/idoc/dys/2334.htm,JUVENILE,167,0.00816067467327,1033.93571832837,3.92584343909e-06
975,963,10001074,HENRYVILLE CORRECTIONAL FACILITY,1504 SCHLAMN LAKE RD,HENRYVILLE,IN,47126,NOT AVAILABLE,(812) 294-4372,STATE,CLOSED,0,CLARK,18019,USA,922140,CORRECTIONAL INSTITUTIONS,http://www.newsandtribune.com/news/henryville-state-prison-closing-next-month/article_5fa570d0-2822-11e6-baca-73e9cca6a8a2.html,6/1/2016,IMAGERY,2017/11/30 00:00:00,http://www.in.gov/idoc/2398.htm,MINIMUM,168,0.00500296503734,633.677162276178,9.21368208352e-07
976,964,10001839,INDIANAPOLIS WOMEN'S COMMUNITY RE-ENTRY CENTER,512 E MINNESOTA ST,INDIANAPOLIS,IN,46203,NOT AVAILABLE,NOT AVAILABLE,STATE,CLOSED,0,MARION,18097,USA,922140,CORRECTIONAL INSTITUTIONS,http://www.in.gov/idoc/mobile.htm,10/1/2015,IMAGERY,2017/11/30 00:00:00,NOT AVAILABLE,MINIMUM,82,0.00136785097366,162.576726094272,8.15035313281e-08
977,965,10004898,NORTHEAST JUVENILE CORRECTIONAL FACILITY,7117 VENTURE LN,FT. WAYNE,IN,46818,NOT AVAILABLE,NOT AVAILABLE,STATE,CLOSED,0,ALLEN,18003,USA,922140,CORRECTIONAL INSTITUTIONS,https://www.in.gov/idoc/files/NEJ_Media_Release.pdf,5/7/2010,IMAGERY,2017/11/30 00:00:00,NOT AVAILABLE,JUVENILE,-999,0.00380630329545,493.883796597538,6.64351673104e-07
978,966,10004928,SOUTHWEST INDIANA REGIONAL YOUTH VILLAGE,2290 SOUTH THEOBALD LANE,VINCENNES,IN,47591,NOT AVAILABLE,(812) 886-3000,STATE,OPEN,15,KNOX,18083,USA,922140,CORRECTIONAL INSTITUTIONS,https://www.in.gov/idoc/dys/files/Knox_County_2014-_Audit_Report.pdf,10/22/2014,IMAGERY,2017/11/30 00:00:00,https://www.in.gov/idoc/dys/files/Knox_County_2014-_Audit_Report.pdf,JUVENILE,80,0.0113095160397,1427.55373478956,6.87236543614e-06
979,967,10001044,HUTCHINSON C.F.-EAST UNIT,400 SOUTH HALSTEAD STREET,HUTCHINSON,KS,67504,NOT AVAILABLE,(620) 662-2321,STATE,OPEN,492,RENO,20155,USA,922140,CORRECTIONAL INSTITUTIONS,https://www.doc.ks.gov/publications/population-report,11/29/2017,IMAGERY,2017/11/30 00:00:00,https://www.doc.ks.gov/facilities/index,MEDIUM,496,0.0157554506168,2072.13712380355,1.29444998743e-05
980,968,10006290,EL DORADO CORRECTIONAL FACILITY SE MEDIUM UNIT,2501 WEST 7TH STREET,OSWEGO,KS,67356,NOT AVAILABLE,(316) 322-2045,STATE,OPEN,259,LABETTE,20099,USA,922140,CORRECTIONAL INSTITUTIONS,https://www.doc.ks.gov/publications/population-report,11/29/2017,IMAGERY,2017/11/30 00:00:00,https://www.doc.ks.gov/facilities/index,MEDIUM,262,0.00709184451284,863.748267531437,1.37360541822e-06
981,969,10004153,WILKES CORRECTIONAL CENTER,404 STATESVILLE RD,NORTH WILKESBORO,NC,28659,NOT AVAILABLE,(336) 667-4533,STATE,OPEN,266,WILKES,37193,USA,922140,CORRECTIONAL INSTITUTIONS,"http://webapps6.doc.state.nc.us/apps/asqExt/ASQ, https://www.ncdps.gov/Adult-Corrections/Prisons/Prison-Facilities",10/31/2017,IMAGERY,2017/12/12 00:00:00,https://www.ncdps.gov/Adult-Corrections/Prisons/Prison-Facilities,MINIMUM,262,0.00463813982198,575.236891319425,1.02441524538e-06
982,970,10001045,EL DORADO CORRECTIONAL FACILITY,1737 SOUTHEAST UNITED STATES HIGHWAY 54,EL DORADO,KS,67042,NOT AVAILABLE,(316) 321-7284,STATE,OPEN,1503,BUTLER,20015,USA,922140,CORRECTIONAL INSTITUTIONS,https://www.doc.ks.gov/publications/population-report,11/29/2017,IMAGERY,2017/11/30 00:00:00,https://www.doc.ks.gov/facilities/index,MEDIUM,1693,0.021445395672,2713.56175718162,2.26216225874e-05
983,971,10001043,HUTCHINSON C.F.-CENTRAL & WORK RELEASE CENTER,500 REFORMATORY STREET,HUTCHINSON,KS,67504,1568,(620) 662-2321,STATE,OPEN,1114,RENO,20155,USA,922140,CORRECTIONAL INSTITUTIONS,https://www.doc.ks.gov/publications/population-report,11/29/2017,IMAGERY,2017/11/30 00:00:00,https://www.doc.ks.gov/facilities/index,MAXIMUM,1106,0.0150681700703,1862.111904985,1.13083338821e-05
984,972,10000238,NEY STATE JAIL,114 PRIVATE RD 4303,HONDO,TX,78861,3812,(830) 426-8030,STATE,OPEN,560,MEDINA,48325,USA,922140,CORRECTIONAL INSTITUTIONS,"https://www.texastribune.org/library/data/texas-prisons/units/, http://www.tdcj.state.tx.us/unit_directory/index.html",9/15/2016,IMAGERY,2018/01/11 00:00:00,http://www.tdcj.state.tx.us/unit_directory/index.html,MEDIUM,576,0.00674827653955,808.472693485938,2.33278950433e-06
985,973,10001031,LANSING CORRECTIONAL FACILITY - CENTRAL UNIT,301 EAST KANSAS AVE,LANSING,KS,66043,NOT AVAILABLE,(913) 727-3235,STATE,OPEN,1538,LEAVENWORTH,20103,USA,922140,CORRECTIONAL INSTITUTIONS,https://www.doc.ks.gov/publications/population-report,11/29/2017,IMAGERY,2017/11/30 00:00:00,https://www.doc.ks.gov/facilities/index,MAXIMUM,1777,0.013053513657,1688.9020922029,9.26737026841e-06
986,974,10001030,LANSING CORRECTIONAL FACILITY - EAST UNIT,301 EAST KANSAS AVE,LANSING,KS,66043,NOT AVAILABLE,(913) 727-3235,STATE,OPEN,614,LEAVENWORTH,20103,USA,922140,CORRECTIONAL INSTITUTIONS,https://www.doc.ks.gov/publications/population-report,11/29/2017,IMAGERY,2017/11/30 00:00:00,https://www.doc.ks.gov/facilities/index,MINIMUM,628,0.0131624717153,1706.34908225077,1.09283964305e-05
987,975,10001830,LARNED CORRECTIONAL MENTAL HEALTH FACILITY-CENTRAL,1318 STATE HIGHWAY 264,LARNED,KS,67550,0280,(620) 285-6249,STATE,OPEN,218,PAWNEE,20145,USA,922140,CORRECTIONAL INSTITUTIONS,https://www.doc.ks.gov/publications/population-report,11/29/2017,IMAGERY,2017/11/30 00:00:00,https://www.doc.ks.gov/facilities/index,MAXIMUM,310,0.00883220202759,1118.05892488735,5.84064887294e-06
988,976,10001028,NORTON CORRECTIONAL FACILITY,ROAD EAST 4 AND UNITED STATES HIGHWAY 36,NORTON,KS,67654,0546,(785) 877-3389,STATE,OPEN,803,NORTON,20137,USA,922140,CORRECTIONAL INSTITUTIONS,https://www.doc.ks.gov/publications/population-report,11/29/2017,IMAGERY,2017/11/30 00:00:00,https://www.doc.ks.gov/facilities/index,MEDIUM,867,0.0120456199244,1512.50917900688,9.40669211876e-06
989,977,10001832,LARNED CORRECTIONAL MENTAL HEALTH FACILITY - WEST,1301 STATE HIGHWAY 264,LARNED,KS,67550,NOT AVAILABLE,(620) 285-6249,STATE,OPEN,274,PAWNEE,20145,USA,922140,CORRECTIONAL INSTITUTIONS,https://www.doc.ks.gov/publications/population-report,11/29/2017,UNVERIFIED,2017/11/30 00:00:00,https://www.doc.ks.gov/facilities/index,MINIMUM,288,0.00653064655481,809.601677709793,2.21026018561e-06
990,978,10004812,NCF SATELLITE UNIT - EAST UNIT,1210 SOUTH CEDAR STREET,STOCKTON,KS,67669,NOT AVAILABLE,(785) 425-6745,STATE,OPEN,124,ROOKS,20163,USA,922140,CORRECTIONAL INSTITUTIONS,https://www.doc.ks.gov/publications/population-report,11/29/2017,IMAGERY,2017/11/30 00:00:00,https://www.doc.ks.gov/facilities/index,MINIMUM,128,0.00455324408292,570.380056802776,1.26628939887e-06
991,979,10002838,PACK PRISON AND TRUSTY CAMP,2400 WALLACE PACK RD,NAVASOTA,TX,77868,NOT AVAILABLE,(936) 825-3728,STATE,OPEN,965,GRIMES,48185,USA,922140,CORRECTIONAL INSTITUTIONS,"https://www.texastribune.org/library/data/texas-prisons/units/, http://www.tdcj.state.tx.us/unit_directory/index.html",9/15/2016,IMAGERY,2018/01/11 00:00:00,http://www.tdcj.state.tx.us/unit_directory/index.html,MEDIUM,1478,0.0169798029042,2042.14737894069,6.97238348686e-06
992,980,10000675,MONTGOMERY COUNTY JAIL,140 NORTH MAIN STREET,HILLSBORO,IL,62049,NOT AVAILABLE,(217) 532-9514,COUNTY,OPEN,-999,MONTGOMERY,17135,USA,922140,CORRECTIONAL INSTITUTIONS,http://www.ilsheriff.org/index.php/directory,3/2/2018,IMAGERY,2018/03/02 00:00:00,http://www.montgomeryco.com/index.php/montgomery-county-sheriff-s,NOT AVAILABLE,40,0.00213810886804,258.92598500487,1.65373167849e-07
993,981,10001033,TOPEKA CORRECTIONAL FACILITY,815 SOUTHEAST RICE ROAD,TOPEKA,KS,66607,NOT AVAILABLE,(785) 559-5002,STATE,OPEN,891,SHAWNEE,20177,USA,922140,CORRECTIONAL INSTITUTIONS,https://www.doc.ks.gov/publications/population-report,11/29/2017,IMAGERY,2017/11/30 00:00:00,https://www.doc.ks.gov/facilities/index,MAXIMUM,903,0.0225615939422,2941.59214065231,3.22493299999e-05
994,982,10004025,CECIL COUNTY DETENTION CENTER,500 LANDING LANE,ELKTON,MD,21921,NOT AVAILABLE,(410) 996-5800,COUNTY,OPEN,284,CECIL,24015,USA,922140,CORRECTIONAL INSTITUTIONS,http://dlslibrary.state.md.us/publications/JCR/2016/2016_309.pdf,8/30/2016,IMAGERY,2018/03/19 00:00:00,http://www.ccgov.org/government/sheriff-s-office-1701,MAXIMUM,324,0.00718119277309,897.331851129501,2.74179544678e-06
995,983,10000558,GARFIELD COUNTY DETENTION FACILITY,107 8TH STREET,GLENWOOD SPRINGS,CO,81601,NOT AVAILABLE,(970) 945-1377,COUNTY,OPEN,124,GARFIELD,08045,USA,922140,CORRECTIONAL INSTITUTIONS,http://www.garcosheriff.com/detention_facility.html,2/19/2018,IMAGERY,2018/02/19 00:00:00,http://www.garcosheriff.com/index.html,MAXIMUM,204,0.00179171600007,219.075600009412,1.77832140484e-07
996,984,10004000,MERCER COUNTY CORRECTIONAL CENTER,1750 ROUTE 29,LAMBERTVILLE,NJ,08530,NOT AVAILABLE,(609) 583-3545,COUNTY,OPEN,-999,MERCER,34021,USA,922140,CORRECTIONAL INSTITUTIONS,"http://www.njcjwa.org/jails.html, http://www.mercercounty.org/departments/corrections",4/6/2018,IMAGERY,2018/04/06 00:00:00,http://www.mercercounty.org/departments/corrections,MAXIMUM,880,0.00665099493135,845.839916442987,2.08755717557e-06
997,985,10001034,KANSAS JUVENILE CORRECTIONAL COMPLEX,1430 NORTHWEST 25TH STREET,TOPEKA,KS,66618,1499,(785) 354-9800,STATE,OPEN,185,SHAWNEE,20177,USA,922140,CORRECTIONAL INSTITUTIONS,"https://www.doc.ks.gov/publications/juvenile/population, https://www.doc.ks.gov/juvenile-services",10/17/2017,IMAGERY,2017/12/01 00:00:00,https://www.doc.ks.gov/juvenile-services,JUVENILE,235,0.024305842024,2877.99417993991,2.29323210096e-05
998,986,10001048,WICHITA WORK RELEASE FACILITY,401 SOUTH EMPORIA STREET,WICHITA,KS,67202,NOT AVAILABLE,(316) 265-5211,STATE,OPEN,244,SEDGWICK,20173,USA,922140,CORRECTIONAL INSTITUTIONS,https://www.doc.ks.gov/publications/population-report,11/30/2017,IMAGERY,2017/12/01 00:00:00,https://www.doc.ks.gov/facilities/index,MINIMUM,250,0.00203485295015,257.071593856062,2.31461723676e-07
999,987,10002844,PLANE STATE JAIL,904 FM 686,DAYTON,TX,77535,NOT AVAILABLE,(936) 258-2476,STATE,OPEN,2074,LIBERTY,48291,USA,922140,CORRECTIONAL INSTITUTIONS,"https://www.texastribune.org/library/data/texas-prisons/units/, http://www.tdcj.state.tx.us/unit_directory/index.html",9/15/2016,IMAGERY,2018/01/11 00:00:00,http://www.tdcj.state.tx.us/unit_directory/index.html,MAXIMUM,2291,0.01422164652,1654.64336717106,1.0146522261e-05
1000,988,10001831,LARNED STATE HOSPITAL,1301 KS HWY 264,LARNED,KS,67550,NOT AVAILABLE,(620) 285-2131,STATE,OPEN,40,PAWNEE,20145,USA,922140,CORRECTIONAL INSTITUTIONS,https://www.doc.ks.gov/publications/population-report,11/30/2017,UNVERIFIED,2017/12/01 00:00:00,https://www.kdads.ks.gov/state-hospitals-and-institutions,NOT AVAILABLE,45,0.0108449624687,1343.2482883786,5.81761722637e-06
1001,989,10006583,CABARRUS REGIONAL JUVENILE DETENTION CENTER,822 MCWHORTER ROAD,CONCORD,NC,28027,NOT AVAILABLE,(704) 720-0807,STATE,OPEN,-999,CABARRUS,37025,USA,922140,CORRECTIONAL INSTITUTIONS,https://www.ncdps.gov/Juvenile-Justice/Juvenile-Facility-Operations/Juvenile-Detention-Centers,12/12/2017,UNVERIFIED,2017/12/12 00:00:00,https://www.ncdps.gov/Juvenile-Justice/Juvenile-Facility-Operations/Juvenile-Detention-Centers,JUVENILE,30,0.00196878836239,244.350487743129,2.45814195226e-07
1002,990,10003650,BLACKBURN CORRECTIONAL COMPLEX,3111 SPURR RD,LEXINGTON,KY,40511,NOT AVAILABLE,(859) 246-2366,STATE,OPEN,591,FAYETTE,21067,USA,922140,CORRECTIONAL INSTITUTIONS,https://corrections.ky.gov/about/Pages/ResearchandStatistics.aspx,11/29/2017,IMAGERY,2017/12/01 00:00:00,https://corrections.ky.gov/depts/AI/Pages/default.aspx,MINIMUM,594,0.0298537971698,3695.56049375148,4.26082150954e-05
1003,991,10001476,MORGAN COUNTY JAIL,300 WEST COURT STREET,JACKSONVILLE,IL,62650,NOT AVAILABLE,(217) 243-4143,COUNTY,OPEN,40,MORGAN,17137,USA,922140,CORRECTIONAL INSTITUTIONS,http://morgancounty-il.com/departments/sheriffs-office/,3/6/2017,IMAGERY,2018/03/02 00:00:00,http://morgancounty-il.com/departments/sheriffs-office/,NOT AVAILABLE,65,0.00173160138645,215.089677553241,1.85689956734e-07
1004,992,10000205,POLUNSKY PRISON,3872 FM 350 S,LIVINGSTON,TX,77351,NOT AVAILABLE,(936) 967-8082,STATE,OPEN,2904,POLK,48373,USA,922140,CORRECTIONAL INSTITUTIONS,"https://www.texastribune.org/library/data/texas-prisons/units/, http://www.tdcj.state.tx.us/unit_directory/index.html",9/15/2016,IMAGERY/OTHER,2018/01/11 00:00:00,http://www.tdcj.state.tx.us/unit_directory/index.html,MAXIMUM,2984,0.0180705605544,2155.11655130568,2.26954790817e-05
1005,993,10000996,WINNEBAGO COUNTY WORK RELEASE CENTER,90 W COUNTY RD Y,OSHKOSH,WI,54901,NOT AVAILABLE,NOT AVAILABLE,COUNTY,CLOSED,0,WINNEBAGO,55139,USA,922140,CORRECTIONAL INSTITUTIONS,https://www.co.winnebago.wi.us/sheriff/corrections-division,5/9/2018,IMAGERY,2018/05/09 00:00:00,NOT AVAILABLE,MINIMUM,210,0.00313200536379,410.124697929543,5.8038729936e-07
1006,994,10000920,CHARLES COUNTY DETENTION CENTER / ANNEX,6905 CRAIN HWY,LA PLATA,MD,20646,NOT AVAILABLE,NOT AVAILABLE,COUNTY,OPEN,333,CHARLES,24017,USA,922140,CORRECTIONAL INSTITUTIONS,http://dlslibrary.state.md.us/publications/JCR/2016/2016_309.pdf,8/30/2016,IMAGERY,2018/03/19 00:00:00,https://www.ccso.us/,NOT AVAILABLE,490,0.00905593680769,1103.27898969389,2.25409272156e-06
1007,995,10000110,EASTERN KENTUCKY CORRECTIONAL COMPLEX,200 ROAD TO JUSTICE,WEST LIBERTY,KY,41472,NOT AVAILABLE,(606) 743-2800,STATE,OPEN,1672,MORGAN,21175,USA,922140,CORRECTIONAL INSTITUTIONS,https://corrections.ky.gov/about/Pages/ResearchandStatistics.aspx,11/29/2017,IMAGERY,2017/12/01 00:00:00,https://corrections.ky.gov/depts/AI/Pages/default.aspx,MEDIUM,1674,0.016348611029,1987.1623009011,1.16117331487e-05
1008,996,10000117,GREEN RIVER CORRECTIONAL COMPLEX,1200 RIVER RD,CENTRAL CITY,KY,42330,NOT AVAILABLE,(270) 754-5415,STATE,OPEN,962,MUHLENBERG,21177,USA,922140,CORRECTIONAL INSTITUTIONS,https://corrections.ky.gov/about/Pages/ResearchandStatistics.aspx,11/29/2017,IMAGERY,2017/12/01 00:00:00,https://corrections.ky.gov/depts/AI/Pages/default.aspx,MEDIUM,947,0.0166803825286,2116.571868194,1.54215962911e-05
1009,997,10000121,WESTERN KENTUCKY CORRECTIONAL COMPLEX,374 NEW BETHEL CHURCH RD,FREDONIA,KY,42411,NOT AVAILABLE,(270) 388-9781,STATE,OPEN,677,LYON,21143,USA,922140,CORRECTIONAL INSTITUTIONS,https://corrections.ky.gov/about/Pages/ResearchandStatistics.aspx,11/29/2017,IMAGERY,2017/12/01 00:00:00,https://corrections.ky.gov/depts/AI/Pages/default.aspx,MEDIUM,670,0.0143266261991,1772.28497041266,9.15713074142e-06
1010,998,10000106,KENTUCKY CORRECTIONAL INSTITUTION FOR WOMEN,3000 ASH AVE,PEWEE VALLEY,KY,40056,NOT AVAILABLE,(502) 241-8454,STATE,OPEN,719,SHELBY,21211,USA,922140,CORRECTIONAL INSTITUTIONS,https://corrections.ky.gov/about/Pages/ResearchandStatistics.aspx,11/29/2017,IMAGERY,2017/12/01 00:00:00,https://corrections.ky.gov/depts/AI/Pages/default.aspx,MAXIMUM,691,0.0168693058824,2084.73809211587,1.07044777689e-05
1011,999,10000107,LITTLE SANDY CORRECTIONAL COMPLEX,505 PRISON CONNECTOR,SANDY HOOK,KY,41171,NOT AVAILABLE,(606) 738-6133,STATE,OPEN,1001,ELLIOTT,21063,USA,922140,CORRECTIONAL INSTITUTIONS,https://corrections.ky.gov/about/Pages/ResearchandStatistics.aspx,11/29/2017,IMAGERY,2017/12/01 00:00:00,https://corrections.ky.gov/depts/AI/Pages/default.aspx,MEDIUM,987,0.0158136954964,1920.46104910748,1.65538591604e-05
1012,1000,10003647,AUDUBON YOUTH DEVELOPMENT CENTER,8711 LAGRANGE RD,LOUISVILLE,KY,40242,NOT AVAILABLE,(502) 429-7287,STATE,OPEN,41,JEFFERSON,21111,USA,922140,CORRECTIONAL INSTITUTIONS,https://schools.jefferson.kyschools.us/special/sac/audubon.html,12/1/2017,IMAGERY,2017/12/01 00:00:00,https://schools.jefferson.kyschools.us/special/sac/audubon.html,JUVENILE,80,0.00793842606852,995.672105637123,2.55389477363e-06
1013,1001,10000116,NORTHPOINT TRAINING CENTER,710 WALTER REED RD,BURGIN,KY,40310,NOT AVAILABLE,(859) 239-7012,STATE,OPEN,1237,BOYLE,21021,USA,922140,CORRECTIONAL INSTITUTIONS,https://corrections.ky.gov/about/Pages/ResearchandStatistics.aspx,11/29/2017,IMAGERY,2017/12/01 00:00:00,https://corrections.ky.gov/depts/AI/Pages/default.aspx,MEDIUM,1226,0.0127955850469,1600.90901744091,1.01516597269e-05
1014,1002,10000102,ROEDERER CORRECTIONAL COMPLEX,P.O. BOX 69,LAGRANGE,KY,40031,NOT AVAILABLE,(502) 222-0170,STATE,OPEN,1209,OLDHAM,21185,USA,922140,CORRECTIONAL INSTITUTIONS,https://corrections.ky.gov/about/Pages/ResearchandStatistics.aspx,11/29/2017,IMAGERY,2017/12/01 00:00:00,https://corrections.ky.gov/depts/AI/Pages/default.aspx,MAXIMUM,1138,0.0154036090826,1854.37174598439,7.82504179028e-06
1015,1003,10002360,FREDERICK COUNTY ADULT DETENTION CENTER,7300 MARCIE'S CHOICE LN,FREDERICK,MD,21704,NOT AVAILABLE,(301) 600-2550,COUNTY,OPEN,374,FREDERICK,24021,USA,922140,CORRECTIONAL INSTITUTIONS,http://dlslibrary.state.md.us/publications/JCR/2016/2016_309.pdf,8/30/2016,IMAGERY,2018/03/19 00:00:00,https://frederickcountymd.gov/677/Sheriff-Adult-Detention,MAXIMUM,405,0.00614593406539,763.379541335995,1.80133522707e-06
1016,1004,10001802,NEW HANOVER REGIONAL JUVENILE DETENTION CENTER,3830 JUVENILE CENTER RD,CASTLE HAYNE,NC,28429,NOT AVAILABLE,(910) 675-0594,STATE,OPEN,-999,NEW HANOVER,37129,USA,922140,CORRECTIONAL INSTITUTIONS,https://www.ncdps.gov/Juvenile-Justice/Juvenile-Facility-Operations/Juvenile-Detention-Centers,12/12/2017,IMAGERY,2017/12/12 00:00:00,https://www.ncdps.gov/Juvenile-Justice/Juvenile-Facility-Operations/Juvenile-Detention-Centers,JUVENILE,18,0.00189881374539,233.354384603085,1.34769061219e-07
1017,1005,10005047,GREEN RIVER YOUTH DEVELOPMENT CENTER,363 BOY CAMP ROAD,CROMWELL,KY,42333,NOT AVAILABLE,(270) 526-3826,STATE,OPEN,23,BUTLER,21031,USA,922140,CORRECTIONAL INSTITUTIONS,https://djj.ky.gov/Pages/PREA.aspx,4/21/2015,IMAGERY,2017/12/01 00:00:00,https://djj.ky.gov/Facilities/Pages/Youth-Development-Centers.aspx,JUVENILE,40,0.00847469958024,1060.99009791873,3.67733638612e-06
1018,1006,10004185,PITT REGIONAL JUVENILE DETENTION CENTER,451 BELVOIR RD,GREENVILLE,NC,27834,NOT AVAILABLE,(252) 830-6590,STATE,OPEN,-999,PITT,37147,USA,922140,CORRECTIONAL INSTITUTIONS,https://www.ncdps.gov/Juvenile-Justice/Juvenile-Facility-Operations/Juvenile-Detention-Centers,12/12/2017,IMAGERY,2017/12/12 00:00:00,https://www.ncdps.gov/Juvenile-Justice/Juvenile-Facility-Operations/Juvenile-Detention-Centers,JUVENILE,18,0.00194291805107,236.976997157358,1.81262983444e-07
1019,1007,10004327,LAKE CUMBERLAND YOUTH DEVELOPMENT CENTER,9000 HIGHWAY 1546,MONTICELLO,KY,42633,NOT AVAILABLE,(606) 348-4201,STATE,OPEN,26,WAYNE,21231,USA,922140,CORRECTIONAL INSTITUTIONS,https://djj.ky.gov/Pages/PREA.aspx,6/16/2017,IMAGERY,2017/12/01 00:00:00,https://djj.ky.gov/Facilities/Pages/Youth-Development-Centers.aspx,JUVENILE,40,0.00872524372477,1093.35977527279,2.18820576871e-06
1020,1008,10005684,OWENSBORO TREATMENT CENTER,3001 LEITCHFIELD ROAD,OWENSBORO,KY,42303,NOT AVAILABLE,(270) 687-7311,STATE,OPEN,21,DAVIESS,21059,USA,922140,CORRECTIONAL INSTITUTIONS,https://djj.ky.gov/Pages/PREA.aspx?Paged=TRUE&p_SortBehavior=0&p_FileLeafRef=Morehead%20YDC%202016%2epdf&p_ID=28&PageFirstRow=31&&View={2A6FDF3C-C8B7-4DC5-9FC3-92531E2BBB46},5/23/2015,IMAGERY,2017/12/01 00:00:00,NOT AVAILABLE,JUVENILE,30,0.0111728649924,1449.02720841985,6.88230794014e-06
1021,1009,10005054,MAYFIELD YOUTH DEVELOPMENT CENTER,3179 STATE ROAD 45 SOUTH,MAYFIELD,KY,42066,NOT AVAILABLE,(270) 247-3237,STATE,OPEN,20,GRAVES,21083,USA,922140,CORRECTIONAL INSTITUTIONS,https://djj.ky.gov/Pages/PREA.aspx,2/22/2016,IMAGERY,2017/12/01 00:00:00,https://djj.ky.gov/Facilities/Pages/Youth-Development-Centers.aspx,JUVENILE,30,0.00621513254821,793.621737410382,2.13039175234e-06
1022,1010,10004312,MOREHEAD YOUTH DEVELOPMENT CENTER,495 FOREST HILLS DR,MOREHEAD,KY,40351,NOT AVAILABLE,(606) 783-8565,STATE,OPEN,6,ROWAN,21205,USA,922140,CORRECTIONAL INSTITUTIONS,https://djj.ky.gov/Pages/PREA.aspx,6/17/2016,IMAGERY,2017/12/01 00:00:00,https://djj.ky.gov/Facilities/Pages/Youth-Development-Centers.aspx,JUVENILE,40,0.0108690800985,1329.52338953836,6.72267533859e-06
1023,1011,10003639,NORTHERN KENTUCKY YOUTH DEVELOPMENT CENTER,15600 TURNER ROAD,CRITTENDEN,KY,40130,NOT AVAILABLE,(859) 356-3172,STATE,OPEN,24,KENTON,21117,USA,922140,CORRECTIONAL INSTITUTIONS,https://djj.ky.gov/Pages/PREA.aspx?Paged=TRUE&p_SortBehavior=0&p_FileLeafRef=Morehead%20YDC%202016%2epdf&p_ID=28&PageFirstRow=31&&View={2A6FDF3C-C8B7-4DC5-9FC3-92531E2BBB46},5/15/2016,IMAGERY,2017/12/01 00:00:00,https://djj.ky.gov/Facilities/Pages/Youth-Development-Centers.aspx,JUVENILE,40,0.00716303417354,863.998964736258,2.06921411521e-06
1024,1012,10006714,GARFIELD COUNTY COMMUNITY CORRECTIONS FACILITY,0244 COUNTY ROAD 333A,RIFLE,CO,81650,NOT AVAILABLE,(970) 625-0334,COUNTY,OPEN,-999,GARFIELD,08045,USA,922140,CORRECTIONAL INSTITUTIONS,https://www.garfield-county.com/criminal-justice/residential.aspx,2/19/2018,IMAGERY/OTHER,2018/02/19 00:00:00,https://www.garfield-county.com/criminal-justice/residential.aspx,MINIMUM,60,0.00142633012648,182.772452538773,1.24786928772e-07
1025,1013,10003645,BOYD REGIONAL JUVENILE DETENTION CENTER,2420 ROBERTS DR,ASHLAND,KY,41102,NOT AVAILABLE,(606) 920-2085,STATE,OPEN,18,BOYD,21019,USA,922140,CORRECTIONAL INSTITUTIONS,https://djj.ky.gov/Pages/PREA.aspx,4/3/2017,IMAGERY,2017/12/01 00:00:00,https://djj.ky.gov/Facilities/Pages/Detention-Centers.aspx,JUVENILE,36,0.00297763577792,389.211368784919,3.54048261779e-07
1026,1014,10003638,CAMPBELL REGIONAL JUVENILE DETENTION CENTER,590 COLUMBIA ST,NEWPORT,KY,41071,6371,(859) 292-6371,STATE,OPEN,18,CAMPBELL,21037,USA,922140,CORRECTIONAL INSTITUTIONS,https://djj.ky.gov/Pages/PREA.aspx,9/14/2015,IMAGERY,2017/12/01 00:00:00,https://djj.ky.gov/Facilities/Pages/Detention-Centers.aspx,JUVENILE,52,0.00270491348523,331.766548121952,3.32572804701e-07
1027,1015,10003651,FAYETTE REGIONAL JUVENILE DETENTION CENTER,3475 SPURR RD,LEXINGTON,KY,40511,NOT AVAILABLE,(859) 246-2806,STATE,OPEN,40,FAYETTE,21067,USA,922140,CORRECTIONAL INSTITUTIONS,https://djj.ky.gov/Pages/PREA.aspx,4/12/2017,IMAGERY,2017/12/01 00:00:00,https://djj.ky.gov/Facilities/Pages/Detention-Centers.aspx,JUVENILE,60,0.00828175930845,1006.68581891826,4.04913387262e-06
1028,1016,10003657,LINCOLN VILLAGE REGIONAL JUVENILE DETENTION CENTER,820 NEW GLENDALE RD,ELIZABETHTOWN,KY,42701,NOT AVAILABLE,(270) 766-5280,STATE,OPEN,25,HARDIN,21093,USA,922140,CORRECTIONAL INSTITUTIONS,https://djj.ky.gov/Pages/PREA.aspx,5/24/2015,IMAGERY,2017/12/01 00:00:00,https://djj.ky.gov/Facilities/Pages/Detention-Centers.aspx,JUVENILE,48,0.00310407834255,390.726377162551,4.48122244863e-07
1029,1017,10004705,MOULTRIE COUNTY JAIL,1505 WEST HAGERMAN ROAD,SULLIVAN,IL,61951,NOT AVAILABLE,(217) 728-4386,COUNTY,OPEN,19,MOULTRIE,17139,USA,922140,CORRECTIONAL INSTITUTIONS,http://www.moultriesheriff.com/Moultrie_County_Detention_Center/Moultrie_County_Detention_Center_and_Sheriffs_Office.html,2/26/2018,IMAGERY,2018/03/02 00:00:00,http://www.moultriesheriff.com/Moultrie_County_Detention_Center/Moultrie_County_Detention_Center_and_Sheriffs_Office.html,NOT AVAILABLE,56,0.001907913723,240.82417212686,2.15446753373e-07
1030,1018,10002947,AMADOR R RODRIGUEZ BOOT CAMP / ED CTR,2310 W HWY 77,SAN BENITO,TX,78586,NOT AVAILABLE,(956) 361-3509,COUNTY,OPEN,-999,CAMERON,48061,USA,922140,CORRECTIONAL INSTITUTIONS,http://www.co.cameron.tx.us/iJDC/index.html,4/25/2018,IMAGERY,2018/04/25 00:00:00,http://www.co.cameron.tx.us/iJDC/index.html,JUVENILE,40,0.00416637657873,486.318319086711,7.89949828444e-07
1031,1019,10003680,MCCRACKEN REGIONAL JUVENILE DETENTION CENTER,500 COUNTRY PARK RD,PADUCAH,KY,42001,NOT AVAILABLE,(270) 575-7111,STATE,OPEN,28,MCCRACKEN,21145,USA,922140,CORRECTIONAL INSTITUTIONS,https://djj.ky.gov/Pages/PREA.aspx,6/18/2016,IMAGERY,2017/12/01 00:00:00,https://djj.ky.gov/Facilities/Pages/Detention-Centers.aspx,JUVENILE,52,0.00252319978337,323.769759331031,3.25767427474e-07
1032,1020,10001944,WARREN REGIONAL JUVENILE DETENTION CENTER,1020 KENTUCKY ST,BOWLING GREEN,KY,42101,NOT AVAILABLE,(270) 746-7155,STATE,OPEN,16,WARREN,21227,USA,922140,CORRECTIONAL INSTITUTIONS,https://djj.ky.gov/Pages/PREA.aspx?Paged=TRUE&p_SortBehavior=0&p_FileLeafRef=Morehead%20YDC%202016%2epdf&p_ID=28&PageFirstRow=31&&View={2A6FDF3C-C8B7-4DC5-9FC3-92531E2BBB46},11/10/2015,IMAGERY,2017/12/01 00:00:00,https://djj.ky.gov/Facilities/Pages/Detention-Centers.aspx,JUVENILE,48,0.00307546615362,377.995732966155,3.77125691289e-07
1033,1021,10003678,ADAIR YOUTH DEVELOPMENT CENTER,401 APPLEBY DRIVE,COLUMBIA,KY,42728,NOT AVAILABLE,(270) 384-0811,STATE,OPEN,18,ADAIR,21001,USA,922140,CORRECTIONAL INSTITUTIONS,https://djj.ky.gov/Pages/PREA.aspx,6/19/2016,IMAGERY,2017/12/01 00:00:00,https://djj.ky.gov/Facilities/Pages/Youth-Development-Centers.aspx,JUVENILE,80,0.0082765514521,993.409937914525,3.40077649148e-06
1034,1022,10005044,CADET LEADERSHIP & EDUCATION PROGRAM,2665 KENTUCKY HIGHWAY 30 WEST,JACKSON,KY,41339,NOT AVAILABLE,(606) 295-2267,STATE,OPEN,17,BREATHITT,21025,USA,922140,CORRECTIONAL INSTITUTIONS,https://djj.ky.gov/Pages/PREA.aspx,3/31/2017,IMAGERY,2017/12/01 00:00:00,https://djj.ky.gov/Facilities/Pages/Cadet-Leadership-and-Education-Program.aspx,JUVENILE,40,0.0031025300489,388.339716055502,5.91603264129e-07
1035,1023,10002416,B B RAYBURN CORRECTIONAL CENTER,27268 STATE HWY 21 N,ANGIE,LA,70426,NOT AVAILABLE,(985) 661-6300,STATE,OPEN,1313,WASHINGTON,22117,USA,922140,CORRECTIONAL INSTITUTIONS,http://doc.louisiana.gov/briefing-book,9/27/2017,IMAGERY,2017/12/01 00:00:00,http://www.doc.la.gov/contact/correctional-facilities/,MEDIUM,1314,0.0195558916002,2390.78630950829,1.50561215705e-05
1036,1024,10000115,LEE ADJUSTMENT CENTER,168 LEE ADJUSTMENT CENTER DRIVE,BEATTYVILLE,KY,41311,NOT AVAILABLE,(606) 464-2866,STATE,OPEN,-999,LEE,21129,USA,922140,CORRECTIONAL INSTITUTIONS,http://www.cca.com/locations,12/1/2017,IMAGERY,2017/12/01 00:00:00,http://www.cca.com/locations,CLOSE,816,0.0111465085758,1408.71978745011,5.11679648092e-06
1037,1025,10000967,ALLEN CORRECTIONAL CENTER,3751 LAUDERDALE WOODYARD RD,KINDER,LA,70648,NOT AVAILABLE,(337) 639-2943,STATE,OPEN,1579,ALLEN,22003,USA,922140,CORRECTIONAL INSTITUTIONS,http://www.doc.la.gov/contact/correctional-facilities/,12/1/2017,IMAGERY,2017/12/01 00:00:00,http://www.doc.la.gov/contact/correctional-facilities/,MAXIMUM,1576,0.019341723561,2257.11745417572,2.05701773967e-05
1038,1026,10004094,DIXON CORRECTIONAL INSTITUTE,5568 STATE HWY 68,JACKSON,LA,70748,NOT AVAILABLE,(225) 634-1200,STATE,OPEN,1778,EAST FELICIANA,22037,USA,922140,CORRECTIONAL INSTITUTIONS,http://doc.louisiana.gov/briefing-book,9/27/2017,IMAGERY,2017/12/01 00:00:00,http://www.doc.la.gov/contact/correctional-facilities/,MAXIMUM,1800,0.0254899000521,3156.59309558661,1.5127595746e-05
1039,1027,10000948,DAVID WADE CORRECTIONAL CENTER,670 BELL HILL RD,HOMER,LA,71040,NOT AVAILABLE,(318) 927-0400,STATE,OPEN,1227,CLAIBORNE,22027,USA,922140,CORRECTIONAL INSTITUTIONS,http://doc.louisiana.gov/briefing-book,9/27/2017,IMAGERY,2017/12/01 00:00:00,http://www.doc.la.gov/contact/correctional-facilities/,MAXIMUM,1224,0.0142928969064,1796.3454018388,1.31993637921e-05
1040,1028,10000185,POWLEDGE PRISON,1400 FM 3452,PALESTINE,TX,75803,NOT AVAILABLE,(903) 723-5074,STATE,OPEN,1101,ANDERSON,48001,USA,922140,CORRECTIONAL INSTITUTIONS,"https://www.texastribune.org/library/data/texas-prisons/units/, http://www.tdcj.state.tx.us/unit_directory/index.html",9/15/2016,IMAGERY,2018/01/11 00:00:00,http://www.tdcj.state.tx.us/unit_directory/index.html,MEDIUM,1137,0.0181945348953,2213.68728737137,1.26892813231e-05
1041,1029,10003998,MIDDLESEX COUNTY ADULT CORRECTION CENTER,ROUTE 130 AND APPLE ORCHARD LANE,NORTH BRUNSWICK,NJ,08902,NOT AVAILABLE,(732) 951-3360,COUNTY,OPEN,1182,MIDDLESEX,34023,USA,922140,CORRECTIONAL INSTITUTIONS,"http://www.njcjwa.org/jails.html, http://www.drugpolicy.org/sites/default/files/New_Jersey_Jail_Population_Analysis_March_2013.pdf",2/15/2016,IMAGERY,2018/04/06 00:00:00,http://www.middlesexcountynj.gov/Government/Departments/PSH/Pages/default.aspx,NOT AVAILABLE,1436,0.00998754684058,1266.36091455541,3.34948784726e-06
1042,1030,10002550,WOOD COUNTY JAIL,400 MARKET ST,WISCONSIN RAPIDS,WI,54495,NOT AVAILABLE,(715) 421-8730,COUNTY,OPEN,110,WOOD,55141,USA,922140,CORRECTIONAL INSTITUTIONS,http://woodcountysheriffsdepartment.com/index.php,5/9/2018,IMAGERY,2018/05/09 00:00:00,http://woodcountysheriffsdepartment.com/index.php,MAXIMUM,132,0.0046692569894,625.366200902047,6.46450652047e-07
1043,1031,10000963,LOUISIANA STATE PENITENTIARY,17544 TUNICA TRACE,ANGOLA,LA,70712,NOT AVAILABLE,(225) 655-4411,STATE,OPEN,6073,WEST FELICIANA,22125,USA,922140,CORRECTIONAL INSTITUTIONS,http://doc.louisiana.gov/briefing-book,9/27/2017,IMAGERY,2017/12/01 00:00:00,http://www.doc.la.gov/contact/correctional-facilities/,MAXIMUM,6312,0.0958348754504,11529.8927111445,0.000111834972715
1044,1032,10001768,WAKE JUVENILE DETENTION CENTER,700 BEACON LAKE DR,RALEIGH,NC,27610,NOT AVAILABLE,(919) 212-3104,STATE,OPEN,-999,WAKE,37183,USA,922140,CORRECTIONAL INSTITUTIONS,https://www.ncdps.gov/Juvenile-Justice/Juvenile-Facility-Operations/Juvenile-Detention-Centers,12/13/2017,IMAGERY,2017/12/13 00:00:00,https://www.ncdps.gov/Juvenile-Justice/Juvenile-Facility-Operations/Juvenile-Detention-Centers,JUVENILE,24,0.00219615242496,273.55095777731,1.28061321579e-07
1045,1033,10000242,RAMSEY PRISON,1100 FM 655,ROSHARON,TX,77583,NOT AVAILABLE,(281) 595-3491,STATE,OPEN,1798,BRAZORIA,48039,USA,922140,CORRECTIONAL INSTITUTIONS,"https://www.texastribune.org/library/data/texas-prisons/units/, http://www.tdcj.state.tx.us/unit_directory/index.html",9/15/2016,IMAGERY,2018/01/11 00:00:00,http://www.tdcj.state.tx.us/unit_directory/index.html,MAXIMUM,1891,0.0154019947356,1808.76606221946,8.05501927349e-06
1046,1034,10006216,CHATHAM YOUTH DEVELOPMENT CENTER,560 PROGRESS BLVD.,SILER CITY,NC,27344,NOT AVAILABLE,(919) 742-6220,STATE,OPEN,61,CHATHAM,37037,USA,922140,CORRECTIONAL INSTITUTIONS,https://www.ncdps.gov/annual-report-youth-development-centers-october-2017,10/1/2017,IMAGERY,2017/12/13 00:00:00,https://www.ncdps.gov/Juvenile-Justice/Juvenile-Facility-Operations/Youth-Development-Centers,JUVENILE,32,0.0030694055315,377.285190052165,5.70349804562e-07
1047,1035,10002200,GILPIN COUNTY JUSTICE CENTER,2960 DORY HILL ROAD,GOLDEN,CO,80403,NOT AVAILABLE,(303) 582-3576,COUNTY,OPEN,-999,GILPIN,08047,USA,922140,CORRECTIONAL INSTITUTIONS,http://www.gilpincountysheriff.com/divisions,2/19/2018,IMAGERY,2018/02/19 00:00:00,http://www.gilpincountysheriff.com/divisions,NOT AVAILABLE,55,0.00343516064828,432.337524782281,5.87337051633e-07
1048,1036,10000156,ROACH UNIT,15845 FM 164,CHILDRESS,TX,79201,NOT AVAILABLE,(940) 937-6364,STATE,OPEN,1369,CHILDRESS,48075,USA,922140,CORRECTIONAL INSTITUTIONS,"https://www.texastribune.org/library/data/texas-prisons/units/, http://www.tdcj.state.tx.us/unit_directory/index.html",9/15/2016,IMAGERY,2018/01/11 00:00:00,http://www.tdcj.state.tx.us/unit_directory/index.html,MEDIUM,1384,0.0131660193846,1622.963699095,1.11841142207e-05
1049,1037,10002208,JEFFERSON COUNTY DETENTION FACILITY,200 JEFFERSON COUNTY PARKWAY,GOLDEN,CO,80419,NOT AVAILABLE,(303) 277-0211,COUNTY,OPEN,1470,JEFFERSON,08059,USA,922140,CORRECTIONAL INSTITUTIONS,https://www.jeffco.us/650/Sheriff,2/15/2016,IMAGERY,2018/02/19 00:00:00,https://www.jeffco.us/650/Sheriff,MAXIMUM,1300,0.00945938884789,1224.67463645082,2.07322259858e-06
1050,1038,10004664,HULSE JUVENILE DETENTION CENTER,24647 NORTH MILWAUKEE AVENUE,VERNON HILLS,IL,60061,NOT AVAILABLE,(847) 377-7800,COUNTY,OPEN,-999,LAKE,17097,USA,922140,CORRECTIONAL INSTITUTIONS,http://19thcircuitcourt.state.il.us/1194/Juvenile-Detention,3/2/2018,IMAGERY,2018/03/02 00:00:00,http://19thcircuitcourt.state.il.us/1194/Juvenile-Detention,JUVENILE,-999,0.00444209350304,562.685216718417,1.3228745139e-06
1051,1039,10002220,GUNNISON COUNTY DETENTION CENTER,510 BIDWELL,GUNNISON,CO,81230,NOT AVAILABLE,(970) 641-1108,COUNTY,OPEN,16,GUNNISON,08051,USA,922140,CORRECTIONAL INSTITUTIONS,http://www.gunnisoncounty.org/165/Detention-Services,2/16/2018,IMAGERY,2018/02/19 00:00:00,http://www.gunnisoncounty.org/165/Detention-Services,NOT AVAILABLE,-999,0.00205149668136,261.34334271792,2.23809639117e-07
1052,1040,10002196,GRAND COUNTY JAIL,670 SPRING STREET,HOT SULPHUR SPRINGS,CO,80451,NOT AVAILABLE,(970) 725-3343,COUNTY,OPEN,-999,GRAND,08049,USA,922140,CORRECTIONAL INSTITUTIONS,http://co.grand.co.us/255/Sheriff,2/19/2018,IMAGERY,2018/02/19 00:00:00,http://co.grand.co.us/255/Sheriff,NOT AVAILABLE,-999,0.00188472421061,240.040379300359,2.21173397205e-07
1053,1041,10002744,CASS COUNTY JAIL,600 HWY 8 NORTH,LINDEN,TX,75563,NOT AVAILABLE,(903) 756-7511,COUNTY,OPEN,68,CASS,48067,USA,922140,CORRECTIONAL INSTITUTIONS,"https://www.tcjs.state.tx.us/index.php?linkID=325, https://texasjailproject.org/list_of_county_jails/",3/1/2018,IMAGERY,2018/04/25 00:00:00,NOT AVAILABLE,NOT AVAILABLE,96,0.00260161633772,304.215583156935,2.63141713825e-07
1054,1042,10002879,CHAMBERS COUNTY JAIL,201 N COURT,ANAHUAC,TX,77514,NOT AVAILABLE,NOT AVAILABLE,COUNTY,OPEN,84,CHAMBERS,48071,USA,922140,CORRECTIONAL INSTITUTIONS,"https://www.tcjs.state.tx.us/index.php?linkID=325, http://www.co.chambers.tx.us/default.aspx?name=sheriff",3/1/2018,IMAGERY,2018/04/25 00:00:00,NOT AVAILABLE,NOT AVAILABLE,148,0.00275080172628,330.795449024898,3.67488024105e-07
1055,1043,10000049,MONROE COUNTY SHERIFF'S DEPARTMENT,216 MAIN ST,UNION,WV,24983,NOT AVAILABLE,NOT AVAILABLE,COUNTY,NOT AVAILABLE,-999,MONROE,54063,USA,922140,CORRECTIONAL INSTITUTIONS,NOT AVAILABLE,NOT AVAILABLE,IMAGERY/OTHER,2018/05/10 00:00:00,NOT AVAILABLE,NOT AVAILABLE,-999,0.00134847610143,164.191231377607,8.13143932391e-08
1056,1044,10005933,BRIDGE CITY CENTER FOR YOUTH,3225 RIVER ROAD,BRIDGE CITY,LA,70094,NOT AVAILABLE,(504) 436-4253,STATE,OPEN,124,JEFFERSON,22051,USA,922140,CORRECTIONAL INSTITUTIONS,https://ojj.la.gov/about-ojj/administrative-functions/ojj-secure-care-facilities/,12/4/2017,IMAGERY/OTHER,2017/12/04 00:00:00,https://ojj.la.gov/about-ojj/administrative-functions/ojj-secure-care-facilities/,JUVENILE,-999,0.0114479017958,1376.01612863083,8.77576203417e-06
1057,1045,10002095,BOSTON PRE-RELEASE CENTER,430 CANTERBURY ST,ROSLINDALE,MA,02131,NOT AVAILABLE,(617) 822-5000,STATE,OPEN,106,SUFFOLK,25025,USA,922140,CORRECTIONAL INSTITUTIONS,http://www.mass.gov/eopss/law-enforce-and-cj/prisons/rsch-data/weekly-count-sheets.html,9/4/2017,IMAGERY,2017/12/04 00:00:00,https://www.mass.gov/prison/locations,MINIMUM,175,0.00393967852077,502.280507622795,2.93345519368e-07
1058,1046,10001643,TENSAS / J.B. EVANS CORRECTIONAL CENTER,500 ROUTH ST,NEWELTON,LA,71357,NOT AVAILABLE,(318) 467-3355,STATE,OPEN,-999,TENSAS,22107,USA,922140,CORRECTIONAL INSTITUTIONS,http://www.doc.la.gov/wp-content/uploads/stats/1k.pdf,3/25/2015,UNVERIFIED,2017/12/04 00:00:00,NOT AVAILABLE,MEDIUM,388,0.00510266615818,606.649207763862,1.26494880504e-06
1059,1047,10000949,SWANSON CENTER FOR YOUTH AT MONROE,4701 S GRAND ST,MONROE,LA,71202,NOT AVAILABLE,(318) 362-5000,STATE,OPEN,156,OUACHITA,22073,USA,922140,CORRECTIONAL INSTITUTIONS,https://ojj.la.gov/about-ojj/administrative-functions/ojj-secure-care-facilities/,12/4/2017,IMAGERY,2017/12/04 00:00:00,https://ojj.la.gov/about-ojj/administrative-functions/ojj-secure-care-facilities/,JUVENILE,426,0.0176437998291,2096.64153349993,1.58160124652e-05
1060,1048,10004747,WARE YOUTH CENTER,3565 UNITED STATES HIGHWAY 71,COUSHATTA,LA,71019,NOT AVAILABLE,(318) 932-4411,STATE,OPEN,-999,RED RIVER,22081,USA,922140,CORRECTIONAL INSTITUTIONS,http://www.wareyouthcenter.com/Group_Home.php,12/4/2017,IMAGERY,2017/12/04 00:00:00,http://www.wareyouthcenter.com/Home_Page.php,JUVENILE,40,0.0182756813812,2140.71223442908,1.63753636407e-05
1061,1049,10006385,SWANSON CENTER FOR YOUTH AT COLUMBIA,132 HWY 850,COLUMBIA,LA,71418,NOT AVAILABLE,(318) 649-4310,STATE,OPEN,-999,CALDWELL,22021,USA,922140,CORRECTIONAL INSTITUTIONS,https://ojj.la.gov/about-ojj/administrative-functions/ojj-secure-care-facilities/,12/4/2017,IMAGERY,2017/12/04 00:00:00,https://ojj.la.gov/about-ojj/administrative-functions/ojj-secure-care-facilities/,JUVENILE,-999,0.00719198186656,862.764665273624,3.05939285718e-06
1062,1050,10002417,C PAUL PHELPS CORRECTIONAL CENTER,14925 STATE HWY 27 N,DEQUINCY,LA,70633,NOT AVAILABLE,NOT AVAILABLE,STATE,CLOSED,0,BEAUREGARD,22011,USA,922140,CORRECTIONAL INSTITUTIONS,http://www.nola.com/politics/index.ssf/2012/11/c_paul_phelps_prison_shuts_dow.html,11/1/2012,IMAGERY,2017/12/04 00:00:00,NOT AVAILABLE,MEDIUM,-999,0.0202453488437,2437.01431424228,1.33422547912e-05
1063,1051,10003997,MIDDLESEX COUNTY JUVENILE DETENTION CENTER,APPLE ORCHARD LANE,NORTH BRUNSWICK,NJ,08902,NOT AVAILABLE,NOT AVAILABLE,COUNTY,OPEN,56,MIDDLESEX,34023,USA,922140,CORRECTIONAL INSTITUTIONS,"http://www.middlesexcountynj.gov/Government/Departments/PSH/Pages/default.aspx, http://www.nj.gov/lps/jjc/2011-AnnualDetentionStatisticsReport.pdf",2/15/2016,IMAGERY,2018/04/06 00:00:00,http://www.middlesexcountynj.gov/Government/Departments/PSH/Pages/default.aspx,JUVENILE,100,0.00579553531894,751.647105789862,1.42330913423e-06
1064,1052,10000175,ROBERTSON PRISON,12071 FM 3522,ABILENE,TX,79601,NOT AVAILABLE,(325) 548-9035,STATE,OPEN,2971,JONES,48253,USA,922140,CORRECTIONAL INSTITUTIONS,"https://www.texastribune.org/library/data/texas-prisons/units/, http://www.tdcj.state.tx.us/unit_directory/index.html",9/15/2016,IMAGERY,2018/01/11 00:00:00,http://www.tdcj.state.tx.us/unit_directory/index.html,MAXIMUM,2984,0.0182016581992,2197.4880084798,2.3129745536e-05
1065,1053,10001101,MARION COUNTY JAIL,217 ADAMS ST,FAIRMONT,WV,26554,NOT AVAILABLE,NOT AVAILABLE,COUNTY,CLOSED,0,MARION,54049,USA,922140,CORRECTIONAL INSTITUTIONS,http://www.timeswv.com/news/officials-looking-into-reopening-county-jail/article_6f3f0752-8584-11e7-bd37-7b501a24f70d.html,3/20/2017,IMAGERY,2018/05/10 00:00:00,NOT AVAILABLE,NOT AVAILABLE,-999,0.00170416553137,213.331187246297,1.75309248049e-07
1066,1054,10006785,FREDERICK COUNTY WORK RELEASE FACILITY,7300 MARCIE'S CHOICE LN,FREDERICK,MD,21704,NOT AVAILABLE,NOT AVAILABLE,COUNTY,OPEN,55,FREDERICK,24021,USA,922140,CORRECTIONAL INSTITUTIONS,http://dlslibrary.state.md.us/publications/JCR/2016/2016_309.pdf,8/30/2016,IMAGERY,2018/03/19 00:00:00,https://frederickcountymd.gov/677/Sheriff-Adult-Detention,MINIMUM,128,0.00181805704612,232.399158051193,1.92785338157e-07
1067,1055,10000038,NICHOLAS COUNTY SHERIFF'S DEPARTMENT,700 MAIN ST,SUMMERSVILLE,WV,26651,NOT AVAILABLE,NOT AVAILABLE,COUNTY,NOT AVAILABLE,-999,NICHOLAS,54067,USA,922140,CORRECTIONAL INSTITUTIONS,NOT AVAILABLE,NOT AVAILABLE,IMAGERY/OTHER,2018/05/10 00:00:00,NOT AVAILABLE,NOT AVAILABLE,-999,0.00162539101126,206.314439740244,1.28773122204e-07
1068,1056,10002097,BRIDGEWATER STATE HOSPITAL,20 ADMINISTRATION RD,BRIDGEWATER,MA,02324,NOT AVAILABLE,(508) 279-4500,STATE,OPEN,191,PLYMOUTH,25023,USA,922140,CORRECTIONAL INSTITUTIONS,http://www.mass.gov/eopss/law-enforce-and-cj/prisons/rsch-data/weekly-count-sheets.html,9/4/2017,IMAGERY,2017/12/04 00:00:00,https://www.mass.gov/prison/locations,MEDIUM,319,0.0116828730159,1466.01234926373,9.07395675481e-06
1069,1057,10000199,SAN SABA TRANSFER FACILITY,206 S WALLACE CREEK RD,SAN SABA,TX,76877,NOT AVAILABLE,(325) 372-4255,STATE,OPEN,546,SAN SABA,48411,USA,922140,CORRECTIONAL INSTITUTIONS,"https://www.texastribune.org/library/data/texas-prisons/units/, http://www.tdcj.state.tx.us/unit_directory/index.html",9/15/2016,IMAGERY,2018/01/11 00:00:00,http://www.tdcj.state.tx.us/unit_directory/index.html,MEDIUM,606,0.00982088119571,1193.76084406392,3.66240323542e-06
1070,1058,10006584,LENOIR YOUTH DEVELOPMENT CENTER,3055 DOBBS FARM ROAD,KINSTON,NC,28504,NOT AVAILABLE,(252) 208-4920,STATE,OPEN,54,LENOIR,37107,USA,922140,CORRECTIONAL INSTITUTIONS,https://www.ncdps.gov/annual-report-youth-development-centers-october-2017,10/1/2017,IMAGERY/OTHER,2017/12/13 00:00:00,https://www.ncdps.gov/Juvenile-Justice/Juvenile-Facility-Operations/Youth-Development-Centers,JUVENILE,44,0.00299821585335,363.60475780775,5.18261386792e-07
1071,1059,10001401,LEMUEL SHATTUCK HOSPITAL CORRECTIONAL UNIT,180 MORTON ST,JAMAICA PLAIN,MA,02130,NOT AVAILABLE,(617) 522-7585,STATE,OPEN,19,SUFFOLK,25025,USA,922140,CORRECTIONAL INSTITUTIONS,http://www.mass.gov/eopss/law-enforce-and-cj/prisons/rsch-data/weekly-count-sheets.html,9/4/2017,IMAGERY,2017/12/04 00:00:00,https://www.mass.gov/prison/locations,MEDIUM,29,0.00424809017858,567.893416592247,9.78459961192e-07
1072,1060,10002099,MASSACHUSETTS ALCOHOL AND SUBSTANCE ABUSE CENTER,2 ADMINISTRATION RD,BRIDGEWATER,MA,02324,NOT AVAILABLE,(508) 279-3500,STATE,CLOSED,0,PLYMOUTH,25023,USA,922140,CORRECTIONAL INSTITUTIONS,http://www.enterprisenews.com/news/20170504/nine-briefly-escape-from-state-substance-abuse-facility-amid-move-to-plymouth,5/4/2017,IMAGERY,2017/12/04 00:00:00,http://www.mass.gov/eopss/law-enforce-and-cj/prisons/doc-facilities/massachusetts-alcohol-and-substance-abuse-center.html,MINIMUM,236,0.0146843868455,1967.9031947851,4.77758845181e-06
1073,1061,10000594,LAS ANIMAS COUNTY JAIL,"2309 EAST MAIN STREET, GARCIA JUSTICE CENTER",TRINIDAD,CO,81082,NOT AVAILABLE,(719) 846-2211,COUNTY,OPEN,-999,LAS ANIMAS,08071,USA,922140,CORRECTIONAL INSTITUTIONS,http://www.lasanimascounty.net/index.php?option=com_content&view=category&layout=blog&id=16&Itemid=138,2/20/2018,IMAGERY,2018/02/20 00:00:00,http://www.lasanimascounty.net/index.php?option=com_content&view=category&layout=blog&id=16&Itemid=138,NOT AVAILABLE,-999,0.00427089361747,540.77010989803,4.41645667547e-07
1074,1062,10006715,LAKE COUNTY JAIL,505 HARRISON AVENUE,LEADVILLE,CO,80461,NOT AVAILABLE,(719) 486-4127,COUNTY,OPEN,-999,LAKE,08065,USA,922140,CORRECTIONAL INSTITUTIONS,http://www.lakecountyco.com/sheriff/,2/20/2018,IMAGERY,2018/02/20 00:00:00,http://www.lakecountyco.com/sheriff/,NOT AVAILABLE,-999,0.00180225965743,228.084066390001,1.4056074613e-07
1075,1063,10002802,SANCHEZ STATE JAIL,3901 STATE JAIL RD,EL PASO,TX,79938,8456,(915) 856-0046,STATE,OPEN,988,EL PASO,48141,USA,922140,CORRECTIONAL INSTITUTIONS,"https://www.texastribune.org/library/data/texas-prisons/units/, http://www.tdcj.state.tx.us/unit_directory/index.html",9/15/2016,IMAGERY,2018/01/11 00:00:00,http://www.tdcj.state.tx.us/unit_directory/index.html,MAXIMUM,1100,0.00984832937849,1188.36057080356,6.07913214725e-06
1076,1064,10002194,LARIMER COUNTY JAIL,2405 MIDPOINT DRIVE,FORT COLLINS,CO,80525,NOT AVAILABLE,(970) 498-5200,COUNTY,OPEN,557,LARIMER,08069,USA,922140,CORRECTIONAL INSTITUTIONS,https://www.larimer.org/sheriff,2/20/2018,IMAGERY,2018/02/20 00:00:00,https://www.larimer.org/sheriff,NOT AVAILABLE,617,0.00650408484297,820.227898377741,1.83254116939e-06
1077,1065,10006502,LA PLATA COUNTY JAIL,742 TURNER DR,DURANGO,CO,81303,NOT AVAILABLE,(970) 247-1161,COUNTY,OPEN,-999,LA PLATA,08067,USA,922140,CORRECTIONAL INSTITUTIONS,http://lpcso.org/divisions,2/20/2018,IMAGERY,2018/02/20 00:00:00,http://lpcso.org/divisions,NOT AVAILABLE,293,0.00486300380424,623.378422870659,1.18694746326e-06
1078,1066,10003999,MONMOUTH COUNTY YOUTH DETENTION CENTER,119 DUTCH LANE RD,FREEHOLD,NJ,07728,NOT AVAILABLE,NOT AVAILABLE,COUNTY,CLOSED,0,MONMOUTH,34025,USA,922140,CORRECTIONAL INSTITUTIONS,http://www.nj.com/news/index.ssf/2010/01/monmouth_juvenile_detainees_to.html,1/28/2010,IMAGERY,2018/04/06 00:00:00,NOT AVAILABLE,JUVENILE,40,0.00511431807035,649.779776820226,9.14961495303e-07
1079,1067,10000046,MINGO COUNTY COURTHOUSE,75 E 2ND AVE,WILLIAMSON,WV,25661,NOT AVAILABLE,NOT AVAILABLE,COUNTY,NOT AVAILABLE,-999,MINGO,54059,USA,922140,CORRECTIONAL INSTITUTIONS,http://www.mingocountywv.com/,3/4/2016,UNVERIFIED,2018/05/10 00:00:00,NOT AVAILABLE,NOT AVAILABLE,-999,0.00145136429536,182.128353907831,1.25123487652e-07
1080,1068,10000008,MINERAL COUNTY HOLDING FACILITY,100 EAST STREET,KEYSER,WV,26726,NOT AVAILABLE,NOT AVAILABLE,COUNTY,NOT AVAILABLE,-999,MINERAL,54057,USA,922140,CORRECTIONAL INSTITUTIONS,NOT AVAILABLE,NOT AVAILABLE,IMAGERY/OTHER,2018/05/10 00:00:00,NOT AVAILABLE,NOT AVAILABLE,-999,0.00130572385289,162.706624653129,1.03102278471e-07
1081,1069,10004208,DOBBS YOUTH DEVELOPMENT CENTER,3060 DOBBS FARM RD,KINSTON,NC,28504,NOT AVAILABLE,(252) 522-0511,STATE,CLOSED,0,LENOIR,37107,USA,922140,CORRECTIONAL INSTITUTIONS,https://www.ncdps.gov/annual-report-youth-development-centers-october-2017,10/1/2017,IMAGERY,2017/12/13 00:00:00,"https://www.ncdps.gov/Index2.cfm?a=000003,002476,003108,003110",JUVENILE,43,0.0198019465682,2392.71130965302,1.55318157095e-05
1082,1070,10001404,MASAC AT PLYMOUTH,1 BUMP POND RD,PLYMOUTH,MA,02360,NOT AVAILABLE,(508) 291-2441,STATE,OPEN,262,PLYMOUTH,25023,USA,922140,CORRECTIONAL INSTITUTIONS,http://www.mass.gov/eopss/law-enforce-and-cj/prisons/rsch-data/weekly-count-sheets.html,9/4/2017,IMAGERY,2017/12/04 00:00:00,https://www.mass.gov/prison/locations,MINIMUM,275,0.0108462896868,1406.49610250803,4.074844795e-06
1083,1071,10001408,MCI - CEDAR JUNCTION,2405 MAIN ST,SOUTH WALPOLE,MA,02071,NOT AVAILABLE,(508) 660-8000,STATE,OPEN,711,NORFOLK,25021,USA,922140,CORRECTIONAL INSTITUTIONS,http://www.mass.gov/eopss/law-enforce-and-cj/prisons/rsch-data/weekly-count-sheets.html,9/4/2017,IMAGERY,2017/12/04 00:00:00,https://www.mass.gov/prison/locations,MAXIMUM,646,0.0160394617808,2039.4246117729,1.48221313964e-05
1084,1072,10004444,MCI - FRAMINGHAM,99 LORING DRIVE,FRAMINGHAM,MA,01701,NOT AVAILABLE,(508) 532-5100,STATE,OPEN,478,MIDDLESEX,25017,USA,922140,CORRECTIONAL INSTITUTIONS,http://www.mass.gov/eopss/law-enforce-and-cj/prisons/rsch-data/weekly-count-sheets.html,9/4/2017,IMAGERY,2017/12/04 00:00:00,https://www.mass.gov/prison/locations,MEDIUM,572,0.0115076602609,1538.93033192428,7.57998713197e-06
1085,1073,10004743,GARRETT COUNTY JAIL,311 EAST ALDER STREET,OAKLAND,MD,21550,NOT AVAILABLE,(301) 334-5055,COUNTY,OPEN,42,GARRETT,24023,USA,922140,CORRECTIONAL INSTITUTIONS,http://dlslibrary.state.md.us/publications/JCR/2016/2016_309.pdf,8/30/2016,IMAGERY,2018/03/19 00:00:00,https://www.garrettcounty.org/sheriffs-office,MAXIMUM,64,0.00341670406949,418.270388267066,3.70385564796e-07
1086,1074,10002215,LINCOLN COUNTY JAIL,103 THIRD AVENUE,HUGO,CO,80821,NOT AVAILABLE,(719) 743-2846,COUNTY,OPEN,-999,LINCOLN,08073,USA,922140,CORRECTIONAL INSTITUTIONS,http://lincolnsheriff.net/index.html,2/20/2018,IMAGERY,2018/02/20 00:00:00,http://lincolnsheriff.net/index.html,NOT AVAILABLE,40,0.00410098905863,513.046864400118,6.9415133586e-07
1087,1075,10000245,SCOTT PRISON,6999 RETRIEVE,ANGLETON,TX,77515,NOT AVAILABLE,(979) 849-9306,STATE,OPEN,1071,BRAZORIA,48039,USA,922140,CORRECTIONAL INSTITUTIONS,"https://www.texastribune.org/library/data/texas-prisons/units/, http://www.tdcj.state.tx.us/unit_directory/index.html",9/15/2016,IMAGERY,2018/01/11 00:00:00,http://www.tdcj.state.tx.us/unit_directory/index.html,MAXIMUM,1130,0.0132967497017,1592.10448326758,4.84582532153e-06
1088,1076,10002363,HOWARD COUNTY DETENTION CENTER,7301 WATERLOO RD,JESSUP,MD,20794,NOT AVAILABLE,(410) 313-5200,COUNTY,OPEN,283,HOWARD,24027,USA,922140,CORRECTIONAL INSTITUTIONS,http://dlslibrary.state.md.us/publications/JCR/2016/2016_309.pdf,8/30/2016,IMAGERY,2018/03/19 00:00:00,https://www.howardcountymd.gov/Departments/Corrections,NOT AVAILABLE,343,0.00695033537943,875.99383576563,1.61279438702e-06
1089,1077,10006737,KNOX COUNTY MARY DAVIS DETENTION HOME,1319 E. 5TH STREET,GALESBURG,IL,61401,NOT AVAILABLE,(309) 343-5112,COUNTY,OPEN,-999,KNOX,17095,USA,922140,CORRECTIONAL INSTITUTIONS,http://www.co.knox.il.us/mary-davis-detention-home/,3/2/2018,IMAGERY,2018/03/02 00:00:00,http://www.co.knox.il.us/mary-davis-detention-home/,JUVENILE,-999,0.00283453302186,359.063877140718,3.16452727351e-07
1090,1078,10000021,LEWIS COUNTY SHERIFF,110 CENTER AVE,WESTON,WV,26452,NOT AVAILABLE,NOT AVAILABLE,COUNTY,NOT AVAILABLE,-999,LEWIS,54041,USA,922140,CORRECTIONAL INSTITUTIONS,NOT AVAILABLE,NOT AVAILABLE,IMAGERY/OTHER,2018/05/10 00:00:00,NOT AVAILABLE,NOT AVAILABLE,-999,0.0011230130088,139.504587310747,6.8197513555e-08
1091,1079,10002101,MCI - NORFOLK,2 CLARK ST,NORFOLK,MA,02056,NOT AVAILABLE,(508) 660-5900,STATE,OPEN,1417,NORFOLK,25021,USA,922140,CORRECTIONAL INSTITUTIONS,http://www.mass.gov/eopss/law-enforce-and-cj/prisons/rsch-data/weekly-count-sheets.html,9/4/2017,IMAGERY,2017/12/04 00:00:00,https://www.mass.gov/prison/locations,MEDIUM,1473,0.0178226696024,2258.46551873664,1.5969210324e-05
1092,1080,10001393,MCI - SHIRLEY,1 HARVARD RD,SHIRLEY,MA,01464,NOT AVAILABLE,(978) 425-4341,STATE,OPEN,1476,MIDDLESEX,25017,USA,922140,CORRECTIONAL INSTITUTIONS,http://www.mass.gov/eopss/law-enforce-and-cj/prisons/rsch-data/weekly-count-sheets.html,9/4/2017,IMAGERY,2017/12/04 00:00:00,https://www.mass.gov/prison/locations,MEDIUM,1455,0.02204015403,2590.06762555594,1.76419371194e-05
1093,1081,10004449,NORTH CENTRAL CORRECTIONAL INSTITUTION,500 COLONY ROAD,GARDNER,MA,01440,NOT AVAILABLE,(978) 630-6000,STATE,OPEN,959,WORCESTER,25027,USA,922140,CORRECTIONAL INSTITUTIONS,http://www.mass.gov/eopss/law-enforce-and-cj/prisons/rsch-data/weekly-count-sheets.html,9/4/2017,IMAGERY,2017/12/04 00:00:00,https://www.mass.gov/prison/locations,MEDIUM,1012,0.0144192034618,1824.08278685663,1.32940409232e-05
1094,1082,10006585,EDGECOMBE YOUTH DEVELOPMENT CENTER,78 POSITIVE WAY,ROCKY MOUNT,NC,27801,NOT AVAILABLE,(252) 544-5730,STATE,OPEN,67,EDGECOMBE,37065,USA,922140,CORRECTIONAL INSTITUTIONS,https://www.ncdps.gov/annual-report-youth-development-centers-october-2017,10/1/2017,IMAGERY,2017/12/13 00:00:00,https://www.ncdps.gov/Juvenile-Justice/Juvenile-Facility-Operations/Youth-Development-Centers,JUVENILE,44,0.0029399776602,366.54590744315,5.21930551983e-07
1095,1083,10002940,SEGOVIA PRE-RELEASE FACILITY,1201 E EL CIBOLO RD,EDINBURG,TX,78542,NOT AVAILABLE,(956) 316-2400,STATE,OPEN,1167,HIDALGO,48215,USA,922140,CORRECTIONAL INSTITUTIONS,"https://www.texastribune.org/library/data/texas-prisons/units/, http://www.tdcj.state.tx.us/unit_directory/index.html",9/15/2016,IMAGERY,2018/01/11 00:00:00,http://www.tdcj.state.tx.us/unit_directory/index.html,MEDIUM,1224,0.00942759032134,1108.16862385849,5.71881226372e-06
1096,1084,10002219,MESA COUNTY JAIL / SHERIFF,215 RICE STREET,GRAND JUNCTION,CO,81501,NOT AVAILABLE,NOT AVAILABLE,COUNTY,OPEN,574,MESA,08077,USA,922140,CORRECTIONAL INSTITUTIONS,http://sheriff.mesacounty.us/jail/,2/20/2018,IMAGERY,2018/02/20 00:00:00,http://sheriff.mesacounty.us/jail/,NOT AVAILABLE,440,0.00647136827567,834.327570975922,1.94525633485e-06
1097,1085,10004041,ST. MARY'S COUNTY DETENTION CENTER,41880 BALDRIDGE ST,LEONARDTOWN,MD,20650,NOT AVAILABLE,(301) 475-4200 EXT 2200,COUNTY,OPEN,198,ST. MARY'S,24037,USA,922140,CORRECTIONAL INSTITUTIONS,http://dlslibrary.state.md.us/publications/JCR/2016/2016_309.pdf,8/30/2016,IMAGERY,2018/03/20 00:00:00,https://www.firstsheriff.com/corrections.asp,NOT AVAILABLE,245,0.00500967832256,621.536511033485,6.93613451527e-07
1098,1086,10004666,OGLE COUNTY JAIL,107 SOUTH 5TH STREET,OREGON,IL,61061,NOT AVAILABLE,(815) 732-2135,COUNTY,OPEN,64,OGLE,17141,USA,922140,CORRECTIONAL INSTITUTIONS,"http://oglecounty.org/departments/sheriff/ogle-county-jail/, http://www.ilsheriff.org/index.php/directory",12/31/2017,IMAGERY,2018/03/02 00:00:00,http://oglecounty.org/departments/sheriff/ogle-county-jail/,NOT AVAILABLE,109,0.00144767129732,193.88659519553,1.26951612118e-07
1099,1087,10002218,MESA COUNTY ALTERNATIVE SENTENCING UNIT,650 SOUTH AVENUE,GRAND JUNCTION,CO,81501,NOT AVAILABLE,NOT AVAILABLE,COUNTY,CLOSED,0,MESA,08077,USA,922140,CORRECTIONAL INSTITUTIONS,http://www.mcsonews.com/2016/04/alternative-sentencing-unit-no-longer.html,4/8/2016,IMAGERY,2018/02/20 00:00:00,http://sheriff.mesacounty.us/jail/template.aspx?id=5232,NOT AVAILABLE,-999,0.00150993098306,189.759302438829,1.40926579823e-07
1100,1088,10004042,WORCESTER COUNTY JAIL,5022 JOYNER RD,SNOW HILL,MD,21863,NOT AVAILABLE,(410) 632-1300,COUNTY,OPEN,184,WORCESTER,24047,USA,922140,CORRECTIONAL INSTITUTIONS,http://dlslibrary.state.md.us/publications/JCR/2016/2016_309.pdf,8/30/2016,IMAGERY,2018/03/20 00:00:00,http://www.co.worcester.md.us/departments,NOT AVAILABLE,480,0.00837632259596,1040.09522235979,2.1207949316e-06
1101,1089,10001472,PEORIA COUNTY JUVENILE DETENTION CENTER,223 NORTH MAXWELL ROAD,PEORIA,IL,61604,NOT AVAILABLE,(309) 634-4200,COUNTY,OPEN,43,PEORIA,17143,USA,922140,CORRECTIONAL INSTITUTIONS,http://www.10thcircuitcourtil.org/198/Prison-Rape-Elimination-Act-PREA,6/16/2016,IMAGERY,2018/03/02 00:00:00,http://www.10thcircuitcourtil.org/190/Juvenile-Detention-Center,JUVENILE,63,0.00431547789511,531.552574467693,6.1724685619e-07
1102,1090,10003635,CUMBERLAND COUNTY JAIL,36 COUNTY WAY,PORTLAND,ME,04102,NOT AVAILABLE,(207) 774-5939,COUNTY,OPEN,340,CUMBERLAND,23005,USA,922140,CORRECTIONAL INSTITUTIONS,http://www.cumberlandso.org/31/Corrections-Division,3/20/2018,IMAGERY,2018/03/20 00:00:00,http://www.cumberlandso.org/31/Corrections-Division,MAXIMUM,500,0.00737265938342,931.068156864312,1.71452520811e-06
1103,1091,10001392,NORTHEASTERN CORRECTIONAL INSTITUTION,1 BARRETTS MILL RD,WEST CONCORD,MA,01742,NOT AVAILABLE,(978) 371-7941,STATE,OPEN,193,MIDDLESEX,25017,USA,922140,CORRECTIONAL INSTITUTIONS,http://www.mass.gov/eopss/law-enforce-and-cj/prisons/rsch-data/weekly-count-sheets.html,9/4/2017,IMAGERY,2017/12/04 00:00:00,https://www.mass.gov/prison/locations,MINIMUM,277,0.0127080022376,1630.01492576769,7.34063963897e-06
1104,1092,10002792,SKYVIEW PSYCHIATRIC FACILITY,379 FM 2972 WEST,RUSK,TX,75785,3666,(903) 683-5781,STATE,OPEN,466,CHEROKEE,48073,USA,922140,CORRECTIONAL INSTITUTIONS,"https://www.texastribune.org/library/data/texas-prisons/units/, http://www.tdcj.state.tx.us/unit_directory/index.html",9/15/2016,IMAGERY,2018/01/11 00:00:00,http://www.tdcj.state.tx.us/unit_directory/index.html,MAXIMUM,562,0.0130352938357,1537.75599916358,9.04051300873e-06
1105,1093,10004204,STONEWALL JACKSON YOUTH DEVELOPMENT CENTER,850 HOLSHOUSER ROAD,CONCORD,NC,28027,NOT AVAILABLE,(704) 652-4300,STATE,OPEN,227,CABARRUS,37025,USA,922140,CORRECTIONAL INSTITUTIONS,https://www.ncdps.gov/annual-report-youth-development-centers-october-2017,10/1/2017,IMAGERY,2017/12/13 00:00:00,https://www.ncdps.gov/Juvenile-Justice/Juvenile-Facility-Operations/Youth-Development-Centers,JUVENILE,128,0.0231188278561,2829.73690189809,1.92196693635e-05
1106,1094,10004451,OLD COLONY CORRECTIONAL CENTER,1 ADMINISTRATION ROAD,BRIDGEWATER,MA,02324,NOT AVAILABLE,(508) 279-6000,STATE,OPEN,702,PLYMOUTH,25023,USA,922140,CORRECTIONAL INSTITUTIONS,http://www.mass.gov/eopss/law-enforce-and-cj/prisons/rsch-data/weekly-count-sheets.html,9/4/2017,IMAGERY,2017/12/04 00:00:00,https://www.mass.gov/prison/locations,MEDIUM,757,0.0126339592669,1577.37586259217,9.79888069194e-06
1107,1095,10004011,OCEAN COUNTY JAIL,114 HOOPER AVE,TOMS RIVER,NJ,08754,NOT AVAILABLE,NOT AVAILABLE,COUNTY,OPEN,-999,OCEAN,34029,USA,922140,CORRECTIONAL INSTITUTIONS,"http://www.co.ocean.nj.us/corrections/index.htm, http://m.pressofatlanticcity.com/news/breaking/cape-jail-looks-to-expand-to-ease-overcrowding-increase-security/article_80e0cee6-6112-11e2-a242-001a4bcf887a.html?mode=jqm",2/15/2016,IMAGERY,2018/04/06 00:00:00,http://www.co.ocean.nj.us/CorrectionsWebSite/,MAXIMUM,700,0.00530557699858,662.683292504282,1.08240681484e-06
1108,1096,10002758,SMITH PRISON,1313 COUNTY RD 19,LAMESA,TX,79331,1898,(806) 872-6741,STATE,OPEN,1254,DAWSON,48115,USA,922140,CORRECTIONAL INSTITUTIONS,"https://www.texastribune.org/library/data/texas-prisons/units/, http://www.tdcj.state.tx.us/unit_directory/index.html",9/15/2016,IMAGERY,2018/01/11 00:00:00,http://www.tdcj.state.tx.us/unit_directory/index.html,MAXIMUM,2234,0.0158328778226,1888.68912013337,1.53227474647e-05
1109,1097,10002710,CHILDRESS COUNTY JAIL,1005 AVENUE F NE,CHILDRESS,TX,79201,NOT AVAILABLE,NOT AVAILABLE,COUNTY,OPEN,51,CHILDRESS,48075,USA,922140,CORRECTIONAL INSTITUTIONS,"https://www.tcjs.state.tx.us/index.php?linkID=325, http://www.childresscountytexas.us/Sheriff/Sheriff.htm",3/1/2018,IMAGERY,2018/04/26 00:00:00,NOT AVAILABLE,NOT AVAILABLE,94,0.00219799340514,265.553421903241,2.16814892767e-07
1110,1098,10000690,PERRY COUNTY JAIL,12 EAST WATER STREET,PINCKNEYVILLE,IL,62274,NOT AVAILABLE,(618) 357-5212,COUNTY,OPEN,-999,PERRY,17145,USA,922140,CORRECTIONAL INSTITUTIONS,http://www.ilsheriff.org/index.php/directory,3/2/2018,IMAGERY,2018/03/02 00:00:00,https://perrycountysheriffsoffice.com/,NOT AVAILABLE,56,0.00149718420211,190.298404640639,1.39646444534e-07
1111,1099,10004010,OCEAN COUNTY JUVENILE DETENTION CENTER,165 SUNSET AVE,TOMS RIVER,NJ,08754,NOT AVAILABLE,(732) 341-1365,COUNTY,OPEN,21,OCEAN,34029,USA,922140,CORRECTIONAL INSTITUTIONS,"http://www.co.ocean.nj.us/ocjs/JSOverview.aspx, http://www.nj.gov/lps/jjc/2011-AnnualDetentionStatisticsReport.pdf",2/15/2016,IMAGERY/OTHER,2018/04/06 00:00:00,http://www.co.ocean.nj.us/ocjs/JSOverview.aspx,JUVENILE,30,0.00510704772412,621.474214328779,1.02884203649e-06
1112,1100,10000022,RANDOLPH COUNTY SHERIFF'S DEPARTMENT,25 HIGH STREET,ELKINS,WV,26241,NOT AVAILABLE,NOT AVAILABLE,COUNTY,NOT AVAILABLE,-999,RANDOLPH,54083,USA,922140,CORRECTIONAL INSTITUTIONS,NOT AVAILABLE,NOT AVAILABLE,IMAGERY/OTHER,2018/05/10 00:00:00,NOT AVAILABLE,NOT AVAILABLE,-999,0.00296600559435,367.699746358767,2.46417343144e-07
1113,1101,10000011,TYLER COUNTY JAIL / SHERIFF,121 COURT ST,MIDDLEBOURNE,WV,26149,NOT AVAILABLE,NOT AVAILABLE,COUNTY,NOT AVAILABLE,-999,TYLER,54095,USA,922140,CORRECTIONAL INSTITUTIONS,http://www.tylercountywv.com/admin/sheriff-tax-office.htm,3/4/2016,UNVERIFIED,2018/05/10 00:00:00,NOT AVAILABLE,NOT AVAILABLE,-999,0.00129575252671,158.485242552952,8.97987976306e-08
1114,1102,10000282,PONDVILLE CORRECTIONAL CENTER,1 INDUSTRIES DR,NORFOLK,MA,02056,NOT AVAILABLE,(508) 660-3924,STATE,OPEN,150,NORFOLK,25021,USA,922140,CORRECTIONAL INSTITUTIONS,http://www.mass.gov/eopss/law-enforce-and-cj/prisons/rsch-data/weekly-count-sheets.html,9/4/2017,IMAGERY,2017/12/04 00:00:00,https://www.mass.gov/prison/locations,MINIMUM,204,0.00806282310566,1018.06089702048,1.93794420637e-06
1115,1103,10006348,BURKE CRV CENTER,5161 WESTERN AVE,MORGANTON,NC,28655,NOT AVAILABLE,(828) 433-4036,STATE,OPEN,155,BURKE,37023,USA,922140,CORRECTIONAL INSTITUTIONS,"http://webapps6.doc.state.nc.us/apps/asqExt/ASQ, https://www.ncdps.gov/Adult-Corrections/Community-Corrections/Confinement-in-Response-to-Violation-CRV",10/31/2017,IMAGERY,2017/12/13 00:00:00,https://www.ncdps.gov/Adult-Corrections/Community-Corrections/Confinement-in-Response-to-Violation-CRV,MINIMUM,248,0.00542245918221,661.84329306436,1.8044199419e-06
1116,1104,10001794,ROBESON CRV CENTER,803 NC HWY 711,LUMBERTON,NC,28360,NOT AVAILABLE,(910) 618-5535,STATE,OPEN,145,ROBESON,37155,USA,922140,CORRECTIONAL INSTITUTIONS,"http://webapps6.doc.state.nc.us/apps/asqExt/ASQ, https://www.ncdps.gov/Adult-Corrections/Community-Corrections/Confinement-in-Response-to-Violation-CRV",10/31/2017,IMAGERY,2017/12/13 00:00:00,https://www.ncdps.gov/Adult-Corrections/Community-Corrections/Confinement-in-Response-to-Violation-CRV,MINIMUM,192,0.00655017577875,796.588651931665,1.72876744017e-06
1117,1105,10004443,SOUTH MIDDLESEX CORRECTIONAL CENTER,135 WESTERN AVENUE,FRAMINGHAM,MA,01701,NOT AVAILABLE,(508) 875-2883,STATE,OPEN,112,MIDDLESEX,25017,USA,922140,CORRECTIONAL INSTITUTIONS,http://www.mass.gov/eopss/law-enforce-and-cj/prisons/rsch-data/weekly-count-sheets.html,9/4/2017,IMAGERY,2017/12/04 00:00:00,https://www.mass.gov/prison/locations,MINIMUM,185,0.00373211189266,471.531149549835,4.12284764083e-07
1118,1106,10004150,CHARLES A DILLON YOUTH DEVELOPMENT CENTER,100 DILLON DR,BUTNER,NC,27509,NOT AVAILABLE,(919) 575-3166,STATE,CLOSED,0,GRANVILLE,37077,USA,922140,CORRECTIONAL INSTITUTIONS,https://www.ncdps.gov/press-release/north-carolina-invests-giving-troubled-youth-second-chance,4/14/2016,IMAGERY,2017/12/13 00:00:00,"https://www.ncdps.gov/Index2.cfm?a=000003,002476,003108,003110",JUVENILE,90,0.0120936412346,1524.05415555192,4.77770270498e-06
1119,1107,10002900,STEVENSON PRISON,1525 FM 766,CUERO,TX,77954,NOT AVAILABLE,(361) 275-2075,STATE,OPEN,1363,DEWITT,48123,USA,922140,CORRECTIONAL INSTITUTIONS,"https://www.texastribune.org/library/data/texas-prisons/units/, http://www.tdcj.state.tx.us/unit_directory/index.html",9/15/2016,IMAGERY,2018/01/11 00:00:00,http://www.tdcj.state.tx.us/unit_directory/index.html,MEDIUM,1384,0.0128936214366,1519.17036433994,1.03677515535e-05
1120,1108,10004209,GASTON REG JUVENILE DETENTION CENTER,135 CAMP SERTOMA RD,DALLAS,NC,28034,NOT AVAILABLE,(704) 922-7832,STATE,CLOSED,0,GASTON,37071,USA,922140,CORRECTIONAL INSTITUTIONS,http://www.wbtv.com/story/29755154/new-juvenile-detention-center-slated-to-open-in-concord,9/9/2015,IMAGERY,2017/12/13 00:00:00,"https://www.ncdps.gov/Index2.cfm?a=000003,002476,003108,003109",JUVENILE,24,0.00205389963955,251.267979910635,1.85761193721e-07
1121,1109,10006716,MESA COUNTY COMMUNITY CORRECTIONS - POWELL BUILDING,650 SOUTH AVENUE,GRAND JUNCTION,CO,81501,NOT AVAILABLE,NOT AVAILABLE,COUNTY,OPEN,-999,MESA,08077,USA,922140,CORRECTIONAL INSTITUTIONS,http://cjsd.mesacounty.us/ResidentialServices.aspx,2/20/2018,IMAGERY,2018/02/20 00:00:00,http://cjsd.mesacounty.us/ResidentialServices.aspx,NOT AVAILABLE,-999,0.00187514914309,230.701621858858,2.03826499515e-07
1122,1110,10004697,PIATT COUNTY JAIL,1216 RAYMOND ROAD,MONTICELLO,IL,61856,NOT AVAILABLE,(217) 762-7822,COUNTY,OPEN,-999,PIATT,17147,USA,922140,CORRECTIONAL INSTITUTIONS,http://sheriff.piattcounty.org/,3/2/2018,IMAGERY,2018/03/02 00:00:00,http://sheriff.piattcounty.org/,NOT AVAILABLE,76,0.00255646498682,325.331428340719,3.23994857274e-07
1123,1111,10000039,WAYNE COUNTY SHERIFF'S OFFICE,700 HENDRICKS ST,WAYNE,WV,25570,NOT AVAILABLE,NOT AVAILABLE,COUNTY,NOT AVAILABLE,-999,WAYNE,54099,USA,922140,CORRECTIONAL INSTITUTIONS,http://www.waynecountywv.org/sheriff.php,3/1/2016,IMAGERY,2018/05/10 00:00:00,NOT AVAILABLE,NOT AVAILABLE,-999,0.00169834158055,211.15159999832,1.59494502836e-07
1124,1112,10000030,WEBSTER COUNTY SHERIFF DEPARTMENT,2 COURT SQUARE,WEBSTER SPRINGS,WV,26288,NOT AVAILABLE,NOT AVAILABLE,COUNTY,NOT AVAILABLE,-999,WEBSTER,54101,USA,922140,CORRECTIONAL INSTITUTIONS,http://www.webstercounty.wv.gov/countygovernmentagencies/Pages/sheriff.aspx,3/4/2016,IMAGERY,2018/05/10 00:00:00,NOT AVAILABLE,NOT AVAILABLE,-999,0.00155349749253,191.36430552998,1.31722518129e-07
1125,1113,10001396,SOUZA-BARANOWSKI CORRECTIONAL CENTER,1 HARVARD RD,SHIRLEY,MA,01464,NOT AVAILABLE,(978) 514-6500,STATE,OPEN,1075,WORCESTER,25027,USA,922140,CORRECTIONAL INSTITUTIONS,http://www.mass.gov/eopss/law-enforce-and-cj/prisons/rsch-data/weekly-count-sheets.html,9/4/2017,IMAGERY,2017/12/04 00:00:00,https://www.mass.gov/prison/locations,MAXIMUM,1410,0.0111127778855,1425.15875938269,7.35773892788e-06
1126,1114,10000229,STILES UNIT,3060 FM 3514,BEAUMONT,TX,77705,NOT AVAILABLE,(409) 722-5255,STATE,OPEN,2819,JEFFERSON,48245,USA,922140,CORRECTIONAL INSTITUTIONS,"https://www.texastribune.org/library/data/texas-prisons/units/, http://www.tdcj.state.tx.us/unit_directory/index.html",9/15/2016,IMAGERY,2018/01/11 00:00:00,http://www.tdcj.state.tx.us/unit_directory/index.html,MEDIUM,2981,0.0179132252423,2138.52030843102,2.25347431951e-05
1127,1115,10003864,CENTER FOR HUMAN DEVELOPMENT - TERRI THOMAS SCHOOL,280 TINKHAM ROAD,SPRINGFIELD,MA,01129,NOT AVAILABLE,(413) 731-4952,STATE,OPEN,15,HAMPDEN,25013,USA,922140,CORRECTIONAL INSTITUTIONS,http://chd.org/child-adolescent-and-family-services/juvenile-justice/,12/4/2017,IMAGERY,2017/12/04 00:00:00,http://chd.org/child-adolescent-and-family-services/juvenile-justice/,JUVENILE,-999,0.00737929706488,960.211663494873,2.37425630471e-06
1128,1116,10002096,JUDGE JOHN CONNELLY YOUTH CENTER,450 CANTERBURY ST,ROSLINDALE,MA,02131,NOT AVAILABLE,(617) 474-8101,STATE,OPEN,75,SUFFOLK,25025,USA,922140,CORRECTIONAL INSTITUTIONS,https://www.publiccounsel.net/ya/wp-content/uploads/sites/6/2015/05/DYS-Metro-Region-Contact-List-4.20151.pdf,12/4/2017,IMAGERY,2017/12/04 00:00:00,NOT AVAILABLE,JUVENILE,-999,0.00504815318098,642.692169569782,8.5833034028e-07
1129,1117,10004034,BALTIMORE CENTRAL BOOKING AND INTAKE CENTER,300 E MADISON ST,BALTIMORE,MD,21202,NOT AVAILABLE,(410) 545-8080,STATE,OPEN,166,BALTIMORE CITY,24510,USA,922140,CORRECTIONAL INSTITUTIONS,http://dpscs.maryland.gov/publicinfo/publications/annuals.shtml#doc,6/30/2016,IMAGERY/OTHER,2017/12/04 00:00:00,http://www.dpscs.maryland.gov/locations/prisons.shtml,MAXIMUM,895,0.00538136342112,731.956759721724,6.51581173121e-07
1130,1118,10000178,ESTES PRISON,1100 HWY 1807,VENUS,TX,76084,NOT AVAILABLE,(972) 366-3334,STATE,OPEN,1023,JOHNSON,48251,USA,922140,CORRECTIONAL INSTITUTIONS,"https://www.texastribune.org/library/data/texas-prisons/units/, http://www.tdcj.state.tx.us/unit_directory/index.html",9/15/2016,IMAGERY/OTHER,2018/01/11 00:00:00,http://www.mtctrains.com/corrections/#locations,MINIMUM,1040,0.00888584769239,1069.92720342868,4.87322109209e-06
1131,1119,10004181,MARION MINIMUM SECURITY UNIT,4019 STATE HWY 226 S,MARION,NC,28752,NOT AVAILABLE,(828) 659-7810,STATE,OPEN,-999,MCDOWELL,37111,USA,922140,CORRECTIONAL INSTITUTIONS,https://www.ncdps.gov/Adult-Corrections/Prisons/Prison-Facilities,12/13/2017,IMAGERY,2017/12/13 00:00:00,https://www.ncdps.gov/Adult-Corrections/Prisons/Prison-Facilities,MINIMUM,116,0.00759372383001,930.588506653638,1.62550114798e-06
1132,1120,10001477,PIKE COUNTY JAIL,204 EAST ADAMS STREET,PITTSFIELD,IL,62363,NOT AVAILABLE,(217) 285-5011,COUNTY,OPEN,-999,PIKE,17149,USA,922140,CORRECTIONAL INSTITUTIONS,http://www.ilsheriff.org/index.php/directory,3/2/2018,IMAGERY,2018/03/02 00:00:00,http://www.pikecountyil.org/pike-county-sheriff/,NOT AVAILABLE,62,0.00157696371966,199.053151340512,1.14758694912e-07
1133,1121,10004735,POPE COUNTY JAIL,216 EAST DECATUR STREET,GOLCONDA,IL,62938,NOT AVAILABLE,(618) 683-4321,COUNTY,OPEN,-999,POPE,17151,USA,922140,CORRECTIONAL INSTITUTIONS,http://www.ilsheriff.org/index.php/directory?option=com_countysheriffs&view=countysheriffs,3/2/2018,UNVERIFIED,2018/03/02 00:00:00,NOT AVAILABLE,NOT AVAILABLE,-999,0.000926886924,117.944943902337,5.27115299305e-08
1134,1122,10006786,CUMBERLAND COUNTY COMMUNITY CORRECTION CENTER,20 COUNTY WAY,PORTLAND,ME,04102,NOT AVAILABLE,(207) 774-5939 EXT 2131,COUNTY,OPEN,-999,CUMBERLAND,23005,USA,922140,CORRECTIONAL INSTITUTIONS,http://www.cumberlandso.org/176/Community-Corrections,3/20/2018,IMAGERY/OTHER,2018/03/20 00:00:00,http://www.cumberlandso.org/176/Community-Corrections,MINIMUM,-999,0.00131079879654,169.875729055334,8.90323268022e-08
1135,1123,10004739,PULASKI COUNTY DETENTION CENTER,20 JUSTICE DRIVE,ULLIN,IL,62992,NOT AVAILABLE,(618) 845-3512,COUNTY,OPEN,185,PULASKI,17153,USA,922140,CORRECTIONAL INSTITUTIONS,http://www.pulaskicountyil.net/pulaski-county-detention-center.html,12/2/2016,IMAGERY,2018/03/02 00:00:00,http://www.pulaskicountyil.net/pulaski-county-detention-center.html,MAXIMUM,240,0.00451784401172,568.105168534703,7.07204140897e-07
1136,1124,10003984,PASSAIC COUNTY JAIL,11 MARSHALL ST,PATERSON,NJ,07501,NOT AVAILABLE,NOT AVAILABLE,COUNTY,OPEN,862,PASSAIC,34031,USA,922140,CORRECTIONAL INSTITUTIONS,http://www.pcsheriff.org/home.html,1/31/2016,IMAGERY,2018/04/06 00:00:00,http://www.pcsheriff.org/home.html,MAXIMUM,1242,0.0045610091946,574.733191592871,3.96484707685e-07
1137,1125,10002731,TELFORD PRISON,3899 STATE HWY 98,NEW BOSTON,TX,75570,NOT AVAILABLE,(903) 628-3171,STATE,OPEN,2626,BOWIE,48037,USA,922140,CORRECTIONAL INSTITUTIONS,"https://www.texastribune.org/library/data/texas-prisons/units/, http://www.tdcj.state.tx.us/unit_directory/index.html",9/15/2016,IMAGERY,2018/01/11 00:00:00,http://www.tdcj.state.tx.us/unit_directory/index.html,MAXIMUM,2872,0.0183697088944,2231.00767567612,2.35178117941e-05
1138,1126,10001751,CALEDONIA CORRECTIONAL INSTITUTION - MINIMUM,"1984 CALEDONIA DR, STATE RD 1141",TILLERY,NC,27882,NOT AVAILABLE,(252) 826-5621,STATE,OPEN,-999,HALIFAX,37083,USA,922140,CORRECTIONAL INSTITUTIONS,https://www.ncdps.gov/Adult-Corrections/Prisons/Prison-Facilities,12/13/2017,IMAGERY,2017/12/13 00:00:00,https://www.ncdps.gov/Adult-Corrections/Prisons/Prison-Facilities,MINIMUM,-999,0.0113141377218,1402.24517566222,5.91074035909e-06
1139,1127,10001773,BLACK MOUNTAIN CORRECTIONAL CENTER FOR WOMEN,1449 N FORK RD,BLACK MOUNTAIN,NC,28711,NOT AVAILABLE,NOT AVAILABLE,STATE,CLOSED,0,BUNCOMBE,37021,USA,922140,CORRECTIONAL INSTITUTIONS,"https://www2.ncdps.gov/Index2.cfm?a=000003,002240,002324",11/13/2015,IMAGERY,2017/12/13 00:00:00,"https://www.ncdps.gov/Index2.cfm?a=000003,002240,002324",MINIMUM,80,0.00604073126148,745.86894789406,1.98443918234e-06
1140,1128,10006546,BALTIMORE PRETRIAL COMPLEX,531 EAST MADISON STREET,BALTIMORE,MD,21202,NOT AVAILABLE,(410) 209-4130,STATE,OPEN,313,BALTIMORE CITY,24510,USA,922140,CORRECTIONAL INSTITUTIONS,http://dpscs.maryland.gov/publicinfo/publications/annuals.shtml#doc,6/30/2016,IMAGERY,2017/12/04 00:00:00,http://www.dpscs.maryland.gov/locations/prisons.shtml,NOT AVAILABLE,-999,0.00277893007178,344.644513003752,4.59065529533e-07
1141,1129,10001795,BLADEN CORRECTIONAL CENTER,5853 US HWY 701 N,ELIZABETHTOWN,NC,28337,NOT AVAILABLE,NOT AVAILABLE,STATE,CLOSED,0,BLADEN,37017,USA,922140,CORRECTIONAL INSTITUTIONS,"https://www2.ncdps.gov/Index2.cfm?a=000003,002240,002324",11/13/2015,IMAGERY,2017/12/13 00:00:00,"https://www.ncdps.gov/Index2.cfm?a=000003,002240,002324",MINIMUM,172,0.00451001850533,546.24843136106,1.14598926296e-06
1142,1130,10004681,PUTNAM COUNTY JAIL,120 NORTH 4TH STREET,HENNEPIN,IL,61327,NOT AVAILABLE,(815) 925-7084,COUNTY,OPEN,-999,PUTNAM,17155,USA,922140,CORRECTIONAL INSTITUTIONS,http://www.ilsheriff.org/index.php/directory,3/2/2018,IMAGERY,2018/03/02 00:00:00,https://www.co.putnam.il.us/county-offices/sheriff-s-office,NOT AVAILABLE,5,0.00223112000206,265.32716109435,1.61903830559e-07
1143,1131,10006717,MESA COUNTY COMMUNITY CORRECTIONS - CHIPETA BUILDING,436 SOUTH 7TH STREET,GRAND JUNCTION,CO,81501,NOT AVAILABLE,NOT AVAILABLE,COUNTY,OPEN,-999,MESA,08077,USA,922140,CORRECTIONAL INSTITUTIONS,http://cjsd.mesacounty.us/ResidentialServices.aspx,2/20/2018,IMAGERY,2018/02/20 00:00:00,http://cjsd.mesacounty.us/ResidentialServices.aspx,NOT AVAILABLE,-999,0.00138486987953,166.824524659057,9.77460528051e-08
1144,1132,10000241,C T TERRELL PRISON,1300 FM 655,ROSHARON,TX,77583,NOT AVAILABLE,(281) 595-3481,STATE,OPEN,1570,BRAZORIA,48039,USA,922140,CORRECTIONAL INSTITUTIONS,"https://www.texastribune.org/library/data/texas-prisons/units/, http://www.tdcj.state.tx.us/unit_directory/index.html",9/15/2016,IMAGERY,2018/01/11 00:00:00,http://www.tdcj.state.tx.us/unit_directory/index.html,MEDIUM,1603,0.0209675139709,2471.14027529287,1.15577359256e-05
1145,1133,10005030,FRANKLIN COUNTY DETENTION CENTER,121 COUNTY WAY,FARMINGTON,ME,04938,NOT AVAILABLE,(207) 778-3032,COUNTY,OPEN,42,FRANKLIN,23007,USA,922140,CORRECTIONAL INSTITUTIONS,http://www.franklincounty.maine.gov/dispatch-log-jail-bookings,3/18/2018,IMAGERY/OTHER,2018/03/20 00:00:00,http://www.franklincounty.maine.gov/dispatch-log-jail-bookings,NOT AVAILABLE,-999,0.00325957349555,420.973086893716,6.29449543539e-07
1146,1134,10005032,HANCOCK COUNTY JAIL,50 STATE STREET,ELLSWORTH,ME,04605,NOT AVAILABLE,(207) 667-7588,COUNTY,OPEN,45,HANCOCK,23009,USA,922140,CORRECTIONAL INSTITUTIONS,https://co.hancock.me.us/site/index.php/state-police-so-call-sharing-agreement-8,3/20/2018,IMAGERY/OTHER,2018/03/20 00:00:00,https://co.hancock.me.us/site/index.php/state-police-so-call-sharing-agreement-8,NOT AVAILABLE,-999,0.00456318278551,585.784805139144,4.99882596688e-07
1147,1135,10000020,WIRT COUNTY SHERIFF DEPARTMENT,1 COURT STREET,ELIZABETH,WV,26143,NOT AVAILABLE,NOT AVAILABLE,COUNTY,NOT AVAILABLE,-999,WIRT,54105,USA,922140,CORRECTIONAL INSTITUTIONS,http://www.littlekanawha.com/wirtphone.htm,3/1/2016,UNVERIFIED,2018/05/10 00:00:00,NOT AVAILABLE,NOT AVAILABLE,-999,0.00142382064204,176.61017130489,1.0979591706e-07
1148,1136,10003983,KEOGH DWYER CORRECTIONAL FACILITY,41 HIGH ST,NEWTON,NJ,07860,NOT AVAILABLE,NOT AVAILABLE,COUNTY,OPEN,116,SUSSEX,34037,USA,922140,CORRECTIONAL INSTITUTIONS,http://www.sussexcountysheriff.com/,4/6/2018,IMAGERY/OTHER,2018/04/06 00:00:00,http://www.sussexcountysheriff.com/,NOT AVAILABLE,225,0.00368359313409,464.189340425788,3.95162974241e-07
1149,1137,10001980,MCLENNAN RESIDENTIAL TREATMENT CENTER,116 BURLESON RD,MART,TX,76664,NOT AVAILABLE,(254) 297-8200,STATE,OPEN,65,MCLENNAN,48309,USA,922140,CORRECTIONAL INSTITUTIONS,http://www.tjjd.texas.gov/programs/prea.aspx,1/14/2016,IMAGERY,2018/01/12 00:00:00,http://www.tjjd.texas.gov/programs/facilities_list.aspx,JUVENILE,185,0.00993869466125,1197.49748792074,6.07424566562e-06
1150,1138,10004188,WESTERN AREA MULTIPURPOSE JUVENILE CRISIS AND ASSESMENT CENTER,20 LEES CREEK RD,ASHEVILLE,NC,28806,NOT AVAILABLE,(828) 338-8340,STATE,OPEN,-999,BUNCOMBE,37021,USA,922140,CORRECTIONAL INSTITUTIONS,https://www.ncdps.gov/press-release/thursday-open-house-scheduled-western-area-multipurpose-juvenile-crisis-and-assessment,8/22/2016,IMAGERY,2017/12/13 00:00:00,NOT AVAILABLE,JUVENILE,4,0.0026098858026,313.918862919811,4.45839801211e-07
1151,1139,10004205,CABARRUS CORRECTIONAL CENTER,130 DUTCH RD,MOUNT PLEASANT,NC,28124,NOT AVAILABLE,NOT AVAILABLE,STATE,CLOSED,0,CABARRUS,37025,USA,922140,CORRECTIONAL INSTITUTIONS,"https://www2.ncdps.gov/Index2.cfm?a=000003,002240,002324",11/13/2015,IMAGERY,2017/12/13 00:00:00,"https://www.ncdps.gov/Index2.cfm?a=000003,002240,002324",MINIMUM,-999,0.00507270468077,642.148430564397,1.45790899375e-06
1152,1140,10000155,TULIA TRANSFER FACILITY,4000 HWY 86 W,TULIA,TX,79088,NOT AVAILABLE,(806) 995-4109,STATE,OPEN,594,SWISHER,48437,USA,922140,CORRECTIONAL INSTITUTIONS,"https://www.texastribune.org/library/data/texas-prisons/units/, http://www.tdcj.state.tx.us/unit_directory/index.html",9/15/2016,IMAGERY,2018/01/12 00:00:00,http://www.tdcj.state.tx.us/unit_directory/index.html,MEDIUM,606,0.00788610078519,981.717032231279,3.40348890069e-06
1153,1141,10004203,CHARLOTTE CORRECTIONAL CENTER,4100 MEADOW OAK DR,CHARLOTTE,NC,28208,NOT AVAILABLE,NOT AVAILABLE,STATE,CLOSED,0,MECKLENBURG,37119,USA,922140,CORRECTIONAL INSTITUTIONS,"https://www2.ncdps.gov/Index2.cfm?a=000003,002240,002324",11/13/2015,IMAGERY,2017/12/13 00:00:00,"https://www.ncdps.gov/Index2.cfm?a=000003,002240,002324",MINIMUM,252,0.00514077173499,646.226264230643,1.24999125406e-06
1154,1142,10001552,BALTIMORE CITY CORRECTIONAL CENTER,901 GREENMOUNT AVE,BALTIMORE,MD,21202,NOT AVAILABLE,(410) 332-4340,STATE,OPEN,503,BALTIMORE CITY,24510,USA,922140,CORRECTIONAL INSTITUTIONS,http://dpscs.maryland.gov/publicinfo/publications/annuals.shtml#doc,6/30/2016,IMAGERY/OTHER,2017/12/05 00:00:00,http://www.dpscs.maryland.gov/locations/prisons.shtml,MINIMUM,495,0.00499080908065,670.661353803944,1.00528685049e-06
1155,1143,10004218,DUPLIN CORRECTIONAL CENTER,364 HWY 11 S & 903,KENANSVILLE,NC,28349,NOT AVAILABLE,NOT AVAILABLE,STATE,CLOSED,0,DUPLIN,37061,USA,922140,CORRECTIONAL INSTITUTIONS,"https://www2.ncdps.gov/Index2.cfm?a=000003,002240,002324",11/13/2015,IMAGERY,2017/12/13 00:00:00,"https://www.ncdps.gov/Index2.cfm?a=000003,002240,002324",MINIMUM,328,0.0107512948865,1320.13278118291,3.05395680069e-06
1156,1144,10002897,YOUNG MEDICAL FACILITY COMPLEX,5509 ATTWATER AVE,DICKINSON,TX,77539,NOT AVAILABLE,(409) 948-0001,STATE,OPEN,449,GALVESTON,48167,USA,922140,CORRECTIONAL INSTITUTIONS,"https://www.texastribune.org/library/data/texas-prisons/units/, http://www.tdcj.state.tx.us/unit_directory/index.html",9/15/2016,IMAGERY,2018/01/12 00:00:00,http://www.tdcj.state.tx.us/unit_directory/index.html,MAXIMUM,455,0.00987301086338,1180.68694708063,3.20236232923e-06
1157,1145,10002885,VANCE UNIT,2 JESTER RD,RICHMOND,TX,77406,NOT AVAILABLE,(281) 277-3030,STATE,OPEN,270,FORT BEND,48157,USA,922140,CORRECTIONAL INSTITUTIONS,"https://www.texastribune.org/library/data/texas-prisons/units/, http://www.tdcj.state.tx.us/unit_directory/index.html",9/15/2016,IMAGERY,2018/01/12 00:00:00,http://www.tdcj.state.tx.us/unit_directory/index.html,MEDIUM,378,0.00684412526088,801.353430778766,2.24351070374e-06
1158,1146,10002713,WHEELER STATE JAIL,986 COUNTY RD AA,PLAINVIEW,TX,79072,NOT AVAILABLE,(806) 293-1081,STATE,OPEN,533,HALE,48189,USA,922140,CORRECTIONAL INSTITUTIONS,"https://www.texastribune.org/library/data/texas-prisons/units/, http://www.tdcj.state.tx.us/unit_directory/index.html",9/15/2016,IMAGERY,2018/01/12 00:00:00,http://www.tdcj.state.tx.us/unit_directory/index.html,MEDIUM,576,0.0077979432922,945.398772048385,3.3243885951e-06
1159,1147,10006503,MOFFAT COUNTY DETENTION FACILITY,800 WEST 1ST STREET,CRAIG,CO,81625,NOT AVAILABLE,(970) 824-4498,COUNTY,OPEN,-999,MOFFAT,08081,USA,922140,CORRECTIONAL INSTITUTIONS,http://www.moffatcountysheriff.com/index.html,2/20/2018,IMAGERY,2018/02/20 00:00:00,http://www.moffatcountysheriff.com/index.html,NOT AVAILABLE,101,0.00293550397529,368.02324978474,5.46333377405e-07
1160,1148,10001979,MCLENNAN COUNTY STATE JUVENILE CORRECTIONAL FACILITY,116 BURLESON RD,MART,TX,76664,NOT AVAILABLE,(254) 297-8200,STATE,OPEN,225,MCLENNAN,48309,USA,922140,CORRECTIONAL INSTITUTIONS,http://www.tjjd.texas.gov/programs/prea.aspx,1/14/2016,IMAGERY,2018/01/12 00:00:00,http://www.tjjd.texas.gov/programs/facilities_list.aspx,JUVENILE,368,0.0117582562475,1408.26142010656,8.21930654574e-06
1161,1149,10000188,BROWNWOOD HALFWAY HOUSE,910 FM 3254,BROWNWOOD,TX,76801,NOT AVAILABLE,(325) 641-6462,STATE,OPEN,7,BROWN,48049,USA,922140,CORRECTIONAL INSTITUTIONS,http://www.tjjd.texas.gov/programs/prea.aspx,3/8/2017,IMAGERY/OTHER,2018/01/12 00:00:00,http://www.tjjd.texas.gov/programs/facilities_list.aspx,JUVENILE,10,0.00125779994397,152.089205550188,9.86971960919e-08
1162,1150,10001765,FOUNTAIN CORRECTIONAL CENTER FOR WOMEN,300 FOUNTAIN SCHOOL RD,ROCKY MOUNT,NC,27804,NOT AVAILABLE,(252) 442-9712,STATE,CLOSED,0,EDGECOMBE,37065,USA,922140,CORRECTIONAL INSTITUTIONS,"https://www2.ncdps.gov/Index2.cfm?a=000003,002240,002324",11/13/2015,IMAGERY,2017/12/13 00:00:00,"https://www.ncdps.gov/Index2.cfm?a=000003,002240,002324",MINIMUM,510,0.0187624816309,2325.20456354282,1.02997289902e-05
1163,1151,10004167,DURHAM CORRECTIONAL CENTER,3900 GUESS RD,DURHAM,NC,27705,NOT AVAILABLE,NOT AVAILABLE,STATE,CLOSED,0,DURHAM,37063,USA,922140,CORRECTIONAL INSTITUTIONS,"https://www2.ncdps.gov/Index2.cfm?a=000003,002240,002324",11/13/2015,IMAGERY,2017/12/13 00:00:00,"https://www.ncdps.gov/Index2.cfm?a=000003,002240,002324",MINIMUM,216,0.00497967959683,605.370207270819,1.26556555631e-06
1164,1152,10001756,GUILFORD CORRECTIONAL CENTER,4250 CAMP BURTON RD,MCLEANSVILLE,NC,27301,NOT AVAILABLE,NOT AVAILABLE,STATE,CLOSED,0,GUILFORD,37081,USA,922140,CORRECTIONAL INSTITUTIONS,"https://www2.ncdps.gov/Index2.cfm?a=000003,002240,002324",11/13/2015,IMAGERY,2017/12/13 00:00:00,"https://www.ncdps.gov/Index2.cfm?a=000003,002240,002324",MINIMUM,-999,0.00451307532078,561.728712081343,1.06017333933e-06
1165,1153,10004225,MCCAIN CORRECTIONAL HOSPITAL,855 OLD HWY 211,RAEFORD,NC,28376,NOT AVAILABLE,NOT AVAILABLE,STATE,CLOSED,0,HOKE,37093,USA,922140,CORRECTIONAL INSTITUTIONS,"https://www2.ncdps.gov/Index2.cfm?a=000003,002240,002324",11/13/2015,IMAGERY,2017/12/13 00:00:00,"https://www.ncdps.gov/Index2.cfm?a=000003,002240,002324",MINIMUM,411,0.0094821123721,1162.95281958879,1.89344192479e-06
1166,1154,10004035,METROPOLITAN TRANSITION CENTER,954 FORREST ST,BALTIMORE,MD,21202,NOT AVAILABLE,(410) 230-1452,STATE,OPEN,202,BALTIMORE CITY,24510,USA,922140,CORRECTIONAL INSTITUTIONS,http://dpscs.maryland.gov/publicinfo/publications/annuals.shtml#doc,6/30/2016,IMAGERY/OTHER,2017/12/05 00:00:00,http://www.dpscs.maryland.gov/locations/prisons.shtml,MINIMUM,580,0.00869568915224,1105.73608007752,3.29495586849e-06
1167,1155,10001558,BROCKBRIDGE CORRECTIONAL FACILITY,7930 BROCK BRIDGE RD,JESSUP,MD,20794,NOT AVAILABLE,(410) 799-1363,STATE,OPEN,660,ANNE ARUNDEL,24003,USA,922140,CORRECTIONAL INSTITUTIONS,http://dpscs.maryland.gov/publicinfo/publications/annuals.shtml#doc,6/30/2016,IMAGERY,2017/12/05 00:00:00,http://www.dpscs.maryland.gov/locations/prisons.shtml,MINIMUM,536,0.00760585842012,989.515556435787,3.76627389051e-06
1168,1156,10002362,BALTIMORE PRE-RELEASE UNIT FOR WOMEN,301 N CALVERTON RD,BALTIMORE,MD,21223,NOT AVAILABLE,NOT AVAILABLE,STATE,CLOSED,0,BALTIMORE CITY,24510,USA,922140,CORRECTIONAL INSTITUTIONS,http://www.dpscs.maryland.gov/locations/prisons.shtml,12/5/2017,IMAGERY,2017/12/05 00:00:00,NOT AVAILABLE,MINIMUM,144,0.00306320686412,385.483793189697,4.10825172608e-07
1169,1157,10004223,EVERGREEN REHABILITATION CENTER,20513 US HWY 301N,ST. PAUL'S,NC,28384,NOT AVAILABLE,NOT AVAILABLE,STATE,CLOSED,0,ROBESON,37155,USA,922140,CORRECTIONAL INSTITUTIONS,http://www.corrections.com/news/article/29031-nc-division-of-prisons-sets-closing-dates-at-four-prisons,8/9/2011,IMAGERY,2017/12/13 00:00:00,http://evergreenrehabilitationcenter.org/,NOT AVAILABLE,-999,0.00584080321972,720.505374955136,2.07795224364e-06
1170,1158,10005520,SAMARKAND YOUTH DEVELOPMENT CENTER,3600 SAMARKAND ROAD,EAGLE SPRINGS,NC,27242,NOT AVAILABLE,NOT AVAILABLE,STATE,CLOSED,0,MOORE,37125,USA,922140,CORRECTIONAL INSTITUTIONS,"http://www.juvjus.state.nc.us/facilities/youth_development_centers.html, http://wmtgradio.wordpress.com/2013/07/31/samarkand-campus-to-be-used-as-law-enforcement-training-center/",11/13/2015,IMAGERY,2017/12/13 00:00:00,NOT AVAILABLE,JUVENILE,70,0.0291329327103,3643.33269308554,3.66733890957e-05
1171,1159,10001022,NORTH CAROLINA CORRECTIONAL INSTITUTION FOR WOMEN - MINIMUM,1201 S STATE ST,RALEIGH,NC,27610,NOT AVAILABLE,(919) 733-4340,STATE,OPEN,-999,WAKE,37183,USA,922140,CORRECTIONAL INSTITUTIONS,"https://www.ncdps.gov/Adult-Corrections/Prisons/Prison-Facilities, https://www2.ncdps.gov/Index2.cfm?a=000003,002240,002324",12/13/2017,IMAGERY,2017/12/13 00:00:00,https://www.ncdps.gov/Adult-Corrections/Prisons/Prison-Facilities,MINIMUM,-999,0.00518844488198,661.806990006081,1.059794392e-06
1172,1160,10001781,WAYNE CORRECTIONAL CENTER,700 STEVENS MILL RD,GOLDSBORO,NC,27530,NOT AVAILABLE,NOT AVAILABLE,STATE,CLOSED,0,WAYNE,37191,USA,922140,CORRECTIONAL INSTITUTIONS,"https://www2.ncdps.gov/Index2.cfm?a=000003,002240,002324",11/13/2015,IMAGERY,2017/12/13 00:00:00,"https://www.ncdps.gov/Index2.cfm?a=000003,002240,002324",MEDIUM,428,0.00680013212269,830.109669343907,2.8277143257e-06
1173,1161,10005031,OXFORD COUNTY HOLDING FACILITY,26 WESTERN AVENUE,SOUTH PARIS,ME,04281,NOT AVAILABLE,(207) 743-9554,COUNTY,NOT AVAILABLE,10,OXFORD,23017,USA,922140,CORRECTIONAL INSTITUTIONS,NOT AVAILABLE,NOT AVAILABLE,IMAGERY/OTHER,2018/03/20 00:00:00,NOT AVAILABLE,MINIMUM,-999,0.00167528073493,215.874594434759,1.42775082834e-07
1174,1162,10004179,WESTERN YOUTH INSTITUTION,5155 WESTERN AVE,MORGANTON,NC,28655,NOT AVAILABLE,NOT AVAILABLE,STATE,CLOSED,0,BURKE,37023,USA,922140,CORRECTIONAL INSTITUTIONS,"https://www2.ncdps.gov/Index2.cfm?a=000003,002240,002324",11/13/2015,IMAGERY,2017/12/13 00:00:00,"https://www.ncdps.gov/Index2.cfm?a=000003,002240,002324",JUVENILE,785,0.0110546684524,1354.34321847428,6.72806932776e-06
1175,1163,10002359,CENTRAL MARYLAND CORRECTIONAL FACILITY,7301 BUTTERCUP RD,SYKESVILLE,MD,21784,NOT AVAILABLE,(410) 781-4444,STATE,OPEN,497,CARROLL,24013,USA,922140,CORRECTIONAL INSTITUTIONS,http://dpscs.maryland.gov/publicinfo/publications/annuals.shtml#doc,6/30/2016,IMAGERY,2017/12/05 00:00:00,http://www.dpscs.maryland.gov/locations/prisons.shtml,MINIMUM,475,0.0103624053661,1291.54469312756,5.65859654167e-06
1176,1164,10001293,EDNA TAMAYO HOUSE,1438 N 77TH SUNSHINE STRIP,HARLINGEN,TX,78550,NOT AVAILABLE,(956) 425-6567,STATE,OPEN,21,CAMERON,48061,USA,922140,CORRECTIONAL INSTITUTIONS,http://www.tjjd.texas.gov/programs/prea.aspx,5/11/2017,IMAGERY,2018/01/12 00:00:00,http://www.tjjd.texas.gov/programs/facilities_list.aspx,JUVENILE,24,0.00114108085993,131.730115924895,6.89178462303e-08
1177,1165,10002364,PATUXENT INSTITUTION,7555 WATERLOO RD,JESSUP,MD,20794,NOT AVAILABLE,(410) 799-3400,STATE,OPEN,915,HOWARD,24027,USA,922140,CORRECTIONAL INSTITUTIONS,"http://dpscs.maryland.gov/publicinfo/publications/annuals.shtml#doc, http://dpscs.maryland.gov/publicinfo/publications/pdfs/pax_annual_report_2013.pdf",4/1/2014,IMAGERY/OTHER,2017/12/05 00:00:00,http://www.dpscs.maryland.gov/locations/prisons.shtml,MAXIMUM,1113,0.0152773995656,1871.31202532552,1.28527973504e-05
1178,1166,10001554,DISMAS HOUSE - EAST,1415 N CAROLINE ST,BALTIMORE,MD,21213,NOT AVAILABLE,NOT AVAILABLE,STATE,CLOSED,0,BALTIMORE CITY,24510,USA,922140,CORRECTIONAL INSTITUTIONS,http://www.dpscs.maryland.gov/locations/prisons.shtml,4/1/2014,IMAGERY,2017/12/05 00:00:00,NOT AVAILABLE,MINIMUM,45,0.00187880037667,231.545802076358,1.70376496382e-07
1179,1167,10001551,DISMAS HOUSE - WEST,105 S MOUNT ST,BALTIMORE,MD,21223,NOT AVAILABLE,NOT AVAILABLE,STATE,CLOSED,0,BALTIMORE CITY,24510,USA,922140,CORRECTIONAL INSTITUTIONS,http://www.dpscs.maryland.gov/locations/prisons.shtml,4/1/2014,IMAGERY,2017/12/05 00:00:00,NOT AVAILABLE,NOT AVAILABLE,-999,0.00193434913305,241.025170446086,1.88117420657e-07
1180,1168,10006353,DORSEY RUN CORRECTIONAL FACILITY,2020 TOULSON ROAD,JESSUP,MD,20794,NOT AVAILABLE,(410) 379-6020,STATE,OPEN,553,ANNE ARUNDEL,24003,USA,922140,CORRECTIONAL INSTITUTIONS,http://dpscs.maryland.gov/publicinfo/publications/annuals.shtml#doc,6/30/2016,IMAGERY,2017/12/05 00:00:00,http://www.dpscs.maryland.gov/locations/prisons.shtml,MINIMUM,480,0.0056901141273,712.768182323253,1.6825072892e-06
1181,1169,10002803,SCHAEFFER HALFWAY HOUSE,12451 GARMENT RD,EL PASO,TX,79938,NOT AVAILABLE,(915) 856-9324,STATE,OPEN,17,EL PASO,48141,USA,922140,CORRECTIONAL INSTITUTIONS,http://www.tjjd.texas.gov/programs/prea.aspx,2/3/2015,IMAGERY,2018/01/12 00:00:00,http://www.tjjd.texas.gov/programs/facilities_list.aspx,JUVENILE,24,0.00212438200003,258.096999991685,2.04461708393e-07
1182,1170,10001261,WILLOUGHBY HOUSE,8100 W ELIZABETH LN,FORT WORTH,TX,76116,NOT AVAILABLE,(817) 244-4992,STATE,OPEN,12,TARRANT,48439,USA,922140,CORRECTIONAL INSTITUTIONS,http://www.tjjd.texas.gov/programs/prea.aspx,2/4/2016,IMAGERY,2018/01/12 00:00:00,http://www.tjjd.texas.gov/programs/facilities_list.aspx,JUVENILE,20,0.00152589074611,187.447269650822,1.08717399808e-07
1183,1171,10001255,MCFADDEN RANCH,3505 N HAYNES RD,ROANOKE,TX,76262,NOT AVAILABLE,(817) 491-9387,STATE,OPEN,47,DENTON,48121,USA,922140,CORRECTIONAL INSTITUTIONS,http://www.tjjd.texas.gov/programs/prea.aspx,6/7/2017,IMAGERY,2018/01/12 00:00:00,http://www.tjjd.texas.gov/programs/facilities_list.aspx,JUVENILE,48,0.00326525710246,391.841084424258,5.16761990579e-07
1184,1172,10002824,CROCKETT STATE SCHOOL,1701 SW LOOP 304,CROCKETT,TX,75835,NOT AVAILABLE,NOT AVAILABLE,STATE,CLOSED,0,HOUSTON,48225,USA,922140,CORRECTIONAL INSTITUTIONS,"http://www.ktre.com/story/24536064/regional-juvenile-facility-moving-to-old-crockett-state-school-building, http://messenger-news.com/2017/09/23/strike-three/",9/23/2017,IMAGERY,2018/01/12 00:00:00,NOT AVAILABLE,JUVENILE,-999,0.0132043606257,1573.61844568201,1.08481286522e-05
1185,1173,10005732,TYC CORSICANA RESIDENTIAL TREATMENT CENTER,4000 WEST 2ND AVENUE,CORSICANA,TX,75110,NOT AVAILABLE,NOT AVAILABLE,STATE,CLOSED,0,NAVARRO,48349,USA,922140,CORRECTIONAL INSTITUTIONS,"http://www.tyc.state.tx.us/programs/corsicana/index.html#history, http://www.publicintegrity.org/2014/02/12/14227/closing-troubled-symbol-texas-juvenile-justice",2/12/2014,IMAGERY/OTHER,2018/01/12 00:00:00,NOT AVAILABLE,JUVENILE,-999,0.0168450137785,1993.71552563425,1.55378716384e-05
1186,1174,10001970,NORTH TEXAS INTERMEDIATE SANCTION FACILITY,4700 BLUE MOUND RD,FORT WORTH,TX,76106,NOT AVAILABLE,NOT AVAILABLE,STATE,CLOSED,0,TARRANT,48439,USA,922140,CORRECTIONAL INSTITUTIONS,http://www.texasprisonbidness.org/facility/north-texas-intermediate-sanction-facility-closed,1/12/2018,IMAGERY,2018/01/12 00:00:00,http://www.tdcj.state.tx.us/divisions/pf/pf_unit_list.html#intermediate,MINIMUM,424,0.0120840271187,1433.50648327997,5.11920995494e-06
1187,1175,10001569,EASTERN CORRECTIONAL INSTITUTION,30420 REVELLS NECK RD,WESTOVER,MD,21890,NOT AVAILABLE,(410) 845-4000,STATE,OPEN,2604,SOMERSET,24039,USA,922140,CORRECTIONAL INSTITUTIONS,http://dpscs.maryland.gov/publicinfo/publications/annuals.shtml#doc,6/30/2016,IMAGERY/OTHER,2017/12/05 00:00:00,http://www.dpscs.maryland.gov/locations/prisons.shtml,MEDIUM,3310,0.0194442149951,2381.35573502039,2.14857636635e-05
1188,1176,10001288,HECTOR GARZA CENTER,620 E. AFTON OAKS BLVD,SAN ANTONIO,TX,78232,NOT AVAILABLE,(210) 568-8600,STATE,OPEN,-999,BEXAR,48029,USA,922140,CORRECTIONAL INSTITUTIONS,https://www.geogroup.com/Locations,1/12/2018,IMAGERY,2018/01/12 00:00:00,https://www.geogroup.com/Locations,JUVENILE,139,0.00259410001488,308.340606946501,4.61126059473e-07
1189,1177,10001570,EASTERN CORRECTIONAL INSTITUTION - ANNEX,30420 REVELLS NECK RD,WESTOVER,MD,21890,NOT AVAILABLE,(410) 845-4000,STATE,OPEN,597,SOMERSET,24039,USA,922140,CORRECTIONAL INSTITUTIONS,http://dpscs.maryland.gov/publicinfo/publications/annuals.shtml#doc,6/30/2016,IMAGERY/OTHER,2017/12/05 00:00:00,http://www.dpscs.maryland.gov/locations/prisons.shtml,MINIMUM,608,0.0112994478228,1442.14668072896,6.77263102056e-06
1190,1178,10002740,WEST TEXAS INTERMEDIATE SANCTION FACILITY,2002 LAMESA HWY,BROWNFIELD,TX,79316,NOT AVAILABLE,(806) 637-4032,STATE,CLOSED,0,TERRY,48445,USA,922140,CORRECTIONAL INSTITUTIONS,http://amarillo.com/local-news/news/2017-06-02/brownfield-lose-250k-plus-annually-state-prison-closes-today,6/2/2017,IMAGERY,2018/01/12 00:00:00,http://tdcj.state.tx.us/unit_directory/xn.html,NOT AVAILABLE,275,0.00477169542487,580.975694334034,1.18114379975e-06
1191,1179,10002869,KEGANS STATE JAIL,707 TOP ST,HOUSTON,TX,77002,NOT AVAILABLE,(713) 224-6584,STATE,NOT AVAILABLE,0,HARRIS,48201,USA,922140,CORRECTIONAL INSTITUTIONS,"https://www.texastribune.org/library/data/texas-prisons/units/kegans/, http://www.tdcj.state.tx.us/unit_directory/index.html",9/15/2016,IMAGERY,2018/01/12 00:00:00,http://www.tdcj.state.tx.us/unit_directory/index.html,MEDIUM,667,0.00295495286874,352.249517240858,5.43153200573e-07
1192,1180,10006586,CENTRAL REGIONAL HOSPITAL,300 VEAZEY ROAD,BUTNER,NC,27509,NOT AVAILABLE,(919) 764-2000,STATE,OPEN,-999,GRANVILLE,37077,USA,922140,CORRECTIONAL INSTITUTIONS,https://files.nc.gov/ncdhhs/CRH%20Treatment%20Units_0.pdf,12/13/2017,IMAGERY,2017/12/13 00:00:00,https://www.ncdhhs.gov/divisions/dsohf/facilities,NOT AVAILABLE,76,0.00913328596859,1127.29102421042,4.42981897181e-06
1193,1181,10002238,MONTEZUMA COUNTY DETENTION CENTER,730 EAST DRISCOLL STREET,CORTEZ,CO,81321,NOT AVAILABLE,(970) 564-4979,COUNTY,OPEN,-999,MONTEZUMA,08083,USA,922140,CORRECTIONAL INSTITUTIONS,http://www.montezumasheriff.org/departments-contacts/,2/20/2018,IMAGERY,2018/02/20 00:00:00,http://www.montezumasheriff.org/departments-contacts/,NOT AVAILABLE,104,0.00336756648228,420.531412574157,4.14280090619e-07
1194,1182,10005028,PISCATAQUIS COUNTY JAIL,52 COURT STREET,DOVER-FOXCROFT,ME,04426,NOT AVAILABLE,(207) 564-3304,COUNTY,OPEN,26,PISCATAQUIS,23021,USA,922140,CORRECTIONAL INSTITUTIONS,https://www.piscataquis.us/sheriff-s-office,3/20/2018,IMAGERY/OTHER,2018/03/20 00:00:00,https://www.piscataquis.us/sheriff-s-office,NOT AVAILABLE,-999,0.00436861943911,582.416493228822,3.46912142893e-07
1195,1183,10005824,SUSSEX COUNTY JUVENILE DETENTION CENTER,135 MORRIS TURNPIKE,NEWTON,NJ,07860,NOT AVAILABLE,NOT AVAILABLE,COUNTY,CLOSED,0,SUSSEX,34037,USA,922140,CORRECTIONAL INSTITUTIONS,"http://www.sussex.nj.us/Cit-e-Access/webpage.cfm?TID=7&TPID=6594, http://www.nj.gov/lps/jjc/2011-AnnualDetentionStatisticsReport.pdf",2/15/2016,IMAGERY,2018/04/06 00:00:00,NOT AVAILABLE,JUVENILE,-999,0.0031155801435,393.985231666776,5.78786283202e-07
1196,1184,10000048,WYOMING COUNTY JAIL,P O BOX 529,PINEVILLE,WV,24874,NOT AVAILABLE,NOT AVAILABLE,COUNTY,NOT AVAILABLE,-999,WYOMING,54109,USA,922140,CORRECTIONAL INSTITUTIONS,"http://www.wyomingcounty.wv.gov/elected_officials/sheriff/Pages/default.aspx, http://en.wikipedia.org/wiki/Wyoming_County_Courthouse_and_Jail",3/4/2016,IMAGERY,2018/05/10 00:00:00,NOT AVAILABLE,NOT AVAILABLE,-999,0.00143807193168,176.824159545946,1.13129221703e-07
1197,1185,10006504,MONTROSE COUNTY JAIL,1200 NORTH GRAND AVE,MONTROSE,CO,81401,NOT AVAILABLE,NOT AVAILABLE,COUNTY,OPEN,-999,MONTROSE,08085,USA,922140,CORRECTIONAL INSTITUTIONS,http://www.co.montrose.co.us/352/Detention-Center,2/20/2018,IMAGERY,2018/02/20 00:00:00,http://www.co.montrose.co.us/352/Detention-Center,NOT AVAILABLE,-999,0.00338672360986,432.885750469747,6.33806108651e-07
1198,1186,10001556,EASTERN PRE-RELEASE UNIT,700 FLAT IRON SQUARE RD,CHURCH HILL,MD,21623,NOT AVAILABLE,(410) 810-5400,STATE,OPEN,180,QUEEN ANNE'S,24035,USA,922140,CORRECTIONAL INSTITUTIONS,http://dpscs.maryland.gov/publicinfo/publications/annuals.shtml#doc,6/30/2016,IMAGERY,2017/12/05 00:00:00,http://www.dpscs.maryland.gov/locations/prisons.shtml,MINIMUM,165,0.00463654077262,554.030000842368,3.12233167598e-07
1199,1187,10001561,HERMAN L TOULSON CORRECTIONAL FACILITY,2001 TOULSON RD,JESSUP,MD,20794,NOT AVAILABLE,NOT AVAILABLE,STATE,CLOSED,0,ANNE ARUNDEL,24003,USA,922140,CORRECTIONAL INSTITUTIONS,http://www.dpscs.state.md.us/locations/tcf.shtml,4/1/2014,IMAGERY/OTHER,2017/12/05 00:00:00,NOT AVAILABLE,MINIMUM,384,0.00744519165047,964.92769865944,3.57454115446e-06
1200,1188,10003601,NORTH DAKOTA STATE PENITENTIARY,3100 RAILROAD AVE,BISMARCK,ND,58506,5521,(701) 328-6100,STATE,OPEN,753,BURLEIGH,38015,USA,922140,CORRECTIONAL INSTITUTIONS,"http://www.nd.gov/docr/media/stats.html, http://www.nd.gov/docr/adult/",12/31/2016,IMAGERY,2017/12/13 00:00:00,http://www.nd.gov/docr/adult/,MAXIMUM,520,0.0146442368747,1964.34374866797,1.07645247484e-05
1201,1189,10002234,OTERO COUNTY JAIL / SHERIFF,222 EAST 2ND STREET,LA JUNTA,CO,81050,NOT AVAILABLE,(719) 384-5941,COUNTY,OPEN,-999,OTERO,08089,USA,922140,CORRECTIONAL INSTITUTIONS,https://www.oterogov.com/elected-officials/sheriff,2/20/2018,IMAGERY,2018/02/20 00:00:00,https://www.oterogov.com/elected-officials/sheriff,NOT AVAILABLE,34,0.00116576847952,148.908671394256,7.64096434579e-08
1202,1190,10001482,RANDOLPH COUNTY JAIL,200 WEST BUENA VISTA STREET,CHESTER,IL,62233,NOT AVAILABLE,(618) 826-5484,COUNTY,OPEN,23,RANDOLPH,17157,USA,922140,CORRECTIONAL INSTITUTIONS,"http://am.randolphco.org/index.php/gov-menu/electedofficials/2015-12-04-01-54-52, http://www.ilsheriff.org/index.php/directory",3/2/2018,IMAGERY,2018/03/02 00:00:00,http://am.randolphco.org/index.php/gov-menu/electedofficials/2015-12-04-01-54-52,NOT AVAILABLE,44,0.0016845158274,208.514085675508,1.72898423887e-07
1203,1191,10000590,PUEBLO COUNTY DETENTION CENTER,909 COURT ST,PUEBLO,CO,81003,NOT AVAILABLE,(719) 583-6125,COUNTY,OPEN,545,PUEBLO,08101,USA,922140,CORRECTIONAL INSTITUTIONS,https://www.sheriff.co.pueblo.co.us/index.html,2/20/2018,IMAGERY,2018/02/20 00:00:00,https://www.sheriff.co.pueblo.co.us/index.html,MAXIMUM,780,0.00376193343711,474.158247003826,7.49641921555e-07
1204,1192,10003631,SOMERSET COUNTY JAIL,131 E MADISON RD,MADISON,ME,04950,NOT AVAILABLE,(207) 474-7409,COUNTY,OPEN,165,SOMERSET,23025,USA,922140,CORRECTIONAL INSTITUTIONS,http://www.somersetcounty-me.org/somerset-county-jail.html#!slide_09,3/20/2018,IMAGERY,2018/03/20 00:00:00,http://www.somersetcounty-me.org/somerset-county-jail.html#!slide_09,MEDIUM,234,0.00626476385597,836.220169677861,1.99715092779e-06
1205,1193,10006665,JACK HARWELL DETENTION CENTER,3101 MARLIN HWY,WACO,TX,76705,NOT AVAILABLE,(254) 759-5900,MULTI,OPEN,-999,MCLENNAN,48309,USA,922140,CORRECTIONAL INSTITUTIONS,http://www.lasallecorrections.com/our-locations-table/,1/12/2018,IMAGERY,2018/01/12 00:00:00,http://www.lasallecorrections.com/our-locations-table/,MAXIMUM,816,0.00649772856247,785.142347726356,2.44541374017e-06
1206,1194,10002212,PARK COUNTY JAIL / SHERIFF,1180 COUNTY ROAD 16,FAIRPLAY,CO,80440,NOT AVAILABLE,(719) 836-4373,COUNTY,OPEN,-999,PARK,08093,USA,922140,CORRECTIONAL INSTITUTIONS,http://www.parkco.us/88/Sheriffs-Office,2/20/2018,IMAGERY,2018/02/20 00:00:00,http://www.parkco.us/88/Sheriffs-Office,NOT AVAILABLE,-999,0.00364800018969,451.71659593513,7.19161494498e-07
1207,1195,10001876,CENTRAL REGIONAL JAIL,1255 DYER HILL RD,SUTTON,WV,26601,NOT AVAILABLE,(304) 765-7904,COUNTY,OPEN,310,BRAXTON,54007,USA,922140,CORRECTIONAL INSTITUTIONS,http://rja.wv.gov/Pages/About-Us.aspx,1/22/2018,IMAGERY/OTHER,2018/01/22 00:00:00,http://rja.wv.gov/facilityinfo/Pages/default.aspx,NOT AVAILABLE,200,0.00577462630518,729.678223039728,2.13508771913e-06
1208,1196,10006864,CLAY COUNTY JAIL,215 WEST GILBERT STREET,HENRIETTA,TX,76365,NOT AVAILABLE,NOT AVAILABLE,COUNTY,OPEN,22,CLAY,48077,USA,922140,CORRECTIONAL INSTITUTIONS,"https://www.sheriff.co.clay.tx.us/, https://www.tcjs.state.tx.us/index.php?linkID=325",3/1/2018,IMAGERY,2018/04/26 00:00:00,https://www.sheriff.co.clay.tx.us/,NOT AVAILABLE,38,0.00154273634668,189.468245118917,1.19170052396e-07
1209,1197,10000009,EASTERN REGIONAL JAIL,94 GRAPEVINE ROAD,MARTINSBURG,WV,25405,NOT AVAILABLE,(304) 267-0046,COUNTY,OPEN,392,BERKELEY,54003,USA,922140,CORRECTIONAL INSTITUTIONS,http://rja.wv.gov/Pages/About-Us.aspx,1/22/2018,IMAGERY,2018/01/22 00:00:00,http://rja.wv.gov/facilityinfo/Pages/default.aspx,NOT AVAILABLE,500,0.00716535565828,900.811822045016,1.98605405008e-06
1210,1198,10005831,MARYLAND  HOUSE OF CORRECTION - JESSUP,"P O BOX 549, HOUSE OF CORRECTION RD",JESSUP,MD,20794,NOT AVAILABLE,NOT AVAILABLE,STATE,CLOSED,0,ANNE ARUNDEL,24003,USA,922140,CORRECTIONAL INSTITUTIONS,http://www.washingtonpost.com/wp-dyn/content/article/2007/03/18/AR2007031800137.html,4/1/2014,IMAGERY/OTHER,2017/12/05 00:00:00,NOT AVAILABLE,MEDIUM,1068,0.00980694467783,1218.83024827625,4.95374382932e-06
1211,1199,10001553,CENTRAL HOME DETENTION UNIT,2100 GUILFORD AVE,BALTIMORE,MD,21218,NOT AVAILABLE,(443) 263-3800,STATE,OPEN,192,BALTIMORE CITY,24510,USA,922140,CORRECTIONAL INSTITUTIONS,http://dpscs.maryland.gov/publicinfo/publications/annuals.shtml#doc,6/30/2016,IMAGERY,2017/12/05 00:00:00,http://www.dpscs.maryland.gov/locations/prisons.shtml,NOT AVAILABLE,-999,0.00271532248938,352.906466461176,3.19275237138e-07
1212,1200,10003607,DAKOTA WOMEN'S CORRECTIONAL AND REHABILITATION CENTER,440 MCKENZIE ST,NEW ENGLAND,ND,58647,NOT AVAILABLE,(701) 579-5100,STATE,OPEN,113,HETTINGER,38041,USA,922140,CORRECTIONAL INSTITUTIONS,"http://www.nd.gov/docr/media/stats.html, http://www.nd.gov/docr/adult/",12/31/2016,IMAGERY,2017/12/13 00:00:00,http://www.nd.gov/docr/adult/,MINIMUM,126,0.00744382487846,1088.32871430862,2.18935681187e-06
1213,1605,10006549,MINNESOTA SECURITY HOSPITAL,100 FREEMAN DRIVE,ST. PETER,MN,56082,1599,(507) 985-2000,STATE,OPEN,369,NICOLLET,27103,USA,922140,CORRECTIONAL INSTITUTIONS,http://www.twincities.com/2017/04/07/big-bucks-needed-to-solve-security-hospital-problems/,4/8/2017,IMAGERY,2017/12/07 00:00:00,http://www.dhs.state.mn.us/main/idcplg?IdcService=GET_DYNAMIC_CONVERSION&RevisionSelectionMethod=LatestReleased&dDocName=id_000261,NOT AVAILABLE,-999,0.00957226099185,1237.65578953659,4.04245960511e-06
1214,1606,10006606,SOUTHERN TRANSITIONAL,800A BUFFALO AVENUE,EGG HARBOR,NJ,08215,NOT AVAILABLE,(609) 965-5200,STATE,OPEN,15,ATLANTIC,34001,USA,922140,CORRECTIONAL INSTITUTIONS,http://www.nj.gov/oag/jjc/prea.html,3/10/2016,IMAGERY/OTHER,2017/12/18 00:00:00,http://www.nj.gov/oag/jjc/residential_community_list.html,JUVENILE,32,0.00286601253136,359.432301396095,2.75470920955e-07
1215,1209,10002617,CENTRAL UTAH CORRECTIONAL FACILITY,255 E 300 N ST,GUNNISON,UT,84634,NOT AVAILABLE,(435) 528-6000,STATE,OPEN,1700,SANPETE,49039,USA,922140,CORRECTIONAL INSTITUTIONS,"https://crbiprod.utah.gov/cognos10/cgi-bin/cognos.cgi?b_action=xts.run&m=portal/cc.xts&gohome=, https://corrections.utah.gov/",1/17/2018,IMAGERY,2018/01/17 00:00:00,https://corrections.utah.gov/,MAXIMUM,1600,0.025579986517,3190.70183830968,2.76898990689e-05
1216,1607,10001618,CREMER THERAPEUTIC COMMUNITY CENTER,689 ROUTE O,FULTON,MO,65251,NOT AVAILABLE,(573) 592-4013,STATE,OPEN,174,CALLAWAY,29027,USA,922140,CORRECTIONAL INSTITUTIONS,https://doc.mo.gov/OD/PREA-2015.php,4/14/2015,IMAGERY,2017/12/07 00:00:00,https://doc.mo.gov/DAI/Institutional_Facilities.php,MINIMUM,180,0.00386513159361,467.943155121035,4.95867331526e-07
1217,1608,10001598,DEERFIELD WORK CENTER FOR MEN,15172 OLD BELFIELD RD,CAPRON,VA,23829,NOT AVAILABLE,(434) 658-4368,STATE,OPEN,199,SOUTHAMPTON,51175,USA,922140,CORRECTIONAL INSTITUTIONS,https://vadoc.virginia.gov/about/facts/,6/15/2017,IMAGERY,2018/01/19 00:00:00,https://vadoc.virginia.gov/facilities/,MINIMUM,216,0.00647102558794,791.129439399416,2.24538190695e-06
1218,1609,10003324,DEERFIELD CORRECTIONAL CENTER,21360 DEERFIELD DR,CAPRON,VA,23829,NOT AVAILABLE,(434) 658-4368,STATE,OPEN,1059,SOUTHAMPTON,51175,USA,922140,CORRECTIONAL INSTITUTIONS,https://vadoc.virginia.gov/about/facts/,4/27/2017,IMAGERY,2018/01/19 00:00:00,https://vadoc.virginia.gov/facilities/,MEDIUM,1080,0.0149153892001,1779.6268493562,9.34383732129e-06
1219,1610,10003845,JACKSON COUNTY JAIL-WESLEY STREET,212 W WESLEY ST,JACKSON,MI,49201,NOT AVAILABLE,(517) 768-7900,COUNTY,OPEN,-999,JACKSON,26075,USA,922140,CORRECTIONAL INSTITUTIONS,https://www.co.jackson.mi.us/167/Sheriff,3/20/2018,IMAGERY,2018/03/20 00:00:00,https://www.co.jackson.mi.us/167/Sheriff,NOT AVAILABLE,200,0.00324330437871,399.350041585937,4.38607433319e-07
